title,url,score,num_comments,created_date,selftext
MCS at Rice Admit - Opinions on Program?,https://www.reddit.com/r/riceuniversity/comments/1btpife/mcs_at_rice_admit_opinions_on_program/,13,5,2024-04-02 04:11:03,"Was recently admitted to the Master of Computer Science program at Rice. I would love to hear about the experience of any alumni or current students!

1. How rigorous/challenging is the coursework? (In particular Core courses or AI / Data Science & ML Specializations)
2. What about the workload? In general, what is the expected time commitment for courses, and did you have enough free time for internship applications, extracurriculars, research, etc.?
3. How are the Career Fairs? What companies have visited in the past couple of years?
4. Have any MCS students obtained Research Assistantships and/or TA-ships on-campus or within the department? Are these positions difficult to find?
5. Are students able to extend their study beyond 3 semesters? Are they allowed to study part-time?

Thanks!"
Pre-med experience,https://www.reddit.com/r/riceuniversity/comments/1btrnf2/premed_experience/,9,15,2024-04-02 06:19:35,"Hi! I was recently admitted and am interesting in doing pre-med, but I’m also considering going to UCLA since it is very stem/pre-health heavy. I know Rice has a higher rate of students get into med school their first try or something like that, but I was wondering about the competitiveness and how easy it is to build up a good portfolio (like clubs, internships, research, volunteering, etc)? Any insight would help!"
is the heat and humidity in houston really that bad? 🫢☀️,https://www.reddit.com/r/riceuniversity/comments/1bstno0/is_the_heat_and_humidity_in_houston_really_that/,17,30,2024-04-01 03:39:09,"I’ve heard houston is super humid and hot and that it can be pretty bad. I’m a person who really hates the cold because it makes me sad and have always wanted to live somewhere warmer but idk if the humidity is better than the cold. I mean does the weather at rice genuinely impact your mood? 

&#x200B;"
Difficulty of BUSI classes?,https://www.reddit.com/r/riceuniversity/comments/1bsxiny/difficulty_of_busi_classes/,5,4,2024-04-01 07:36:30,"For the upperclassmen business majors, does it get any easier after financial accounting? 😭 low-key considering switching majors if all the busi classes are as hard as 305 "
fun classes this fall 2024?,https://www.reddit.com/r/riceuniversity/comments/1bswpi1/fun_classes_this_fall_2024/,3,3,2024-04-01 06:40:58,"i’m a senior who needs 3 additional credit hours, and i’m looking for fun, interesting, and light (maybe underrated) courses to take! does anyone have any recommendations?"
Rice visiting student program ,https://www.reddit.com/r/riceuniversity/comments/1bs1yu6/rice_visiting_student_program/,3,0,2024-03-31 04:38:31,Has anyone ever been a part of the Rice visiting student program? Or do you know anybody who has? What is the experience like?
College Party Tonight?,https://www.reddit.com/r/riceuniversity/comments/1brt9it/college_party_tonight/,0,0,2024-03-30 21:44:48,Hi everyone I’m an English guy (21) on spring break looking to get the American College Party experience. Could anyone help me out?
I didn't realize College Coordinators are paid so little?!,https://www.reddit.com/r/riceuniversity/comments/1bqf271/i_didnt_realize_college_coordinators_are_paid_so/,66,15,2024-03-29 03:17:11,"I found this job posting on [jobs.rice.edu](https://jobs.rice.edu) for a College Coordinator (doesn't say which college), and the pay range is from $42,500-45,000. That seems incredibly low for everything they do for students. Shoutout to Sharon O'Leary at Lovett - hope you're getting A LOT more than this! Kind of embarrassing for Rice to be paying this little for employees this vital."
Wellfleet student insurance cancalled?,https://www.reddit.com/r/riceuniversity/comments/1bqt22w/wellfleet_student_insurance_cancalled/,1,1,2024-03-29 16:09:57,Anyone elses wellfleet student insurance cancelled as of this week? 
undergrad business,https://www.reddit.com/r/riceuniversity/comments/1bqfprf/undergrad_business/,7,4,2024-03-29 03:50:37,"hey! i got admitted for co28 and i’m interested in the business major. ik it’s pretty new so i can’t find many opinions ab it… can any current students share their thoughts on the program? like is the curriculum is good, etc. + is it viable to double major in something stem like cs? "
Boniuk senpai please I don't have any opinions,https://i.redd.it/khkmd4spm3rc1.png,37,0,2024-03-28 16:08:47,
VISION program,https://www.reddit.com/r/riceuniversity/comments/1bq7qsc/vision_program/,7,14,2024-03-28 21:48:20,Went to go register for OWL days and got an invitation for VISION program. Any past attendees that can shed light on whether it's worth going? 
Rice - Architecture,https://www.reddit.com/r/riceuniversity/comments/1bpv5tn/rice_architecture/,5,5,2024-03-28 13:06:08,Can you share what you lıke & dislike about Barch @ Rice? 
Are clubs competitive to join?,https://www.reddit.com/r/riceuniversity/comments/1bpn4vt/are_clubs_competitive_to_join/,9,7,2024-03-28 04:46:44,
Trustee Distinguished Scholarship!,https://www.reddit.com/r/riceuniversity/comments/1bonst0/trustee_distinguished_scholarship/,17,6,2024-03-27 00:11:27,"Hello :) 

I was just admitted to Rice for the class of 2028 (go owls!) and I was wondering if anyone could speak to the benefits of the Trustee Distinguished Scholarship. Is it money alone? Is there a community surrounding the award at all? "
How soon can I switch to engineering?,https://www.reddit.com/r/riceuniversity/comments/1bose38/how_soon_can_i_switch_to_engineering/,7,10,2024-03-27 03:42:24,"Hi!!! I was just admitted to Rice and I'm SO excited.

To keep it short and sweet, I applied as a chem major but changed my mind last month that I want to do engineering. How fast can I switch? Can I even switch before I sign up for classes for fall?

Thank you!!!"
Rice Financial Aid,https://www.reddit.com/r/riceuniversity/comments/1bollng/rice_financial_aid/,7,2,2024-03-26 22:43:29,"Hi! I was recently admitted to Rice University (lesgo), however there wasn’t a mention of my financial aid because I hadn’t filled out the foreign income document. Do I need to fill this out to receive my FA? Do any past admitted (esp international) students know anything about this?

Thanks"
Rice Class of 2028 Discord,https://www.reddit.com/r/riceuniversity/comments/1bo6xbs/rice_class_of_2028_discord/,17,17,2024-03-26 12:40:58,"Now that RD decisions are coming out (gl everyone), we’ve decided to officially announce our community Discord server for the class of 2028! Join it to discuss your decisions, ask alums for advice, and talk to fellow applicants."
Is the aerospace academy worth it?,https://www.reddit.com/r/riceuniversity/comments/1bo4lar/is_the_aerospace_academy_worth_it/,4,5,2024-03-26 10:31:15,I got invited to the rice university aerospace academy for the summer I’m just wondering if it’s worth the price?
Alcohol Policy Advisory Committee - Final Report (A TL;DR),https://www.reddit.com/r/riceuniversity/comments/1bl3o8u/alcohol_policy_advisory_committee_final_report_a/,22,0,2024-03-22 16:39:18,"The report starts by discussing the motivation behind APAC's formation: in general, recent trends with alcohol consumption.

# Policies Regarding Hard Alcohol Possession and Consumption on Campus

* ""\[O\]ur goals for health/safety and commitment to student self-governance are not best served by banning hard alcohol.""
* Hard alcohol should be considered anything with *an ABV of over 20%.*
* Serving hard alcohol should be prohibited in ***all public spaces*** (e.g., not in student rooms) unless part of a registered event.

# Intersection of Alcohol Consumption and Public Parties

* Publics should be organized in close collaboration with *RUPD and REMS.* Capacity is determined by *indoor space* (""outdoor space is just for 'getting air', not for overflow capacity"").
* Events with 200+ attendees that involve alcohol should require an *RSVP or ticketing process*, and students must present their IDs regardless of wristbands being issued.
* ""**Martel's Beer Bike morning party** should be changed to a *quad only outdoor event* without utilization of the sundeck...""

# Enhanced Education, Safety Measures, and Accountability

* *Alcohol education presentations* should occur more frequently, particularly for incoming students and around major events.
* *RUPD* should have a closer connection with SJP, student leaders, and core teams.
* CJs, AJs, and REMS should receive *greater support from the university*, such as from core teams.
* ""\[T\]he **'Amnesty Policy'** \[should\] be modified such that a 'warning' is issued to those in violation."" Warnings are aggravating factors in determining sanctions.
* *Fake IDs* should result in a referral to SJP and subsequent sanction.
* Colleges should submit written descriptions of ""their strategy for promoting health/safety...""; until this is submitted, their Beer Bike will remain dry.
* **""Re-launch a 'Culture of Care' campaign that specifically focuses on reasonable, responsible, and respectful alcohol consumption on our campus.""**

&#x200B;

Given Dean Gorman's email, all of these changes are either in effect or will be going into effect soon"
Incoming grad student looking for friends/roommate,https://www.reddit.com/r/riceuniversity/comments/1bl4c4i/incoming_grad_student_looking_for_friendsroommate/,10,8,2024-03-22 17:06:27,Hey guys!! I’ll be moving to Houston in August and am definitely looking to make friends or find a roommate 🙏. I’m also really interested in fun things to do around campus/in Houston
be honest,https://www.reddit.com/r/riceuniversity/comments/1bkd78j/be_honest/,17,46,2024-03-21 18:11:33,pls be honest do you actually like being a student at rice 
Housing Options for Incoming Graduate Student,https://www.reddit.com/r/riceuniversity/comments/1bjpvlo/housing_options_for_incoming_graduate_student/,9,9,2024-03-20 22:04:32,"Hello, I will be joining Rice in fall of 2024 as a new PhD student. What are some affordable areas that offer studios/1bedrroms close to campus? I will have a car, but I would appreciate nearby locations. 

I also heard about Rice's own graduate housing, but unfortunately you have to leave after one year. Is this option worth it, given it might help me socialize and make some friends? 

I would appreciate any leads, Thanks!"
Grad school ,https://www.reddit.com/r/riceuniversity/comments/1bjpkew/grad_school/,3,3,2024-03-20 21:52:06,Moving to Houston in July and would love to connect/potentially find a female roommate. Incoming grad student this fall and looking to meet people around my age (f24) / other grad students 
How many astrophysics majors are there at Rice? What is the community like?,https://www.reddit.com/r/riceuniversity/comments/1bjepuv/how_many_astrophysics_majors_are_there_at_rice/,6,3,2024-03-20 14:25:55,"Hello, I am thinking of attending Rice next semester and am an astrophysics major. I have offers from other T20s but I want to stay close to home. I want to know how many astrophysics majors Rice has and what the community here is like. Thank you very much."
BRC Parking Permit,https://www.reddit.com/r/riceuniversity/comments/1bisfta/brc_parking_permit/,2,1,2024-03-19 19:10:39,"Hey guys I am a recent Rice grad student alumni who just transitioned to BCM as a postdoc. I used to park at BRC which was so convenient and cheap (comparing to TMC parking rate of course) but now I am about to lose that privilege at July since I have just left Rice.   
Any ideas about keeping the BRC garage access? "
Twilight Epiphany parking?,https://www.reddit.com/r/riceuniversity/comments/1bi5xeq/twilight_epiphany_parking/,4,5,2024-03-18 23:46:34,I've never been to Rice campus before and will be going to an event tomorrow at the skyspace. Was just wondering if there were any free or cheaper parking options outside what seems to be the $12 fee that the event suggests
The Case For God event on March 26th.,https://i.redd.it/frwut8od86pc1.jpeg,3,3,2024-03-18 22:44:57,
Underwear Party Fiasco,https://www.reddit.com/r/riceuniversity/comments/1bhe6cc/underwear_party_fiasco/,4,4,2024-03-18 01:00:30,Checking in after about 4.5 months… where are we with the undergraduate party scene and the fallout from NOD?
Most fun/rewarding course you've taken!,https://www.reddit.com/r/riceuniversity/comments/1bfw0gl/most_funrewarding_course_youve_taken/,11,12,2024-03-16 02:51:08,What's been your favourite course taken at Rice :)
Friends,https://www.reddit.com/r/riceuniversity/comments/1bdua60/friends/,12,2,2024-03-13 15:28:23,"Helloo 👋🏻 I am trying to meet more people! I’m not huge into the party scene, so I was looking for alternative ways to make friends. Are there any specific coffee shops or study spots that tend to be more social? "
CMOR 220 Summer,https://www.reddit.com/r/riceuniversity/comments/1bdyr7k/cmor_220_summer/,3,1,2024-03-13 18:26:07,"Hey has anyone taken CMOR 220 over the summer? If so, can you please share your experience on how it went :D"
Lost sentimental earring,https://i.redd.it/trme5llbuwnc1.jpeg,17,1,2024-03-12 14:06:00,"Hi I lost one of my earrings somewhere on campus, likely between hotel zaza and the keck building (maybe around the statue?). If anyone has found it I would be forever indebted to you

"
"Has anyone done MECH 200 over the summer? If so, how did it go?",https://www.reddit.com/r/riceuniversity/comments/1bcjjsd/has_anyone_done_mech_200_over_the_summer_if_so/,7,1,2024-03-12 00:34:37,title
Materials Science and Nanoengineering,https://www.reddit.com/r/riceuniversity/comments/1bazr0z/materials_science_and_nanoengineering/,6,8,2024-03-10 02:52:07,I am extremely excited to be going to Rice this fall but was wondering if I could get some insight into the MSNE major since its quite a small and mysterious major. How is the department as a whole? How are the professors? How is the student cohort? How are the opportunities? How are the job placement outcomes? Thank you so much in advance Owls!
Pass fail,https://www.reddit.com/r/riceuniversity/comments/1b9fqf7/pass_fail/,7,3,2024-03-08 05:00:37,"if I pass/fail a class does the grade get uncovered when I graduate 
? The class is unrelated to my major."
arch portfolio,https://www.reddit.com/r/riceuniversity/comments/1b9iu8a/arch_portfolio/,0,0,2024-03-08 08:01:30,"heyyy! 
would any present arch major be willing to send me their portfolio? just want to see the artistic caliber of the applicants rice admits. thank youu! "
Who are your favourite professors / the unsung legends at Rice. Which class and why?,https://www.reddit.com/r/riceuniversity/comments/1b8mbql/who_are_your_favourite_professors_the_unsung/,22,18,2024-03-07 05:16:45,An identical question is one of the most upvoted posts in this sub but since it was asked over 4 years ago I figured I'd make a new one. Thank you for your responses!
School motto?,https://www.reddit.com/r/riceuniversity/comments/1b7a7hh/school_motto/,8,16,2024-03-05 16:57:13,"Does Rice University have a school motto that students on campus are familiar with? Wikipedia says it is ""Letters, Science, Art"" which is on the Rice seal. But I've also seen people say the motto is ""unconventional wisdom.""

Anyone have any insights on what is actually used around the campus with students, if anything?"
Photography permit,https://www.reddit.com/r/riceuniversity/comments/1b4tpjp/photography_permit/,4,4,2024-03-02 17:33:30,"Hi, so I registered to be able to take pictures at Rice University and I was just wondering if I had to reserve an appointment or can I just go and take pictures? Any help is appreciated!"
CS Exchange Student - help needed,https://www.reddit.com/r/riceuniversity/comments/1b1mg1i/cs_exchange_student_help_needed/,5,4,2024-02-27 20:43:11,Hii! I'll be in Rice next semester (Fall 2024) as a CS exchange student. I need to choose the courses that I'm gonna be enrolling in - do you have any reccomendations? I'm interested in taking Data Science courses. I also want to do research - should I enroll into COMP 490 - CS PROJECTS or COMP 449 - DS PROJECTS. Is one better than the other? What's the difference? Thank youuu! :))
Grad students: How's the health insurance?,https://www.reddit.com/r/riceuniversity/comments/1azg6kc/grad_students_hows_the_health_insurance/,3,7,2024-02-25 05:32:07,This question completely slipped my mind during preview. How are they treating you? Have you had any issues getting them to cover things?
Is a Bioengineering Bachelor's Degree Competitive in Workforce?,https://www.reddit.com/r/riceuniversity/comments/1az7301/is_a_bioengineering_bachelors_degree_competitive/,6,6,2024-02-24 22:15:41,"Title! 

I recently learned that a bachelor's degree in biomedical engineering is one of the more competitive engineering degrees, but essentially a pointless one in the workforce (virtually all BME degrees are overlooked for electrical and chemical engineers).

I understand that biomedical engineering and bioengineering are two different degrees, but is this a common issue for both?

Thanks in advance! :D"
Appealing for more financial aid ,https://www.reddit.com/r/riceuniversity/comments/1az5yn2/appealing_for_more_financial_aid/,6,18,2024-02-24 21:29:36,I just wanted to know if somebody here has tried to appeal for more financial aid using the special circumstances form and could help me out. I think I have a pretty legitimate reason but I’m not sure if it’s serious enough to form a solid argument. Also is it worth mentioning that my fin aid package doesn’t match the one calculated by the bot on their website? 
Humanities Tower,https://www.reddit.com/r/riceuniversity/comments/1axbp0k/humanities_tower/,9,1,2024-02-22 17:10:11,Anyone know how to get into the tower of the humanities building? I’ve never been able to find the entrance for it
Manage funds for environmental analysis ,https://www.reddit.com/r/riceuniversity/comments/1awi5ps/manage_funds_for_environmental_analysis/,3,6,2024-02-21 17:40:39,"My sister got admitted to Rice University for her masters in environmental analysis. How could she manage funds? They have not mentioned anything about scholarships or any funding.
Much appreciate your help!!"
Protest in Duncan Hall?,https://www.reddit.com/r/riceuniversity/comments/1ars6wm/protest_in_duncan_hall/,20,15,2024-02-15 22:26:28,Anyone just saw/heard the protest in Duncan Hall? I heard some noises but not sure what happened. It seems like the students were quickly taken away in less than a minute.
Just putting this out there,https://www.reddit.com/r/riceuniversity/comments/1aq3ig8/just_putting_this_out_there/,28,3,2024-02-13 20:24:01,"Does any girl wanna hang out this Wednesday (just another day of the week), go grab dinner (normal activity to hang out), talk about life, our values, with some jokes peppered in between (just typical things people do while hanging out to get closer to one another), and maybe if things go well, hang out again in the future (on another normal day?)

And of course, to thank you for accepting the invite, dinner would be on me!

(Edit: if you don't get the joke this was posted February 12th)"
recent sammy the owl sticker pack!,https://www.reddit.com/gallery/1apiwov,31,4,2024-02-13 02:55:07,"love is in the air for some sammy the owl stickers including:

•pizza
•crochet
•pain
•southmainbets
•chibi

as always, you can buy them on linktr.ee/mississippimoo for $1 each"
Any classical guitar players,https://www.reddit.com/r/riceuniversity/comments/1apyo9p/any_classical_guitar_players/,2,3,2024-02-13 17:11:28,I am beginner and would love to connect with people with experience
Looking for Off Campus Housing - any graduating seniors that would recommend me their place?,https://www.reddit.com/r/riceuniversity/comments/1ap5nok/looking_for_off_campus_housing_any_graduating/,12,6,2024-02-12 17:34:52,"Hi guys! Today I found out I got kicked OC.

I don't have any experience looking for apartments, but I heard some advice that it was better to check with graduating seniors, so that's what I'm doing.

I'm looking for a place close to campus (less than 30 min walking if possible) that costs less than $1000 per person, I'm flexible with the amenities.

Right now I'm looking for a place alongside my roommate, but we can find extra roommates as well if necessary.

Have a great day!"
"Lost my parking ticket when I parked at the complimentary parking in rice village, and followed another car out as it ran its ticket. Is there a chance I've been flagged or anything else I should be concerned about? I kept it under 2 hours.",https://www.reddit.com/r/riceuniversity/comments/1apc8c3/lost_my_parking_ticket_when_i_parked_at_the/,0,4,2024-02-12 21:55:21,
Heavy Taxation of Private University Endowments Part of Presidential Candidate Platform,https://www.reddit.com/r/riceuniversity/comments/1aoquv5/heavy_taxation_of_private_university_endowments/,13,4,2024-02-12 03:56:41,"From Campaign Platform: 

""Under the plan I’m announcing today, we will take the billions and billions of dollars that we will collect by taxing, fining, and suing excessively large private university endowments, and we will then use that money to endow a new institution called the American Academy.""

""Its mission will be to make a truly world-class education available to every American, free of charge, and do it without adding a single dime to the federal debt. This institution will gather an entire universe of the highest quality educational content, covering the full spectrum of human knowledge and skills, and make that material available to every American citizen online for free.""

""Most importantly, the American Academy will compete directly with the existing and very costly four-year university system by granting students degree credentials that the U.S. government and all federal contractors will henceforth recognize. The Academy will award the full and complete equivalent of a bachelor's degree. ""

Source: [https://www.donaldjtrump.com/agenda47/agenda47-the-american-academy](https://www.donaldjtrump.com/agenda47/agenda47-the-american-academy)



There is little reason to believe that Rice University would *not* be considered to have an 'excessively large private university endowment', suggesting that it would be a target of a plan to levy substantial taxes on such universities. While Rice University would likely survive this plan, it would be unlikely to remain the same sort of place, which seems to be a two birds, one stone sort of outcome."
Rice MECE programs thoughts and advice,https://www.reddit.com/r/riceuniversity/comments/1anlugw/rice_mece_programs_thoughts_and_advice/,8,4,2024-02-10 17:44:49,"HI! I just received an admit for the Rice MECE program to start this fall to focus on computer engineering, and I was wondering if anyone could share their thoughts about the program or about Rice engineering in general. "
accommodation for adhd / dyslexia,https://www.reddit.com/r/riceuniversity/comments/1ajl4cy/accommodation_for_adhd_dyslexia/,7,4,2024-02-05 16:50:33,I was wondering how Rice is accommodating toward an undergraduate and graduate student with a documented ADHD and Dyslexia. Does all the professor follow the accommodation guideline provided with the university? How well does the campus disability service department follow the recommended acommodation guideline provided by neuropsychological report which provides the diagnosis? 
RICE MBA students,https://www.reddit.com/r/riceuniversity/comments/1aglcrf/rice_mba_students/,5,1,2024-02-01 20:54:01,Hows recruiting looking?
Anyone got in with IB?,https://www.reddit.com/r/riceuniversity/comments/1ag392v/anyone_got_in_with_ib/,6,11,2024-02-01 05:12:45,I'm an international student and I'm studying IBDP. I was wondering if there's anyone here who did ib and if so what were your grades?
Has anybody applied for the Rice Undergrad Summer Research Programs?,https://www.reddit.com/r/riceuniversity/comments/1afwnhj/has_anybody_applied_for_the_rice_undergrad_summer/,8,3,2024-01-31 23:49:33,"Hi there!

Wanted to know if anybody applied for these. [https://reu.rice.edu/](https://reu.rice.edu/)"
Rice Health Advisors,https://www.reddit.com/r/riceuniversity/comments/1ag1zyr/rice_health_advisors/,0,1,2024-02-01 04:05:25,So I heard that there's a program at rice where students can sign up to be health advisors and care for people. Can anyone tell what that's like?
Access to public lectures & events,https://www.reddit.com/r/riceuniversity/comments/1af0nl6/access_to_public_lectures_events/,4,4,2024-01-30 21:58:17,"Hey guys, where do you usually find the information about public lectures and other events? Just trying to utilize more resources here"
1937 Rice Football Schedule,https://i.redd.it/cdhlfykzquec1.jpeg,66,9,2024-01-26 21:26:50,
Is there anyone you consider a campus celebrity right now?,https://www.reddit.com/r/riceuniversity/comments/1abn31b/is_there_anyone_you_consider_a_campus_celebrity/,3,20,2024-01-26 16:58:58,
Financial aid documentation,https://www.reddit.com/r/riceuniversity/comments/19dm3lp/financial_aid_documentation/,4,3,2024-01-23 11:12:43,"Hi! I am not really sure what I should write in “Personal, family or sponsor’s funds”. Should I enter here the amount that my family may be able to pay annually or should I write here our overall income (salary+pension)?"
