title,url,score,num_comments,created_date,selftext
ITS STARTING: INCOMING FRESHMEN OPEN THIS,https://www.reddit.com/r/riceuniversity/comments/1e044kv/its_starting_incoming_freshmen_open_this/,77,17,2024-07-10 19:10:08,"It's beautiful to see the annual flood of posts from incoming freshmen questioning whether their new college is ""good"" or ""bad."" My advice is this: try not to over-investigate your new home before you arrive. Of course, it's fine to learn a bit about the history and get a perk of the dorms, but don't risk tainting your view of the colleges/Rice before you even get here!

O-Week's purpose is to introduce you to life at Rice and immerse you in the culture and traditions of your residential college. Each college’s O-Week team has been preparing for months to make this transition fun and smooth, but we can only do this if you come with the right mindset! Every college has its pros and cons, but discover them for yourself once you're actually in the hedges. Avoid the negativity bias and trust your future peers to make this an experience worth remembering.

LGTP💛"
Residential College,https://www.reddit.com/r/riceuniversity/comments/1e00n88/residential_college/,9,10,2024-07-10 16:50:12,Has anyone gotten their college or roommate ate yet? If so where do you see it?
Brown College ,https://www.reddit.com/r/riceuniversity/comments/1e0uxd8/brown_college/,0,22,2024-07-11 17:44:50,Can anyone give me good feedback on Brown as our Kid was just selected to live there as a Freshman and is absolutely devastated .    I'm trying to stay positive.
Thought on Jones College ,https://www.reddit.com/r/riceuniversity/comments/1e02cxq/thought_on_jones_college/,5,8,2024-07-10 17:59:33,"Hi, I just got sorted into Jones college and was wondering what the ""vibes"" are like. Thanks so much!!"
Language Tests,https://www.reddit.com/r/riceuniversity/comments/1e04yu2/language_tests/,3,8,2024-07-10 19:45:12,"I’m an incoming freshman, and I’m still waiting on results for a couple of language tests I did (French and Italian). Is it normal to wait this long?"
CFA lvl 1 study group ?,https://www.reddit.com/r/riceuniversity/comments/1e01f9s/cfa_lvl_1_study_group/,1,1,2024-07-10 17:21:31,"Anyone here in Houston doing CFA lvl 1. I usually go to rice university fondren library to study if anyone wanna join for studying

"
Should I score send my 4 on APUSH to rice,https://www.reddit.com/r/riceuniversity/comments/1dzfx2s/should_i_score_send_my_4_on_apush_to_rice/,5,10,2024-07-09 22:44:41,Is a score send worth it? I live I Houston and hope to go to rice as well. I also have a visit to the uni scheduled! But I was just wondering if score sends mean anything to the college
Got an email saying I missed my tour when I didn't,https://www.reddit.com/r/riceuniversity/comments/1dza9sb/got_an_email_saying_i_missed_my_tour_when_i_didnt/,5,2,2024-07-09 18:51:35,"Hey I couldn't find the admissions megathread or the answer to this question so please forgive me.

  
Basically I went to a rice tour a couple of months ago, and I realized that they sent me an email saying that I didn't go. I know rice tracks demonstrated interest so should i just send an email saying ""hey, i actually did go, but only my dad signed in while I was in the bathroom"". This is my first time communicating with an admissions officer/team so sorry if it sounds like a stupid question thanks"
Questions,https://www.reddit.com/r/riceuniversity/comments/1dzi9u0/questions/,1,8,2024-07-10 00:31:05,"Wow automod is really strict on this sub. I think this post is well within in the rules tho so I'll put my questions in the comments. Not sure what exactly is triggering it


"
Business Major,https://www.reddit.com/r/riceuniversity/comments/1dzbza1/business_major/,2,4,2024-07-09 20:01:50,Is it true that Rice has grade deflation for its business classes? Like they curve down or smth?
"Hi, I created a hub of information and resources for Rice University students. I hope this is helpful to someone. Please let me know if you want me to add anything specific.",https://seniormars.com/projects/resources/,30,1,2024-07-08 21:21:51,
Residential college assignments ,https://www.reddit.com/r/riceuniversity/comments/1dydt4a/residential_college_assignments/,16,5,2024-07-08 16:52:46,Hi! Does anyone know if residential college assignments are still coming out today?
Load too big?,https://www.reddit.com/r/riceuniversity/comments/1dynvfn/load_too_big/,3,8,2024-07-08 23:43:10,"COMP 318
COMP 222
STAT 310
MATH 212

Is this doable? My biggest concern is Calc 3 and im debating if I should just take it another semester. "
What's good about Health Science at Rice?,https://www.reddit.com/r/riceuniversity/comments/1dx85fb/whats_good_about_health_science_at_rice/,1,1,2024-07-07 04:28:39,"Undergrad here. I want to know the advantages of majoring in health science at Rice compared to other schools. 

Basically, I want to know what's different or what makes it unique. Thanks! "
Does anyone know how can I go from Kingwood to Rice by Bus?,https://www.reddit.com/r/riceuniversity/comments/1dwf2qj/does_anyone_know_how_can_i_go_from_kingwood_to/,7,3,2024-07-06 02:22:49,"I’m sorry, I never used a bus. I’m doing a research program at Rice. I don’t have a car and Uber is way too expensive. I live in Kingwood and I’m trying to take the bus to get to Rice. Has anyone traveled from Kingwood to Rice by Bus and tell me how does it work? "
clubs,https://www.reddit.com/r/riceuniversity/comments/1dvtgjl/clubs/,4,4,2024-07-05 08:53:54,are there any specific rice clubs/student activities i can mention in my essays for rice? 
What's the best resource to get student reviews of Rice courses and professors?,https://www.reddit.com/r/riceuniversity/comments/1dvdqx5/whats_the_best_resource_to_get_student_reviews_of/,5,8,2024-07-04 18:26:31,"Is Rate My Professor the only option, or are there Rice-specific websites?"
Life at Rice,https://www.reddit.com/r/riceuniversity/comments/1duns5h/life_at_rice/,18,13,2024-07-03 20:03:38,"Rising senior looking into colleges. 

How is life at Rice? Are there any things to do outside of class and during the weekends? Do you think choosing this school was the right choice for you and why? How is the community? Lastly, are there opportunities to grow as a person in general?

I want this to be very open to get as much ""real"" information as I can, thanks to everybody who helps!"
Calculus ,https://www.reddit.com/r/riceuniversity/comments/1duxmaq/calculus/,2,13,2024-07-04 03:57:37,"Hello,
I am an incoming freshmen. I understand that Calc 1 is required and calc 2 as prerequisite for some classes. Who’s the best professor  for those classes? "
“New” Required Courses,https://www.reddit.com/r/riceuniversity/comments/1du5xrm/new_required_courses/,4,1,2024-07-03 04:43:04,"I’m an alum and was looking at Rice’s current graduation requirements; I’m a little confused on some of what I read and would love it if anyone here can clarify. 

When I was a student, LPAP (taken any time) and FWIS (taken during an assigned semester freshman year) were both required, and it looks like that hasn’t changed. It looks like students now need 9 hours per distribution instead of 12. 

However, the part that I don’t understand has to do with some new labels:

-Critical Thinking in Sexuality (first semester freshman year)
-Analyzing Diversity-labeled course (Is this the same as CTIS or an additional requirement? Website says it must be taken in the first two years and is three credit hours, so I’m thinking it’s different?) 
-Critical Dialogues on Diversity (The website says that this should be taken right after CTIS, so is this basically the last half of the required course?)

I guess what I’m struggling to understand is whether the university added three new required courses or whether any of these overlap."
STAT 310 w/ McGuffey,https://www.reddit.com/r/riceuniversity/comments/1dtkiw2/stat_310_w_mcguffey/,6,3,2024-07-02 12:23:36,"Hey yall

How was STAT 310 w/ McGuffey for those who have taken it with her? What was the workload/exams like? Thanks!"
mental health,https://www.reddit.com/r/riceuniversity/comments/1dspa2l/mental_health/,8,2,2024-07-01 10:02:26,"hi! I am an incoming first-year grad student, does any one have any idea whether I am eligible to benefit from mental health wellbeing services?

thanks"
New Rice student ,https://www.reddit.com/r/riceuniversity/comments/1dsfqt4/new_rice_student/,25,27,2024-07-01 00:21:23,What are some things I should know or be aware of going in as a new student at Rice?? Thanks! 
Rice Sports Page,https://www.reddit.com/r/riceuniversity/comments/1dsi97k/rice_sports_page/,15,2,2024-07-01 02:34:06,"Hey everyone, I would really appreciate if y’all would give my new Rice sports page a follow. I’m currently a rising Sophomore at Rice, in Jones College, and i’m a diehard Rice Sports fan. My sister was a former soccer player for Rice, and I have been watching Rice sports since I was a kid. My page will be mainly covering football and basketball but am open to expanding. I don’t think it’s fair that other Universities in Texas have their own separate sports news outlet and Rice doesn’t, so I’m here to change that. Thank you!

Instagram: @ricesportshub"
gmy nearby,https://www.reddit.com/r/riceuniversity/comments/1dsegoa/gmy_nearby/,0,1,2024-06-30 23:17:58,I am here for one more moth only. What would be good option for me to join gym. Any gyms around campus i can join and cancel after 1 month>?
Shadowing Near Rice,https://www.reddit.com/r/riceuniversity/comments/1dnnnmx/shadowing_near_rice/,12,7,2024-06-24 20:34:17,"Hey guys, I was wondering if anyone knows of any places near Rice that offer shadowing opportunities for pre-med students. I’ve been trying to contact some private-practice doctors but am having trouble finding personal contact information (i.e. anything other than the clinic’s phone number). Any guidance would be greatly appreciated.
"
Any way I can your the rice dorms before I arrive this August?,https://www.reddit.com/r/riceuniversity/comments/1dmbqkb/any_way_i_can_your_the_rice_dorms_before_i_arrive/,4,4,2024-06-23 02:16:01,Are the any in-person dorm tours available 
Hybrid MBA Scholarship,https://www.reddit.com/r/riceuniversity/comments/1dl5x23/hybrid_mba_scholarship/,9,3,2024-06-21 14:53:20,"Hello, 

I (35F) have Rice's Hybrid MBA program at the top of my list as far as a dream B-school is concerned. 

I'm in a neighboring state and am currently a water and wastewater engineering consultant within industrial settings but am eager to branch out into other industries (such as oil and gas, renewables, etc) with intentions of eventually landing in M&A/private equity worlds. Currently hold a master's in microbiology and am about to finish a master's in civil engineering w/ a focus on water resources in December. 

My employer is willing to support me financially. Here in lies the problem: I don't think they meant fully funding a program that is going to be well over $130K. With that said, are scholarships even possible for the Hybrid MBA students? Seems as if most of the funding is for the Traditional, full time students. "
Every day is a (Rice) Owl's Birthday! A rigorous exploration of a classic problem through math and rust.,https://seniormars.com/posts/everyday-birthday/,14,0,2024-06-21 02:04:26,
Dry Cleaning Shop Recs,https://www.reddit.com/r/riceuniversity/comments/1djkdrb/dry_cleaning_shop_recs/,5,2,2024-06-19 14:21:41,"Hello, would like some Dry Cleaning recommendations close to Rice. Lmk thanks :D"
Computer Recommendations ,https://www.reddit.com/r/riceuniversity/comments/1dj7gj9/computer_recommendations/,8,8,2024-06-19 01:41:01,"I’m coming to Rice this Fall as an undergraduate freshman in the Astrophysics major, does anyone have any laptop recommendations?"
"Upcoming Rice Grad Student Seeking Advice on Cycling in Houston
",https://www.reddit.com/r/riceuniversity/comments/1di4nys/upcoming_rice_grad_student_seeking_advice_on/,12,10,2024-06-17 18:06:34,"Hi everyone!

I'm an upcoming grad student at Rice University and I'm planning to stay off-campus, around 3-3.5 miles away from the university. I prefer cycling or using an electric bicycle for my daily commute as it doubles as exercise and is eco-friendly.

I have a few questions and would appreciate any advice you can offer:

1. Cycling in Houston: Are there any restrictions or specific regulations for cycling on the roads in Houston? Are the roads generally bike-friendly?

2. Bike Purchase: Where is the best place to buy a bicycle or an electric bike? Would Amazon be a good option, or are there local shops or cheaper places you'd recommend?

3. Commute Experience: How is the experience of cycling to Rice? Is it practical and safe?

Thank you in advance for your help! Looking forward to joining the Rice community soon!"
Campanile Orchestra,https://www.reddit.com/r/riceuniversity/comments/1dgvaaj/campanile_orchestra/,4,2,2024-06-16 00:11:11,"Does anyone know how selective it is, specifically for wind players?"
gym,https://www.reddit.com/r/riceuniversity/comments/1dgqgnr/gym/,2,4,2024-06-15 20:10:35,hi i am a non rice student here. Anyway i can use rice's rec for summer? or do you know any good campus gym around here as i stay around rice campus area 
Moody Civic Immersion,https://www.reddit.com/r/riceuniversity/comments/1df4s5y/moody_civic_immersion/,7,9,2024-06-13 17:37:30,I just got into the program! Should I go? Does anyone have an idea what the experience is like?
Grad Students Wellbeing Center Experience ,https://www.reddit.com/r/riceuniversity/comments/1ddy84g/grad_students_wellbeing_center_experience/,7,14,2024-06-12 04:35:47,"Hey everyone,

This is particularly directed to the grad students out there. Has anyone tried the Counselling/Therapy services offered by the Wellness Centre? How was your experience? Did you have to pay for the therapist?

I am at my breaking point and i really think it's time to get some therapy. But wanted to know how it has worked out for others out there..."
EMT-B: INTRODUCTION TO EMERGENCY CARE,https://www.reddit.com/r/riceuniversity/comments/1ddwy6n/emtb_introduction_to_emergency_care/,6,6,2024-06-12 03:22:54,I'm posting this to hear from anyone who has taken the course 'EMT-B: Introduction to Emergency Care.' I'd like to know how the class was and hear about your experiences. Any information is welcome.
Incoming Bioengineering grad student for fall 2024,https://www.reddit.com/r/riceuniversity/comments/1ddwv9e/incoming_bioengineering_grad_student_for_fall_2024/,6,4,2024-06-12 03:18:15,"Hi all,

I'll be joining the MS in Bioengineering program for fall 2024. Trying to connect with people from the same cohort. If you come across this, please hit me up. "
regarding the Health Insurance at Rice,https://www.reddit.com/r/riceuniversity/comments/1dciu6a/regarding_the_health_insurance_at_rice/,4,2,2024-06-10 11:04:37,"Hi, I'm joining Rice this Fall and have yet to explore any health insurance plans. The website mentions that the current insurance plan rate is around $3,200 per annum. But I have an option to waive it. I want to ask the current graduates whether it's worth waiving it and looking for another insurance plan. And also I request you to provide any better insurance plans at a lower cost if possible.

On the website, they've also mentioned something regarding AETNA and Wellfeet. I have no clue what that's about, can anyone please explain about that too :>

"
Dorm Essentials,https://www.reddit.com/r/riceuniversity/comments/1daojc2/dorm_essentials/,18,19,2024-06-07 23:07:19,"I’m an incoming freshman this fall. I already have a packing list together, but am wondering if any upperclassmen or alumni have any suggestions for things a freshman at Rice may need that aren’t on the typical dorm packing lists? Thanks for any help!"
Question about MEML@Rice,https://www.reddit.com/r/riceuniversity/comments/1dav7z9/question_about_memlrice/,3,0,2024-06-08 05:06:56,"Hi, I recently got an admission offer from Rice University for MEML program and have a question about major courses.

Do these major courses require heavy load for assignments and exams? Or are they based on discussion for grading?

I need to work as a full time worker and take relevant courses as a part-time student, so would like to check it in advance. Please share your experience with me if possible. Thank you."
Do the Rice supplementals stay the same every year?,https://www.reddit.com/r/riceuniversity/comments/1dahxw1/do_the_rice_supplementals_stay_the_same_every_year/,1,3,2024-06-07 18:26:19,"I want to know if they the same, to see if I can work on them now."
Social Scene at Rice ,https://www.reddit.com/r/riceuniversity/comments/1d9fkqt/social_scene_at_rice/,13,9,2024-06-06 11:08:26,"Im an incoming freshman and I've heard alot of res college culture and social life at Rice is centered more around drinking and partying, if you aren't into that stuff and most of the cult aspects of the res college life, is it difficult to make friends? or what do you see other students do? "
NOD Officially Cancelled,https://i.redd.it/k24bb2odmu4d1.jpeg,72,25,2024-06-06 00:48:06,Wiess magisters and the Dean of Undergraduate have announced that NOD will no longer be a public at Rice University. So long almost 50 years of lingerie-laced tradition.🫡
grads: what are you doing now?,https://www.reddit.com/r/riceuniversity/comments/1d9a0t4/grads_what_are_you_doing_now/,14,15,2024-06-06 04:42:43,please i need some hope in this cruel world
Further studies planning question,https://www.reddit.com/r/riceuniversity/comments/1d80swk/further_studies_planning_question/,4,0,2024-06-04 16:02:08,"Hi, I am a rising senior majoring at rice in ECE and I am eager to hear from current/past MECE students what is needed to get into the program (stuff like grades, research, clubs etc.) and what is needed to be eligible to get your tuition waved."
phys 126 and orgo 1 in the same semester,https://www.reddit.com/r/riceuniversity/comments/1d8738d/phys_126_and_orgo_1_in_the_same_semester/,2,3,2024-06-04 20:21:50,Is this doable? 
is phys 126 online doable,https://www.reddit.com/r/riceuniversity/comments/1d7zna2/is_phys_126_online_doable/,2,1,2024-06-04 15:15:03,^ 
Is taking orgo 1 and biochem 1 in the same semester doable,https://www.reddit.com/r/riceuniversity/comments/1d7z3ki/is_taking_orgo_1_and_biochem_1_in_the_same/,1,2,2024-06-04 14:52:20,"I also have stats and religion 101 planned for that semester 

edit: orgo is with yearty"
phys 125 with stenson,https://www.reddit.com/r/riceuniversity/comments/1d7mczw/phys_125_with_stenson/,2,7,2024-06-04 02:24:57,how is phys 125 with stenson (it will be in a relatively light 12 credit semester) 
RICE UNIVERSITY,https://www.reddit.com/r/riceuniversity/comments/1d7z1or/rice_university/,0,1,2024-06-04 14:50:07,"If I am a mid-student, do I still have a chance to get into Rice? and what can I do to have higher chances? I want to study law and business. Or any good universities I could enter?"
owl access??,https://www.reddit.com/r/riceuniversity/comments/1d65t5u/owl_access/,10,5,2024-06-02 05:07:48,"hey ya’ll, got invited to owl access as a limited income student…is it worth it? i’m kind of confused on what exactly i would be doing there…. if anyone knows, thanks in advance😄

UPDATE: thanks for the advice, everyone! i ended up deciding that i will participate😇"
Curious: what schools did you turn down for Rice?,https://www.reddit.com/r/riceuniversity/comments/1d44e4o/curious_what_schools_did_you_turn_down_for_rice/,42,41,2024-05-30 13:44:32,....and why?
RESP Invite,https://www.reddit.com/r/riceuniversity/comments/1d4esju/resp_invite/,9,9,2024-05-30 21:20:21,I just got an email inviting me to RESP… does this mean I’m stupid LOL and also is it worth participating?
"How bad of an idea is it to take Ochem1 & COMP 140 at the same time, and Ochem2 & COMP 182 at the same time?",https://www.reddit.com/r/riceuniversity/comments/1d4bvwi/how_bad_of_an_idea_is_it_to_take_ochem1_comp_140/,8,7,2024-05-30 19:13:16,"How bad of an idea is it to take Ochem1 & COMP 140 at the same time, and Ochem2 & COMP 182 at the same time?

I want to combine CS and pre-health prereqs, but i'm not sure if that's a good idea, or if I should completely drop one interest?

Thank you all!

\*\*Edit:

If it gives more clarity, I have 50 AP Credits, which will allow me (if I did my calculations right) to take 10 credit-hour semesters all throughout my four years? So hypothetically, I will be able to concentrate on those two hard classes"
Incoming Freshman Question ,https://www.reddit.com/r/riceuniversity/comments/1d33dpc/incoming_freshman_question/,12,10,2024-05-29 04:08:05,Can anyone tell me if the FWIS writing assessment really takes most people five hours to complete or is Rice just very generous with the time allowed?
CS Major with no prior experience,https://www.reddit.com/r/riceuniversity/comments/1d30216/cs_major_with_no_prior_experience/,11,8,2024-05-29 01:10:51,"Hello, how feasible is it to pursue a CS major without prior experience in coding at Rice? Have any of you done that? I originally applied as an aspiring Biosciences major, but I have had a recent identity crisis and exploring different areas I may want to study, and CS is in the running"
Does Rice host virtual internships for CC students during the academic year?,https://www.reddit.com/r/riceuniversity/comments/1d22i8d/does_rice_host_virtual_internships_for_cc/,0,3,2024-05-27 21:14:25,
How to buy semester pass for North Lot Parking?,https://www.reddit.com/r/riceuniversity/comments/1d1vqgc/how_to_buy_semester_pass_for_north_lot_parking/,0,3,2024-05-27 16:36:24,"Title, cant seem to find an online way to do this. Let me know. Thanks"
Did anyone here take HUMA 131 Fall 2022?,https://www.reddit.com/r/riceuniversity/comments/1d1j0n0/did_anyone_here_take_huma_131_fall_2022/,4,0,2024-05-27 04:06:03,"Hi all, I'm trying to find the screenshot that I thought I had of the single funniest Canvas discussion post of all time. Unfortunately, I got my access to all my Rice stuff cut off prematurely, so I can't look at anything in Canvas.

If you were in that class and still have access to Canvas, can you DM me? Thanks! <3"
community for students with ADHD,http://reddit.com/r/ADHDatRice/,6,2,2024-05-22 01:02:27,"I apologize in advance for the self-promotion, but since this community likely has many ADHD’ers, I wanted to share:

I’ve just created a subreddit for any Rice students who have ADHD, suspect they have ADHD, or have a partner with ADHD. the purpose is to provide peer support and a safe space to discuss topics relevant to ADHD and/or/Rice.

here it is if you’re interested!! r/ADHDatRice
"
Keck Hall Tower,https://www.reddit.com/r/riceuniversity/comments/1cxh4ne/keck_hall_tower/,6,0,2024-05-21 19:56:15,Anyone know how to get into the tower on Keck Hall?
Gym Usage for non-Rice Students,https://www.reddit.com/r/riceuniversity/comments/1culyok/gym_usage_for_nonrice_students/,4,4,2024-05-18 01:34:54,"Hello! Longhorn here! I will be in Houston for about 2.5 months for an internship. I'll be staying in a house in West Uni Place. As such, I was curious to know what the rules/regulations/fees were regarding non-Rice people using your university gym in the summer. Would love to potentially use it if possible. If that is not the case, will happily take gym recommendations that are close by that I can use. Let me know. Thanks!!🤘🏾"
Tuition Data,https://www.reddit.com/r/riceuniversity/comments/1cu5yui/tuition_data/,0,2,2024-05-17 14:01:34,Where would i find the tuition for Rice for each year after 2000?
Post-grad outcomes Rice MBE?,https://www.reddit.com/r/riceuniversity/comments/1ctxpmh/postgrad_outcomes_rice_mbe/,0,1,2024-05-17 05:32:15,"Hi, not sure if this is the right subreddit but I'm an incoming Master's in Bioengineering student at Rice. I'm probably going to do the research specialization track and I'm thinking of doing a PhD after. Just wanted to see if anyone knew what the post-grad outcomes usually are for MBE grads and if it's common to pursue a PhD or if people head straight to industry?"
Off- Campus housing at Rice University ,https://www.reddit.com/r/riceuniversity/comments/1ctjrnu/off_campus_housing_at_rice_university/,4,5,2024-05-16 18:21:36,"Hi guys, I would like to know where the current Rice students reside off-campus. And which apartments are affordable and have a good community. Please do share."
Im an incoming international grad student for Rice Univ's MA in Global Affairs this fall! Any tips on surviving campus life? Keen on making friends too!,https://www.reddit.com/r/riceuniversity/comments/1cta6a4/im_an_incoming_international_grad_student_for/,9,0,2024-05-16 10:57:34,
Affordability?,https://www.reddit.com/r/riceuniversity/comments/1csx2a9/affordability/,12,3,2024-05-15 22:01:04,"This is mainly for those of you whose COA isn't entirely covered by Rice... How do you and your families manage to afford Rice?

If you don’t mind sharing…
Are you full pay or half pay and are you pulling out loans to afford the price associated with Rice or can your family afford to pay all of it?
If you appealed and received a change in your FA offer, what was the difference between your offers? Did you originally not meet need-based eligibility?

I know that not everyone has the same financial situation but I would just like some background info on different situations to sort of compare to my family’s financial circumstances and see what can be possible."
Any thoughts on how to get into the gym without an ID?,https://www.reddit.com/r/riceuniversity/comments/1ctc22y/any_thoughts_on_how_to_get_into_the_gym_without/,0,4,2024-05-16 12:46:04,"
"
