title,url,score,num_comments,created_date,selftext
SOCI 344Sociology of Mental Health,https://www.reddit.com/r/riceuniversity/comments/1gw4mvf/soci_344sociology_of_mental_health/,6,0,2024-11-21 01:43:27,"  If anyone has taken this class, I'd love to hear an honest review. It's a field I'm really interested in, but I'm worried about the workload. Also, I'm not very good at writing, so if the class involves a lot of writing, I need to take that into consideration.  Thanks,"
Rice University adds to global footprint with new center in India ,https://www.houstonchronicle.com/news/houston-texas/education/article/rice-university-in-india-19925599.php,16,0,2024-11-19 21:38:15,
late pass/fail,https://www.reddit.com/r/riceuniversity/comments/1gsubr9/late_passfail/,6,6,2024-11-16 19:01:44,need to appeal for a late pass/fail but deadline was nov 1   how strict is Rice EX&S 
Advice needed to join the tennis community on campus,https://www.reddit.com/r/riceuniversity/comments/1gstqls/advice_needed_to_join_the_tennis_community_on/,0,2,2024-11-16 18:35:35,I will stay in Houston during the winter break and I want to find a tennis community where I can find someone to play with during week. Where and how can I find the community? I’m not sure if just walk up to the tennis court work 😬
Can I work as a TA and have an on-campus job simultaneously,https://www.reddit.com/r/riceuniversity/comments/1gqn4hg/can_i_work_as_a_ta_and_have_an_oncampus_job/,6,4,2024-11-13 20:47:24,"I’m an international student interested in taking  on a TA role, which requires commitment upto 20 hours at maximum per week. I’m wondering if it’s possible to also work an additional on campus job while being a TA?"
Does anyone know when or if the job position for Temporary Seasonal Readers will open up?,https://www.reddit.com/r/riceuniversity/comments/1gpw0c8/does_anyone_know_when_or_if_the_job_position_for/,6,2,2024-11-12 21:27:23,I could really use an extra job right now. 
help with spring 2025 course syllables,https://www.reddit.com/r/riceuniversity/comments/1go8x9k/help_with_spring_2025_course_syllables/,5,4,2024-11-10 19:40:19,"hi! I'm coming to Rice for exchange this coming spring \^\^ I'll need to start mapping my modules back to my home university soon but I can't seem to find much information on the course syllables on the course schedules,,, does anyone know when are course syllables released? any advice?"
help with admission pls,https://www.reddit.com/r/riceuniversity/comments/1go3cwj/help_with_admission_pls/,0,1,2024-11-10 15:39:33,"https://preview.redd.it/mq6vb4eyf30e1.png?width=789&format=png&auto=webp&s=410bbbd511e00c5dc5d4555f9e82d4df98cb5e19

https://preview.redd.it/hy1lyjp2g30e1.png?width=964&format=png&auto=webp&s=97940fcafc5fd5145d014908eed98d65bb99ffb9

So I had sent my IELTS score approx. 6 days ago and it wont still appear here  
Should I worry about this as i already had received an email confirmation that states my IELTS score was processed =\_="
Phys 102,https://www.reddit.com/r/riceuniversity/comments/1glt4wr/phys_102/,7,7,2024-11-07 15:32:11,"How difficult is Phys 102? I have AP credit for Phys 101 and I was considering taking Phys 102 this spring. I was also thinking about taking Phys 101 and 102 next year if the knowledge from Phys 101 is important for taking 102. Also, how does the difficulty of Physics 101/102 compare to Chem 121/122."
What classes defined your Rice experience?,https://www.reddit.com/r/riceuniversity/comments/1gjoswp/what_classes_defined_your_rice_experience/,23,13,2024-11-04 20:47:25,"i'm a senior Elec reminiscing about my time in college. As I'm approaching my last semester at Rice, I am looking to learn about what classes y'all feel define your Rice experience.

Rice has so many different opportunities across all departments from sculptures/art to medieval history to class on electromagnetism the brain.

TLDR: what are some must-take classes and why? Who are some must-take professors and why?"
Which area are you more likely to walk to a bite to eat?,https://www.reddit.com/r/riceuniversity/comments/1gig4n2/which_area_are_you_more_likely_to_walk_to_a_bite/,5,0,2024-11-03 05:38:53,"Walk to get a bite to eat*

Basically, I’m wondering if TMC or Rice Village are more popular for a bite to eat. For TMC, particularly the block where Starbucks, Piada, Halal Guys, etc is. But also some others.



[View Poll](https://www.reddit.com/poll/1gig4n2)"
Does anybody have a favorite D1 class? ,https://www.reddit.com/r/riceuniversity/comments/1gh7wi2/does_anybody_have_a_favorite_d1_class/,12,4,2024-11-01 15:21:06,
Is the Rice MSCS Program Worth It?,https://www.reddit.com/r/riceuniversity/comments/1ggk97w/is_the_rice_mscs_program_worth_it/,10,7,2024-10-31 17:37:49,"
Hey everyone! I just got an admit for the masters in computer science program at Rice University (Spring '25 intake), and I'm curious to hear opinions from current or past students—especially fellow international students from India. How’s the program in terms of academic rigor, research opportunities, and campus life? Is it worth the investment overall?

Please reach out or DM me if you’re also joining this spring or have any insights! Thanks!

"
Any classes that can be taken asynchronously? ,https://www.reddit.com/r/riceuniversity/comments/1ggk1uk/any_classes_that_can_be_taken_asynchronously/,3,9,2024-10-31 17:28:58,"I'm debating whether or not to take a Winter internship for next semester, and I'd have to relocate to the internship's office so I won't be at Rice. Does anyone know any classes that can be mostly taken asynchronously? i.e., no mandatory lectures and perhaps online exams (but willing to fly in for exam days). I can't take a semester off due to my scholarship, but I'm in a position where not taking any major classes won't affect my graduation date. I'd ideally take 12 credit hours of easyish classes that I can take while not being on campus.

Thanks!"
Best and worst FWIS and why?,https://www.reddit.com/r/riceuniversity/comments/1gfxe5e/best_and_worst_fwis_and_why/,11,5,2024-10-30 21:09:41,Title explains.
Does anyone know the dollar amount of the Virani Family's donation,https://www.reddit.com/r/riceuniversity/comments/1gfcgf0/does_anyone_know_the_dollar_amount_of_the_virani/,23,2,2024-10-30 02:31:51,I'm just curious what Rice thinks its brands are worth lol
Halloween party?,https://www.reddit.com/r/riceuniversity/comments/1gerp2o/halloween_party/,0,1,2024-10-29 10:53:19,"Hello!
Is there any Halloween party in the school on 10/31?
Thanks!"
Rice football head coach Mike Bloomgren fired!,/r/ricefootball/comments/1gdjcoz/bloomgren_fired/,29,1,2024-10-27 19:57:15,
What makes Rice Engineering Unique?,https://www.reddit.com/r/riceuniversity/comments/1gdh1zr/what_makes_rice_engineering_unique/,0,11,2024-10-27 18:02:04,"I know that Rice is ranked well, but I’m curious what is special about engineering at Rice compared to other universities. Any programs, research, opportunities, professors, general vibe? "
Finding an OC Roommate,https://www.reddit.com/r/riceuniversity/comments/1gc8mr8/finding_an_oc_roommate/,2,0,2024-10-26 00:11:37,"Hey y'all!

I am finding an off-campus roommate for the spring semester. DM me if you are interested! "
PhD students ,https://www.reddit.com/r/riceuniversity/comments/1gblfed/phd_students/,8,1,2024-10-25 03:49:41,"Any current PhD students here ? chemistry, chemical biology? "
Videography / Filmmaking Clubs,https://www.reddit.com/r/riceuniversity/comments/1gbnziu/videography_filmmaking_clubs/,2,5,2024-10-25 06:36:17,"I am planning to major in Computer Engineering. But, I am really interested in video editing and filming as well as a hobby. Are there any clubs at Rice related to this?"
Can someone help me?,https://www.reddit.com/r/riceuniversity/comments/1gatbvu/can_someone_help_me/,0,2,2024-10-24 03:27:00,I’m currently a senior in highschool and my top school is rice. I don’t care for any other school and i tried to make friends with students from rice but wasn’t too sure how to make them  😭i have so many questions and just need to be able to speak to someone who has experienced any of them!! 
FWIS grade,https://www.reddit.com/r/riceuniversity/comments/1gak3e5/fwis_grade/,0,4,2024-10-23 20:11:53,"I got a few late assignments and worry if this is gonna affect my final grade (only 2, not the big assignments). Is there anyway I can secure my grades?"
tips?,https://www.reddit.com/r/riceuniversity/comments/1g9xlbi/tips/,12,9,2024-10-23 00:31:46,Hi! I’m a junior in highschool right now and Rice is my top school. Wondering if anyone has any tips that can help increase my chances of admission? Or anything that I should know just in general? I can give more information regarding my academics and extra curriculars if that will help with understanding what I need to prioritize. Thanks in advance!
Any international alumni for the MEML program at Rice?,https://www.reddit.com/r/riceuniversity/comments/1g9uz8e/any_international_alumni_for_the_meml_program_at/,0,0,2024-10-22 22:27:47,
Looking for bpd friends on campus,https://www.reddit.com/r/riceuniversity/comments/1g94v20/looking_for_bpd_friends_on_campus/,13,9,2024-10-22 00:07:58,"Hello! currently an undergrad struggling with bpd. I just wanted to see if anyone else on campus also has bpd and wants to be friends! I don’t really have anyone to talk to about what I go through (in friendships my age) and would love to be able to relate to someone else :,) Feel free to DM me!"
"Rice, Baylor Universities sued, accused of inflating prices for students with divorced parents",https://www.houstonchronicle.com/news/houston-texas/education/article/rice-baylor-price-inflation-lawsuit-19841526.php,125,20,2024-10-18 12:13:16,
On-Campus jobs at Rice,https://www.reddit.com/r/riceuniversity/comments/1g6o4ua/oncampus_jobs_at_rice/,3,8,2024-10-18 17:45:33,"I just got admitted for my Masters in Engineering Management for Spring 25’, are there any on-campus jobs available at the Uni?"
tetra and meal swipes,https://www.reddit.com/r/riceuniversity/comments/1g6kr2d/tetra_and_meal_swipes/,2,2,2024-10-18 15:27:21,"Hi! How can I check how many tetra points and meal swipes I have remaining? and can I buy merch form the campus store by tetra points?

thanks"
pde and probability programs,https://www.reddit.com/r/riceuniversity/comments/1g4w743/pde_and_probability_programs/,1,3,2024-10-16 10:31:25,Could someone provide insights on the Rice mathematics department in terms of its graduate programs (PhD) with a focus on analysis-related areas like PDE and probability? Thank you!
Whoever was playing piano in the Student Center this afternoon was crushing it! ,https://v.redd.it/3bc7wm3aitud1,98,6,2024-10-15 00:50:50,Very impressive! 🙏 
What is housing like?,https://www.reddit.com/r/riceuniversity/comments/1g3s6j3/what_is_housing_like/,3,4,2024-10-14 22:06:46,What is the dorms like? Is there multiple people to a room or can you be the only one in the room?
"Current students and Alumns, what is something you love about Rice that most people wouldn't know about?",https://www.reddit.com/r/riceuniversity/comments/1g3ujjy/current_students_and_alumns_what_is_something_you/,1,9,2024-10-14 23:58:44,"Other ways to phrase the question:
What has made/makes Rice standout to you?
Favorite avtuvities/events at Rice?
What do you love about the community?
Are there any values the school harbors but aren't well known or talked about?

All answers are appreciated."
"What is the ""hookem horns"" or ""whoosh"" for Rice University?",https://www.reddit.com/r/riceuniversity/comments/1g271wu/what_is_the_hookem_horns_or_whoosh_for_rice/,19,21,2024-10-12 18:53:21,
Cards Not Working for Permit Parking?,https://www.reddit.com/r/riceuniversity/comments/1g1cgy7/cards_not_working_for_permit_parking/,2,4,2024-10-11 15:28:18,"I've been noticing recently that some people's cards aren't working for the permit parking gates and it's been causing lines to enter, does anyone know what's going on? I normally see this at West Lot 3."
Rice Mech Eng,https://www.reddit.com/r/riceuniversity/comments/1g1k1xj/rice_mech_eng/,0,4,2024-10-11 21:03:16,"Whats fun things in Rice Mechanical engineering. Give me insider facts plz

"
Help with supplementals,https://www.reddit.com/r/riceuniversity/comments/1g0zglr/help_with_supplementals/,0,3,2024-10-11 02:17:33,Would any of y’all be willing to look over my supplemental essays and give me some feedback? I need all the help I can get. Thanks!!
Pre med major,https://www.reddit.com/r/riceuniversity/comments/1g0r1ww/pre_med_major/,0,5,2024-10-10 19:30:55,What is the most popular/competitive pre med major at Rice and why? Just curious!!
Hi?,https://www.reddit.com/r/riceuniversity/comments/1fxzw3c/hi/,19,8,2024-10-07 04:54:49,"I was walking on campus and someone just drove by and yelled hi, five minutes later they came back and did it again? Has anyone else experienced this?"
"Current neuro majors, WHY should I go to Rice to study neuroscience? What classes, professors, and opportunities amused you when stepping on campus? Just trying to get a deeper insight into Rice's neuro program :p",https://www.reddit.com/r/riceuniversity/comments/1fx8ctc/current_neuro_majors_why_should_i_go_to_rice_to/,0,2,2024-10-06 04:16:50,
Arroz shirt,https://www.reddit.com/r/riceuniversity/comments/1ftsmjj/arroz_shirt/,28,8,2024-10-01 16:41:13,"A little bit of a silly question, but does anyone know where the Arroz shirts are from? I went to the bookstore and asked if they sold them there and they didn't know what I was talking about. I'm Mexican American so I'd really like to be able to get my hands on one lol. "
Help ,https://www.reddit.com/r/riceuniversity/comments/1fufonq/help/,0,5,2024-10-02 13:03:47,Trying to walk on to a college in the future anyone know how I could walk on to THE rice university 
Former Rice quarterback Tommy Kramer reveals dementia diagnosis,https://www.expressnews.com/sports/high-school/article/former-lee-standout-kramer-reveals-dementia-19794622.php,35,0,2024-09-26 16:48:30,
do admission chances change at all if you have a sibling currently enrolled at rice?,https://www.reddit.com/r/riceuniversity/comments/1fq8tfg/do_admission_chances_change_at_all_if_you_have_a/,7,7,2024-09-26 22:27:34,"I know that Rice offers a system where siblings can be put into the same residential college, but in terms of admissions, do they care at all?"
Today's Job fair,https://www.reddit.com/r/riceuniversity/comments/1fomx7o/todays_job_fair/,7,5,2024-09-24 20:45:53,How was it? 
sammy the owl sticker pack 8!,https://www.reddit.com/gallery/1fnvsrt,17,0,2024-09-23 21:21:59,"debuting 5 new stickers including:
-sammy bluey
-evangelion sammy
-sammy tea
-sammylingo
-be bold sammy

if you come to the archi market this wednesday, i'll be selling the sammy bluey sticker. everything else will be coming next week so make sure to pre order through this link: https://docs.google.com/forms/d/1q7NEjE1tqvwxjkRnHR4KEr6LCQEj0K7dKrW811Bb784/viewform

all stickers are $1 each"
How was your experience with career exposure & tech career night? ,https://www.reddit.com/r/riceuniversity/comments/1fnuqu6/how_was_your_experience_with_career_exposure_tech/,3,3,2024-09-23 20:37:18,"It will be my first time attending an event at rice university. 

I am doing masters of computer science online. If you have any juicy tips, feel free to share. "
Fun classes？,https://www.reddit.com/r/riceuniversity/comments/1fni0x1/fun_classes/,16,9,2024-09-23 11:22:45,"Hey! I’m heading to Rice Uni for an exchange next year. I’m really into humanities and social sciences, but I’m also super excited to explore some science courses. Any fun course recommendations?
"
Switching from Natural Science to Engineering at Rice?,https://www.reddit.com/r/riceuniversity/comments/1fnjzfb/switching_from_natural_science_to_engineering_at/,5,4,2024-09-23 13:06:44,"# Hi everyone! If I get into Rice University’s Natural Science School, is it possible to switch to the Engineering School later on? What’s the process like, and are there any major challenges I should be aware of?

#   "
Those who applied test optional,https://www.reddit.com/r/riceuniversity/comments/1fn59pf/those_who_applied_test_optional/,7,3,2024-09-22 22:18:28,"Those who applied test optional and got in, what do you think made you stand out from other applicants?!"
What is Rice like?,https://www.reddit.com/r/riceuniversity/comments/1fn94er/what_is_rice_like/,0,5,2024-09-23 01:29:17,Please tell me about the good and bad at Rice. What are some important things to know?
CS at rice…,https://www.reddit.com/r/riceuniversity/comments/1fm8m9c/cs_at_rice/,13,14,2024-09-21 17:46:57,"If you’re doing CS at Rice, was that your first choice or option to do it at rice? And how is it like in general at Rice? I’ve attended two on campus events and in both AND THE VIRTUAL INFO SESSION there wasn’t a single CS student that I could ask anything or get their insight "
I'm attending Rice's open fall house (Owl about Rice) tomorrow. What should I be wearing? ,https://www.reddit.com/r/riceuniversity/comments/1flht85/im_attending_rices_open_fall_house_owl_about_rice/,10,13,2024-09-20 17:38:54,The question basically
Any Must Visit Sites/Restaurants?,https://www.reddit.com/r/riceuniversity/comments/1fl14oh/any_must_visit_sitesrestaurants/,14,25,2024-09-20 01:56:40,"Visiting this weekend for OWL About Rice… I would appreciate any strong recommendations for getting a feel for the community. Any campus events or amazing restaurants(BBQ, brunch) that we shouldn’t miss?

Thanks in advance!!!"
Do the group of Persian students still meet up at the Valhalla every Friday?,https://www.reddit.com/r/riceuniversity/comments/1fjjgx7/do_the_group_of_persian_students_still_meet_up_at/,8,1,2024-09-18 03:32:09,
dining halls,https://www.reddit.com/r/riceuniversity/comments/1fjc0ng/dining_halls/,8,7,2024-09-17 21:51:02,"hi guys! im pretty confused about how dining halls work. so if I swipe and get in, and get like a decent plate and then get out to sit and actually eat it, can I get back in again (without swiping) to get a drink, dessert, etc.? thankyouu!"
Lectures for STAT 413 (INTRODUCTION TO STATISTICAL MACHINE LEARNING),https://www.reddit.com/r/riceuniversity/comments/1fii6pg/lectures_for_stat_413_introduction_to_statistical/,1,1,2024-09-16 22:34:17,"I'm not a student at Rice, but my college does not really have any Machine Learning classes, but I am interested in learning more about this topic. Is there any videos/ textbooks/ notes available for this class? "
Tips for going to Rice vs UH game!,https://www.reddit.com/r/riceuniversity/comments/1fdn9lo/tips_for_going_to_rice_vs_uh_game/,26,1,2024-09-10 17:15:22,"Hey Rice! Your Owls will be facing off against the University of Houston this Saturday at 7 and they will need all the help they can get! In preparation for this I’ve made a quick guide for anyone who wants to go to the game but might not know how to get there, where to sit, where to get tickets etc. 

**Tickets**

Single tickets are currently selling as low as $11 on [Ticketmaster](https://www.ticketmaster.com/event/Z7r9jZ1A7AJGV) and [seatgeek](https://seatgeek.com/houston-cougars-football-tickets/ncaa-football/2024-09-14-7-pm/6370834). Odds are the stadium won’t be anywhere near full so you should be able to purchase the cheapest tickets available and then find an empty spot somewhere you like near other Rice fans.

However, if you’re uncomfortable with the possibility of taking someone else’s seats, I would recommend buying seats on the visitor bench side close to the visitor sections. Sections 224-226 and 323-327 are listed as the official visitor sections in the [UH seating map](https://dxbhsrqyrr690.cloudfront.net/sidearm.nextgen.sites/uhcougars.com/images/2024/8/26/2024_football_map__-_08.14.24.png) so Rice season ticket holders and football team family members who got their tickets through Rice will likely be sitting in those sections.

**Travel to UH**

*Fan bus*- Rice athletics is organizing a fan bus to take fans from Rice to the game approximately 4 hours before kickoff  (3 pm). If you are interested in this option, fill out the [interest form](https://docs.google.com/forms/d/e/1FAIpQLSeFvKpVJFwTAnrARNdy0wjfwIKKuyqJPjCcO3g4ra-pQy6q0g/viewform) sent out by Rice athletics.

*Metro Rail*- The metro rail has a stop near Rice and near TDECU stadium. If you get on the metro across the street from Rice, near Hermann park, you can ride it toward downtown. Get off on the central station main stop, then walk to Central Station Rusk or Central Station Capitol and get on the purple line train. You then get off at the UH stadium stop. The rail does charge $1.25 for regular fare. Since this would take two trains it would be $5 bucks to ride the rail to the game and back.

If you aren’t coming in from Rice you can also park in a parking garage or lot in downtown Houston then get on the closest station for the purple line. There are stops near discovery green and Shell Energy stadium if you know of a place you like to park near either of those. And if you're confused about any of this you can use google maps to route you from Rice to UH and click the transit option so it will show you the metro rail stops and routes. 

*Driving to UH*- If you will be driving to UH, be aware that parking there is difficult. I would recommend getting there early. A lot of their parking lots are reserved for UH parking permit holders. Parking lots you can expect to park in are labeled in teal, purple, black, and pink stripes in the [UH gameday parking map](https://dxbhsrqyrr690.cloudfront.net/sidearm.nextgen.sites/uhcougars.com/images/2024/8/26/2024_football_map__-_08.14.24.png), though there likely will be other options farther away.

**Tailgating**

If you plan to tailgate at your own car, you should be able to at any of the parking lots listed in the [UH gameday parking map](https://dxbhsrqyrr690.cloudfront.net/sidearm.nextgen.sites/uhcougars.com/images/2024/8/26/2024_football_map__-_08.14.24.png). Parking lots will be open to 6 hour prior to kickoff so you can start as early as 1 pm.

Rice is also organizing a tailgate in Cougar alley from 5-7. You can register for that at [this link](https://events.rice.edu/event/361778-rice-vs-uh-bayou-bucket-tailgate). Prices for that recently dropped and they do take walk-ins. And if you don’t want the food and drink you can just show up and mingle with other Rice fans!

Happy Bayou Bucket y’all! Let’s cheer our owls to a win. Rice fight never dies!"
Is it easy to change major at Rice?,https://www.reddit.com/r/riceuniversity/comments/1fcq2qx/is_it_easy_to_change_major_at_rice/,20,6,2024-09-09 13:58:14,I heard that students have lots of flexibility on major choosing at Rice. Is that still a truth now? Or is it only easy when I want to change between two related majors? Are there occasions that there's too many people in one major so I can't change to that major?
How is campus life on the weekend?,https://www.reddit.com/r/riceuniversity/comments/1f9p3nc/how_is_campus_life_on_the_weekend/,11,5,2024-09-05 15:23:15,"We just took a tour last Saturday and loved so much about Rice, including the residential college system. It was not the best time to tour, given it was Saturday morning of a long weekend. It was naturally very quiet but I’m curious how lively it is on a regular weekend? 

We saw lots of students with Rice gear in Rice Village. What’s a typical weekend like? And what do you like/not like about student life? Thanks!"
Student Insurance Prescription Price Change,https://www.reddit.com/r/riceuniversity/comments/1f9wnyt/student_insurance_prescription_price_change/,3,1,2024-09-05 20:31:42,Basically the title. Has anyone’s copay for medications gone up this year?
"Rice Jewish students need Chabad house ""now more than ever""",https://www.chron.com/culture/religion/article/rice-houston-jewish-students-19742204.php,3,2,2024-09-05 15:41:54,
"Wayne Graham, legendary Rice baseball coach, has passed away",https://i.redd.it/qdqepya8qsmd1.jpeg,76,4,2024-09-04 13:40:32,
"Wayne Graham, legendary coach who led Rice baseball to seven College World Series, dies at 88",https://www.houstonchronicle.com/sports/college/article/rice-baseball-wayne-graham-dead-obit-19741881.php,53,2,2024-09-04 13:40:01,
Microwaves in Duncan Hall or nearby?,https://www.reddit.com/r/riceuniversity/comments/1f8yeit/microwaves_in_duncan_hall_or_nearby/,3,2,2024-09-04 16:56:24,"Hi everybody, I was wondering if there were microwaves in Duncan Hall or anywhere nearby? Thanks!"
Art Project Assistance,https://www.reddit.com/r/riceuniversity/comments/1f89juo/art_project_assistance/,2,0,2024-09-03 19:54:13,"Hello friends,

This is a slightly odd request but here goes. I have a slight art project involving clamshells that I need painted by ideally an Indigenous identifying person or someone of Mexican descent. I am willing to pay a negotiable amount for the work to be done (I am fair and not cheap). 



Drop off and pick up of clamshells must be done in SW Houston and in public. Please DM me if such a deal works for you. "
Place to charge Scooter?,https://www.reddit.com/r/riceuniversity/comments/1f7gmgb/place_to_charge_scooter/,2,1,2024-09-02 20:11:31,I’m a new student at Will Rice. Is there a place in each college where we can charge the scooter?
"Looking for tennis instructor 
",https://www.reddit.com/r/riceuniversity/comments/1f5z45x/looking_for_tennis_instructor/,3,1,2024-08-31 22:18:26,"I'm a first year grad student looking to take tennis lessons. If anybody teaches or has an instructor they could recommend, that would be great! I've played a bit, but I still consider myself a beginner. Thank you! "
