title,url,score,num_comments,created_date,selftext
CMOR 302/303 and MATH 355 for ECE,https://www.reddit.com/r/riceuniversity/comments/17jjrvh/cmor_302303_and_math_355_for_ece/,0,4,2023-10-30 02:54:52,"Hi guys, ECE freshman here. I wonder what are the differences between those classes for a ECE major?"
Halloween Parties?,https://www.reddit.com/r/riceuniversity/comments/17imn6n/halloween_parties/,7,3,2023-10-28 20:43:42,Does anyone know of any Halloween parties tonight? Need a second round
Voting Shuttles,https://www.reddit.com/r/riceuniversity/comments/17henuk/voting_shuttles/,13,0,2023-10-27 03:39:25,"  **VOTE! Make your voice heard!**

To support the Rice community's participation in early voting in Harris County, Rice Transportation will provide bus service to the TMC voting center beginning Saturday, October 28, through Friday, November 3. 

The details for using the BRC/TMC Bus service are:

**Voting Location:** 

John P. McGovern Commons in the Texas Medical Center

6550 Bertner Avenue

**Bus Service on Weekdays:** 

* Beginning at 4:00 p.m.,  community members can      board the BRC/TMC bus along College Way in the Inner Loop and request to      be dropped off for early voting.
* Pickup to return to campus will be at the early      voting location (at the Bertner address). Buses will operate until 7:30      p.m. during the week. 

&#x200B;

**Bus Service on the Weekend of October 28 and 29:** 

* Beginning at 1:00 p.m. on the weekends, buses will      operate from the Rice Student Center.
* Buses will depart every 30 minutes and will run until      7:30 p.m.

&#x200B;

**Shuttle Return and Operating Times:** 

* Shuttles will operate until 7:30 p.m. each evening to      ensure everyone has ample time to vote and return to campus.
* For weekend service on Saturday and Sunday, shuttles      will run from 1:00 p.m. to 7:30 p.m. 

Everyone is encouraged to make their voice heard. "
Tips for Rice Football with kids?,https://www.reddit.com/r/riceuniversity/comments/17ercox/tips_for_rice_football_with_kids/,8,6,2023-10-23 18:27:55,"
Looking to take my kids (4 and 7) to the Rice football game this Saturday. Never been so was wondering if it’s easy to buy tickets at the gate day-of? Or should we buy in advance to make sure we are able to sit in a certain section? Any other tips?"
NOD is approaching! Alumni: What was NOD like for you?,https://www.reddit.com/r/riceuniversity/comments/17cqkna/nod_is_approaching_alumni_what_was_nod_like_for/,19,7,2023-10-21 01:02:22,"If you have any fun (or not so fun) stories or experiences about NOD, feel free to share!

I know that NOD has gotten tamer over the years with constant new restrictions and policies, so I‘m curious to see what it was like in the past."
Rice Class of 2028 Discord??,https://www.reddit.com/r/riceuniversity/comments/17cu3ol/rice_class_of_2028_discord/,7,6,2023-10-21 04:11:20,"Hey, I've been looking around for Rice university discords, and have only found ones for 2027 and further. Are there any discords for upcoming 2028 applicants/students interested in Rice?"
Neuroscience BS course selection HELP,https://www.reddit.com/r/riceuniversity/comments/17bwf1h/neuroscience_bs_course_selection_help/,2,2,2023-10-19 23:06:12,"I'm a freshman planning to go on the Neuroscience BS cellular and molecular path. As course selection for the spring semester is about to start I'm wondering if any upperclassman can tell me in which semester did y'all take these ""core neuroscience lecture courses"" and how hard were they?

https://preview.redd.it/75rzzumnq8vb1.png?width=1694&format=png&auto=webp&s=fc2cc0655c3e3ba908a0946045689cff958b16ad"
"Hey, I am an senior hoping to join next fall and i have some questions about student culture.",https://www.reddit.com/r/riceuniversity/comments/17abtrc/hey_i_am_an_senior_hoping_to_join_next_fall_and_i/,14,11,2023-10-17 23:19:53,"I wanted to learn more about the student culture like traditions, superstitions, rivalries between the colleges, and more. I am interested in any significant events that happened in the school year like pranks between colleges and students. "
Double major,https://www.reddit.com/r/riceuniversity/comments/177mfsj/double_major/,2,3,2023-10-14 10:25:29,Any double majors for neuroscience and computer science double major? Is it worth it?
Full List of AAC Subreddits,/r/AmericanAthletic/comments/175vab1/full_list_of_aac_subreddits/,7,0,2023-10-12 02:11:08,
Is Rice University's MCS program friendly to those without a CS background?,https://www.reddit.com/r/riceuniversity/comments/1719wva/is_rice_universitys_mcs_program_friendly_to_those/,7,9,2023-10-06 11:32:53," I am an international student who, somewhat unwillingly, chose finance as my undergraduate major. During that time, I took some computer science courses, such as data structures. Now, I'm interested in pursuing a more computer science-centric major. I'm curious, is Rice University's MCS program friendly to those without a CS background?"
warmest buildings to study in on campus?,https://www.reddit.com/r/riceuniversity/comments/170xk36/warmest_buildings_to_study_in_on_campus/,15,3,2023-10-05 23:56:10,room temperature for most people is too low for me and i want to find somewhere i can study without being cold and miserable or layering up
How do I find a mentor?,https://www.reddit.com/r/riceuniversity/comments/170adho/how_do_i_find_a_mentor/,7,4,2023-10-05 06:06:15,"I'm a freshman coming into Rice as a (formerly-known) VADA major for film/photography. With Rice's STEM-heavy focus, I've been trying to find opportunities in film and gaining experience through internships or on-campus jobs. I talked to one of my professors and he told me that I should try to find some sort of mentor.

This question doesn't need to be specific to film/photography, but rather for Humanities/Arts majors. I just want to know how to find one and what should I expect from a mentor?"
Bombed Econ 200 Midterm. Drop or P/F? Need help,https://www.reddit.com/r/riceuniversity/comments/16zvp0g/bombed_econ_200_midterm_drop_or_pf_need_help/,9,6,2023-10-04 19:07:00,"Looking for some help about what to do with Econ 200. I am double majoring with Econ, and could switch to just my primary major if necessary. I absolutely bombed the first midterm but would like to avoid dropping the class. Does anyone have experience with taking this course and was able to get through it? Ideally I pass/fail, get a decent grade and go on about everything else. Or I can drop and just go with my primary major. Is it possible to make a comeback in this class? I know I got well below the average. Any advice is much appreciated!"
Texas politics pushing away new faculty hires at Rice University,https://www.chron.com/news/houston-texas/article/rice-university-politics-faculty-18403743.php,60,18,2023-10-04 03:58:15,
Voter Registration On Campus,https://www.reddit.com/r/riceuniversity/comments/16z0y0y/voter_registration_on_campus/,10,0,2023-10-03 19:25:17,"Fondren Library will host a voter registration table daily 2-5pm this week (Oct 2-6) M-F and next Monday (Oct 9), as well as 12-6pm next Tuesday October 10, which will be the last day to get registered for this fall election. During this event, we also distribute important election information to voters who are registered to become informed voters.

Please send anyone you know who needs this service.

Location: across the Circulation Desk, 1st floor, Fondren Library

Question: contact [govhelp@rice.edu](mailto:govhelp@rice.edu)."
Expected Curve for COMP 182,https://www.reddit.com/r/riceuniversity/comments/16z3gwa/expected_curve_for_comp_182/,2,5,2023-10-03 21:05:30,"Hi. I'm currently taking COMP 182 as an incoming freshman this semester, and I wanted to see what the curve for this class has been in the past. Right now, I believe that I have been doing well in the class, but in the wake of the first exam (which had an average score of 50%), I wanted to know what the curve for the whole class usually is. If the average on the second midterm and final end up being the same, there would need to be a curve of 20 to 30 points in order for most of the class to pass. Is this typical?"
How much pull does the Rice name have in med school admissions?,https://www.reddit.com/r/riceuniversity/comments/16yi0ej/how_much_pull_does_the_rice_name_have_in_med/,9,7,2023-10-03 04:02:54,"Title, basically. 

Specifically curious about personal experiences of recent grads + OOS (top tier 💀) schools!"
Alumni Parking,https://www.reddit.com/r/riceuniversity/comments/16y8qdw/alumni_parking/,3,3,2023-10-02 21:17:48,"does anyone know if i have a family thats an alumni member if I can just get alumni parking instead of student parking

&#x200B;"
Classroom Visits,https://www.reddit.com/r/riceuniversity/comments/16x131k/classroom_visits/,3,2,2023-10-01 13:22:23,Hello I’m a senior that’s planning to visit Rice. One of the options that I can sign up for are classroom visits. Can anyone give me any info on what they are exactly/if I should do one of them?
Are intro STEM classes curved?,https://www.reddit.com/r/riceuniversity/comments/16ukh14/are_intro_stem_classes_curved/,8,3,2023-09-28 16:24:19,"MATH 102/212, PHYS 101/102, etc."
Academic rigor,https://www.reddit.com/r/riceuniversity/comments/16u1cdz/academic_rigor/,10,6,2023-09-28 00:34:29,"Is the academics at Rice manageable? Is working hard a guarantee that one could pass? More often that not, do people pass or fail? What ways can one guarantee good scores throughout their time at Rice?!"
Looking To Hire A Rice Student Part Time For Archival Work,https://www.reddit.com/r/riceuniversity/comments/16t7kor/looking_to_hire_a_rice_student_part_time_for/,13,1,2023-09-27 02:03:22,"Hi all, 

Wanted to post a relatively low-skill job opportunity for a Rice student looking for some part-time work. 

The job is ideal for humanities or media students, but not exclusive. 

It will involve working in the Fondren Library archives, and could become tedious. It is part of a larger project that should run for anywhere between 3 - 6 months, and depending on the efficiency and quality of work, could be up to 2 - 3k USD per month. 

DM me or comment below if this is of interest to you and we can hop on a call to talk about requirements and if its a good fit! "
What do you do in FWIS 188,https://www.reddit.com/r/riceuniversity/comments/16pumv7/what_do_you_do_in_fwis_188/,2,3,2023-09-23 04:09:20,I'm an engineering major thinking of taking FWIS 188 in the spring but I've heard it's very time consuming. Why is that so? What kinda projects are you assigned and why are they time consuming
"If I get into Rice for com sci,should I be familiar with everything related to it already? Or I can study about it when I’m at Rice",https://www.reddit.com/r/riceuniversity/comments/16ltoy7/if_i_get_into_rice_for_com_scishould_i_be/,7,11,2023-09-18 12:04:02,
Does Rice have a computational concentration for cognitive science?,https://www.reddit.com/r/riceuniversity/comments/16llqkx/does_rice_have_a_computational_concentration_for/,4,1,2023-09-18 04:30:18,"hey!

I'm currently a highschool senior and I was wondering if Rice has a computational concentration for cog sci (AI/Machine Learning). Pls lmk, thanks ! <3"
Microwave on campus,https://www.reddit.com/r/riceuniversity/comments/16kqc9t/microwave_on_campus/,4,5,2023-09-17 03:28:41,Does anyone know if there is a public microwave on campus?
RICE BEATS HOUSTON 43-41 TO RECLAIM THE BAYOU BUCKET!!!,https://i.redd.it/t5qpyhscqcnb1.jpg,137,2,2023-09-10 03:59:12,RICE WINS IN DOUBLE OT FOR THE FIRST TIME SINCE 2010!
Party/tailgate needed,https://www.reddit.com/r/riceuniversity/comments/16c154u/partytailgate_needed/,8,4,2023-09-07 00:27:04,"Hi everyone! And happy upcoming gameday. My friends and I go to uh and are thinking about coming to watch the game. Does anyone know if there are any pre-games, parties, or a tailgate happening? Also, what is the most popular bar and hangout on campus? 

I invite everyone to come to uh for our next game; we’re so much fun, it’s worth it."
Any kinesiology majors here?,https://www.reddit.com/r/riceuniversity/comments/165a7hw/any_kinesiology_majors_here/,5,7,2023-08-30 09:47:35,"I love everything about rice but I have some specific questions about the kinesiology undergraduate majors. If anyone is in one of the programs, it would be amazing if I could ask some questions :)

Edit (questions):

1. how were the professors?
2. how big were the classes and how were the student to faculty ratio?
3. How were the difficulty of the courses and were there adequate resources to help you?
4. How is are the kinesiology majors for pre-med (i.e. managing course load, planning etc)

Thanks in advance!"
"Looking to sell something, where is the best place to do so?",https://www.reddit.com/r/riceuniversity/comments/1645x6m/looking_to_sell_something_where_is_the_best_place/,1,4,2023-08-29 02:29:02,"Am looking to sell a pair of shoes to Rice students, anywhere know where is the best place to do so?"
Are there any conservative clubs / organizations at Rice?,https://www.reddit.com/r/riceuniversity/comments/1639srr/are_there_any_conservative_clubs_organizations_at/,3,11,2023-08-28 02:32:59,
How to learn MATH 102 on your own?,https://www.reddit.com/r/riceuniversity/comments/1613vu5/how_to_learn_math_102_on_your_own/,8,4,2023-08-25 16:24:08,"I've been to lecture a few times and it's become rapidly apparent that I won't do well without learning the curriculum essentially entirely through self study.

How would you go about learning this curriculum on your own?"
How is the relatively new MEML program? Any folks who can provide thier feedback and whether or not other universities in Texas can compare with this,https://www.reddit.com/r/riceuniversity/comments/160rwkt/how_is_the_relatively_new_meml_program_any_folks/,0,0,2023-08-25 07:14:38,
economics at Rice,https://www.reddit.com/r/riceuniversity/comments/15x3d2c/economics_at_rice/,0,2,2023-08-21 10:09:15,"economics students at Rice

could you please explain the difference between ECON and MTEC"
How to See Daily Schedules,https://www.reddit.com/r/riceuniversity/comments/15wn0f5/how_to_see_daily_schedules/,4,3,2023-08-20 21:06:57,Is there another way to view your day-to-day schedule like what classes at what time and where besides Banner. Banners involves too many steps and I was trying to see if there a schedule on Canvas but there seems to not be any either. Any tips
ASAP: Date spots/ideas?,https://www.reddit.com/r/riceuniversity/comments/15utzvp/asap_date_spotsideas/,5,13,2023-08-18 19:33:54,"O-Week is moving fast ‼️

I'm planning for Saturday evening so I'm running out of time to figure it out.

I'm not familiar with Houston. Any recommendations for places or activities within walking / scooter distance of campus? Preferably not very costly activities and under-21 friendly."
Any Fallout: New Vegas Players?,https://www.reddit.com/r/riceuniversity/comments/15tcyeg/any_fallout_new_vegas_players/,7,8,2023-08-17 04:38:09,"Weird opening, I know, but I wanted to maybe reach out to some students that play it to understand what their life is like as a Rice university student and what inspired them to go there.

Any responses would be appreciated (you know what I mean). Thanks so much! "
Phys 101 and 102.,https://www.reddit.com/r/riceuniversity/comments/15rtx0v/phys_101_and_102/,4,9,2023-08-15 14:13:34,"Hi im a freshman for this fall and i am choosing my courses now. I have AP credits for 101 and 102 and i intend to major in ECE. In this case, would the AP physics C foundation enought for me to take higher level courses like ELEC 220?"
Places to study on and around campus at 5am?,https://www.reddit.com/r/riceuniversity/comments/15q9tzg/places_to_study_on_and_around_campus_at_5am/,9,7,2023-08-13 20:49:07,Hey guys I like to wake up early and study but I haven't found any place on or around campus that's open at 5am. Y'all got any suggestions?
Making Friends during Oweek,https://www.reddit.com/r/riceuniversity/comments/15p075g/making_friends_during_oweek/,21,14,2023-08-12 09:37:44,I'm an incoming freshman and I'm a little awkward at times during conversations and find it hard to start a conversation with someone new. Are there any tips on making friends during oweek because I'm afraid everyone will form their little circles before I really get to know anyone.
Classes Delivered Online,https://www.reddit.com/r/riceuniversity/comments/15nwx97/classes_delivered_online/,5,8,2023-08-11 03:03:30,"Y’all is there any d1/d2 classes delivered online right now? I just broke my knee so if it delivers by online format would be perfect!
Currently sophomore natural science division so flooded by D3."
FWIS 100 and Premed pre-requisites,https://www.reddit.com/r/riceuniversity/comments/15msqvf/fwis_100_and_premed_prerequisites/,6,5,2023-08-09 21:51:09,"So I have been placed at FWIS 100 course fall and FWIS spring, does this satisfy med schools pre-requisites or do I have to take extra FWIS courses during my sophomore year?"
Getting out of FWIS 100,https://www.reddit.com/r/riceuniversity/comments/15n51p2/getting_out_of_fwis_100/,0,12,2023-08-10 07:10:10,I just found out I got placed into FWIS 100 and the disappointment is heavy. I would never have guessed that I would be placed in here. How many ppl are in FWIS 100 every year and is there anyway I can petition for this as I truly believe that my writing skills would be sufficient for any normal FWIS course
Aetna Student Health or Inhouse alternative insurance plan... Which is better for international students and why?,https://www.reddit.com/r/riceuniversity/comments/15mjwr4/aetna_student_health_or_inhouse_alternative/,2,2,2023-08-09 16:21:23,
Making Up for Class and Excused Absences,https://www.reddit.com/r/riceuniversity/comments/15lbn4t/making_up_for_class_and_excused_absences/,11,4,2023-08-08 08:09:39,"I’m an incoming freshman and I just found out I will have to leave campus back to my country for a whole week or even two in September to handle some legal issues (nothing bad). If so, what support does rice offer for these kind of situation as I’m really worried about falling behind. Do they offer online classes? recorded lectures? reference materials?"
Rice Graduate Apartments,https://www.reddit.com/r/riceuniversity/comments/15j5vy3/rice_graduate_apartments/,1,3,2023-08-05 20:31:19,Does anyone know what floor RGA Unit 121 would be on?
Incoming graduate with questions about course scheduling & some other things,https://www.reddit.com/r/riceuniversity/comments/15hrc0x/incoming_graduate_with_questions_about_course/,4,5,2023-08-04 05:42:33,"Hi! I'm an incoming international graduate student for the CS program. I'm currently planning out my semester right now, and I'm confused if classes happen in 75 or 50 minute time blocks. So far, it looks to me that graduate classes are more likely to be 75 minutes long than 50 minutes. Am I correct in this assumption? Also, how long of a break do I have between classes? 10 minutes? 

It's a bit of a hassle since I'm trying to plan my schedule out in a spreadsheet, like I usually do haha. Thanks in advance for the help!"
Looking for students for some Owl dodgeball!,https://i.redd.it/6k1pq3plyxfb1.jpg,23,10,2023-08-03 18:49:47,
MATH classes over the summer,https://www.reddit.com/r/riceuniversity/comments/15e978n/math_classes_over_the_summer/,4,10,2023-07-31 07:33:31,"Are Math 211, Math 212 and Math 355 fully online over the summer? ( I am particularly referring to the current semester)"
SHARE DRIVE Airport to RGA,https://www.reddit.com/r/riceuniversity/comments/15e9y8d/share_drive_airport_to_rga/,3,3,2023-07-31 08:16:06,"Hi, does anybody arrive in Houston (IAH) on the 11th of Aug around 9 PM and want to share ride to RGA? Please contact me or comment below. 

#ShareTaxi #RGA"
Are there course evals for summer classes?,https://www.reddit.com/r/riceuniversity/comments/15e1ue3/are_there_course_evals_for_summer_classes/,6,1,2023-07-31 00:56:09,^ what the title says. I’m just curious and want to leave a good review for my class
Registering for Classes as Freshmen,https://www.reddit.com/r/riceuniversity/comments/15dooqq/registering_for_classes_as_freshmen/,8,8,2023-07-30 15:43:26,"As a freshmen during O week, will there be a chance I get deny from any class because it filled up too quickly or will all classes be available regardless of how late I signed up? I’m talking abt classes like FWIS, AD, LPAP or any requirements classes"
How much free time do we get during o-week?,https://www.reddit.com/r/riceuniversity/comments/15d5bho/how_much_free_time_do_we_get_during_oweek/,14,14,2023-07-29 22:49:09,Wondering if we would get time to go to the gym or just chill
Choosing a concentration for ELEC,https://www.reddit.com/r/riceuniversity/comments/15d72f8/choosing_a_concentration_for_elec/,9,6,2023-07-30 00:10:00,"Hi guys, I'm a rising sophomore majoring in ELEC. I've had a hard time trying to choose a concentration for my major. At the moment I find PEN really cool but I could not find anything about the job prospects for it as it seems more suitable for a carreer in research. 

Since I am not planning to go into graduate school right after college, I was wondering if the concentration really matters for an ELEC major in terms of job opportunities, especially since I am also gonna take a few classes from Computer Engineering and Data Science and Systems. Any advice will be welcome!"
New community to support our Rice Owls football team! 👐,/r/ricefootball/comments/15d18af/welcome_to_rricefootball/,3,1,2023-07-29 20:15:00,
TXU Electricity Referral code drop (for college students who need an energy plan!),https://www.reddit.com/r/riceuniversity/comments/15czbpo/txu_electricity_referral_code_drop_for_college/,4,2,2023-07-29 18:32:28,"**My referral code is AEN-Y0RP-S38C.**

Sign up for any [TXU energy plan](https://www.pp.txu.com/residential/txu-elease/shop-plans.aspx) (ie., Value Edge 12) with **AEN-Y0RP-S38C** and get a free $50 Visa card. Stay with the plan for 90 days as a new member and get your free $50 card in the mail (both of us)!

Drop any energy referral codes!"
MechE Starting Salary?,https://www.reddit.com/r/riceuniversity/comments/15c3ctd/meche_starting_salary/,10,8,2023-07-28 17:15:30,"Does anybody have an idea of what the average starting MechE salary is for people working in Houston or urban Texas? I'm curious because I want to have a ballpark on how to set up my finances. I've read online to expect 65-75k, and I would appreciate some input. I plan on working in the aerospace industry, hopefully."
Summer Physics Help,https://www.reddit.com/r/riceuniversity/comments/159zmny/summer_physics_help/,9,1,2023-07-26 08:20:49,"Hey guys, I’m currently taking PHYS 126 with Dr. Beaird over the summer and I was wondering if anyone has had any experience with him for this class? I’m struggling ngl and would appreciate if someone could pm me so I could ask for some advice on how to go about it? Thanks!"
How neurodiverse is Rice?,https://www.reddit.com/r/riceuniversity/comments/159zzxa/how_neurodiverse_is_rice/,2,9,2023-07-26 08:42:34,Is it a good place for someone on ASD? What kind of support do they have? Do they have stats on what percentage of population is neurodiverse?
Conflicted between two courses - need your opinion,https://www.reddit.com/r/riceuniversity/comments/157w9bg/conflicted_between_two_courses_need_your_opinion/,3,2,2023-07-24 01:21:32,"For context, I am going to be a junior this fall majoring in CS. I am conflicted between two courses: COMP 430 and ASIA 223. The other courses I will be taking are COMP 318 (the new one to replace COMP 310), COMP 382, RELI 334 and BUSI 305. I am not sure if taking COMP 430 will make this course load super heavy. Has anyone taken it before? What are your thoughts?"
Do I need a mattress topper?,https://www.reddit.com/r/riceuniversity/comments/157cp5j/do_i_need_a_mattress_topper/,7,5,2023-07-23 11:42:39,Incoming freshman at Lovett here! Are the existing mattresses soft? Should I get a topper for comfort?
"""RICE Alert: Chi Alpha Campus Ministries Accused of Protecting Registered Sex Offender as Mentor - Urgent Investigation Required!""",https://www.reddit.com/r/riceuniversity/comments/15305rk/rice_alert_chi_alpha_campus_ministries_accused_of/,34,7,2023-07-18 14:34:22,"Hey Rice University! Here is a Public Service Announcement you need to know.

Chi Alpha Campus Ministries has been in the local and national news lately for protecting and promoting a registered sex offender as their spiritual mentor. Some concerned students and parents contacted us to get the word out to the Rice community after arresting two campus pastors at Baylor and A&M Corpus Christi, Daniel Savala, for continuous sexual abuse of minors.

Please inform your campus president and dean of students to investigate this group. We believe Rice deserves better, and we hope Chi Alpha reforms for the sake of its students and faculty.

The Rice student house was across the street from Daniel Savala's home.

[**Check out the news stories >**](https://xalionsden.com/in-the-news)

&#x200B;

https://preview.redd.it/rge49ksbiqcb1.png?width=5088&format=png&auto=webp&s=613c5fa72ce153c06bab93e73894505c9bb3369c"
Student Health Insurance,https://www.reddit.com/r/riceuniversity/comments/15333iy/student_health_insurance/,3,1,2023-07-18 16:27:03,"Anyone have suggestions/advice on the best option for health insurance while in school? I'll be a full time MBA student in the fall and trying to decide what the best option is. The Aetna plan through Rice is $3139/yr but doesn't include vision/dental coverage, and adding myself to my wife's work plan would cost $3810/yr. Are there any more affordable options that provide adequate coverage?"
