title,url,score,num_comments,created_date,selftext
Rec letter confirmation email ,https://www.reddit.com/r/rutgers/comments/1gtmsmg/rec_letter_confirmation_email/,1,0,2024-11-17 20:27:29,"Hey, I figured I’d ask this here because I’ve had to bother tech support a couple times and don’t really want to open another ticket unnecessarily. I’m applying to graduate programs at ten schools and one of my letter writers submitted everything today, I got email confirmation from everyone but Rutgers. When I went into my portal, I can see all three recommenders, but when I go to “manage recommenders”, the one who submitted everything isn’t there. I take that to mean one of two things: either there’s a disconnect and she never got listed, so I should resend the form, or everything got submitted fine so I can’t edit her listing. Obviously I’m hoping for Option 2, but the websites don’t give me any info. So does anyone remember if they got a confirmation email from the portal when their recommenders uploaded letters? If it makes a difference, I haven’t submitted yet (waiting on possible fee waiver). Thanks! "
WATCH OUT FOR SUSPISCIOUS EMAIL,https://i.redd.it/4r32gcfcgd1e1.png,27,6,2024-11-17 02:20:43,
Anyone registered in intro to biochem with Murphy for the spring semester please Dm me. ,https://www.reddit.com/r/rutgers/comments/1gtm51o/anyone_registered_in_intro_to_biochem_with_murphy/,1,0,2024-11-17 19:58:45,
Gen Chem 2(162),https://www.reddit.com/r/rutgers/comments/1gtlfjn/gen_chem_2162/,1,4,2024-11-17 19:27:32,"I'm transferring out of Rutgers next semester(transfer pathway), and I don't need to take Gen Chem 2 for my transfer, but I need to maintain a good GPA for my transfer (above 3.3). What's gen chem 2 like, is it worth taking that class? I currently have 70s on my exams for gen chem 1 with Langowski, and I'm considering skipping gen chem next sem if it's difficult.. I'm in the SOE btw"
Can you still send in your SAT scores after the deadline?,https://www.reddit.com/r/rutgers/comments/1gtdfdx/can_you_still_send_in_your_sat_scores_after_the/,3,2,2024-11-17 13:21:50,"Basically what the title says, applying for RD (regular decision) and writing SAT in Dec 7th. Deadline is on Dec 1st. Can I still send in my SAT score after the deadline?"
Busch puddle,https://i.redd.it/kcuyzyy4pc1e1.jpeg,35,7,2024-11-16 23:47:56,"Busch puddle
"
R U Sick,https://www.reddit.com/r/rutgers/comments/1gswxdc/r_u_sick/,51,8,2024-11-16 21:02:25,Cause now I am and my weekend is just gonna be me sitting around sleeping and studying 
Gale abraham,https://www.reddit.com/r/rutgers/comments/1gtjh53/gale_abraham/,1,2,2024-11-17 18:02:03,"Has anyone ever taken him 
I might need to take him for discrete and i heard some bad things on rate my prof but honestly rate my prof is rlly limited 
Anyone know how he is??"
How do I tell if my application counted for Early Action?,https://www.reddit.com/r/rutgers/comments/1gtbgzx/how_do_i_tell_if_my_application_counted_for_early/,3,1,2024-11-17 11:19:27,"Hello, my SRAR finally showed up in the portal after a couple of weeks. I submitted my application for Early Action, but it doesn't show anywhere in the portal whether or not it counted as early or for Regular Decision. Is there any way to know?"
I will venmo $20 to the first person who finds Dr. Cowan and tells him Autumn sent him a Letter of Recommendation request ,https://www.reddit.com/r/rutgers/comments/1gsoiyd/i_will_venmo_20_to_the_first_person_who_finds_dr/,120,34,2024-11-16 14:34:39,"I have been trying to get in touch with this man and my efforts have proven fruitless. If you’re serious about taking me up on my offer, I'll DM you with details (aka what email address i sent the email from, the subject of the email, etc). Will send the money when he replies to me and he identifies you as the person who tipped him off. He’s teaching 198:501 and 198:520 this semester

Edit: Okay I have like 5 takers, I’m putting a hold on any more people because I don’t want to harass the man, appreciate the enthusiasm fr

Edit 2: mission accomplished, thanks everyone!!!"
My girl is gone.  Debbe (Deborah Lynn Hishon).  RU Class of 1981 (Livingston). ,https://www.reddit.com/r/rutgers/comments/1gtpdsf/my_girl_is_gone_debbe_deborah_lynn_hishon_ru/,0,9,2024-11-17 22:21:23,"We were high school sweethearts (1977-1981).  She had two brothers.  I found her daughter, but it’s like she didn’t exist.  WTF?  "
Found this on the weekend 1 bus,https://i.redd.it/p8s8nmg0bi1e1.jpeg,0,0,2024-11-17 18:39:28,
"""Brooklyn Calzones"" and ""Freaking Good Pizza"" ... ghost kitchens?",https://www.reddit.com/r/rutgers/comments/1gsya75/brooklyn_calzones_and_freaking_good_pizza_ghost/,12,6,2024-11-16 22:05:53,"So I've ordered from both of these places on DoorDash/Uber Eats in CA and since I live nearby, I've had to go pick orders from them up.

Except the pick-up spot for both of them ... is in Knights Express Pizza & Grill. Wtf???

On the apps, the distance to all of them is about the same ... and their phone numbers are the same too (+17326400101). The same dude picks up every time.

Two of them literally have their own website btw:

\- Knights Express Pizza & Grill: [https://knightsexpresspizza.com](https://knightsexpresspizza.com), [https://www.knightsexpressmenu.com](https://www.knightsexpressmenu.com)

\- Brooklyn Calzones: [https://www.brooklyncalzones.com](https://www.brooklyncalzones.com)

Somehow a regular cheese pizza at Knights Express Pizza & Grill is $12.75 (DD) but $16.19 at Freaking Good Pizza. In fact, all the prices in Freaking Good Pizza are way more expensive. But ALL 3 businesses are in the same building, made by the same kitchen. Is this allowed? Idk why Google Maps, DoorDash, or UberEats haven't updated their pages, this is so weird. The way they have marketed themselves on the websites is also so different, like they are completely different brands, which doesn't make sense.

Edit: There's another ""Freaking Good Pizza"" less than a mile away on 169 French Street, with the same background on the app ... rlly shady lmfao"
Yo we got a shoutout,https://www.instagram.com/reel/DB-MFO0SdjB/?utm_source=ig_web_button_share_sheet,13,0,2024-11-16 21:37:15,https://www.instagram.com/reel/DB-MFO0SdjB/?utm_source=ig_web_button_share_sheet
2 minute survey,https://www.reddit.com/r/rutgers/comments/1gt589n/2_minute_survey/,3,0,2024-11-17 04:04:04,"I'm trying to get responses to this survey for a class project, if you can fill it out that would be great. Thank you :)

[Tech Together survey - Google Forms](https://docs.google.com/forms/d/13UgfDMm4UftLdwBhHjEXpjHWGuPTK1XbqP2I_a4Zjek/edit#responses)

"
Kinky Event,https://www.reddit.com/r/rutgers/comments/1gt9kr2/kinky_event/,1,4,2024-11-17 08:58:30,"Hello folks,

Did anyone attend the kinky event in New Brunswick yesterday? 

I wanted to go but felt a little shy lol. "
Do you struggle with ADHD?,https://www.reddit.com/r/rutgers/comments/1gt42cv/do_you_struggle_with_adhd/,2,0,2024-11-17 02:57:40,"Hi hi, I have ADHD and really want to help build a tool to help students with ADHD schedule and allocate their time efficiently. Am really curious on the type of features ya'll want. If you have ADHD, I would really really appreciate it if you filled out the form I added below about your experiences. Am offering 25 dollars (venmo) to three people who fill out the form and I follow up with. Thanks so much!!

[https://forms.gle/T94AViUtTWcd54n88](https://forms.gle/T94AViUtTWcd54n88)"
applying to be an RA as a freshman,https://www.reddit.com/r/rutgers/comments/1gt5nb6/applying_to_be_an_ra_as_a_freshman/,3,2,2024-11-17 04:29:06,"Hey, so I want to be an RA next year as a sophomore, but I saw that I needed at least 24 RU NB credits to be eligible. By the time I'm done with the spring semester, I will have had at least 24 credits but I don't right now bc I only took 15 credits this semester at the time of me applying. Should I even apply? And have there been people who applied as freshmen who was able to become an RA their sophomore year?"
To the Girl on Livingson Tonight,https://www.reddit.com/r/rutgers/comments/1gskv37/to_the_girl_on_livingson_tonight/,48,8,2024-11-16 10:52:01,"Hey, I’m the guy you saw on Livingston tonight. I wanted to ask for your number, but there were so many people on Livingston. I don't know if I'll see you again, so I figured I’d take my shot here. If you remember me and feel like chatting, let me know I’d love to talk."
Possible Email Scam?,https://www.reddit.com/r/rutgers/comments/1gsykgd/possible_email_scam/,6,3,2024-11-16 22:19:20,"I just got an Email from ""Janet Felix"" from the ""Rutgers University Help Desk."" It doesn't seem legit to me but I thought I would ask all of you.

This is what it said:

This is the last time we will notify you that we'll stop processing incoming emails in your school account, and the reason is you failed to verify your account which may lead to the permanent deletion of your account from our database in the next few hours. to verify this  
  
Copy and paste the URL Below into the address bar of your web browser to cancel the request

  
It also included something about how RUTGERS was equivalent to a password. It didn't make a lot of sense. This seems pretty fake, right?"
Someone to play raquetball with?,https://www.reddit.com/r/rutgers/comments/1gsyk9y/someone_to_play_raquetball_with/,6,2,2024-11-16 22:19:06,"Hi, I (24F) am looking for someone to play raquetball with at any of the Rutgers gyms! Busch campus has some nice ones but I can’t find anyone to play with. Please message me if you’re interested :) "
cool cars on cookdoug,https://i.redd.it/87mdhh7b851e1.jpeg,354,16,2024-11-15 22:41:08,Was sad and abt to cry and then saw these cars and thought they were so cool lol that I forgot abt crying 
Help with schedule ,https://www.reddit.com/r/rutgers/comments/1gt045u/help_with_schedule/,3,1,2024-11-16 23:33:52,"Who is the easiest college writing prof? 
Easier core SEBS classes"
Chipotle on George Street,https://www.reddit.com/r/rutgers/comments/1gsth0s/chipotle_on_george_street/,7,6,2024-11-16 18:23:44,"Anyone know if the chipotle on george street is still doing online orders only? Or if they are still doing online orders only, when they'll start taking real orders again? Thanks"
Rate my schedule,https://i.redd.it/07z113vl2b1e1.png,5,6,2024-11-16 18:20:10,
rate my schedule ,https://i.redd.it/r29hcsz82e1e1.jpeg,0,20,2024-11-17 04:23:12,"loaded with 6, might drop 1"
Is Structure of Information (04:189:152) worth taking fully asynchronous?,https://www.reddit.com/r/rutgers/comments/1gt0yhp/is_structure_of_information_04189152_worth_taking/,2,6,2024-11-17 00:15:04,"Hii! First Rutgers Reddit post 🤗

I’m looking at an asynch Structure of Information section, and wanted to know how the workload is. Should I be taking this in person instead? I would have Conlin if I took it asynch. Hope someone can help! Thanks!"
"From a person considering rutgers, and will live on campus, is there really no air conditioning in some of the dorms, or is the website just outdated?",https://www.reddit.com/r/rutgers/comments/1gt0w91/from_a_person_considering_rutgers_and_will_live/,2,40,2024-11-17 00:12:08,"I'm concerned. If there's no AC, it must be uncomfortable in fall and spring, right? Please tell me that's just outdated or something. And, if it's not, there's still heating, right? I'm from Texas and I won't be able to handle not having heat with it being less than 20 degrees out. What's living on campus like, in general, also?

Also, I have an emotional support animal who will be living with me there. Do you know anyone who has a cat with them on campus? If I have a roommate, will I have to worry about them mistreating her or letting her out of the dorm without letting her back in? How much does a single cost in New Brunswick?"
Bait electives ,https://www.reddit.com/r/rutgers/comments/1gstzgk/bait_electives/,6,6,2024-11-16 18:46:48,Does anyone know any easy bait electives to take?
This Sub is Hilarious,https://www.reddit.com/r/rutgers/comments/1gsfbjr/this_sub_is_hilarious/,69,8,2024-11-16 04:21:19,"I love how I don’t go to Rutgers and for some reason, this sub pops up on my feed more than my university’s. Probably will visit one day just to see how it looks like in real life. "
Please just stay home if you are sick,https://www.reddit.com/r/rutgers/comments/1gsqpup/please_just_stay_home_if_you_are_sick/,8,2,2024-11-16 16:18:27,"I feel like in all of my classes there's someone near me coughing nonstop. It's one thing if you have an exam you really can't miss, but come on, this is a 100 person class that doesn't take attendance and you're going to get me and everyone else sick. Please just skip it, the slides are posted you really aren't missing that much. If you really must go to class when you're sick, at least wear a mask. Am I crazy for thinking this?"
"I’m a nursing student taking chemistry of life in the spring what professor is better Pramanik or Hinch? It seems like Professor BOIKESS usually teaches it, but he’s not teaching it in the spring. Any advice?",https://www.reddit.com/r/rutgers/comments/1gsvxp5/im_a_nursing_student_taking_chemistry_of_life_in/,3,0,2024-11-16 20:15:37,
gen physics next sem (continuing into next fall) or waiting till junior yr for physics for the sciences? ,https://www.reddit.com/r/rutgers/comments/1gt2vsm/gen_physics_next_sem_continuing_into_next_fall_or/,1,1,2024-11-17 01:52:59,"as a freshman premed. also considering analytical, heard it's not too bad (would take it next fall or junior yr). thanks!"
Academic Integrity Violation,https://www.reddit.com/r/rutgers/comments/1gsut3t/academic_integrity_violation/,3,3,2024-11-16 19:23:23,"I feel angry about how I was found responsible for violating academic integrity. And the appeals committee (which I’ve heard favors the student) upheld everything. Everything is my fault and nothing will ever change. So the only way to move on is either to transfer out of Rutgers or drop out entirely. Any thoughts on this? I genuinely need help on this, I really do. "
Oxyshred ?,https://www.reddit.com/r/rutgers/comments/1gsqybj/oxyshred/,5,12,2024-11-16 16:29:13,"For any of the gym gals and guys, have u taken or regularly use oxyshred preworkout? I’m newish to the gym and have seen a lot of people (on tiktok) use it? Is it a scam or do u recommend something better? If it helps I am 22 yr old girl ! Thank you🙂"
How is 01:694:492 Gene Regulation: Clocks to Cancer? ,https://www.reddit.com/r/rutgers/comments/1gt1ub2/how_is_01694492_gene_regulation_clocks_to_cancer/,1,0,2024-11-17 00:59:26,"Hey all, 

May someone please help me out? Does anyone have any knowledge of how difficult 01:694:492 Gene Regulation: Clocks to Cancer is? This is the first class I would be taking within the Molecular Bio and Biochemistry department (as an elective) and I do not know how difficult upper level classes are there. Do you think I would struggle a lot with this class if I have not taken biochemistry, but would have taken orgo 1 and genetics by the time I start the class? I am taking this class as an elective with the goal of getting an A, do you think this is a reasonable goal (without having this class take away a TON of time from my other classes)? 

How does it compare to genetics with Glodowski in terms of complexity of material and work required? If this helps in giving advice, I am a CBN major and have primarily taken classes that fall within the CBN requirements. 

Please, if anyone can provide me any input, even if they haven't taken this class, it would be much appreciated! 🙏"
asynchronous classes?,https://www.reddit.com/r/rutgers/comments/1gsrzjg/asynchronous_classes/,3,1,2024-11-16 17:16:16,what are some fully asynchronous classes (i’m in sas) for registration purposes thank u!
Is there a defensive driving class I can take?,https://www.reddit.com/r/rutgers/comments/1gt1dyx/is_there_a_defensive_driving_class_i_can_take/,1,0,2024-11-17 00:36:19,Title
LOOKING FOR ROOMATE,https://www.reddit.com/r/rutgers/comments/1gt0xvk/looking_for_roomate/,1,0,2024-11-17 00:14:16,"Looking for 1 guy to fill a house on CA. It’s a single room, rent is 945/month. If u want more details lmk ASAP, landlord has other interest in the house "
Writing class,https://www.reddit.com/r/rutgers/comments/1gsvho1/writing_class/,2,4,2024-11-16 19:54:59,"I need to choose one of these for spring 25. Which one is easiest/easy professor?

Writing for Professionals or

Scientific and Technical Writing or

Writing for Business & the Professions

or Writing Grant Proposals

"
Rutgers Gyms,https://www.reddit.com/r/rutgers/comments/1gsqi0i/rutgers_gyms/,4,1,2024-11-16 16:08:38,"Does anyone know what gyms are less packed? I was thinking it might be gyms like Douglass or Livi, but I want to make sure."
"Epidemiology w/ Cabredo, Enrico?",https://www.reddit.com/r/rutgers/comments/1gszalp/epidemiology_w_cabredo_enrico/,1,0,2024-11-16 22:54:21,"I'm interested in the Epidemiology asynchronous course with Cabredo but there is nothing on Rate My Professor about him. I looked at his SIRS results and they seem good. However, I prefer to read reviews so I know better of what to expect. Has anyone taken it? And how is the course?"
Business Law,https://www.reddit.com/r/rutgers/comments/1gsritc/business_law/,3,0,2024-11-16 16:55:31,can I take business law at RBS as a sophomore? 
how is your diet?,https://www.reddit.com/r/rutgers/comments/1gsdr92/how_is_your_diet/,36,29,2024-11-16 02:51:51,"how many meals do you eat on average? what do your meals consist of i.e carbs, etc"
What with this 15 dollar RUSA thing?,https://www.reddit.com/r/rutgers/comments/1gsbls0/what_with_this_15_dollar_rusa_thing/,39,20,2024-11-16 00:54:18,Title
I love the math and physics department ,https://www.reddit.com/r/rutgers/comments/1gsghys/i_love_the_math_and_physics_department/,14,1,2024-11-16 05:39:29,Anyone know why the math and physics department are so much better than chem or the ee department 
orgo 2 + 311 at the same time ?,https://www.reddit.com/r/rutgers/comments/1gsuuli/orgo_2_311_at_the_same_time/,1,2,2024-11-16 19:25:17,is this a terrible idea advice pls 
when will i hear back?? ,https://www.reddit.com/r/rutgers/comments/1gsu1l5/when_will_i_hear_back/,1,3,2024-11-16 18:49:28,"hi !! i’m a transfer looking to enroll for the fall 2025 semester. i submitted my application about just over a week ago and am looking to know when i’ll hear back?? i got an email saying my application was successfully completed and i have my RUID now. my application says it’s under review, but now im just very anxiously awaiting an answer lol (rutgers has been my dream school since forever). is there a rough estimate of when i’ll be able to hear back?? "
I cannot see any option to link my SRAR to my Rutgers application portal. I have completed and submitted my srar on the SRAR portal after which it told me to link it via the applicant portal however there doesn't seem to be any option to link my srar to my portal.,https://www.reddit.com/r/rutgers/comments/1gsqa86/i_cannot_see_any_option_to_link_my_srar_to_my/,1,2,2024-11-16 15:59:01,
Rate my schedule ,https://i.redd.it/0ea8kf63d71e1.jpeg,7,1,2024-11-16 05:51:29,might add another course but idk :)
how to move on/shake it off when an internship that’s been jelqmaxxing you for the last two months finally rejects you?,https://www.reddit.com/r/rutgers/comments/1gs0xih/how_to_move_onshake_it_off_when_an_internship/,61,19,2024-11-15 16:57:39,
Someone to play tennis in Rutgers-Camden?,https://www.reddit.com/r/rutgers/comments/1gsozix/someone_to_play_tennis_in_rutgerscamden/,1,0,2024-11-16 14:57:55,"I am not a Pro, but I’d like to improve my hitting. I live next to the waterfront. DM me."
How Hard's CS323 (Num. Analysis) with Peng Zhang? ,https://www.reddit.com/r/rutgers/comments/1gsj9dw/how_hards_cs323_num_analysis_with_peng_zhang/,3,0,2024-11-16 08:48:54,"(Course: 01:198:323 - Numerical Analysis and Computing) 

Couldn't find much about them on ratemyprof, so any info would be helpful "
Favorite pondering spots,https://www.reddit.com/r/rutgers/comments/1gs2xnp/favorite_pondering_spots/,42,23,2024-11-15 18:21:07,I’m a freshman and don’t know any of the good pondering spots on campus. I’ve been feeling a bit lonely recently so now I just want to sit somewhere and ponder in hopes of getting the resolve to be more social. So I’m in need of pondering spots preferably closer to cook since that’s where I’m at.
Request to Stream the Tyson vs Paul on the YARD TV,https://www.reddit.com/r/rutgers/comments/1gs54bp/request_to_stream_the_tyson_vs_paul_on_the_yard_tv/,27,9,2024-11-15 19:55:07,If it’s approved please let me know 🙏😭
Horses on cook?,https://www.reddit.com/r/rutgers/comments/1gsbz1x/horses_on_cook/,8,10,2024-11-16 01:13:47,"I’ve been extremely stressed with exams & I was rly hoping to therapeutically reconnect with nature for my mental health😭 cook Doug is so calming & I feel like I haven’t accessed all the university’s available resources. Would I be able to pet the horses on cook Doug for free (bc I rly don’t want to pay money for a tour), maybe even take pictures with them? "
What is everyone sick with?,https://www.reddit.com/r/rutgers/comments/1grxko7/what_is_everyone_sick_with/,62,45,2024-11-15 14:29:01,Everyone is sick. Do we know what's going around?
8:30 AM + 10:20 Recitation = Starvation ,https://www.reddit.com/r/rutgers/comments/1gryit1/830_am_1020_recitation_starvation/,50,25,2024-11-15 15:13:16,"Do not do one of these to try getting all your classes over with. You will starve every morning. Every other student knows where to get breakfast and 100% there is a line 20 minutes long. 
"
Lmao so true,https://v.redd.it/r91zgqm7u31e1,32,1,2024-11-15 18:00:48,
is this legit?,https://i.redd.it/gds77o7avb1e1.jpeg,0,15,2024-11-16 21:00:35,
where to watch paul and mike tyson fight at rutgers or new brunswick ,https://www.reddit.com/r/rutgers/comments/1gs9wur/where_to_watch_paul_and_mike_tyson_fight_at/,10,5,2024-11-15 23:30:36,
SUBLEASING SOCAM!!,https://www.reddit.com/gallery/1gs1tbl,30,0,2024-11-15 17:34:30,"Hey everyone!! 

Please let anyone (girls) who needs housing in Rutgers know about this. I am subletting my current lease to someone else. Due to an emergency, I need to move out. All the details are below!!

Address: 290 George St, New Brunswick, 08901
Apartment: SoCam
Room: 1011 C (10th floor)
Rent: $1225/ month 
Lease: August ‘24 - August ‘25
Unit: 3 bedroom 

I have left some pretty furniture in the room for you to use~~ A chair, a lamp with good lighting (the main light is not good), and extra drawers! The view outside is also really pretty!! 

There are 2 bus stops right in front of the building, both are EE buses (college ave + cook/douglass route) but it’s relatively easy to get around campus. I lived here for 3 years and absolutely loved it. 

For anyone new to SoCam, the mail system is also very easy and there’s a gym and laundromat and other amenities.. (check the website: socam290.com)

Also!! There are 2 other rooms (2 other girls) in the unit, but one person does not even live there and the other person is only there on weekdays. So you basically get the whole unit to yourself for basically half the price of a single (studio) unit!! 

There’s also a grocery store right in front of the apartment, a convenience store, and so many shops down George Street. Everything you need is there!

Contact me (preferably through email) if you’re interested or for more details or even if you’re just thinking about it. The process is really easy!! My info is below: 

Phone: +82 10 3206 8268
Email: pastelwings18@gmail.com"
I HAVE AN EXAM BRUH,https://i.redd.it/rvh30jt3x21e1.jpeg,44,2,2024-11-15 14:54:47,
Weird/Creepy interaction in livi parking lot?,https://www.reddit.com/r/rutgers/comments/1gs00ug/weirdcreepy_interaction_in_livi_parking_lot/,31,7,2024-11-15 16:18:41,"I parked my car in yellow lot and I’m walking through to the livi apartments and I’m stopped by a guy in the yellow working jacket by the blocked off parking spots and he stops me to tell me he likes me, asks my name, if I go to school here, if we can be friends and I say no thanks and I try to walk away and he’s still following me and tells me “stop I am talking to you” so I was like no we don’t need to be friends I have to go to class and he’s like okay we’ll talk when you’re back!!! I’m so weirded out cause he was hired by Rutgers to work the yellow lot or whatever so girls be careful walking in the yellow lot! Btw he was old"
"Which schedule is better: Comp Apps in person with Arnold Lau, online with John Hajdu crammed, or online with John Hajdu more spread out? I have no coding experience. As a second-semester RBS freshman, would in-person be better, or should I go online for more free time?",https://www.reddit.com/r/rutgers/comments/1gskrsv/which_schedule_is_better_comp_apps_in_person_with/,0,3,2024-11-16 10:45:04,"https://preview.redd.it/t5diln8ct81e1.png?width=1272&format=png&auto=webp&s=a811d671392248a9e24640fc7e5e3e9f35e7e418

https://preview.redd.it/5yc0zb9et81e1.png?width=1225&format=png&auto=webp&s=76816fe9a9bc1e22f3a4151664044795554116fa

https://preview.redd.it/uoy7ppqft81e1.png?width=1192&format=png&auto=webp&s=f9aaa0f15de1ca2237d7669c087cff30c7ab4824

"
RUSA Condemns Student Supporting Israel’s Invitation of Racist Speaker ,https://dailytargum.com/article/2024/11/rusa-sets-precedent-for-u-speaker-invitations-amid-backlash-to-son-of-hamas,36,5,2024-11-15 14:16:37,Passed Resolution Condemning Invitation of Mosab Hassan Yousef: https://docs.google.com/document/d/1OCIie7rh_TDh-1-5X7IVARLnqHjaLGhF8k5tqOvxURw/edit
