title,url,score,num_comments,created_date,selftext
BOWL BOUND🔴⚫️🪓,https://i.redd.it/ss8vsidrmd1e1.jpeg,100,7,2024-11-17 02:56:24,We beat UMd and are ELIGIBLE FOR BOWL GAMES!!
Bro this kid fell onto my face with his gargantuan backpack and broke my glasses ,https://www.reddit.com/r/rutgers/comments/1gwll23/bro_this_kid_fell_onto_my_face_with_his/,266,30,2024-11-21 17:55:49,"Bro did these creatures not take physics 101 in high school. Did you not learn about inertia because why tf is this kid with 50 pounds of stuff in bag raw dogging this bus without holding onto something. Bro damn dear backwards leaped at me istg it has to be premeditated.

Nah I’m legit so mad. My glasses broke and left a large red mark on my face.

Here I was minding my business listening to music. Next thing I see my life flashing before my eyes as this gorilla pounds my face. Nah cuz where in this school contract did I sign up to get clobbered by prime mike tyson. 

My fucking airpods fell too. So while I was recovering from seeing my ancestors damn near welcome me into afterlife, I was scrambling to find my airpod that fell in middle of a crowded bus all dizzy and shit. 

I swear my life was turned upside down in that moment I went home and started praying cuz I’m convinced that was divine punishment."
FIRST SNOW AT RUTGERS TOMORROW???,https://i.redd.it/wlzbo0iy3a2e1.jpeg,76,15,2024-11-21 16:09:47,
rate my senior year schedule :P,https://i.redd.it/rr6ele7upa2e1.png,37,9,2024-11-21 18:12:48,
"Got on the A bus, driver accidentally drove to Livy",https://i.redd.it/cbwn4ecqqb2e1.jpeg,11,1,2024-11-21 21:39:13,
LX spotted at Busch Student Center,https://i.redd.it/7rrd3udrjb2e1.jpeg,10,5,2024-11-21 21:00:11,"I knew the A and H were unreliable, but I didn't think I'd see an LX show up before one of them *while I was on Busch*"
Is an evil Monday worth it?,https://i.redd.it/jm8pn7z8bb2e1.jpeg,9,19,2024-11-21 20:12:25,(ps. I like the 8:30s)
I've decided to drop out of college 🙃 anyone else ,https://www.reddit.com/r/rutgers/comments/1gwpw3b/ive_decided_to_drop_out_of_college_anyone_else/,6,10,2024-11-21 20:48:31,
Queen ,https://i.redd.it/uz6ncaljp52e1.jpeg,152,9,2024-11-21 01:21:54,
Ya'll need to stop trying to overpack your schedule. I've seen to many wash out from overwhelming themselves,https://www.reddit.com/r/rutgers/comments/1gw87fo/yall_need_to_stop_trying_to_overpack_your/,80,36,2024-11-21 04:45:11,"Balance is key. Also if you're going to pack your schedule, you can't live more than 15 min from campus or you will burn the fuck out."
Searching for Roomate,https://www.reddit.com/r/rutgers/comments/1gwqv30/searching_for_roomate/,3,0,2024-11-21 21:29:09,"Hello, I am a 23 year old male. I am looking for a roommate to live with me at **The Standard @ New Brunswick**, specifically for a double apartment (Bexley B7, Room B).

I have already applied for Room A, just looking for a clean, and genuine roommate. Also emphasis on clean.

DM me if interested, looking forward to you reaching out!

\-=-=-=-=-=-=-=-"
psych department ,https://www.reddit.com/r/rutgers/comments/1gwrop1/psych_department/,2,0,2024-11-21 22:04:13,bruh why isn’t the psych department replying to me when im tryna get a class ts annoying
macroeconomics ,https://www.reddit.com/r/rutgers/comments/1gwrne3/macroeconomics/,2,1,2024-11-21 22:02:42,are they going to add more sections for intro to macroeconomics????
why is it saying this,https://i.redd.it/d2cwmacq392e1.jpeg,12,1,2024-11-21 12:46:43,is it saying this for anyone else too
Does anyone here go to the robert wood johnson gym ,https://www.reddit.com/r/rutgers/comments/1gwndh2/does_anyone_here_go_to_the_robert_wood_johnson_gym/,3,10,2024-11-21 19:05:02,
Anywhere I can print with my own paper?,https://www.reddit.com/r/rutgers/comments/1gwq8sg/anywhere_i_can_print_with_my_own_paper/,3,0,2024-11-21 21:03:01,I need to print something on different type of paper is there any printer I can put my own paper in?
Lil Rutgers Representation at the UFC Fight last Saturday,https://i.redd.it/jsrsmom8b52e1.jpeg,87,1,2024-11-21 00:01:42,
Anywhere I can print with my own paper?,https://www.reddit.com/r/rutgers/comments/1gwp20e/anywhere_i_can_print_with_my_own_paper/,3,0,2024-11-21 20:13:46,"Hey, does anyone know if I can print anywhere with my own paper? I need to use a different type of paper but not sure if I can put it into the big printers"
how to be less nervous,https://www.reddit.com/r/rutgers/comments/1gw96ij/how_to_be_less_nervous/,30,24,2024-11-21 05:42:02,how can i be less nervous about a presentation i have to give on monday? i keep thinking about it and it comes to my realization that i have no idea how i will ramble about the topic for 5 mins straight. that’s just unreal 
The line for jeanette mccurdy longer than hotdog day ,https://www.reddit.com/r/rutgers/comments/1gw2lli/the_line_for_jeanette_mccurdy_longer_than_hotdog/,60,7,2024-11-21 00:09:23,WILL THEY LET US ALL IN IF WE RSVPED
Rutgers football student section,https://www.reddit.com/r/rutgers/comments/1gwmjdg/rutgers_football_student_section/,2,1,2024-11-21 18:33:00,I have a friend who I plan on bringing to the game on Saturday who doesn’t go to Rutgers. How can I get them in the student section? Can they just buy whatever ticket then walk with me into the student section?
These frkn bus drivers,https://www.reddit.com/r/rutgers/comments/1gwmac2/these_frkn_bus_drivers/,1,7,2024-11-21 18:23:07,"It takes so much self control not not yell ""let's go!!!"" When these people just be sitting in the driver's seat not going anywhere "
what the hell happened? ,https://www.reddit.com/r/rutgers/comments/1gwrnaz/what_the_hell_happened/,1,0,2024-11-21 22:02:35,What the hell just happened on ca by the sac? I saw multiple cop cars(Yes I'm nosy). 🥰
We only have 12 days of classes left,https://www.reddit.com/r/rutgers/comments/1gwrkyl/we_only_have_12_days_of_classes_left/,1,0,2024-11-21 21:59:58,🎶 …and a partridge in a pear treeeeeeeee 🎶
Spring parking permit,https://www.reddit.com/r/rutgers/comments/1gwrbk6/spring_parking_permit/,1,2,2024-11-21 21:48:43,I didn’t buy a parking permit for the fall but i’m seriously considering it for the spring because of how much it would help me. does anyone know when spring permits will be available and how much they will cost for the whole semester?
what to do if I'm too sick to take a midterm?,https://www.reddit.com/r/rutgers/comments/1gwfn04/what_to_do_if_im_too_sick_to_take_a_midterm/,5,3,2024-11-21 12:56:59,"I'm a freshman and super sick rn and I have an important midterm tmr and I definitely cant take it and I'm not sure what to do in this situation. I can definitely get a doctors note if needed. I would really appreciate any help on what to do 🙏🙏🙏

edit: I filled out the form in the self reported absence system. I will be emailing my professor next. what else should I do? where do I put my doctors note? pls helpp thanks"
Sports bar,https://www.reddit.com/r/rutgers/comments/1gwqi5m/sports_bar/,1,0,2024-11-21 21:13:52,"Hey yall! What are some good sports bars around New Brunswick?? 

Thanks for all your help"
meal swipes,https://www.reddit.com/r/rutgers/comments/1gwkldp/meal_swipes/,2,13,2024-11-21 17:18:02,"anyone wanna buy some swipes, still got 100 left 😓"
Off-campus roommate search 2025-26 school year,https://i.redd.it/72v6p7npe32e1.jpeg,157,13,2024-11-20 17:37:35,"Hi everyone! Looking to fill a double in my current house on College Ave, for the 2025-26 school year. The house is co-ed (2 girls 3 boys so far) so any two people can occupy the room. We have a cat (picture of Milo is attached) and the house is beautiful and a 3 minute walk to the College Ave student center. Rent is $622.50 per person and electric/water/wifi is split between everyone (7 total) and is no more than 20-35 total per month. We have a porch and driveway, and an in unit free washer and dryer. 
Please comment if interested! Hoping to renew the lease and sign soon."
Linear Algebra 640:250,https://www.reddit.com/r/rutgers/comments/1gwkils/linear_algebra_640250/,2,4,2024-11-21 17:15:06,Does anyone know when the names of the professors for Linear get released?
When does spring registration 2025 close?,https://www.reddit.com/r/rutgers/comments/1gwi444/when_does_spring_registration_2025_close/,3,2,2024-11-21 14:54:34,Title. When does Webreg not let you register/ change anymore for spring 2025?
what does this mean,https://i.redd.it/s96d41wceb2e1.jpeg,1,9,2024-11-21 20:29:51,
3 Finals In Under 24 Hours(ODS Help),https://www.reddit.com/r/rutgers/comments/1gwolop/3_finals_in_under_24_hoursods_help/,1,0,2024-11-21 19:55:33,"Hi, Im a first-year freshman, bla bla bla, basically I know nothing about the finals process especially with ODS accommodations. I have 3 finals(on December 16 from 12-3) and 2 the next day within 5-ish hours of each other. Because of my ODS accommodations, I receive time and a half (1 1/2) for any of my exams but I would need to take it at a separate classroom in the ODS building. In terms of these overlapping finals is there anything I can do about that(other than emailing my professors right now before the 25th deadline and informing them). "
Help me complete my research project!,https://www.reddit.com/r/rutgers/comments/1gwn3x6/help_me_complete_my_research_project/,0,0,2024-11-21 18:54:33,"Hello all! 

I am working on my dissertation project and would appreciate anyone who has 15-20 minutes to complete my survey. The qualifications for my survey are that you are at least 18 years or older, an undergraduate student, and identify with the Latinx community. At the end of completion, there is an opportunity to enter a raffle for an Amazon gift card. 

Here is the link [https://alliant.qualtrics.com/jfe/form/SV\_82oVyhwq33bLDWC](https://alliant.qualtrics.com/jfe/form/SV_82oVyhwq33bLDWC)"
Peep the schedule… gonna change my section of macro hopefully during syllabus week! ,https://i.redd.it/6ok3xy56wa2e1.jpeg,1,4,2024-11-21 18:47:55,
The Confused RU Freshman's Go-To Guide for Classes in Thanksgiving Week,https://www.reddit.com/r/rutgers/comments/1gw50cm/the_confused_ru_freshmans_goto_guide_for_classes/,24,0,2024-11-21 02:01:05,"Monday => Monday Schedule

Tuesday => Thursday Schedule 

Wednesday => Friday Schedule 

Thursday => 🦃🦃 (Day Off!)

Friday => 🛍️🏬 (Day Off!) "
Joining DRC,https://www.reddit.com/r/rutgers/comments/1gwkw7t/joining_drc/,1,0,2024-11-21 17:29:44,"Does living on Douglass fulfill a requirement for Douglass Residential College? I lived there last year and want to join DRC Spring 2025.

Second question, is Knowledge and Power available as a summer course?"
Plagiarism?,https://www.reddit.com/r/rutgers/comments/1gwfrtl/plagiarism/,2,3,2024-11-21 13:03:39,"Can I use  the bulk of one paper that I wrote on my own for one class to write a paper for another class dealing with the exact same topic, or would I be “caught” and reprimanded for self-plagiarism?"
"For those of you who have taken inorganic chemistry here, how is it? I have to decide between that and orgo 2.",https://www.reddit.com/r/rutgers/comments/1gwju69/for_those_of_you_who_have_taken_inorganic/,1,0,2024-11-21 16:48:56,
What's the deal with the schedule next week?,https://www.reddit.com/r/rutgers/comments/1gw3379/whats_the_deal_with_the_schedule_next_week/,19,9,2024-11-21 00:31:44,Wednesday is Friday? what does that mean?
brand marketing vs. AI in marketing ,https://www.reddit.com/r/rutgers/comments/1gwizdh/brand_marketing_vs_ai_in_marketing/,1,0,2024-11-21 16:15:04,"for anyone who has taken either of these courses, i'd love to hear how it was/if u recommend one over the other ! "
"4 exams, 1 day",https://www.reddit.com/r/rutgers/comments/1gw03cg/4_exams_1_day/,32,14,2024-11-20 21:34:07,Yeah. Idk why all my professors are doing this but I’m reaching out to the dean ultimately. Does anyone know what happens from there or what I should look out for?
"#FoodWatch: Free pumpkin pie, apple pie, donuts, and apple cider in Livingston Apartments B lounge",https://www.reddit.com/r/rutgers/comments/1gw3a7u/foodwatch_free_pumpkin_pie_apple_pie_donuts_and/,16,6,2024-11-21 00:40:49,"Free pie, donuts, and apple cider currently available in Livingston Apartments B lounge (next to the main entrance) for all students. In addition to pumpkin pie and apple pie there is also cherry pie, blueberry pie and Dutch apple pie. Not sure how much longer it will be out so act fast."
How to not wake up roommate ,https://www.reddit.com/r/rutgers/comments/1gvst5k/how_to_not_wake_up_roommate/,72,31,2024-11-20 16:00:52,I have an 8:30am 3 times a week next semester. How do I wake up and get ready without waking up my roommate? 😭
Working women in American society ,https://www.reddit.com/r/rutgers/comments/1gwhmro/working_women_in_american_society/,1,0,2024-11-21 14:32:32,Has anyone taken this with balkanlioglu or adria scharf??
How can Campus Latenight food get better? Help Us Out!,https://www.reddit.com/r/rutgers/comments/1gw6asu/how_can_campus_latenight_food_get_better_help_us/,7,0,2024-11-21 03:03:36,"How do you think about food on campus after 11pm?

I'm working on a project for my *Intro to Entrepreneurship* course, and we're exploring solutions for late-night food availability on campus. To make this happen, I need your input!

[https://docs.google.com/forms/d/e/1FAIpQLSc02A8uE10HAFGi61BcOYu3dCux80gYAUyr5UZpl9MAWRsgJg/viewform?usp=sf\_link](https://docs.google.com/forms/d/e/1FAIpQLSc02A8uE10HAFGi61BcOYu3dCux80gYAUyr5UZpl9MAWRsgJg/viewform?usp=sf_link)

**Survey Details:**

* Takes less than 3 minutes
* Helps us understand what YOU need when hunger strikes at night

Your feedback is super valuable and will directly shape our ideas. Thanks in advance for your help!

"
Engineering majors ,https://i.redd.it/fz9vj3noh22e1.jpeg,57,27,2024-11-20 14:32:28,"Am I cooked? Upperclassmen , Is it possible to maintain decent grades with this schedule ? "
25-26 housing ,https://www.reddit.com/r/rutgers/comments/1gwecow/2526_housing/,1,0,2024-11-21 11:44:54,"hi, i’m looking for a single/double for the 25-26 school year. preferably on college ave or cook/doug. dm me if ure leasing + if ure a girl looking for a roommate "
Cool places on campus,https://www.reddit.com/r/rutgers/comments/1gw66um/cool_places_on_campus/,3,3,2024-11-21 02:58:14,Anyone know any nice places on campus I can bring my friend to? Any campus is fine
Good affordable car-wash near Rutgers? Yk besides the frats ,https://www.reddit.com/r/rutgers/comments/1gw14cc/good_affordable_carwash_near_rutgers_yk_besides/,7,4,2024-11-20 22:50:46,
Creative Writing Professor Franco Alfredo ,https://www.reddit.com/r/rutgers/comments/1gwa4pj/creative_writing_professor_franco_alfredo/,1,0,2024-11-21 06:43:15,"I need an easy class just to fill credits so I decided to register for 01:351:212 Introduction to Creative Writing. The professor is Franco Alfredo. I heard that Creative Writing is an easy class but does anyone else have experience with it, or with this professor? How much work will it take to get an A?"
dance courses,https://www.reddit.com/r/rutgers/comments/1gw9nou/dance_courses/,1,0,2024-11-21 06:11:39,"i was wondering what course i could take as a beginner-ish in dance to get better? I'm not a dance major, but I do theatre and wanted to improve my dance skills :)"
Rutgers vs Illinois,https://www.reddit.com/r/rutgers/comments/1gvql98/rutgers_vs_illinois/,17,8,2024-11-20 14:21:59,"Hey all I’m a freshman this year, but I haven’t had the chance to go to any of the games and finally got some free time. Was just wondering if this game was even worth going to as I heard it was going to be very boring. Pls lmk how you think it will be and if anybody wants to go together also lmk, thanks! :)"
what exactly is the schedule for next semester? ,https://www.reddit.com/r/rutgers/comments/1gw4zli/what_exactly_is_the_schedule_for_next_semester/,2,7,2024-11-21 02:00:10,"I can't find anything online; someone said Friday classes are on Tuesday or something.  so are we not having Tuesday classes? i know we have a break from nov28-dec1, but whats the schedule for next week?"
Screenshot of student tickets ,https://www.reddit.com/r/rutgers/comments/1gw94n6/screenshot_of_student_tickets/,0,7,2024-11-21 05:38:42,"so uhhh, i'm not a NB student, (Newark), but i'm still tryna go to the last home football game of the season. I'm assuming you're unable to transfer free student tickets from one account to another, but is it still possible to scan the student ticket via a screenshot of the qr code? Im seeing yes and no everyone from different places, Yes from recent accounts of going to games this year, and no from Rutgers websites, so ultimately, idk what to trust. Sounds cheap but i kinda just don't want to spend the $20 and if possible would like to just use my friend's free ticket 😭😭"
"Freshman planning to become a CS major, am I behind?",https://www.reddit.com/r/rutgers/comments/1gvr7sn/freshman_planning_to_become_a_cs_major_am_i_behind/,13,13,2024-11-20 14:51:19,"i got placed into precalc 111 when i took the math placement exam, and i’m registering for precalc 112 rn, but the prereq for taking Intro to CS requires you to have at least completed precalc 115

this means that i can’t take cs 111 until the second semester of sophomore year, which makes me feel very behind, are there other ways i could fulfill my cs requirements until then? i need advice desperately"
Why Can't I Register,https://www.reddit.com/r/rutgers/comments/1gvu585/why_cant_i_register/,8,7,2024-11-20 16:56:55,"I'm currently a sophomore with 32 credits and I am trying to register for spring 25 and I keep getting this error

https://preview.redd.it/jpcsqeuf732e1.png?width=957&format=png&auto=webp&s=c42c92aee16c9795f1fb1c6bf98dd71d568689da

"
If I keep my mostly As and like 2 or 3 Bs in all regular classes what will my GPA be? ,https://www.reddit.com/r/rutgers/comments/1gwaki6/if_i_keep_my_mostly_as_and_like_2_or_3_bs_in_all/,0,2,2024-11-21 07:12:07,Like so Ima freshman and I have mostly all As and 2 B+ and then like a B that is almost a B+. So like what will my GPA likely be assuming I maintain this? I’m just curious. 
how was scheduling today ? ,https://www.reddit.com/r/rutgers/comments/1gvqlij/how_was_scheduling_today/,10,2,2024-11-20 14:22:18,"Freshman here and i think it went well but also i registered from home so i didnt have to deal with rutgers wifi and everyone fighting 

Still need to spn for one class or hope and pray that it gets dropped by someone ( if you would like to drop sections 01 -04 of gen chem we could arrange something cuz i really need it ;) 

Besides that i hope everyone schedule is good for next semester 

also hmu if you want to drop those sections if chem 161 so i can have it please 🙏🏼 "
Lost sony headphones ,https://i.redd.it/6cx05au3152e1.jpeg,3,0,2024-11-20 23:04:54,"Did anyone find a sony headphones (photo attached). It was lost yesterday evening in the academic building west (room 2125).
"
Classes,https://www.reddit.com/r/rutgers/comments/1gvtwmr/classes/,5,4,2024-11-20 16:46:55,"So I’m a transfer student, but I only have 50 credits left to complete before graduating. I’m in the business school majoring in marketing. I see we are required to take 15?!! classes in business core. How is that going to be possible for me?"
Rutgers Linux Printing Setup Script,https://www.reddit.com/r/rutgers/comments/1gw5ial/rutgers_linux_printing_setup_script/,0,0,2024-11-21 02:24:35,"I posted this in the Discord, thought I'd post here as well if anyone's Googling around in the future:

[https://github.com/Humboldt-Penguin/rutgers\_linux\_printing\_setup](https://github.com/Humboldt-Penguin/rutgers_linux_printing_setup)"
Help,https://www.reddit.com/r/rutgers/comments/1gw4yxd/help/,0,0,2024-11-21 01:59:21,"Help

So I have a couple pre reqs that I had to take this semester but they are filled up right now, I am hoping I can snipe a course but if not I can take the class at Newark right? (BUSINESS CORE CLASSES)"
Classes,https://www.reddit.com/r/rutgers/comments/1gw4xz2/classes/,0,2,2024-11-21 01:58:03,"Please help me guys!! I wasn’t able to register for classes during the time given bc I was on financial hold and now I can’t register for classes on webreg bc it says that “you may not register or change registration today. Please review the registration dates for Camden, Newark and New Brunswick and try again on the appropriate date.” What do I do??? Who do I contact??? Plsss"
Will this affect my grade?,https://www.reddit.com/r/rutgers/comments/1gvykht/will_this_affect_my_grade/,3,6,2024-11-20 19:56:12,"I was sitting in my car and I just locked eyes with my professor who walked by and he smiled at me, but it didn’t register that it was him so I just didn’t smile or wave or do anything. I hope I didn’t look like a stuck up bitch. Do you think it will impact my grade for not acknowledging him? Should I say something at my next class like I didn’t realize it was him until he walked by ?"
Working Women in American Society Asynchronous: How is it?,https://www.reddit.com/r/rutgers/comments/1gw4sjc/working_women_in_american_society_asynchronous/,0,4,2024-11-21 01:50:44,"Looking for easy async classes, has anyone taken this before? How is it?"
When can I start registering for Spring 2025 Classes as a Junior???,https://www.reddit.com/r/rutgers/comments/1gw4plm/when_can_i_start_registering_for_spring_2025/,1,2,2024-11-21 01:46:59, I thought It opened a while ago but when I went to WebReg I wasn't able to schedule any classes and it told me to come back on the proper date. When I clicked the link which would supposedly have the date it was a 404 not found -\_-
4107 dead in front of College Hall,https://i.redd.it/ss7ml0icoy1e1.jpeg,71,28,2024-11-20 01:42:43,"u/yw618 another teen bus down

"
How long does it take for an spn to go through ? ,https://www.reddit.com/r/rutgers/comments/1gvw8ny/how_long_does_it_take_for_an_spn_to_go_through/,3,0,2024-11-20 18:21:31,"I put an spn for chem 161 and i was curious, if i got it when would i get an email back for that ?"
Physics Lab Question,https://www.reddit.com/r/rutgers/comments/1gw2pwq/physics_lab_question/,1,0,2024-11-21 00:14:53,I wanted to take gen physics lab 1 next semester but heard that downcurving was a thing. Is it as bad and TA dependent as people say?
"ASYNC: Which is easier, Working Women in American Society or Media Art and You?",https://www.reddit.com/r/rutgers/comments/1gvz4np/async_which_is_easier_working_women_in_american/,2,5,2024-11-20 20:19:03,"Looking for an easy async course, has anybody taken either of these and can speak on it?"
Jennette McCurdy Event,https://www.reddit.com/r/rutgers/comments/1gvvuua/jennette_mccurdy_event/,3,3,2024-11-20 18:05:51,"Does anyone know if you need your RUID to get into the event. Basically I got in to the event, but my friend didn't. Can they just say my name and be admitted or is that not possible?"
Livi soon,https://i.redd.it/pf06zqimhx1e1.jpeg,127,12,2024-11-19 21:43:14,Livingston campus in 2025 
Class help!!!,https://i.redd.it/ec37dftri32e1.jpeg,4,5,2024-11-20 18:00:25,"I need to take one of these classes as a requirement, is there any class listed that anyone would recommend?"
You have been hired by Rutgers to anger as many people as possible. You can change or introduce only one thing. What would you do?,https://www.reddit.com/r/rutgers/comments/1gv5r8z/you_have_been_hired_by_rutgers_to_anger_as_many/,137,116,2024-11-19 19:33:46,
Rutgers v. Illinois,https://www.reddit.com/r/rutgers/comments/1gw4sm1/rutgers_v_illinois/,0,0,2024-11-21 01:50:50,Selling my ticket to Saturday’s game since I can’t go anymore. #CHOP PM me if you need an extra ticket.
I wish harm upon no one ,https://www.reddit.com/r/rutgers/comments/1guzua5/i_wish_harm_upon_no_one/,257,26,2024-11-19 15:31:56,"but to whoever took environmental justice from me , i hope you never find a parking space. i hope all your busses run late and you never find a seat. i hope the night before an exam you forget to charge your laptop and you’re unable to take it. when you miss the REXL bus and stand there defeated, i will be on that bus laughing at you. may the ru screw strip you of your sanity the way you stripped me of my class."
"Where do you normally go to make friends here, been having a hard time probably because I look like shit any tips?",https://www.reddit.com/r/rutgers/comments/1gw02uu/where_do_you_normally_go_to_make_friends_here/,0,24,2024-11-20 21:33:23,Toxic responses welcomed 
Potential free tuition from Rutgers?,https://i.redd.it/txcyx2ctj02e1.jpeg,10,3,2024-11-20 08:00:53,
How to take appointments with specialist doctor - Student health insurance ,https://www.reddit.com/r/rutgers/comments/1gvz0er/how_to_take_appointments_with_specialist_doctor/,1,3,2024-11-20 20:14:01,"I am in international student, so I am having little trouble understanding the healthcare system. Back home I could just go to any specialist ( endocrinologist, psychiatrist)directly taking an appointment.
I am United healthcare student insurance, so if I want to connect with an endocrinologist or psychiatrist ( I am medications prescribed by doctor back home, I was allowed to carry 90 day medications) how do I go about it ? How do I search for in network providers ? Are the doctors in Rutgers Hospital New Brunswick under United Healthcare or I have to search online ? Do I first have to go a family medicine doctor and later they will recommend a specialist or I can directly go specialist? Can someone please guide me how does this system work? Thanks in advance "
