title,url,score,num_comments,created_date,selftext
throwback to october 30 when my friend gave me this and I had no idea the medium was  satire and 100% believed it💀,https://i.redd.it/uomq8c162p0e1.jpeg,185,9,2024-11-13 16:18:12,
Some advice needed,https://www.reddit.com/r/rutgers/comments/1gredx0/some_advice_needed/,1,4,2024-11-14 20:28:21,"Next sem I am for sure taking these classes:
Data management for data science (210),
Design and analysis of algos,
Stats inference for data science,
Some WCr class.

For my fifth option I am considering some of these electives (which I’ll take later if not now): Systems programming, principles of info and data management, or intro to AI. Considering the other classes, which one should I take? I’m also in my second year (this is my fourth semester here). "
"If Rutgers requires 40 min between classes to cross campuses, why are class breaks only 30?",https://www.reddit.com/r/rutgers/comments/1gre0f5/if_rutgers_requires_40_min_between_classes_to/,1,10,2024-11-14 20:11:35,It means I can’t take a 10:20-11:40 on Douglass and 12:10-1:30 on CA. Am I wrong? This is frustrating lol
Fucked scheduling junior year up - RU Screwed ,https://www.reddit.com/r/rutgers/comments/1grdw28/fucked_scheduling_junior_year_up_ru_screwed/,1,3,2024-11-14 20:06:20,Cbn major. Had to drop orgo and take it next sem with sethi (wasn’t working out with textbook studying). and next semester I realized neuro pain and addiction and cell bio are at the same time and day like wtf? And then gotta take orgo 2/biochem over the summer to catch up. RU Screwed at its finest 
"If you’re forced to need 40 min to cross campuses, why are classes blocked out by 30 min?I can’t take an 11:40 and 12:10 because it’s not enough time. It doesn’t make sense why they would do it like that instead of making the classes start at 12:20",https://www.reddit.com/r/rutgers/comments/1grdp9c/if_youre_forced_to_need_40_min_to_cross_campuses/,1,2,2024-11-14 19:58:40,
instrument hall? ,https://www.reddit.com/r/rutgers/comments/1grdng7/instrument_hall/,1,1,2024-11-14 19:56:28,"I'm a producer, and I'm looking for a space where I can just mess around with available instruments or just a recording space. Do we have that on campus? "
How do I find a roommate?,https://www.reddit.com/r/rutgers/comments/1grbulo/how_do_i_find_a_roommate/,1,5,2024-11-14 18:39:55,Hi guys! Any advice for finding roommates for next year? Made a post on the Class of 2027 spreadsheet but not sure what else to do. Also--speaking of--I'm a rising sophomore girl looking for off campus housing/roommates for next year. Let me know if you're interested!
Is RUWireless Secure down for anyone else?,https://www.reddit.com/r/rutgers/comments/1gqnofb/is_ruwireless_secure_down_for_anyone_else/,51,16,2024-11-13 21:10:42,
Housing question ,https://www.reddit.com/r/rutgers/comments/1grbl37/housing_question/,1,1,2024-11-14 18:28:42,"Why am i seeing things like ""anyone wanna room at such and such next year w me"" 
Is housing apps for next year already open?
Can you pick the specific building you want?
Do you have better luck if you do the app with a predetermined roommate?
Also if i just wanna stay in an apt is there an option where i can be like either an apt or no housing?"
research methods with jane miller,https://www.reddit.com/r/rutgers/comments/1grbbxn/research_methods_with_jane_miller/,1,0,2024-11-14 18:17:55,how is this prof? i've heard mixed things and it's only her and another prof available for the class
Update! Really unfortunate for this guy,https://i.redd.it/yiskvm0ffq0e1.jpeg,52,12,2024-11-13 20:54:16,Getting towed now
Prof Hamidi,https://www.reddit.com/r/rutgers/comments/1gqhsm1/prof_hamidi/,94,34,2024-11-13 17:07:02,"I'll get downvoted for this but I don't care. Heard a lot about Hamidi recently and wanted to clarify a few things.

Hamidi gets a bad rep from a lot of people because she's not carefree like most professors. She expects students to put in the same effort that she puts into the class. When they don't, rather than ignore it (which most professors do) she calls it out. Most students who complain about her want a class where they can put no or the bare minimum effort, but that's no reason to call her a bad professor. 

Yes, her accent can be a bit tricky to understand. And I'm not a fan of her occasional pop quizzes. Required lecture attendance isn't fun but it's free points for just sitting there. But she gives extra credit and she tries to make sure everyone understands the material. Puts her at about the same level as a lot of profs here. 

Take it from someone who complained about her for a whole year and a half. 2 years later, I wish many of my professors were like her. 

Tldr; Many people have different opinions on Hamidi as a professor. You have to gauge whether she as a professor is a good fit for what you want from the class. If you're into participating and actively learning the material, she's a good professor and she'll recognize your effort. If you're trying to fill a requirement and don't want to put much effort (which is fair) either don't take her or suck it up for a semester. No need to badmouth any professor because their methods don't work for you. There's honestly more pressing things to worry about. "
basement show group me,https://www.reddit.com/r/rutgers/comments/1gr4qvn/basement_show_group_me/,2,0,2024-11-14 13:27:57,can someone add me back…i got removed for being inactive but i swear it was just a busy week :( 
COMP APPS hybrid? ,https://www.reddit.com/r/rutgers/comments/1gr8t3y/comp_apps_hybrid/,1,1,2024-11-14 16:32:22,Has anyone taken comp apps for business as a hybrid course? If so do you recommend it? I'm not sure if I want to do hybrid or fully in person. 
Anyone know any mac repairs centers?,https://www.reddit.com/r/rutgers/comments/1gr8p5d/anyone_know_any_mac_repairs_centers/,1,0,2024-11-14 16:27:42,Does anyone know any mac repair centers that does good work for cheaper than kite and key? My mac’s display is faulty and they are quoting around 600 dollars to replace the display and the battery. So I wanted to know if there’s any repairs centers around nb or Piscataway. 
am i cooked?,https://www.reddit.com/r/rutgers/comments/1gr8g74/am_i_cooked/,1,1,2024-11-14 16:17:06,"i completely fail calc 151, i did sooooo bad on the first midterm and i did even worse on the second one, like i know the concept, i get good grades on my recitation quizzes so like wtf "
I feel like i don't belong or deserve to be in this school,https://www.reddit.com/r/rutgers/comments/1gqj9ol/i_feel_like_i_dont_belong_or_deserve_to_be_in/,57,30,2024-11-13 18:07:00,"Idk what's wrong with me since last semester basically freshman year i was undecided and just took those general classes with math but now I am actually taking major classes as a sophomore (Chem and physics)  and i feel like it is so out of reach to just pass a major class and it just makes me feel like i deserve to even be in the class or even the college. I look around and everyone just seems to know what they are doing except me. the exam averages make me feel worse as well like if the averages are failing grades i think to my self how i will i ever pass??? Srsly and i think i am about to fail my first class (physics)  if i don't do well on the final.... 

& Brahmia (the physics prof)  said that less than 10% of the class fails  WHICH MAKES ME FEEL WORSE and makes me really rethink if i deserve to be here like i had a whole semester (2month so far) and i can't even learn phyiscs properly how much of an idiot am i?? 

Like what happens if i fail a class and have to repeat it i doubt any pharmacy school in the world would accept me right?? 

I don't know what it is is but if someone who did well on these classes (chem or phyiscs) can just give me tips i appreciate it.  because honestly if i fail 2 classes i surely just give up because i hate this feeling like do i just do book problems?? i just don't get it anymore lecture isn't enough



"
What is up with the internet?,https://www.reddit.com/r/rutgers/comments/1gqsk20/what_is_up_with_the_internet/,15,2,2024-11-14 00:48:34,I
Anyone know any similar buildings or rooms? ,https://www.reddit.com/gallery/1gr71w6,1,8,2024-11-14 15:17:11,"Hi so it’s been a while since I graduated Rutgers and was wondering are there any music rooms with like a piano? Ik this sounds crazy but I’m looking for a place to do a photoshoot. I can put reference photos up for a similar vibe if anyone knows of Rutgers has a similar environment. 

Thank you "
SYSTEMS PHYS,https://www.reddit.com/r/rutgers/comments/1gr6yei/systems_phys/,1,3,2024-11-14 15:12:55,"Systems Phys with Amole Grace, hows this professor? will this meet PA school requirements? help "
SCM major,https://www.reddit.com/r/rutgers/comments/1gr6o9z/scm_major/,1,0,2024-11-14 15:00:30,"hi incoming freshman student, (transfer spring) to RBS—im going to majoring in Supply Chain Management. can someone speak more on this major, job prospects from rutgers, salary, opportunities, what the courses are like, etc"
Elementary Orgo Lab,https://www.reddit.com/r/rutgers/comments/1gr64r8/elementary_orgo_lab/,1,0,2024-11-14 14:35:42,Does this lab usually fill up immediately? Does anyone know how many sections there usually are? 
can i have ur bike ,https://i.redd.it/ophdk7fyyq0e1.jpeg,17,6,2024-11-13 22:44:06,idk who left their bike unlocked for a few days but like it’s been like this and could be stolen so easily. the bike is sick tho if give it to me😈🙏🙏🙏
Has anyone ever tried these from the Atrium? I never knew these were a thing at stores 🤢🤪,https://www.reddit.com/gallery/1gqel1s,67,30,2024-11-13 14:51:08,
Does anyone have PS portal and able to connect it on campus?,https://www.reddit.com/r/rutgers/comments/1gr3ga7/does_anyone_have_ps_portal_and_able_to_connect_it/,1,0,2024-11-14 12:15:42,I don’t know if I just set up incorrectly or if RU wireless just doesn’t connect but I was curious if anyone else had this issue. 
If anyone found two jackets at Newell Apartments from last semester pls DM me ,https://www.reddit.com/r/rutgers/comments/1gr2xbv/if_anyone_found_two_jackets_at_newell_apartments/,1,2,2024-11-14 11:42:45,Will pay if found 🥹
History of Broadway Dance online,https://www.reddit.com/r/rutgers/comments/1gqy05h/history_of_broadway_dance_online/,3,3,2024-11-14 05:41:07,"Has anyone taken history of broadway dance online this semester? If so, how was the workload and is it considered an easy A?"
"3 credit Upcycling Class(sewing, clothing, fabric art)",https://i.redd.it/fafew2tx7q0e1.jpeg,17,14,2024-11-13 20:12:20,"I’ve seen lots of people asking for easy but fun courses to take. My suggestion is to look into Upcycling: An artistic response to the environmental effects of fast fashion, taught by Denise Wagner, Costume Shop Supervisor for the Rutgers Theater department. 
You do not need any prior skills or knowledge. It’s an extremely fun class, you will get to do some sewing, embroidery, weaving and fabric dyeing. Almost the entire class is hands on projects except for 1 short presentation(no writing assignments). I took it last semester and highly recommend it! I can even send the list of projects/schedule if anyone wants it."
WiFi Issues,https://www.reddit.com/r/rutgers/comments/1gqodv4/wifi_issues/,11,1,2024-11-13 21:40:22,Anyone get a new router installed in their building/suite having issues with WiFi consistency?
"Cal2, Orgo2, GenBio1, and College Writ in a semester?",https://www.reddit.com/r/rutgers/comments/1gquu0z/cal2_orgo2_genbio1_and_college_writ_in_a_semester/,3,16,2024-11-14 02:42:42,Is it doable for a first-year student or is it too much?
Bus broke down on route 1 south ,https://v.redd.it/y6ipr1jzmq0e1,9,6,2024-11-13 21:36:42,
Pet insurance,https://i.redd.it/rn1huyx9kq0e1.jpeg,8,8,2024-11-13 21:21:35,Hey guys I recently looked up if Rutgers has pet insurance and found out that they do! I’m currently enrolled in the Rutgers Student Health Insurance but want to get my dog Ace on it as well. I’ve received found a lump on his leg and don’t have the money for a possible surgery for it. Any advice on how to get him onto the pet insurance? Thanks for the help! Here’s a picture of him for your troubles!
Which Schedule??? Would you rather have late class or friday off?? i need help pls,https://www.reddit.com/gallery/1gqhz3w,14,17,2024-11-13 17:14:31,
Scared for Spring 25 ,https://www.reddit.com/r/rutgers/comments/1gqzd6w/scared_for_spring_25/,1,0,2024-11-14 07:14:10,"Hello everyone! I’m new to this.
I would like to know if anyone ever took Neuroendocrinology 120:445 (in the Newark Campus). I’m a bit timid to take it. I’m currently taking the professor teaching it for another class however I’m getting lucky with the exams and boosting up my grade in her class. 

Because it’s my last semester I want to know if it is anything like her other classes. 

I’m hoping to end it strong before graduating :) !! "
Best college writing professor,https://www.reddit.com/r/rutgers/comments/1gqfgbq/best_college_writing_professor/,19,16,2024-11-13 15:29:10,I need to take college writing in h the spring but there’s so many profs and I really don’t want to be stuck with a bad one… any tips on who’s class I should aim to register for? 🙏
How am I looking here?,https://www.reddit.com/r/rutgers/comments/1gqz7bk/how_am_i_looking_here/,0,3,2024-11-14 07:02:06,"https://preview.redd.it/oirf9khqet0e1.png?width=1958&format=png&auto=webp&s=928491d8b0837e6d426b402eaf065f17d195bb04

I'd like to know who was better between MAURER, SORENSEN, and LUZON for MMP and if the class is writing intensive. Also wanted to know any experiences people had with Geft(Discrete II) or Zhang(NUM ANAL COMP)."
This is it,https://www.reddit.com/r/rutgers/comments/1gpzw9e/this_is_it/,241,50,2024-11-13 00:20:13,I have been a regular rutgers reddit scroller but now I have decided I will start posting. Maybe this post gets 0 upvotes but I will feel happy that I have did it finally. Sooooo how's everything going?
19 Credits - RBS Freshman Second Semester... is this excessive?,https://www.reddit.com/r/rutgers/comments/1gqxp4b/19_credits_rbs_freshman_second_semester_is_this/,1,3,2024-11-14 05:22:10,"https://preview.redd.it/e9dez230ys0e1.png?width=1054&format=png&auto=webp&s=86e0e8eb758f2b2f0c9f5e29a132a66f52c0c76e

"
ITI Electives Already Full,https://www.reddit.com/r/rutgers/comments/1gqlgqc/iti_electives_already_full/,7,9,2024-11-13 19:37:48,The ITI electives I want to take next semester are already full. What are my options? Course sniper?
Anyone looking to room in Newell next year?!,https://www.reddit.com/r/rutgers/comments/1gqthj4/anyone_looking_to_room_in_newell_next_year/,2,1,2024-11-14 01:34:19,Hiii! Im looking around for a roommate to live in Newell with me because I don’t wanna go random. I am currently a sophomore who just transferred in and I am an animal science major. Lmk if you’re interested :) 
College writing asynchronous closed??,https://www.reddit.com/r/rutgers/comments/1gqnu6g/college_writing_asynchronous_closed/,4,7,2024-11-13 21:17:26,How is it already closed if freshman aren’t even allowed to register yet and college writing is only available to freshman (what an advisor told me in orientation) There’s like 3 sections so I’m confused bc that’s so much people prob 
Easy SAS Core classes,https://www.reddit.com/r/rutgers/comments/1gqw209/easy_sas_core_classes/,1,2,2024-11-14 03:47:32,"I want to take 1 or 2 core classes next sem that fufill any of the cores:  
CCO/D

SCL

AHo/p/q/r

WCr/d

I'd like to maximize the amount of time I have for lab research, work, and other volunteering stuff so I plan on doing these asynch. So far thinking about Intro to gender race sexuality. I've looked at the schedule of classes but would like some outside input!"
Any alternatives to taking math here?,https://www.reddit.com/r/rutgers/comments/1gqrdao/any_alternatives_to_taking_math_here/,2,3,2024-11-13 23:52:52,Is there like a class I can take in a month or a week where I can just knock off the math prerequisite?
Physics 193 and 194,https://www.reddit.com/r/rutgers/comments/1gqviu3/physics_193_and_194/,1,0,2024-11-14 03:18:42,Any cc offer these classes? Preferably online so i dont gotta drive a million miles. I heard HCCC has it but not sure if its online 
Help regarding graduate application - LOR related,https://www.reddit.com/r/rutgers/comments/1gqv7w7/help_regarding_graduate_application_lor_related/,1,0,2024-11-14 03:02:53,"In my application, I had added 3 recommenders. Initially I was unaware of the ""waive your rights to view the submitted....."" so I had chosen ""No"". Few days later, from the ""Manage Recommendations"" section I updated that choice for ALL 3 RECOMMENDERS and resent that submission email.

Now, yesterday, I opened the ""Manage Recommendations: section and can now only view/edit 1 OF MY RECOMMENDER's DETAILS.

Does this mean, my other 2 recommenders have submitted the LOR? Because I never received any mail that said that LOR was received or something like that.

Can someone please give some info?"
Fuck math300,https://www.reddit.com/r/rutgers/comments/1gqv669/fuck_math300/,1,3,2024-11-14 03:00:26,"That’s all I wanted to say. 
"
Open Poker game,https://www.reddit.com/r/rutgers/comments/1gqmq8q/open_poker_game/,3,2,2024-11-13 20:31:01,"There is a poker game in downtown New Brunswick. If you are interested in playing DM me for info. 

Super friendly game, good times. "
Grad School Tickets,https://www.reddit.com/r/rutgers/comments/1gqu6jx/grad_school_tickets/,0,1,2024-11-14 02:09:38,"Hey y’all, do you guys know if it is possible to get an extra ticket for graduation , I have six family members and I know we are only allowed five? "
When can I add more classes into my spring schedule?,https://www.reddit.com/r/rutgers/comments/1gqtt71/when_can_i_add_more_classes_into_my_spring/,1,2,2024-11-14 01:50:53,I’m currently registered for 16 credits but I want to add another course into my schedule for the spring. Do I ask my advisor for permission or I just have to wait?
Does anyone know how to connect meta quest3 to the school's ruwireless secure network？,https://www.reddit.com/r/rutgers/comments/1gqtr1w/does_anyone_know_how_to_connect_meta_quest3_to/,1,2,2024-11-14 01:47:51,as i said in the title， i bought a meta quest3，but i failed to connect my quest3 to ruwireless secure
Spring semester class registration ,https://www.reddit.com/r/rutgers/comments/1gqtn8m/spring_semester_class_registration/,0,3,2024-11-14 01:42:33,When does spring registration open for freshman? 
shin is my only option for chem next sem,https://www.reddit.com/r/rutgers/comments/1gqlhhv/shin_is_my_only_option_for_chem_next_sem/,3,1,2024-11-13 19:38:41,"im taking chem 2 next sem and im doing pretty well rn with kornienko, but ive heard shin is not good. am i just going to be teaching myself?"
Anyone know any college writing teacher that doesn’t require attendance?,https://www.reddit.com/r/rutgers/comments/1gqtg4b/anyone_know_any_college_writing_teacher_that/,0,8,2024-11-14 01:32:19,Saw asynchronous college writing closed and I do not wanna go in for just one class for 2 days when I could just not go at all. Anyone know any teachers that post notes and is basically no attendance require for college writing ???
Which schedule is better,https://www.reddit.com/gallery/1gqivpg,3,5,2024-11-13 17:51:29,"As title says
I don’t mind 8ams and live on Busch "
Final product ,https://i.redd.it/fzqyku7wlo0e1.jpeg,7,2,2024-11-13 14:46:59,I am sniping for better courses but this is what I have to work with right now. Unfortunately 75 credits and wifi was not enough to get the section for my College Ave class that I wanted.
Schedule advice ,https://i.redd.it/jc4pes4lbo0e1.jpeg,7,4,2024-11-13 13:49:13,"Is this schedule too much for next semester? I’m a sophomore pursuing a CBN major. (to reflect my experience, my midterm average in Honors Orgo 1 is average in the class but it has been pretty hard. And ive only gotten B+s in physics 1 and a writing class, the rest As. My freshman year semesters were both 16 credits. I also tutor for about 3 hours weekly, but prep time factors in like 1.5-2 hours. I also do research about 6-8 hours a week but I might cut down next semester.) 
"
does anyone know the email for the head of the FAO?,https://www.reddit.com/r/rutgers/comments/1gqnib6/does_anyone_know_the_email_for_the_head_of_the_fao/,2,0,2024-11-13 21:03:28,"Trying to sort out an issue for a few weeks and I havent heard back from anyone since my last correspondence, thinking of reaching out to the head directly or calling in next week if I dont get a response by Friday because the issue is pretty serious. ive sent multiple followup emails about my issue and no response.

does anyone know the financial aid office supervisor's actual email? DM me please - thanks!"
Rate schedule ,https://i.redd.it/joj8ohtyhr0e1.jpeg,1,0,2024-11-14 00:30:19,"now this looks like a lot but lemme explain, transferring to soe and rn i couldn’t register for them but this is what my final when i could register for them would look like, lowkey might drop greek civilization, i want to take 18 credits cuz i withdrew from a class my first semester and well i only have 12 credits that i will get but idk yet"
Best stats for research professor,https://www.reddit.com/r/rutgers/comments/1gqjokg/best_stats_for_research_professor/,3,5,2024-11-13 18:24:00,"Out of these options, who’s the best professor for basic stats for research 
Direcchio, Zhao, Wu, or Rojas "
Is this doable?,https://www.reddit.com/r/rutgers/comments/1gqmtyy/is_this_doable/,2,0,2024-11-13 20:35:16,"https://preview.redd.it/80nrvg9faq0e1.png?width=981&format=png&auto=webp&s=d93b06561bef5dd82152302e7a7a103e4b3e2b97

I'm a junior majoring in Bio and just wondering if this schedule is doable. I would be taking structure of info with Juliana Mestre, how is she? Would it be best that I push structure of information for the fall to take it online? I would appreciate your help. "
Wild cheater spotted by EE,https://i.redd.it/k6mvm6glqi0e1.jpeg,221,45,2024-11-12 19:02:41,
I need to fulfill the literature requirement. Anybody know an easy lit course possibly online? what professor?,https://www.reddit.com/r/rutgers/comments/1gqrlvh/i_need_to_fulfill_the_literature_requirement/,1,0,2024-11-14 00:03:46,
Y’all I’m so done,https://www.reddit.com/r/rutgers/comments/1gpt6d5/yall_im_so_done/,190,65,2024-11-12 19:30:54,Anyone else absolutely completely drained out and can’t squeeze an ounce of effort out of themselves anymore? I have 5 chapters of financial accounting to learn before my midterm tomorrow and after that midterm ima need to catch up on weeks worth of stats homework and lessons along with work for my two online get very demanding classes before Friday/Saturday. What the hell should I do? I wanna sleep until next year 
Chem I exam replacement,https://www.reddit.com/r/rutgers/comments/1gqg8hl/chem_i_exam_replacement/,5,6,2024-11-13 16:02:33,"Plz dont give me the dog shit “dont bank on it” “its not guaranteed”


Does chem do exam replacement this semester plz i seen posts it happened year after year"
Help with concentration ,https://www.reddit.com/r/rutgers/comments/1gqq2y9/help_with_concentration/,1,0,2024-11-13 22:54:21,I haven’t declared my bait concentration (looking to do it soon) but I want to take Business Decision Analytics Under Uncertainty for the spring. I already have the prereq complete but in the subject notes it says open to Bait majors and bait cert. will I still be able to take the class? 
Do the health centers give out doctors notes ,https://www.reddit.com/r/rutgers/comments/1gqkq6z/do_the_health_centers_give_out_doctors_notes/,2,1,2024-11-13 19:07:06,
Course Selection Help,https://www.reddit.com/r/rutgers/comments/1gqq1c0/course_selection_help/,1,1,2024-11-13 22:52:24,"Should I take data structures, intro to linear algebra, gen physics and discrete structures or data structures, intro to linear algebra, gen physics and multivariable, or none of the above?"
Looking for a roomate ,https://www.reddit.com/r/rutgers/comments/1gqpw6t/looking_for_a_roomate/,1,0,2024-11-13 22:45:59,Looking for a roomate to take an apartment in New Brunswick. Any interested text me 
Getting tickets for family/friends for basketball?,https://www.reddit.com/r/rutgers/comments/1gqkdyw/getting_tickets_for_familyfriends_for_basketball/,3,2,2024-11-13 18:53:23,I know for football it’s an easy process of buying the tickets for family/friends but is there a similar process for getting tickets for them for basketball. As a student btw.
Tagalog Classes,https://www.reddit.com/r/rutgers/comments/1gqpmbh/tagalog_classes/,1,5,2024-11-13 22:34:10,I’m interested in taking a language class and saw that Elementary Tagalog was offered but can’t find it anywhere? Does anyone know if it was removed due to a lack of interest or something? The course code is 01:098:101
Need roommates/ looking for a house,https://www.reddit.com/r/rutgers/comments/1gqtz9s/need_roommates_looking_for_a_house/,0,1,2024-11-14 01:59:26,"Looking for roommates. Preferably south Asian, but don't have to be. We are trying to get this house which has 5 rooms, 3 doubles and 2 big singles. It is 1 block away from CAG. The group is currently two guys and one girl. DM me with questions. "
has anyone here taken' 07:965:255  upcycling: an artistic response to the environmental effects of fast fashion' or is planning on taking it next semester? ,https://www.reddit.com/r/rutgers/comments/1gqosv1/has_anyone_here_taken_07965255_upcycling_an/,1,3,2024-11-13 21:58:19,thoughts on it? it sounds like fun but I want a less time consuming class
