title,url,score,num_comments,created_date,selftext
CS 416,https://www.reddit.com/r/rutgers/comments/1gpa46b/cs_416/,1,3,2024-11-12 02:15:56,"Is it just me or can you not pre-register for 01:198:416	Operating Systems Design (NB), this is what I see on my end.

https://preview.redd.it/atrh9i2xqd0e1.png?width=587&format=png&auto=webp&s=096e594c167d8768481f7c829c4bec7d08fa1ac8"
trying to transfer to SON from RBS,https://www.reddit.com/r/rutgers/comments/1gpa3jo/trying_to_transfer_to_son_from_rbs/,1,1,2024-11-12 02:15:04,"hiiii i'm a freshman in RBS trying to figure out what classes to take next semester so i'm not exceedingly behind if i get into the nursing school:)

i'm planning on taking chemistry of life, research in the disciplines, gen psych, and a literature course because it seems like that's all i can take..right?

also if i get into the nursing school what classes would i take fall 2025?

based off of what i already have done and the classes i'm taking next semester, if i take microbiology the summer before junior year after finishing anatomy ii in the spring, will i still have to stay an extra year if ""technically"" i'm on track with class of 2028?

please lmk if i'm missing anything i've tried reaching out to SON-advising but they're not being very helpful

https://preview.redd.it/x5bp11m2pd0e1.png?width=1290&format=png&auto=webp&s=4402389082f1d3268f9d63f950bfa72a027e287c

"
Big fights this weekend,https://www.reddit.com/r/rutgers/comments/1gp1rla/big_fights_this_weekend/,3,1,2024-11-11 20:09:14,I wanna do a watch party in the quad I lounge for the Jake Paul and Mike Tyson fight on Friday and UFC on Saturday so if anyone is down Quad 1 lounge Friday/Saturday 
Tb to when I discovered CSP while scheduling my sophomore spring semester 🙏 ,https://www.reddit.com/r/rutgers/comments/1gp9rmk/tb_to_when_i_discovered_csp_while_scheduling_my/,0,0,2024-11-12 01:58:49,
best BAIT electives?,https://www.reddit.com/r/rutgers/comments/1gosphw/best_bait_electives/,7,3,2024-11-11 13:54:49,"i need one more bait elective to fill my requirement for next semester. i’ve already taken investment modeling and plan on taking AI in marketing, but i don’t know what to do for the last one. professor recommendations would be nice too"
OIT Job in Spring,https://www.reddit.com/r/rutgers/comments/1gp8rae/oit_job_in_spring/,1,1,2024-11-12 01:09:25,Can I apply to a OIT Job position for the coming Spring semester?
Should I go directly to the dean in this situation?,https://www.reddit.com/r/rutgers/comments/1goicke/should_i_go_directly_to_the_dean_in_this_situation/,61,13,2024-11-11 03:00:55,"I missed a week of classes due to a medical condition and I have a doctor’s note to certify my absence. The problem is that the syllabus for one of my classes states that we have to tell the professor before missing classes/assignments but I wasn’t able to tell the professor beforehand because it happened suddenly and I couldn’t tell the professor about it when the due dates passed because I wasn’t feeling well for the whole week. Should I directly send the doctor’s note to the Dean and explain this whole situation (in detail) to them? Because on the syllabus it says that late work/absences are only allowed if you inform the professor about it beforehand. Sorry if this doesn’t make sense, I’m kinda stressed lol"
NEED HELP FOR SPRING SEMESTER CLASSES,https://www.reddit.com/r/rutgers/comments/1gp8kgk/need_help_for_spring_semester_classes/,1,1,2024-11-12 01:00:15,"literally what it says in the title. I am a senior ITI student, minoring in Business Administration. I am done with the ITI requirements and almost done just 2 left in Business Administration core classes requirements, but behind on credits so i need help or recommendations on what easy classes I can take spring semester, which can be related to my major and/or minor or not related at all but can help me getting credits so that way I can graduate on time by May 2025! I would really appreciate the help!"
past exams for orgo 315,https://www.reddit.com/r/rutgers/comments/1gp7u1x/past_exams_for_orgo_315/,1,0,2024-11-12 00:25:52,does anyone have any past exams for honors orgo?
Is Cryptography a difficult class?,https://www.reddit.com/r/rutgers/comments/1goynel/is_cryptography_a_difficult_class/,3,1,2024-11-11 18:04:12,"Trying to fill out my schedule and I'm 2 classes away from math minor, any other suggestions would be nice."
Is there a curve applied for Physics for the Sciences 193,https://www.reddit.com/r/rutgers/comments/1gp16sn/is_there_a_curve_applied_for_physics_for_the/,2,4,2024-11-11 19:45:54,
PARDON MY SHOUTING BUT HAS ANYONE TAKEN INFANT PSYCH WITH PROF MICHELLE HURST,https://www.reddit.com/r/rutgers/comments/1gotkpv/pardon_my_shouting_but_has_anyone_taken_infant/,5,0,2024-11-11 14:35:05,
Coming to Grad Here From GT,https://www.reddit.com/r/rutgers/comments/1gov64m/coming_to_grad_here_from_gt/,4,3,2024-11-11 15:43:44,"I'm considering applying here for my grad program. I have research connections in Georgia Tech (GT) that I don't want to lose, but I'm honestly exhausted by just being far away from home, and I know tuition will be cheaper here. For reference I'm a CS major who wants to do a grad program in Bioinformatics. I've been pretty late in my realizing I'm interested in pursuing medicine, but the grad program would be a good safety net as opposed to a gap year in case I decide it won't work out for me and I need to find CS roles after I take the following year to find clinical experiences.

Would anyone recommend coming here for their grad program especially for something Bioinformatics-adjacent? Rutgers and Georgia Tech are honestly similar in ranking, though Georgia Tech has a more developed CS/Bioinformatics program. Would it be harder to find connections in research here?"
CS Majors help,https://www.reddit.com/r/rutgers/comments/1gowzh5/cs_majors_help/,4,14,2024-11-11 16:58:28,"I am an intl student planning to major in CS  
This freshmen semester I have below classes:  
\- Calc 1 135  
\- Intro to CS  
\- Intro to Microecon  
\- Lang & Society in AMESA  
\- RU FIT 1 Credit Seminar

And as for the next semester I am planning to register for the below:   


https://preview.redd.it/ij5rb9laza0e1.png?width=1794&format=png&auto=webp&s=95bb85f50b899f5062bc967face448c3363f93a9

Kindly let me know how it is and I am planning to take Asynch Video Editing   
If any one has any idea about Video Editing Class kindly do lmk "
Pathogenic Microbio,https://www.reddit.com/r/rutgers/comments/1gozthb/pathogenic_microbio/,2,0,2024-11-11 18:50:29,How is this class? is getting an A possible and how is the workload?
Stay Away from the CoRE building...,https://www.reddit.com/r/rutgers/comments/1gov2eb/stay_away_from_the_core_building/,2,2,2024-11-11 15:39:29,"... it's a crime scene!

  
[https://dailytargum.com/article/2024/11/rupd-investigates-burglary-on-busch-campus](https://dailytargum.com/article/2024/11/rupd-investigates-burglary-on-busch-campus)"
exam on Friday before Spring break?,https://www.reddit.com/r/rutgers/comments/1gp2ppx/exam_on_friday_before_spring_break/,0,4,2024-11-11 20:46:36,Hiii I’m trying to book the tickets to go somewhere else on Spring break. Just wondering if there is a possibility that professors put exam on the Friday before that? Thanks!
How to transfer (Urgent) ,https://www.reddit.com/r/rutgers/comments/1gp2mgt/how_to_transfer_urgent/,1,0,2024-11-11 20:42:53,Hi all! I was accepted to a different college. I live on campus and am a first year. What do I need to do to tell Rutgers I’m not coming back next semester and will not need housing? 
What's the difference between 198:439  intro to data science and 198:461  ml principles?,https://www.reddit.com/r/rutgers/comments/1gotnvp/whats_the_difference_between_198439_intro_to_data/,3,0,2024-11-11 14:38:59,"Some earlier post said that intro to data science is mainly machine learning. So what's the difference between these two?

I want to learn machine learning and also also data science related skills that may be useful for future data science related job. Do i need to take both courses or just one of them?."
Am I tripping or the whole state of NJ is experiencing power outage ? ,https://i.redd.it/9y30aniqa70e1.jpeg,20,9,2024-11-11 04:34:19,
Selective courses?,https://www.reddit.com/r/rutgers/comments/1gowi5y/selective_courses/,2,3,2024-11-11 16:39:27,"Hi guys I’m considering taking selective courses from below:

Endocrinology (Dr. Igor Shmarakov)

System physiology

Molecular and cellular physiology (Dr. William Belden)

Biochem of cancer (Dr. Lori White)

Pathophysiology (Dr. Anna Hausmann)

Can anyone give me some advice about these courses if you have taken any one of them? Thank you so much🙏
"
Asynchronous/online comp sci elective for spring2025? ,https://www.reddit.com/r/rutgers/comments/1gp1q98/asynchronousonline_comp_sci_elective_for/,1,2,2024-11-11 20:07:45,"I couldn’t find anyone in the schedule, I can’t fit any inperson ones I want on my schedule, do you guys know of any online ones? 🙏"
why r they playing Joel Olsteen in the nielson dining hall 💀,https://i.redd.it/lb6rta7dt30e1.jpeg,151,18,2024-11-10 16:51:29,
Passion Puddle named 'most romantic' place in NJ,https://www.reddit.com/r/rutgers/comments/1go3xlj/passion_puddle_named_most_romantic_place_in_nj/,177,16,2024-11-10 16:05:09,"Apparently if you want to feel the love, look no further than Cook/Doug campus. Passion Puddle made it to the top of the list of romantic places in NJ. Article also points out that it was also named the 6th most romantic spot on a US college campus back in 2015.

[https://patch.com/new-jersey/across-nj/puddle-most-romantic-place-nj](https://patch.com/new-jersey/across-nj/puddle-most-romantic-place-nj)"
RBS Newark - Management Skills 302,https://www.reddit.com/r/rutgers/comments/1govg1h/rbs_newark_management_skills_302/,2,2,2024-11-11 15:55:37,"Has anyone taken Zeki Pagda, Daniel Levin, Danni Wang, Ramdas Chandra, or Olivia Foster-Gimbel for Management Skills at RBS Newark? I am registering for classes and the only professor whose class works with my schedule is Zeki Pagda’s, but I saw horror stories on RateMyProfessor and am now altering my schedule. If anyone could share their experience with any of these professors, I would greatly appreciate it! "
Crime alert,https://i.redd.it/lmkyrtt4860e1.jpeg,33,2,2024-11-11 00:57:47,So now we got ppl stealing from labs 🤡
Decision Date,https://www.reddit.com/r/rutgers/comments/1gouf05/decision_date/,2,6,2024-11-11 15:12:14,"Hi, I applied early action to rutgers as a freshman for fall 2025. Does anyone know when I should hear back with my decision or when you guys got your decisions in the past?"
What classes can I take/should take,https://www.reddit.com/r/rutgers/comments/1gozy4j/what_classes_can_i_takeshould_take/,0,2,2024-11-11 18:55:42,"Hi! So I am a freshman planning on majoring in CS(BS) and maybe a minor in econ. I have decided to take data structures and macroecon for the spring semester. I need to take a 4 credit classes. I wanted suggestions for a 4 cred class and some easy SAS core fulfilling classes.   
For context -  I got creds for Calc I and II. And I just completed lin alg. "
Transferring to New Brunswick for Computer Science?,https://www.reddit.com/r/rutgers/comments/1gozefo/transferring_to_new_brunswick_for_computer_science/,1,0,2024-11-11 18:34:04,"Hello! I am a current freshman Computer Science major at Newark and I was wondering if it would be worth it to transfer to New Brunswick for the upcoming fall semester. I know the computer science department in New Brunswick is so much better but I was wondering if it would even matter to transfer. A friend of mine did make the point that if you want to go to graduate school (I do), there would be less competition and you would be able to stand out more in Newark if you get involved. In contrast, if you were to go to New Brunswick there would be so much more competition to get into these top programs and stand out amongst the big crowd. In addition, Newark has easy access to New York. Is transferring to New Brunswick for the top cs program worth it?"
Good schedule?,https://www.reddit.com/r/rutgers/comments/1goyrjp/good_schedule/,0,0,2024-11-11 18:08:40,"https://preview.redd.it/taf6ej01cb0e1.png?width=1946&format=png&auto=webp&s=94411b4f1896e0bbb498186641c3246bc6287c7f

i'm certain it's great"
Finance Courses,https://www.reddit.com/r/rutgers/comments/1goyis2/finance_courses/,1,1,2024-11-11 17:59:24,"Which finance courses w/professor are better to take? How is the class?

Derivaties: Lauren DeMarco, Joseph Stratz, Zhaodong Zhong

Global Capital Markets: Daniel Weaver, Joseph Stratz

Treasury Management: Ronald Richter

International Financial Management: Sheaffer"
what classes can i take over summer? ,https://www.reddit.com/r/rutgers/comments/1goy6lk/what_classes_can_i_take_over_summer/,1,12,2024-11-11 17:45:55,Hi Im an international so ill be going back to my home country over the summer. I wanna know what are the STEM mandatory classes that i can take over the summer. I know Calc is one of them but what are the other ones. 
Jameson bed bugs,https://i.redd.it/i8mwg37q450e1.jpeg,42,4,2024-11-10 21:16:56,"Minor rant about situation:

Its 2 rooms that are affected and they should not have self treated because now the treatments are less effective. They need to take some accountability and deal with the consequences. Not allowing me to post link so just read through the short article on the CDC website for bed bugs,,,

,,,

Okay, bigger rant (aka rah rah society and education bad {but not really})

I feel disappointed at the way rutgers students (and many other students at higher education institutions) dont challenge their views. 

We all like to say we are open to change but if you are only consuming information that agrees with yourself and completely disregarding everything else without understanding other perspectives, other information, etc,,, then you only wish to be ignorant (even if your views are “correct” because you should be able to understand why other people think the way they do and think logically on why they are “wrong”)

How does this tie in to the bed bugs??

If 1 (one) person posts something on reddit about bed bugs, dont just believe them. There was a post here a few weeks ago about a baby born on REXB and TOO MANY OF YOU BELIEVED IT. Clearly satire, yada yada. But your first instinct was just to believe it? Always hold some level of skepticism against everyone from children, to politicians, even to redditors (hard, i know),,,

And this skepticism should be with everything!! You wonder how [insert candidate, person, thing in your life you do not agree with] got into their current position and you need to realize people consume different media and grew up in different environments and have their own anecdotes for life,,, you should question everything and not blindly follow anything or anyone!! (May seem counterintuitive to say but also listen to people that are experts {like the pest control},, these people literally gain nothing from lying lololol)

What is supposed to set higher education student apart from the rest is that they are in a position to learn and be vulnerable, be willing to grow(!!!). 

We need to understand why we feel certain ways and always get our information from multiple sources and fact check ourselves and our beliefs. We shall not stray further from this point

Stay alive people,,,

 {tips fedora and exits stage left}"
Most useful Finance Elective?,https://www.reddit.com/r/rutgers/comments/1goxv68/most_useful_finance_elective/,1,1,2024-11-11 17:33:10,I've seen posts about the most easiest finance elective but does anyone know what the most useful electives I should take?
Photography course?,https://www.reddit.com/r/rutgers/comments/1gos9lw/photography_course/,2,3,2024-11-11 13:32:58,"Hi, is there any course related to photography that is in the SAS core? I love to take picture and edit them. I would like to take it as a fun class that I enjoy in order to balance out my schedule."
adv. creative writing fiction prof,https://www.reddit.com/r/rutgers/comments/1gowdiv/adv_creative_writing_fiction_prof/,1,0,2024-11-11 16:34:08,"hey guys, i want to take adv creative writing workshop with joyce carol oates. does anyone know how she is or if its difficult to get into that class? it seems like she wants a writing sample before ur able to register for the class. 

Thanks!"
Found Calc 3 Notebook at Alex,https://i.redd.it/441rebx2a50e1.jpeg,24,0,2024-11-10 21:46:55,"If you left your orange composition book for multi in the undergrad reading room at Alex library it's at the front desk.
 "
first year science program & aresty research assistant program questions,https://www.reddit.com/r/rutgers/comments/1gou3j4/first_year_science_program_aresty_research/,1,0,2024-11-11 14:58:38,"is the first year science program only for stem students or do they have branches for history/sociology research? is it worth it to do it or should i apply to a specific project within the aresty research assistant program first? can i or should i do both? let me know, thanks!!"
Can I Study Computer Science with Limited Math Skills?,https://www.reddit.com/r/rutgers/comments/1gotfmq/can_i_study_computer_science_with_limited_math/,1,1,2024-11-11 14:28:47,"Hi!

I’m thinking about studying computer science, but I’m a bit concerned I’m not good at math. I can handle algebra and some simple calculus, I didn’t take any of the more advanced math courses, so I don’t know if I’d be able to handle them if math is necessary for CS.

So, my question is: How much math is actually required, and Is it possible to succeed in computer science with just a basic understanding of math? 

If anyone has advice or personal experiences to share, I would really appreciate it."
important questions,https://www.reddit.com/r/rutgers/comments/1goi7vf/important_questions/,9,2,2024-11-11 02:54:06,"do the busses run during the winter break??

also does my financial aid bill have to be under 1k for me to register for classes?

thanks🫶🏿"
mail,https://www.reddit.com/r/rutgers/comments/1gosopw/mail/,2,2,2024-11-11 13:53:43,"i bought something from someone and when they mailed it to me, they didn’t put my full last name on the package (just the first initial). the package got delivered on the 8th at 10am and i haven’t gotten an email to pick anything up despite getting something else delivered later that same day and already having received that pickup email. should i just go into the post office and ask about it? i’m concerned that because my full last name isn’t on it that’s somehow preventing me from receiving the email "
Spring 2025 transfer!,https://www.reddit.com/r/rutgers/comments/1gogvyl/spring_2025_transfer/,9,1,2024-11-11 01:44:06,"Hey! I'm an incoming transfer student (junior) for spring 2025! does anyone know when and how are we supposed to register for classes? Does it happen on the star day? Since the spring registration is open rn, would we have classes available for us to register in January? WOULD APPRECIATE any tips for your fellow transfer student! THANK YOU!"
havent recieved term bill refund ,https://www.reddit.com/r/rutgers/comments/1gonqbg/havent_recieved_term_bill_refund/,2,4,2024-11-11 08:38:41,i signed up for direct deposit back in august. my refund should be over $30k. is it normal to not have received it yet? 
Teachers need to stop grading only tests,https://www.reddit.com/r/rutgers/comments/1gou00k/teachers_need_to_stop_grading_only_tests/,0,11,2024-11-11 14:54:10,"I’m taking into to stats for business right now and I literally do all the homework and it’s very easy but once the exam comes I fucking freeze. I got a 79 on my first exam, 84 with a curve. I took my second exam last week and I BOMBED that shit. I don’t know my score yet, but my only hope is that the curve lets me pass. I’m literally good at math too (Atleast I think so). I took AP calc in my senior year of highschool and got a 4 on the AP exam. But somehow “statistics” is where my brain draws the line. But my main gripe is that the teacher, regardless of how good he is, only grades fucking exams so my grade is far worse than it should be. Doesn’t check homework no nothing, people find this to be a blessing but I certainly don’t like it. Very few grades results in a high risk of a bad grade or straight up failure. I know this is my fault, but I just suck at tests."
Natasa Sesum for Calc 5/Advanced Calc (question),https://www.reddit.com/r/rutgers/comments/1gokjdf/natasa_sesum_for_calc_5advanced_calc_question/,3,0,2024-11-11 05:04:04,"I was just wondering if anyone who has had Sesum in the past knows if she drops any homework grades? I was also wondering what her overall grading looks like for Calc 5, just because I am starting to lose grip of what we are learning and I don't think I'm the only one. With that being said, to anyone who sees this and has taken Calc 5, are there any resources that anyone found helpful to get them through the course? Any input would be appreciated, thank you in advance! "
Livingston apartments,https://www.reddit.com/r/rutgers/comments/1go8o2a/livingston_apartments/,17,10,2024-11-10 19:29:04,I'm a freshman right now does anyone know how hard it is to get into Livingston apartments? 
PSA: There are no library chatbots (yet).,https://www.reddit.com/r/rutgers/comments/1gohvw3/psa_there_are_no_library_chatbots_yet/,3,1,2024-11-11 02:36:09,title.
white guys in freling floor 2,https://www.reddit.com/r/rutgers/comments/1gnr7gs/white_guys_in_freling_floor_2/,269,65,2024-11-10 03:09:42,"to the white guys in the lounge on floor 2 for the love of god stop saying the fucking n word. i know damn well at our big age you know better than to say that word. you know the fucking history behind that word and if i hear that shit happening again i’m gonna bang on your door just like you do to mine <3 

do yourselves a favor and shut the fuck up. (i don’t enjoy posting on here but i can’t stand these racist mfs someone get me off ca) 

note: if i had more solid proof i would 100% report them but right now im just trying to stay safe. "
wcr requirement,https://www.reddit.com/r/rutgers/comments/1gokzwd/wcr_requirement/,2,1,2024-11-11 05:31:15,"i was looking at possible classes to fill the wcr core for sas and saw computer architecture listed as one for spring 2025. is it true comp arch fills wcr because i am currently taking that. if not, do you guys know any easy and/or async classes i could take that fill wcr or wcd?"
NEED HELP for classes,https://www.reddit.com/r/rutgers/comments/1god3rd/need_help_for_classes/,7,4,2024-11-10 22:41:09,"Hey everyone sorry for the caps in the title but I do need help as I pick classes tmr. Help decide which 2 courses are the easiest A with the least amount of work from the options below. 1.)Greek and ROM Mythology 2.)Intro Gen race sexuality 3.) plants and people 4.) intro to environmental science. If anyone has taken any of these and with what professors, I will greatly appreciate it as I just need to take 2 of them!"
Can I take Intro to Supply Chain Management (33:799:301) as a non-business major?,https://www.reddit.com/r/rutgers/comments/1goi7ad/can_i_take_intro_to_supply_chain_management/,3,2,2024-11-11 02:53:06,"https://preview.redd.it/sjy8j3tjs60e1.png?width=1021&format=png&auto=webp&s=bfa5801c57cd4f7c53943245637cf51e9667446a

All sections say something like the attached image so I am unsure. For reference, I am a computer engineering major."
"Please help me decide. CS431, CS434, CS452? I would really appreciate some input on each",https://www.reddit.com/r/rutgers/comments/1goc52o/please_help_me_decide_cs431_cs434_cs452_i_would/,6,0,2024-11-10 21:58:57,I'm tryna graduate and need 2 more electives. I would also appreciate if there's another course in mind that I could take that's not too heavy.
Any advice?,https://www.reddit.com/r/rutgers/comments/1goergp/any_advice/,5,0,2024-11-10 23:57:44,"I’m a senior exercise science major and next semester i will take biomechanics and my internship. I’m finishing my major and need some more “fun” classes to bridge the gap of credits, i need another 7.5 credits to reach 120 for graduation. 

I want to take easy courses to bridge the credit gap so like that I have more time for the harder biomechanics course and the time requirement of my internship. What courses should i take? I have a psych class I’m looking at that i will probably be taking. If the course is interesting and easy that is a bonus, or if the course is easy and online also. Or if there are any courses that may just be beneficial for me to take?

(I took some of the easier exercise science electives already)"
software methodology professor,https://www.reddit.com/r/rutgers/comments/1gomjag/software_methodology_professor/,0,7,2024-11-11 07:10:32,"whos better for software methodology, sesh or chang?"
Food/ cool place reccomendations,https://www.reddit.com/r/rutgers/comments/1gom2qb/food_cool_place_reccomendations/,1,0,2024-11-11 06:38:35,Im an alumnus familiar with the area and im going to be back tomorrow. Any new food places or poi i should stop by? 
Anyone take any of these labor studies classes? Only asking because each class either has one or only two rate my professors reviews. ,https://www.reddit.com/r/rutgers/comments/1goi5cw/anyone_take_any_of_these_labor_studies_classes/,2,0,2024-11-11 02:50:13,"new jersey labor history with SIDORICK

employment discrimination law with COONEY, JAMES

law for business & non-profit organizations with Peter ROKKOS

Please let me how the professors and classes are "
