title,url,score,num_comments,created_date,selftext
When is wake November ED release date?,https://www.reddit.com/r/wfu/comments/1gwq6sf/when_is_wake_november_ed_release_date/,1,2,2024-11-21 21:00:53,I’ve seen a lot that said it might be Tomorrow or next Friday? Does anyone know?
Wake Forest Early Decision Question,https://www.reddit.com/r/wfu/comments/1gtuctf/wake_forest_early_decision_question/,5,3,2024-11-18 02:23:02,"Hello! My son applied ED Wake Forest/got all the materials in October 25.
Would he hear back at the end of November or in December?
"
interview,https://www.reddit.com/r/wfu/comments/1gtp1hr/interview/,2,3,2024-11-17 22:06:15,should I do virtual or video for the interview option?? which one would higher my chances in getting in or be better/ APPRECIATE ANY ADVICE!
Chances?,https://www.reddit.com/r/wfu/comments/1grhzvk/chances/,0,1,2024-11-14 23:06:34,"I applied to wfu for grad school, and also applied for their accounting for the future event- I was denied the event. Does that mean my application probably wont be accepted?"
why wake ,https://www.reddit.com/r/wfu/comments/1gqwcfh/why_wake/,0,4,2024-11-14 04:03:28,"im a student interested in research in cell biology, does anybody know any unique things I can put in my why wake that I can't find online "
pls deadline close help required,https://www.reddit.com/r/wfu/comments/1gq7gxk/pls_deadline_close_help_required/,0,5,2024-11-13 07:21:28,"in the why us essay i would rather mention soccer or their engineering department, however idk the specifics, anyone currently playing soccer or doing engineering, pls help me what to write, i fell insanely sick for the past 2 weeks so i wasnt able to research, im spending current time to write the other supps, help appreciated, god bless"
wake forest,https://www.reddit.com/r/wfu/comments/1gpdaef/wake_forest/,0,1,2024-11-12 05:07:20,I am applying as a bio major to wake and have interest in bio can someone pls give me some unique things I could write about in my why wake essays?
"wfu sports soccer or any team, any help appreciated ",https://www.reddit.com/r/wfu/comments/1gopz8h/wfu_sports_soccer_or_any_team_any_help_appreciated/,0,1,2024-11-11 11:21:50,"for the why wfu supp, i wanna add smthing related to soccer, counselor said to be specific so i can write about the soccer coach Muz, if anyone knows in detail about muz or what type of soccer he plays, his strat or anything in particular, i would love to know, pls reply if u have info, there are 3 days left for supps and i want to apply"
ed vs ac ,https://www.reddit.com/r/wfu/comments/1goduyb/ed_vs_ac/,2,2,2024-11-10 23:15:24,"If I am first gen would you recommend early actioning or earning decision to wake?  this is one of my top schools , pls help"
application help,https://www.reddit.com/r/wfu/comments/1godve3/application_help/,1,0,2024-11-10 23:16:01,can I submit a pdf of my research poster I have 
November ED,https://www.reddit.com/r/wfu/comments/1gmo0v5/november_ed/,5,6,2024-11-08 17:29:44,"Does anyone know the rough dates for when ED’s are released for Wake. I applied early/mid October and was wondering when the decisions are released? 
"
wfu pls help me w a question,https://www.reddit.com/r/wfu/comments/1gmfrec/wfu_pls_help_me_w_a_question/,2,3,2024-11-08 10:46:30,"law and business are the top most studied majors in wfu, im applying engineering and there were 241 people enrolled as undergrad engineers in wfu, does it improve my chances to get in wfu as most people apply for business and law in wfu and im appling for a major that is fairly new, is the engineering school less selective?"
wfu fam pls help,https://www.reddit.com/r/wfu/comments/1gl1cs2/wfu_fam_pls_help/,2,1,2024-11-06 15:39:53,does wfu offer a concentration in civil engineering. As an undergrad i want to pursue civil engineering but ive been researching and could only find their Engineering in Science degree. Answers to be appreciated. God bless.
do i have a chance in receving aid or merit based grants from wfu?,https://www.reddit.com/r/wfu/comments/1gk0toh/do_i_have_a_chance_in_receving_aid_or_merit_based/,2,4,2024-11-05 06:50:15,"Im an intl pakistani student  
\-5A\*/6As  
\-SAT optional  
\-National and International Award (one in soccer and one in writing comp)  
\-v good ecs and activites  
\-im also an author, wrote self improvement book and sold 3000+ copies (int+nationally), won author of year in my state

My seniors told me applying to wake is a blind shot as im an inlt student and wake is not that generous so im basically wasting my ED  
They also told me SAT optional will basically k\*ll my chances even more and that applying here is a needle in hay shot  
what does the reddit fam think of this?should i apply here or not bcs i rlly want to get admitted with good or full aid"
Does anyone know where I can find a similar 20” mascot statue like this or the running mascot version?,https://i.redd.it/gkgbgz29zzyd1.jpeg,4,0,2024-11-05 02:53:12,
hey wfu fam,https://www.reddit.com/r/wfu/comments/1gjbpec/hey_wfu_fam/,3,9,2024-11-04 11:08:04,"Im an intl pakistani student applying ed1 for wfu, today my councillor told me to contact people who made it to wfu, could anyone pls (who are or went to wfu) drop down some suggestions while making my application or anything j in general. also im appealing for alot of aid, so does it reduce my chances, im also a national gold medal soccer player and heard wfu is a highly sports oriented uni, does this help my case? God bless for any help"
Any International Pakistani or Indian that went to WFU or is in WFU,https://www.reddit.com/r/wfu/comments/1gjnmbz/any_international_pakistani_or_indian_that_went/,0,1,2024-11-04 19:59:04,"i want ur advice on what to do, im applying ED 1 and seniors are telling me not to do so as they wont give me aid and are very selective, what should i do, i rlly like the uni?"
Visual Art Major at WFU?,https://www.reddit.com/r/wfu/comments/1gj43gs/visual_art_major_at_wfu/,1,0,2024-11-04 02:30:03,"Hi, I’m a senior in high school hoping to apply ED at WFU. The only problem I’ve run into is finding information about majoring in art here (besides the website). I was wondering if anyone already attending Wake—especially art majors—could give me their honest opinion on the program. Though I was hopeful when visiting the campus and seeing their appreciation of the arts plastered around the school, I’ve felt discouraged seeing little to no input on it from actual students. Help?"
ed ,https://www.reddit.com/r/wfu/comments/1gionfu/ed/,3,0,2024-11-03 14:55:12,difference in acceptance rate in ed 1 or ed 2?
does wfu offer full aid for an international student,https://www.reddit.com/r/wfu/comments/1gin3bw/does_wfu_offer_full_aid_for_an_international/,2,5,2024-11-03 13:41:36,"im an international student looking for full ride, is that possible at wfu? and what are the chances, i cant afford tution my parents are real broke broke"
Grad school interview ,https://www.reddit.com/r/wfu/comments/1ghy8m7/grad_school_interview/,2,0,2024-11-02 14:55:27,"Hi! I got an invite to interview for an accounting masters here, does anyone know what they’ll be asking?"
'why us' essays,https://www.reddit.com/r/wfu/comments/1ght2vs/why_us_essays/,1,3,2024-11-02 09:59:03,"hey everyone! submitting my application in 1-2 days (EA) and wanted to ask if there's any really niche or stand-out info I can include in the 'why us' essay. I've done a lot of research on the school, and 150 words is already difficult to maintain as a word limit, but wanted to hear if there was maybe something special you guys included in your essays! (students at wfu)"
Do I have any chance?,https://www.reddit.com/r/wfu/comments/1gh74tj/do_i_have_any_chance/,5,4,2024-11-01 14:47:52,"Do you think I can get into WFU? Its my top choice but I cant ED because of aid. Im really nervous because I got to a fairly small school but 2 people from my school are ed-ing, and 3 others are applying RD and some of them have better stats than me. Do you think I have any chance at all..?

Stats:

Psych Major

3.95uw, 4.25 w

34 ACT(not superscore)

5 aps, 6 honors

5 on AP Psych, 5 on AP Lang(only 2 aps i took before senior yr)

Decent ECs and Essays

(live in illinois, mid/high income, white, not first gen)"
notification date,https://www.reddit.com/r/wfu/comments/1gh7qca/notification_date/,3,1,2024-11-01 15:13:42,"When I was at the open house for Wake a few weeks ago, one of the admissions counselors said that there are two more notification dates: near Thanksgiving and near Christmas. 

I applied on the 31st and the deadline is the 15th of November, will I hear back by Thanksgiving?"
Gift for Recently Accepted Student,https://www.reddit.com/r/wfu/comments/1gfptvp/gift_for_recently_accepted_student/,6,8,2024-10-30 15:52:26,"Hi All!

My little cousin just got into Wake Forest, and I was wondering if there was some cool niche gift I can get her? Like is there a local restaurant I can get a gift certificate to? Is there an essential piece of gear from the bookstore?

Any suggestions welcomed! I just didnt want to do a hoodie or beer mug if I could avoid it."
pre med -wf,https://www.reddit.com/r/wfu/comments/1gfb3sy/pre_med_wf/,4,0,2024-10-30 01:22:58,"How Is pre med as a wf student? I am really thinking about ed here but I want to make sure the support is great for the amount it will cost me to attend. 

  
\- How easy is it to gain lab experience as a first yr

\- How is finding oppurtinites for clinal hours here

\- How is the support in the stem classes "
 wf - first gen - First in the Forest program,https://www.reddit.com/r/wfu/comments/1gfb8jb/wf_first_gen_first_in_the_forest_program/,3,2,2024-10-30 01:29:46,"If I ed to wake but I am a first gen , will I still be considered for the  First in the Forest program if I don't early action?"
Deferred,https://www.reddit.com/r/wfu/comments/1gclfz9/deferred/,3,11,2024-10-26 13:46:20,My daughter was deferred for ED yesterday....she's really bummed.  Anyone have any experience with deferment and the likelihood of being accepted?  Thanks in advance:)
Grad school interview,https://www.reddit.com/r/wfu/comments/1gcmsa0/grad_school_interview/,2,2,2024-10-26 14:51:21,Hi! I’m interviewing soon for master program. What questions should I be ready for? Any tips on what to focus on or avoid? Thanks!
Interviews,https://www.reddit.com/r/wfu/comments/1gb8tnh/interviews/,5,2,2024-10-24 17:53:27,What are these interviews everyone's talking about? Does everyone get the opportunity to do them? I'm applying EA and wanted to know. 
Wake forest said interview spots were full…is this a soft rejection?,https://www.reddit.com/r/wfu/comments/1gartem/wake_forest_said_interview_spots_were_fullis_this/,3,6,2024-10-24 02:06:22,I applied RD and just got an email saying they could not give me an interview because of how many students applied. Just confused because it’s October I don’t see how that many RD students applied. Should I take this as they don’t want me? I also got a text from a current student so I’m confuseddddd. If anyone that got denied an interview still got in please lmk bc I’m stressing
Experience with CS Professor,https://www.reddit.com/r/wfu/comments/1gaomzi/experience_with_cs_professor/,3,2,2024-10-23 23:30:12,"I was wondering if anyone has ever taken a CS course with professor Natalia Khuri? If so, what was your experience with her as a professor?"
Interested in WFU,https://www.reddit.com/r/wfu/comments/1g919rh/interested_in_wfu/,5,4,2024-10-21 21:24:24,"I’m interested in going to WFU and I’ve spoken to a rep about attending, but I’m somewhat hesitant because of things I’ve seen online about the school being predominantly white and affluent, both of which I am not. I don’t care about that specifically, but more so about student life while being queer and not white and how that can go. 

I think Wake is a really awesome school in a lot of other regards, it’s just that that’s making me question. "
Top 10 List,https://www.reddit.com/r/wfu/comments/1g3wg4w/top_10_list/,2,7,2024-10-15 01:34:20,"Hello!

I am trying to go to Wake (it’s my 1st choice) and debate there. I am finished with most of my application but I’m not sure what to make my list about.

I’m thinking about things I do outside of school, to show another side of myself that the rest of my essay simply doesn’t. It talks about school, my passions regarding school, my autism, but not what I do for fun.

I’m hoping to add a new layer to who I am to admissions, but I’m not sure if this is the best route."
Today is the last day to register to vote (Online/by Mail/in Person),https://www.reddit.com/r/wfu/comments/1fyaev0/today_is_the_last_day_to_register_to_vote/,8,1,2024-10-07 15:27:52,
College bars?,https://www.reddit.com/r/wfu/comments/1fyfv0i/college_bars/,1,2,2024-10-07 19:11:16,What are some of the popular bars for college students in the area?
ED Application ,https://www.reddit.com/r/wfu/comments/1fxn0a4/ed_application/,4,5,2024-10-06 18:18:47,"Hi! I’m a senior in high school and I recently applied ED to Wake. I checked off all of the things on the portal by Sep. 20, and then had my interview on Oct 3. Do you think I will hear back at the end of this month (Oct) or November? 
Also, does Wake put a large emphasis on your interest in the school when reviewing your app? I am worried about my GPA. It is definitely not high enough to get in (4.0 W) but i have shown a lot of interest in the school (touring, summer program) and have strong rigor & extracurriculars. so hopefully that helps. 

Thanks in advance! "
"Is there any truth in why they call wake forest, work forest? ",https://www.reddit.com/r/wfu/comments/1fo200k/is_there_any_truth_in_why_they_call_wake_forest/,16,17,2024-09-24 02:21:59,What is the culture really like? 
Portal,https://www.reddit.com/r/wfu/comments/1fo1unz/portal/,2,0,2024-09-24 02:14:18,"I applied about a month ago and it says on common app that everything is submitted including my recommendations n shit and I just checked the portal and it says a big red x ❌ for teacher recommendation, transcript, and ED agreement although I know that I submitted the ED agreement. Am I good? I think that all that shit is included in the common app"
Where do Wake grads typically wind up working?,https://www.reddit.com/r/wfu/comments/1fnka4e/where_do_wake_grads_typically_wind_up_working/,5,11,2024-09-23 13:20:32,Do you feel there are more opportunities in the Midwest for awake grads or are they pretty dispersed all over? 
ED rolling question ,https://www.reddit.com/r/wfu/comments/1flh5fk/ed_rolling_question/,3,16,2024-09-20 17:09:58,Heard that they now do a drop every month of decisions. Is that right and if so when has it been historically ie last day of month etc?  Thanks! 
Tim Duncan Wake Forest Highlights,https://youtu.be/7BCAocyjNYw,17,0,2024-09-18 16:03:10,
Would I get in? ,https://www.reddit.com/r/wfu/comments/1fbnkls/would_i_get_in/,4,6,2024-09-08 02:27:44,"Hey guys, so I'm thinking of applying to wake forest. Im going in for biochemistry or chemistry. I have a GPA of 3.9 (unweighted) and 4.8 (weighted) and a SAT score of 1150 (I know, it sucks.) I've heard that they don't care about your stats, they like unique people who nail their interview. If that's the case, what questions do they ask? What should I write my personal essay about? "
Apartment complexes near wake,https://www.reddit.com/r/wfu/comments/1fbllan/apartment_complexes_near_wake/,2,2,2024-09-08 00:38:51,"Looking to get out of current situation, what our some good apartment complexes that are on the cheaper side near wake?"
What's the seat back situation in the stadium?,https://www.reddit.com/r/wfu/comments/1fb4pht/whats_the_seat_back_situation_in_the_stadium/,1,4,2024-09-07 11:25:37,Are there backs on all the bleacher seats or just certain sections?
How should I report this silent discrimination experience,https://www.reddit.com/r/wfu/comments/1fa1piq/how_should_i_report_this_silent_discrimination/,0,32,2024-09-06 00:12:37,"Hey everyone, I wanted to get your thoughts on something that happened recently. I'm an Asian female international student at WFU, and in one of my classes, I usually sit next to a white American girl. At first, everything seemed fine, but recently the vibe has changed, and I can feel her being dismissive towards me. I know my spoken English isn't at a native level, but my communication is clear and I’ve had no issues connecting with other American students.

What makes me uncomfortable is that during class discussions, she often stays silent or gives me this dismissive look whenever I try to engage in conversation. It's like she's intentionally shutting me down. This week, she even went as far as moving to sit with a group of American students during discussion time, completely avoiding me. To me, this feels like silent discrimination against international students — no outright words, but her actions spoke loudly, showing no consideration for how it might affect me.

I don't believe I deserve to be treated with this level of disrespect just because I’m an international student. It’s upsetting because I thought WFU, a university that prides itself on equality, diversity, and respect, would foster a more inclusive environment.

I’m also worried that if this continues unchecked, other international students might experience similar treatment. Do you think I should report this to the school or a relevant department? I don't want others to go through what I’m experiencing. Would appreciate any advice.

Update: And can people stop twisting the issue? Does someone have to be liked in order to be treated decently? What kind of twisted logic is that? I don't like this girl, but I would never treat her the way she treats me—completely ignoring a classmate sitting right next to her. Stop trying to pin things on me with false accusations."
Fraternities and hazing,https://www.reddit.com/r/wfu/comments/1f7n1pm/fraternities_and_hazing/,3,9,2024-09-03 00:55:33,"Senior in HS and loved wake and everything but just like at any school, I’ve heard abt hazing. Bc Greek is the dominant social activity there, I want to know how intense the hazing is and if there are some worse than others. "
Is the Barcelona study abroad program as good as the Salamanca one?,https://www.reddit.com/r/wfu/comments/1f58dta/is_the_barcelona_study_abroad_program_as_good_as/,3,1,2024-08-30 22:42:33,I am applying to study abroad and was wondering if the Barcelona program was as good as the Salamanca one. I am applying to both but feel i have more a chance with the Barcelona program. Thanks!
Apartment sublease-close to campus,https://www.reddit.com/gallery/1f4apwe,0,2,2024-08-29 19:09:19,"1B1B apartment for rent, close to wfu campus. Nice layout with balcony and big storage. Available now."
Does my daughter have a shot a merit aid?,https://www.reddit.com/r/wfu/comments/1f0389p/does_my_daughter_have_a_shot_a_merit_aid/,4,3,2024-08-24 11:38:47,"4.6 gpa, rigorous curriculum. 36 ACT. Extra-curriculars are not special. Application essays seem very good. Thanks in advance for any input."
Admissions Interview,https://www.reddit.com/r/wfu/comments/1exxm1a/admissions_interview/,5,12,2024-08-21 18:48:09,My daughter just signed up for the optional admissions interview and I was wondering if anyone had any tips to help her prepare.  Thanks in advance!
How difficult/interesting/good is the Mathematical Business major?,https://www.reddit.com/r/wfu/comments/1etuyen/how_difficultinterestinggood_is_the_mathematical/,6,2,2024-08-16 17:36:14,I want to switch into that major but haven't met anyone in it to talk to about it
Celtic's Alistair Johnston honoured alongside Lionel Messi and Raphinha after Copa America heroics,https://www.67hailhail.com/news/celtics-alistair-johnston-gets-the-same-honour-as-lionel-messi-after-copa-america-heroics/,3,0,2024-08-13 17:32:47,
Does anyone here have any experience applying ED?,https://www.reddit.com/r/wfu/comments/1eo6pea/does_anyone_here_have_any_experience_applying_ed/,1,21,2024-08-09 18:09:26,Wake Forest is top of my list right now as a rising senior. I am working through the essays right now and I am really thinking about going ED. I also like the idea of rolling admissions so I can hear back early. 
computer science culture for women,https://www.reddit.com/r/wfu/comments/1ems41f/computer_science_culture_for_women/,4,2,2024-08-08 00:29:37,Posting for my daughter who doesn't have a reddit account--Wake Forest is one of her top choices and she's thinking of majoring in computer science. She's wondering what the culture is like for women in that major--would love to hear from current/past female students about their experience. 
Not getting status portal,https://www.reddit.com/r/wfu/comments/1ektrqy/not_getting_status_portal/,1,5,2024-08-05 17:30:56,"I am applying for Fall 2025 and I submitted my application for ED 1 on Saturday. I am planning on doing the zoom interview, and the website says that I should have received my status portal with instructions to set up my interview within 24 hours. The deadline for requesting an interview is 5 days after filing, but I still have not received anything from Wake about my status portal, and it is over 72 hours since applying. I am starting to get worried because I feel like I did something wrong. I am emailing admissions right now asking for assistance, but I was wondering if any current students had this problem, or can suggest any help to me."
Golf at Wake?,https://www.reddit.com/r/wfu/comments/1eifas4/golf_at_wake/,4,8,2024-08-02 17:01:43,"Hi all - 

I'm curious as to the golf options at WFU.  My understanding is that the WFU golf team plays at a private course next to campus (Old Towne Club).  

Given that, what play/practice options exist for non-team students (and their parents :)?  

Thanks in advance"
transfer student scholarships,https://www.reddit.com/r/wfu/comments/1e2nro9/transfer_student_scholarships/,0,3,2024-07-13 23:19:24,does wfu give transfer students scholarships? i just graduated high school and was supposed to be going to another school but had to withdraw because i couldn't afford after the 1st year. i'll be attending a cc and transferring and have interest in wfu now.
South Forest housing?,https://www.reddit.com/r/wfu/comments/1e18s8v/south_forest_housing/,3,5,2024-07-12 04:31:53,"Hi! I am an incoming freshman and am very nervous about housing coming out soon and was wondering if anyone could answer some questions?

Is your residence building actually assigned COMPLETELY randomly or is it based at all on the answers you put on your housing application?

Does each south forest dorms have like a reputation? And if so what are they?

If I answered that I prefer a smoke free environment on my housing form does that mean I’m screwed and automatically sent to Johnson?

Thanks!"
Federal work study jobs ,https://www.reddit.com/r/wfu/comments/1e0a1ts/federal_work_study_jobs/,1,8,2024-07-10 23:15:37,Any advice or thoughts on which work study jobs or just jobs around campus are good? I want to be able to interact with others and be involved with the community and I’m hoping to find a work study job that can help me with this. Thoughts??? 
Music at Wake,https://www.reddit.com/r/wfu/comments/1e013tn/music_at_wake/,1,6,2024-07-10 17:08:39,"Are music majors given special treatment at wake regarding music ensembles and things? To my knowledge, they’re not, but I just want to make sure. (I’m writing my ‘why wake’ essay and I don’t want to get my facts wrong lol)"
Course schedule question,https://i.redd.it/mdotu5puopbd1.jpeg,1,5,2024-07-10 15:42:00,"I just registered for classes today and I realized that some classes have two classes in one day? Is it just a typo or is the class actually like that? 
"
class schedule ,https://www.reddit.com/r/wfu/comments/1dyjwmr/class_schedule/,1,4,2024-07-08 20:56:46,"ive been trying to build my schedule and its looking like on tuesday and thursdays my only break for lunch will start at 1:45, i know lunch ends at 2. does 2 mean the dining room closes or they stop serving food at 2? will i be able to get food from the dining halls given the time i get out of class? "
WFU Health Insurance?,https://www.reddit.com/r/wfu/comments/1dy9xvr/wfu_health_insurance/,1,4,2024-07-08 14:12:48,"Hi all - Getting ready to pay first bills for 2 incoming freshmen.  Noticed a 'Health Insurance' fee of $1,379 per student per semester.  In addition, there is also a 'Wellness Fee' of $197 and a 'Student Health Fee' of $286.  Does anyone have any information on this?  I'm assuming this is to pay for trips to the WFU clinic (cold meds, bumps/bruises, etc.) and not full blown health coverage for major illnesses/accidents?  If that's the case, that seems a little steep, no?

If that's NOT the case, then do we need to maintain their regular health insurance (i.e. on parent's family plan) while they are in school?

Thanks"
is the parking pass worth it?,https://www.reddit.com/r/wfu/comments/1dwe527/is_the_parking_pass_worth_it/,3,5,2024-07-06 01:32:44,"Hello, I am an incoming freshmen trying to decide to purchase a parking pass, and I was wondering if there are any alternative options? or a cheaper option to say the very least? Any information would help thank you."
Wake Forest Syllabi,https://www.reddit.com/r/wfu/comments/1dtx53l/wake_forest_syllabi/,2,5,2024-07-02 21:23:43,"Hi guys! I'll be coming to WFU in the fall to get my master's. Is there a place where I can see previous years Syllabi, or do I just need to start emailing professors? Thanks y'all!"
