title,url,score,num_comments,created_date,selftext
What's it like for minorities in WFU?,https://www.reddit.com/r/wfu/comments/ej4k6t/whats_it_like_for_minorities_in_wfu/,6,2,2020-01-02 21:24:51,"My daughter is a junior in high school and has expressed interest in Wake Forest.  She is a mixed race person.

I'm interested in hearing from minorities regarding their recent experience being part of the WF student body.   Wake Forest has been in the news in recents months (e.g. emails sent to faculty and staff about the need to ""purge"" the country of non-whites) .  Are you finding the environment to be overall ""welcoming"" of minorities?

I recognize that the recent events that has brought WF into the news may simply be aberrations.  However, I grew up in Northern Virginia and in my experience, while most people were respectful of each other, it wasn't uncommon to run into the dixie flag flyers.  And less than politically correct language was not unusual.  

What have your experiences been like?"
Sublease for the Summer,https://www.reddit.com/r/wfu/comments/ej7rco/sublease_for_the_summer/,2,2,2020-01-03 01:16:04,"Hi y'all

I'm a student from Clemson who will be interning in the Winston Salem area the summer of 2020.  I was wondering if subleasing is common at Wake, and if anyone needed a male to sublease their apartment for the summer.  I've looked into the Wake SHIP program, but it is not quite ideal as I will be starting in May and it does not open until June.

Thanks!"
I am currently filling out an application for wake forest. I did some researching about the programs computer science programs can offer and I can’t seem to find anything unique. Can someone tell me a computer science program that only wake forest offers?,https://www.reddit.com/r/wfu/comments/eirwee/i_am_currently_filling_out_an_application_for/,7,2,2020-01-02 02:31:19,
Nighttime shot of Wait Chapel,https://i.redd.it/lml0hgv61a741.jpg,34,2,2019-12-28 01:26:43,
What do you like/dislike about Wake Forest?,https://www.reddit.com/r/wfu/comments/eg77cn/what_do_you_likedislike_about_wake_forest/,9,5,2019-12-27 05:53:47,"Hello everyone, I just applied to wfu! 

Can y'all tell me what you like/dislike about wfu. Thanks :)"
Previewing the Pinstripe Bowl,https://impassionedsportsnerd.wordpress.com/2019/12/26/bowl-game-preview-part-2/,1,0,2019-12-26 20:28:45,
prospective student concerns/pros and cons,https://www.reddit.com/r/wfu/comments/edw6kg/prospective_student_concernspros_and_cons/,6,3,2019-12-21 22:14:41,"Hello all, 

I am currently a high school senior (female) in southern california. I am thinking about applying to wake forest by January 1. However, I wanted to know what you all think about the internships and jobs post graduation the university has or hasn’t set you up with? Also do you think being in North Carolina possibly isolates you from businesses and other large employers? Lastly, overall what do you believe to be the pros and cons of the school.

Thank you!"
Wake Forest Lovefeast 2019,https://www.youtube.com/watch?v=31yPVpALZOA&feature=share,8,1,2019-12-18 23:25:29,
Admitted w/ lower GPA?,https://www.reddit.com/r/wfu/comments/ec3rtl/admitted_w_lower_gpa/,6,6,2019-12-17 23:13:02,"Wondering if anyone on here knows someone or was themselves admitted with about a 3.5 gpa? I'm planning to ED2 but not sure if it's even worth the effort. The rest of my app should be really solid, and I'm going in for history. Lastly, I was unable to get an interview, which is pretty unfortunate. Anything is helpful !!"
Admitted w/ lower stats?,https://www.reddit.com/r/wfu/comments/ec3mej/admitted_w_lower_stats/,2,0,2019-12-17 23:02:06,Wondering if anyone on here knows someone who was or was themselves admitted with about a 3.5 gpa? I'm planning to ED2 but not sure if it's even worth the effort. The rest of my app should be solid.
Rooming at WFU,https://www.reddit.com/r/wfu/comments/e4igxf/rooming_at_wfu/,3,12,2019-12-01 15:04:17,"Rising freshmen here. Was curious how the room and board process works. Is your roommate entirely random? How long do you have to stay with that roommate? If you’re in a frat, do you live on sight ? Thanks"
How conservative is Wake?,https://www.reddit.com/r/wfu/comments/e44gvm/how_conservative_is_wake/,10,8,2019-11-30 22:15:04,"Hi! I'm a HS senior really interested in Wake, but I've heard that it's really conservative. I'm completely accepting of a wide range of different political views, but idk if it's an echo chamber (my HS was a liberal echo chamber so I'm over it). Lemme know what y'all think!"
Can any students help me get access to a document?,https://www.reddit.com/r/wfu/comments/e22txf/can_any_students_help_me_get_access_to_a_document/,3,4,2019-11-26 19:15:22,"This document isn't online as far as I can tell. It also isn't behind any paywalls online or on sci-hub. If there is maybe a secret wake forest library or database where anyone could find this it would be a big help. Shot in the dark but if u can find it pls send it to me.

Document is ""Shanahan, William. ""Kritik Of Thinking."" Health Care Policy: Debating Coverage Cures. Winstom-Salem, NC: Wake Forest University, Debater's Research Guide, 1993.""

Edit: I am not a wake forest person. I am in highschool and cannot find this document anywhere online and the citation included wake forest."
WFU application questions(ED) and chanceme?,https://www.reddit.com/r/wfu/comments/dza0qj/wfu_application_questionsed_and_chanceme/,3,4,2019-11-20 23:13:45,"I submitted my application on the deadline day for Early Decision applicants and requested for the interview a month before the deadline, but still haven’t heard back yet. I called the admission office today and they told me that it’s possible that I would not get the interview because it’s close to the end of interview session(11/26), unless if the admission officers feel the need to interview me after they read my application.

I’m just so stressed that would this put me on a disadvantage because everybody else did the interview?? Also on the school website, an interview is actually mandatory for the early decision applicants... I’m so freaked out, please I need help anyone here who got in without an interview?? 

I also didn’t submit my SAT score because it’s terrible and didn’t have great GPA(weighted 4.18, unweighted 3.6) either, but ECs and essays weren’t bad. I just don’t see any hopes now"
Help with whether or not I should submit my 1280 SAT score,https://www.reddit.com/r/wfu/comments/dwtqut/help_with_whether_or_not_i_should_submit_my_1280/,4,10,2019-11-15 17:11:59,"EDIT: I got a higher SAT score. I submitted my new one. 

I'm applying today to Wake Forest, and I still haven't made a solid choice of whether or not I should submit my SAT score. It's 1280 (660R, 620M).

Thank you"
Previewing the Virginia Tech game,https://impassionedsportsnerd.wordpress.com/2019/11/09/week-11-preview-2/,1,0,2019-11-09 15:35:16,
DnD on campus,https://www.reddit.com/r/wfu/comments/dt7hbj/dnd_on_campus/,8,0,2019-11-08 00:51:57,"Hi all, 

I'm a first-year and I wanna start playing DnD. Does anyone know where I can find a group on campus? I've been looking but can't find anything. Does anyone have any idea?"
02/02/2005: #6 Duke Blue Devils at #7 Wake Forest Demon Deacons,https://www.youtube.com/watch?v=LKLxiWbOTcQ&feature=share,10,2,2019-10-27 02:40:49,
My buddy and I are students and do endurance races. So he decided to try a one-man team for hit the bricks this year.,https://youtu.be/bEA-B838_pQ,10,0,2019-10-04 10:57:07,
Suggestions for parking for Louisville football game,https://www.reddit.com/r/wfu/comments/dd00tc/suggestions_for_parking_for_louisville_football/,3,0,2019-10-04 00:45:03,"So, I graduated last year and this is my first game as an alum. I was wondering if anyone had suggestions for parking that’s relatively easy to get to and get out/ doesn’t have quite as much traffic as Reynolds Blvd for example."
Jamie Newman a deserving honorable mention of Week 4,https://theathleteshub.org/best-of-college-football-week-4/,10,2,2019-09-24 21:43:53,
"Dr Anthony Atala, Wake Forest School of Medicine, Discussing ""Bio""-Printing New Organs",https://www.youtube.com/watch?v=Omjjk6XXdIM,13,0,2019-09-12 10:00:00,
Are the underground tunnels still open?,https://www.reddit.com/r/wfu/comments/d06bd9/are_the_underground_tunnels_still_open/,3,6,2019-09-05 20:27:22,"Hello, I was wondering if the underground tunnels are still open somewhere. I've heard about them, but it seems that many entrances have been locked or closed off. Is there still any way to get into them? There is already a post about this on this subreddit, but it's a few years old and I was wondering if anyone could give any updates. Or, perhaps someone could share if there are any other interesting places to go on campus."
Bostwirk Dorm Reviews?,https://www.reddit.com/r/wfu/comments/crs51v/bostwirk_dorm_reviews/,3,2,2019-08-17 21:21:10,"Hey guys i'm an incoming freshman and I got put in the Bostwick dorm. What is the dorm like, give me your thoughts, opinions and tips. Thanks!"
Stan Cotten talks Wake Forest football,https://www.reddit.com/r/ACC/comments/cpzf4l/wake_forest_and_pitt_football_previews/,1,0,2019-08-14 00:12:14,
Summer Preview Series: Q&A on Wake Forest Deacons Football,https://www.shakinthesouthland.com/2019/8/9/20798392/summer-preview-series-q-a-clemson-wake-forest-deacons-football,2,0,2019-08-09 13:23:28,
"Utah State Aggie, here. Wondering about best food in town ahead of August 30 game.",https://www.reddit.com/r/wfu/comments/cm4mrf/utah_state_aggie_here_wondering_about_best_food/,11,7,2019-08-05 01:41:24,"As the title indicates, I will be visiting Winston-Salem for the first time in a few weeks when our football teams kick off the season against one another. What are the must-see and must-do (if time permits) things that Winston-Salem has to offer? All suggestions welcome!"
2019 Football Preview,https://impassionedsportsnerd.wordpress.com/2019/07/29/acc-atlantic-preview/,7,1,2019-07-29 22:54:01,
Request for help: Guest trying to connect a device to the internet,https://www.reddit.com/r/wfu/comments/c1vw21/request_for_help_guest_trying_to_connect_a_device/,0,0,2019-06-18 01:15:11,"Hello people,
I'm currently visiting WFU for the period of the summer and was wondering if someone with a wfu username would be kind to add my ps4 as one of their devices (https://is.wfu.edu/services/my-devices/). The internet adapter on the ps4 does not connect to eduroam or wfuGuest wifi's.
Any help would be appreciated <3"
Transfer,https://www.reddit.com/r/wfu/comments/bxy1l5/transfer/,3,3,2019-06-07 18:28:36,Hey just curious because I didn't see on WFU's site if you could transfer in a sophomore or not. Can someone enlighten me?
"With the 30th anniversary of Tiananmen Square coming up on June 4th, here's an article about a Wake student who captured and smuggled out footage of the event, thus making headlines nationwide.",https://www.nytimes.com/1989/12/04/us/student-censured-hero-or-deceiver.html,9,1,2019-05-30 16:41:59,
Community Changes,https://www.reddit.com/r/wfu/comments/bs72dz/community_changes/,10,3,2019-05-23 19:19:38,"Hey Deacons,

Hopefully you have seen a few changes in the community whether you are using mobile or are on a desktop.

We have now added post flairs so that people will have a better indication of what you are posting, and so we know what to expect from you. There have been individual flairs for quite some time now, but you can make your own now as well.

We have not decided on whether to start cracking down on discussions if they get out of hand, however, they will be locked if needed. If out of line and disrespectful, members may be banned or suspended. We don't really want to do this because we think it has been pretty respectful in previous posts, but you can help us by appropriately reporting when need be.

Lastly, if you have any suggestions for the subreddit, you can comment below!"
What the hell is with the dining services here?,https://www.reddit.com/r/wfu/comments/bnrqew/what_the_hell_is_with_the_dining_services_here/,2,4,2019-05-12 17:44:21,"I'm starting graduate school and am here for the Maymester start. I've just checked hours and locations that are open during this time - not only is nothing open for standard dinner hours, some Sundays list everything as closed for the whole day. (There is one Sunday saving grace, with the Starbucks being open until 1PM on the 19th - truly amazing)

Naturally it's only stuff like Chic-Fil-E and Subway that have limited hours for what seems like the entire Maymester period. I can only hope it gets better for Summer 1. 

Who can I complain to about this. I was expecting there to be a gaurantee for food of some sort for people on campus but apparently I can't expect basic necessities here? I know i'm not the only person left on campus."
Transfer Student GPA requirements?,https://www.reddit.com/r/wfu/comments/bjkt37/transfer_student_gpa_requirements/,2,6,2019-05-01 18:42:10,"Hello. I am a CS student who is interested in transferring to WFU I have a 3.65 GPA should I apply or is the GPA not good enough? I COULDN'T find anything on the website.
Thanks for the help."
University hosts no-whites-allowed faculty and staff listening sessions — to promote inclusivity,https://www.thecollegefix.com/university-hosts-no-whites-allowed-faculty-and-staff-listening-sessions-to-promote-inclusivity/,0,6,2019-04-25 02:55:45,
"WFU coach ﻿Jamill Jones, accused in deadly attack of tourist in NYC, resigns",https://www.wxii12.com/article/wfu-coach-jamill-jones-accused-of-attacking-a-tourist-in-nyc-resigns/27130847,3,0,2019-04-17 16:12:50,
Foreign Language Requirement,https://www.reddit.com/r/wfu/comments/bdhh9g/foreign_language_requirement/,4,7,2019-04-15 15:43:59,"After reading the WF bulletin, online placement test procedures, I still can't tell if 3 years in a high school foreign language will waive the foreign language requirement? Now, it's been 2 years since I've studied the dead language. Options?"
John Collins balling,https://www.youtube.com/watch?v=7ybBcwq7VZo&t=37s,12,0,2019-04-12 23:42:11,
Check out this interview with former Deacon WR Alex Bachman!,https://www.reddit.com/r/wfu/comments/b89mpt/check_out_this_interview_with_former_deacon_wr/,7,0,2019-04-01 21:42:54, [https://studentunionsports.com/acc-football/interview-wake-forest-alex-bachman/hsillings](https://studentunionsports.com/acc-football/interview-wake-forest-alex-bachman/hsillings) 
Does anyone know when the transfer application is due?,https://www.reddit.com/r/wfu/comments/b7p7ze/does_anyone_know_when_the_transfer_application_is/,1,2,2019-03-31 15:58:09,"The website says that they begin reviewing applications on April 1st, but there’s no deadline given. I am working on my transfer application right now after getting on the waitlist last year, and I’m just not sure when to turn it in. Thanks! "
Message in a bottle for fellow wfu.misc readers...,https://www.reddit.com/r/wfu/comments/b2rnza/message_in_a_bottle_for_fellow_wfumisc_readers/,10,1,2019-03-19 02:22:54,"If any of my fellow wfu.misc fossils stumbles across this, hope everyone is doing good.  Shout out if you see this.

For the younger students, back in 1995 when dinosaurs still roamed the land and Al Gore was still trying to get the Internet off the ground, Wake’s main (only?) server hosted several wfu.* NNTP newsfeeds.  Several of us hung out in wfu.misc and chatted all the time about the usual things.  Just suffered a bit of nostalgia earlier today."
D in AP Calculus BC,https://www.reddit.com/r/wfu/comments/b2pwom/d_in_ap_calculus_bc/,6,3,2019-03-18 23:42:37,"Hi, I was admitted to wake forest back in November under ED1. I currently take 7 AP classes this year for a total of 17 by the end of high school. I have A’s in 2 classes, B’s in 4 classes, and unfortunately a 60 in Calculus BC. I am trying my best to pull it up, but realistically, the highest I will finish at will still be a 65 or 68 at most. I wrote the admissions department explaining my situation, getting tutoring, missing school due to migraine, and the person said rescinding is viewed on a case by case basis in the summer, but she did say that if a red flag were to rise, all that will happen is that they want me to come to wake forest for a “chat” on why I got the grade I got. How should I approach all of this? Thank you everyone!"
Summer Immersion Program,https://www.reddit.com/r/wfu/comments/avm2ok/summer_immersion_program/,1,1,2019-02-28 03:03:38,I got accepted to Wake Forest's summer program and was wondering if anyone here has ever attended/has any information on it. Do you need prior experience? I was looking at the biosciences and engineering program in particular but I'm scared that because I have no experience in robotics I'll feel like I'm behind. Anything would help!
"I'm a graduate student, and my cat has been missing for 3 days. I got two reports tonight that she was seen on campus. I wanted to share some photos of her to see if we could raise awareness. Please keep me updated if you see anything.",https://i.redd.it/bi5g1mc173d21.png,16,0,2019-01-28 03:55:25,
How is WFU for STEM?,https://www.reddit.com/r/wfu/comments/a9cq0y/how_is_wfu_for_stem/,3,5,2018-12-25 06:29:52,"With the kind of supplements it has, undergraduate research opportunities and small student to teacher ratio among other things I'm really attracted to WFU. However from what I saw online (well, on [niche.com](https://niche.com) to be exact) popular majors don't include much STEM stuff. So I was wondering, overall how is the quality of STEM education at WFU?

\[Among STEM I'm mainly interested in: Physics, Molecular Biology, Biomedical Engineering (It's offered at undergraduate level as well right?) and maybe CS\]"
Jared Birmingham Bowl Preview,https://www.reddit.com/r/BonaFideScrubs/comments/a8lyjl/cfb_bowl_games_2018_preview_jared_birmingham_bowl/,3,1,2018-12-22 16:27:11,
Clubs for the less 'frat' types?,https://www.reddit.com/r/wfu/comments/a51xue/clubs_for_the_less_frat_types/,7,1,2018-12-11 01:09:33,"Hi! I'm going to Wake next fall and was wondering about clubs that will give me an outlet to make some friends (and not be bored). What clubs might y'all suggest?

&#x200B;"
Wake Forest's Petros Chrysochos a Favorite for Tennis' Fall National Championships,https://www.crackedracquets.com/ita-fall-nationals-favorites-181106/,9,0,2018-11-06 18:42:36,
"My policy group is trying to see if the minimum wage is enough for students to help cover their basic living costs for university. Please take this survey, it only takes 5 minutes and is helping us create policy surrounding living wage for students! *Also, please share!*",https://www.reddit.com/r/wfu/comments/9tp3u4/my_policy_group_is_trying_to_see_if_the_minimum/,3,0,2018-11-02 23:04:42,"
[survey](https://unc.az1.qualtrics.com/jfe/form/SV_3fmCt9nXx7lIv5P)"
Matt Colburn a deserving star of Week 9,https://theathleteshub.org/2018/10/29/best-of-college-football-week-9/,9,1,2018-10-29 19:58:37,
Social scene outside of frats?,https://www.reddit.com/r/wfu/comments/9jx0zh/social_scene_outside_of_frats/,3,7,2018-09-29 14:06:34,"I'm applying to Wake in a little bit and was curious how the social scene was besides frats? Is basically everyone in a frat, and those who aren't are isolated? How big are parties? How often does stuff like that happen?"
Press F,https://i.redd.it/i4o579w7ppl11.jpg,23,1,2018-09-12 01:39:26,
Application submission time?,https://www.reddit.com/r/wfu/comments/9epy24/application_submission_time/,2,5,2018-09-10 18:53:10,"Hi everyone! I had my interview and it went really well! I had my SAT and it went... not as well! I'm torn between signing up for the SAT in October to improve a 1380, or simply submitting what I have. Is there a benefit to submitting my application earlier? I'm doing ED if that helps."
Safety on campus?,https://www.reddit.com/r/wfu/comments/9d24r6/safety_on_campus/,5,2,2018-09-05 02:21:51,"How safe is it on campus? I know it's relatively secluded, but how safe do you all feel while walking around, especially at night?
"
"Interactive map of polling places, electoral districts, and candidates for the 2018 midterm election November 6th",https://fiveham.github.io/NC-elections/all-districts?bounds=no36.157536so36.119049ea-80.232107we-80.319322&layer=house&pp,3,0,2018-08-07 10:07:57,
Interview Advice?,https://www.reddit.com/r/wfu/comments/951gdx/interview_advice/,5,4,2018-08-06 13:52:10,"Hi again! Stressed out senior here, wondering if there's any advice you all have for the interview. Is there anything that caught you by surprise, wish you had known before, etc. that's worth mentioning?"
Seeking Pro-Choice Volunteers,https://www.reddit.com/r/wfu/comments/94err0/seeking_prochoice_volunteers/,11,0,2018-08-04 00:03:19,"Hi all! If you are pro-choice and looking for a flexible volunteer gig, we could use your help! We currently are seeking volunteers able to assist in Raleigh, NC and Greensboro, NC.

Our group volunteers with a local abortion care provider to greet patients as they arrive and escort them into the facility, past protesters.

We are client focused, which means we do not engage with the protesters. Basically, this is a great gig for anyone who wants to do more direct access work on the abortion issue who also won't feel super compelled to just come to argue with protesters the entire time lol.

We are an incredibly easy to get involved with and FLEXIBLE volunteer group! While shift times are firm, we do NOT have commitment requirements or shift signup requirements. We simply ask for folks to come out and join us when they can and as often as they can handle.

We need help Monday - Saturday in the AM hours (between 8 AM - 11 AM typically).

If you are interested in getting involved just send us an email!

[ProChoiceVolunteers@gmail.com](mailto:ProChoiceVolunteers@gmail.com)"
Welcome WFU2022! What questions do you have?,https://www.reddit.com/r/wfu/comments/8zlxun/welcome_wfu2022_what_questions_do_you_have/,5,0,2018-07-17 15:10:51,"I thought this would be a nice way to welcome new students to the sub. I'm a professor on campus, so I can try to answer questions from that perspective, and hopefully other students will jump in to answer anything I can't."
English majors?,https://www.reddit.com/r/wfu/comments/8zmu0y/english_majors/,3,3,2018-07-17 16:53:27,"Hi! I'm a rising senior planning to ED to wake, and was wondering if any English majors here would be able to shed some light on their experience. How does it stack up compared to other highly selective unis? Any notable staff, things to know before jumping in? I want to teach high school English if it helps. Thank you!"
Is WFU gonna rescind my offer?,https://www.reddit.com/r/wfu/comments/8xzpdf/is_wfu_gonna_rescind_my_offer/,2,4,2018-07-11 13:46:01,"Hey y'all, I sat my IB exams in May 2018 and dropped from 33 pts to 27 pts, but not only that, I currently don't have my IB diploma due to unexpected circumstances with one of my HL subjects. I have already submitted for a remark, but I can only wait for the results of the remark.

So: Is WFU gonna rescind my offer? I've already emailed the admissions office about this, but it seems to be taking a little while for them to respond...

P.s. I am an international student.

UPDATE: I have a diploma now!!!!! "
Can we do chance me's on here?,https://www.reddit.com/r/wfu/comments/8xry0b/can_we_do_chance_mes_on_here/,3,10,2018-07-10 18:28:15,"I'm a rising senior hoping to ED to Wake this fall. In order to lower (or raise) my anxiety, I've wanted to see what actual Wake students think of my stats. I get the interview is super important, and was also wondering if there were any tips you guys could give. "
Wake Forest's Chrysochos Reflects on Men's Tennis' Historic Season and Winning Both the Team and Singles Title (Podcast),https://www.crackedracquets.com/cracked-interviews-podcast-chrysochos-1806012/,4,0,2018-06-12 19:33:30,
Wake Forest Captures First NCAA Tennis National Championship in Program History; Defeats Ohio State 4-2,https://www.crackedracquets.com/wake-forest-national-championship-2018/,19,0,2018-05-23 16:02:19,
"Already NCAA Team Champions, WFU's Petros Chrysochos & Borna Gojo Both Seeded for NCAA Tennis Singles Tournament",https://www.crackedracquets.com/men-ncaa-singles-sweet-16/,5,0,2018-05-23 17:25:48,
Wake Forest One Win Away From First National Title in NCAA Men's Team Tennis,https://www.crackedracquets.com/ohio-state-wake-forest-national-championship-2018/,12,0,2018-05-22 17:54:27,
Wake Forest Headed to NCAA Men’s Tennis Final Four,https://www.crackedracquets.com/ncaa-team-championships-elite-8-recap/,12,0,2018-05-21 13:15:23,
Deacs Take Care of Business-Advance to Sweet 16!!,https://www.crackedracquets.com/tickets-punched-to-winston-salem/,6,0,2018-05-15 02:13:37,
Top 5 Stories of Tennis NCAA Regular Season; Demon Deacons Dominate,https://www.crackedracquets.com/top-5-stories-from-end-ncaa-regular-seasons/,3,0,2018-05-03 17:10:42,
Our dearest condolences to Margaret Ann O’Sullivan's family and friends,https://www.reddit.com/r/wfu/comments/8dx5zc/our_dearest_condolences_to_margaret_ann/,12,1,2018-04-21 17:23:20,"I think President Hatch conveyed it well when he said, ""Maggie’s passing is a loss for the entire Wake Forest community. May her family and friends find comfort and support as they grieve her loss and remember her life."" 

In an email broadcasted to members of the Wake Forest community, we learned that Margaret Ann O'Sullivan passed away in Johnson Residence Hall last night. This is awful news to hear, especially so close to the end of the semester, and I hope we can remember her friends and family in our prayers.  "
WFU Fall 2018 classes are up on Coursicle (get notified when class opens up),https://www.coursicle.com/app/,2,0,2018-04-09 15:18:12,
