title,url,score,num_comments,created_date,selftext
Ecn 390 w/ Jac Heckelman,https://www.reddit.com/r/wfu/comments/kvuigm/ecn_390_w_jac_heckelman/,8,2,2021-01-12 16:07:55,"Hi, all. I was interested in ECN 390 (Public Choice) with Jac Heckelman. I've heard that his classes are way too tough, esp. that the tests are near-impossible, but I'm not sure how authentic these reviews are. Also, I'm not looking for a super-hard course since I've a heavy credit load. What do y'all think? Thanks so much!"
Can we sign up for classes using POI this semester?,https://www.reddit.com/r/wfu/comments/kuhxtt/can_we_sign_up_for_classes_using_poi_this_semester/,7,1,2021-01-10 16:50:43,is that a thing we can still do now?
Atmosphere around sports,https://www.reddit.com/r/wfu/comments/krglnq/atmosphere_around_sports/,13,12,2021-01-06 04:47:58,"I applied to Wake regular decision. I’m a huge sports fan and one of the benefits of Wake is the d1 sports in a power conference. However, I’ve heard there isn’t a ton of excitement surrounding the sports. I don’t expect everyone to want to go to every game like me but I want to know what the culture is like. Do most students really just go to the football tailgates and then leave without even stepping in the stadium? Is there a big student section? Do kids go to basketball games? How many students go to football and basketball games? I know the energy around sports isn’t as much as most big time schools or even like Boston College, but I was just wondering what your experience has been like and if sports could easily be a big part of my experience at Wake- or would I be on my own with these interests. Thanks!"
I ended up changing my ED2 To RD let’s see how this goes,https://www.reddit.com/r/wfu/comments/kogkjy/i_ended_up_changing_my_ed2_to_rd_lets_see_how/,8,8,2021-01-01 18:49:50,😄pain
Do I need a graphing calculator for ECN 150?,https://www.reddit.com/r/wfu/comments/kngfsn/do_i_need_a_graphing_calculator_for_ecn_150/,7,4,2020-12-31 02:05:39,Just to make sure because I have to buy batteries.
Clothes at Wake,https://www.reddit.com/r/wfu/comments/kmxd7l/clothes_at_wake/,8,16,2020-12-30 07:05:20,I am a current hs senior and considering wake. My biggest concern is that Wake is very formal. I heard that people dress up for class and wear suits and ties to football games. Is this true? Do some people dress casually?
ECN 391 (Koleman Strumpf),https://www.reddit.com/r/wfu/comments/kmto95/ecn_391_koleman_strumpf/,7,2,2020-12-30 03:10:08,"Hi, all. I am kind of interested in the said course, but I'm not sure how good Strumpf is. I stumbled on three reviews for him and two of them were terrible. Apparently, he's way too hard and not so congenial. What do you all think about him? Thanks so much."
WAKE FOREST BOWL GAME INFO & STATS,https://www.reddit.com/r/wfu/comments/kmfm0m/wake_forest_bowl_game_info_stats/,13,0,2020-12-29 14:39:24,"[https://fifthquarter.net/news/2020/12/29/what-to-know-about-each-bowl-game-match-up-dec-29-31/](https://fifthquarter.net/news/2020/12/29/what-to-know-about-each-bowl-game-match-up-dec-29-31/)

  The Demon Deacons have performed extremely well in the red zone, converting on 94.7% of their attempts (36-for-38). This was the highest percentage in the country among teams that had played at least seven games."
"How would y’all rank wake, from 1-10. 1 being I hate this place and 10 being this is the best campus in the world",https://www.reddit.com/r/wfu/comments/km1h1p/how_would_yall_rank_wake_from_110_1_being_i_hate/,10,6,2020-12-28 23:13:41,
"Do we 25ers who have been accpeted from ed1 have a chat room? Say, discord?",https://www.reddit.com/r/wfu/comments/kihvza/do_we_25ers_who_have_been_accpeted_from_ed1_have/,5,6,2020-12-23 00:24:32,"Hi there.

So I was accpeted from ed1, and I thought it would be nice to have a chat room to let us be familiar to each other. Can not wait to September next year lol. 

I would welcome 24ers to join us as well. Your experience about WFU would mean a lot to us lol."
Pre-med,https://www.reddit.com/r/wfu/comments/khy8tt/premed/,9,4,2020-12-22 04:40:47,"Hi, I'm a current freshman who did not plan on being premed originally but is seriously considering it  (taking the classes for now). Is wake generally good for premed? Do people at Wake get into good medical schools? Is wake well known and reputable amongst medical schools? Thanks everyone!"
I should probably be over this by now TBH.,https://www.reddit.com/r/wfu/comments/khtiax/i_should_probably_be_over_this_by_now_tbh/,16,1,2020-12-21 23:57:16,"&#x200B;

https://preview.redd.it/rkm319z6pm661.png?width=767&format=png&auto=webp&s=a56dd0d7ec9ef6e5b89d718084125dc338ed816e

||||
|:-|:-|:-|
||||"
Would anyone be willing to chat about WFU?,https://www.reddit.com/r/wfu/comments/khmsf6/would_anyone_be_willing_to_chat_about_wfu/,8,9,2020-12-21 18:17:26,"Hey everyone,

I plan on applying RD to WFU, and I am absolutely in love with their programs, however, due to some confusion (I'm an Intl applicant and got the timings a bit mixed up) I missed the deadline for some of the virtual sessions. I was hoping someone on this sub would be willing to just chat a bit over DMs or Discord or something or the other because I'd really like to find out from someone who attends WFU what their experience is like, and just learn a bit more about the uni itself."
Computer Science at Wake?,https://www.reddit.com/r/wfu/comments/kgjje0/computer_science_at_wake/,10,10,2020-12-20 00:12:00,"Hey all! So Wake Forest is a school close to the top of my list, and I was just wondering about their CS program. The biggest thing I’m worried about is landing a job after college. Wake Forest is a *fantastic* school, but I’m wondering if it’s strong on the CS side. Basically, if I choose to go to WF for CS will that put me at a disadvantage when I graduate and start job hunting?"
International Game Developers Association (virtual) meeting Thursday night - open to anyone interested in learning more about any aspect of a career in video games,https://www.reddit.com/r/wfu/comments/kensow/international_game_developers_association_virtual/,6,1,2020-12-17 02:06:26,"Hi all! 

We will have a virtual meeting for the Western NC IGDA group this Thursday night (December 17th) at 7:30 EST. Nich Mebane will be speaking about audio for your games. All of the details are on the links below. If you're not in the Facebook group right now you just need to apply and we'll get you added. You can also find the information on our MeetUp site -Looking forward to seeing you all there! (This is a free event) 

[https://www.facebook.com/groups/IGDAWesternNCGroup](https://www.facebook.com/groups/IGDAWesternNCGroup) 

[https://www.meetup.com/IGDA-Western-NC.../events/275176376/](https://www.meetup.com/IGDA-Western-NC.../events/275176376/)"
final grades,https://www.reddit.com/r/wfu/comments/keg091/final_grades/,9,1,2020-12-16 19:30:12,hi im a freshman and I'm wondering when are we usually able to view our grades on win. Ik they were due at 12 today but I'm not sure when they will be updated
Can someone please speak to the econ major at WFU?,https://www.reddit.com/r/wfu/comments/ke4gdy/can_someone_please_speak_to_the_econ_major_at_wfu/,3,5,2020-12-16 07:05:21,"Hey guys. I’m a high school student looking at Wake Forest and had some questions about the econ major. 

1 - how quant focused is it? I’m not bad at math but I don’t enjoy it and I’m not interested in getting a PhD in Econ. 

2 - does the liberal arts education interfere with your ability to take electives that an Econ major might want (statistics, programming etc)? 

3 - Are there plenty of research opportunities or do those go more to the business/STEM majors? 

4 - What are internships/job placements like for econ majors? 

Anything you guys could say would be greatly appreciated. Thank you!"
Admission,https://www.reddit.com/r/wfu/comments/kdzj9r/admission/,6,4,2020-12-16 01:41:43,How will we know when our admission decision is out? Will it be in the mail or online?
Is this true?,https://www.reddit.com/r/wfu/comments/kdqf21/is_this_true/,9,9,2020-12-15 17:46:04,"On a wake forest pdf about interviews. It says all students applying early decision must go through an interview, the pdf is from 2014. I made up my mind to apply ED 2 to wake after the interview deadline, does this mean I can’t apply Ed or will be rejected because I didn’t get the interview ? Has anyone applied ED 2 without an interview ?"
Parking cost at Deacon Station?,https://www.reddit.com/r/wfu/comments/kcsray/parking_cost_at_deacon_station/,7,2,2020-12-14 07:02:40,I’m living at Deacon Station next semester and plan on bringing my car. Anyone know what the cost is to park there? Is it free because it’s “off campus” or is it the regular $275 for Seniors?
Interview Questions,https://www.reddit.com/r/wfu/comments/kcqb7l/interview_questions/,6,7,2020-12-14 04:13:05,"Hello, I have an interview Tuesday, what kind of questions should i expect?"
Does anyone know when will result normally come out after the interview? (ED1),https://www.reddit.com/r/wfu/comments/kbqryw/does_anyone_know_when_will_result_normally_come/,2,2,2020-12-12 15:21:11,"FYI, the school offers me the interview opportunity which is on December 10."
How different is wake coming from the northeast?,https://www.reddit.com/r/wfu/comments/kbiij0/how_different_is_wake_coming_from_the_northeast/,7,7,2020-12-12 04:13:40,I am applying to wake from PA and some people tell me it is a big chance from the northeast. Is it that different?
Sociology at Wake,https://www.reddit.com/r/wfu/comments/kb73e0/sociology_at_wake/,8,10,2020-12-11 17:26:25,"Hi I’m applying to wake thinking of either majoring in English or sociology. If anyone has any information or experience with either department, any info would be great."
"Does anyone know how likely it is to be admitted if I couldn’t get an interview? Is there anything I can do to increase my chances? For context, I’m applying Ed2.",https://www.reddit.com/r/wfu/comments/kaoqmz/does_anyone_know_how_likely_it_is_to_be_admitted/,7,8,2020-12-10 21:31:40,
Business & Enterprise Management Majors—what's unique about the program?,https://www.reddit.com/r/wfu/comments/k7equi/business_enterprise_management_majorswhats_unique/,5,8,2020-12-05 20:10:08,Title. I'm applying to WFU and could use the help in writing my essay! Thanks!
Looking for Wake Forest fight song sheet music,https://www.reddit.com/r/wfu/comments/k61wvr/looking_for_wake_forest_fight_song_sheet_music/,10,3,2020-12-03 17:37:45," Hey Demon Deacons Fans!

I am working on a project to create a college marching medley inspired by the ""Big Ten Medley"". To do this I need sheet music/ scores of the fight song from each D1 school. If you are apart of the Wake Forest Marching Band or know someone who is, I would appreciate any help I can get.

This link is to a google doc that has every selection I have access to already. If you would like to share what I am looking for please comment there the link or message me directly if you wish for the music to only be sent to me and not to be made public.

[https://docs.google.com/document/d/1dlcIjsTJSlo6PhUwPyMqzVPMK-cw4oDqSJ2buiMQiUI/edit?usp=sharing](https://docs.google.com/document/d/1dlcIjsTJSlo6PhUwPyMqzVPMK-cw4oDqSJ2buiMQiUI/edit?usp=sharing)

Thanks and Go Deacs!"
Jeopardy! National College Championship,https://www.reddit.com/r/wfu/comments/k60kms/jeopardy_national_college_championship/,6,0,2020-12-03 16:34:12,"\*\*CALLING ALL UNDERGRAD STUDENTS\*\*

We are currently casting for an all-new competition featuring 15 colleges from across the country. The *Jeopardy! National College Championship* promises to be a competition like you've never seen before! 

If you're interested take the test **TODAY**! We'd love to have students from **Wake Forest University** represent the best and brightest on *Jeopardy*!

Link is below and if you have any questions feel free to message me. GOOD LUCK!

TEST: [https://www.jeopardy.com/be-on-j/national-college-championship](https://www.jeopardy.com/be-on-j/national-college-championship)

https://preview.redd.it/vl93anvv10361.jpg?width=600&format=pjpg&auto=webp&s=d9b104ec07f500693defaf02445c9846bb97f2cc"
"(VIDEO) This Mixtape was Posted today with MBB Signee Rob McCray...He looks Ridiculously Explosive, WOW!!",https://m.youtube.com/watch?v=BP0ujKuCjsA&list=PLplXkikOFQn4dAwpWkZpgJKez_FI2SPwC&index=203,4,0,2020-12-03 17:08:02,
Disc golf?,https://www.reddit.com/r/wfu/comments/k53spt/disc_golf/,16,0,2020-12-02 06:13:52,"Is anyone on here a member of the disc golf club at Wake?

I am a graduate student that recently got into the sport. I played the front nine last week and recently discovered there was a back nine. I think it is by the soccer fields near Reynolds Village but I haven't gone to investigate. 

The course doesn't seem to be frequently played, but I am a fan!"
Assistance with application essays.,https://www.reddit.com/r/wfu/comments/k4uu6e/assistance_with_application_essays/,0,4,2020-12-01 21:41:44,"Hello there Wake Forest Students! I was wondering if any of you kind people would be willing to read over my essays before I submit them in 7 hours. I would be forever indebted to you. I only have three 150 word essays. PM me and I can send you a word document or invite you to google docs. Thank you for your time, Go Deacs!"
Essays,https://www.reddit.com/r/wfu/comments/k3iscs/essays/,3,7,2020-11-29 22:25:46,"I was hoping someone could read my essays give me feedback. I know last year they were longer, this year they're 450 words total, I really need help so I'd truly appreciate it."
What do you love about Wake Forest specifically?,https://www.reddit.com/r/wfu/comments/k2672u/what_do_you_love_about_wake_forest_specifically/,8,8,2020-11-27 18:05:06,"I know why statistically wake forest is an awesome school, but I want to know someone’s personal experience. Please let me know what you love about Wake Forest."
why is your entire campus gated?,https://www.reddit.com/r/wfu/comments/k12nro/why_is_your_entire_campus_gated/,10,13,2020-11-25 22:36:20,"I've been to a ton of colleges around the country and they're always nice places to walk.  Was very suprised to see however that your campus was totally fenced off from the surrounding area which I've never seen anywhere else.  It didn't seem like the surrounding area was sketchy, so was very confused as to why the fence was there.

Any idea why the fence is there?"
Attention All Georgia Residents Attending College At WFU:,https://i.redd.it/z5yrh00svf161.jpg,18,1,2020-11-25 19:40:04,
SAGE SURRATT SCOUTING REPORT,https://www.reddit.com/r/wfu/comments/k0rnjk/sage_surratt_scouting_report/,10,0,2020-11-25 12:53:29,"Hi! I have done a breakdown of Sage Surratt. Where do you think he will get drafted? 

http://ninetynineyards.com/2020/11/25/sage-surratt-scouting-report-everything-you-need-to-know/"
Selling SPA 212 Materials,https://www.reddit.com/gallery/jzoi2w,0,5,2020-11-23 19:28:10,
I hate registration.,https://www.reddit.com/r/wfu/comments/jxpssq/i_hate_registration/,25,0,2020-11-20 14:18:27,That is all.
Calculus 1 teacher rec,https://www.reddit.com/r/wfu/comments/jx6ez2/calculus_1_teacher_rec/,5,4,2020-11-19 16:58:28,"Can anyone give me a good recommendation for a Calculus/Analytical Geom 1 teacher?

EDIT: I’m thinking about Rezapour - any info on him?"
Looking for a Nancy Susan Reynolds Scholar,https://www.reddit.com/r/wfu/comments/jx0zl7/looking_for_a_nancy_susan_reynolds_scholar/,10,1,2020-11-19 11:21:25,"Any Nancy Susan Reynolds Scholar out there, I had some questions. If you are a Nancy Susan Reynolds Scholar, or know someone who is one, please do inform me. I will DM you (or them). Thanks in advance."
Cute raccoon I followed outside Poteat,https://v.redd.it/7tcdjzw4xyz51,36,4,2020-11-18 09:33:09,
Top 10 List,https://www.reddit.com/r/wfu/comments/ju8aoh/top_10_list/,8,2,2020-11-14 20:05:28,"Hi! i am applying to wake ed ii and had a quick question about the top 10 list. do i need to put any explanation of each item i put on there, or just simply list out each one. I know there are some extra characters that i could explain, but it is necessary?"
Questions for current or former WFU students :),https://www.reddit.com/r/wfu/comments/jtmv3f/questions_for_current_or_former_wfu_students/,10,7,2020-11-13 19:51:19,"Hi! I'm planning on applying as a psych major to Wake Forest, and I was wondering if anyone can answer some questions I have about the school, dorms, food, and social life.

These questions are probably more relevant to Wake in 2019 as opposed to the COVID era, but I'd love to hear your perspective. Thanks!

&#x200B;

1. What are freshman dorms like (best and worst dorms)? Is there a lot of dorm camaraderie, and do people tend to form friend groups with their dorms?
2. What does the psych major look like? Do psych students tend to be as stressed as pre-med students (bio, chem, physics, engineering)?
3. Is there a huge divide between students in Greek life and students in regular dorms? What do parties look like for non-Greek kids?
4. How common are small, discussion-based classes? Are most of your classes large as a freshman?
5. What does social life/student life look like at Wake? Are there any weekly traditions that everyone tends to love? Do dorms host specific events, and what are some examples of these?
6. How is the food at Wake, and what are some of your favorite meal options?
7. What's the November-March weather situation--how cold does it get, and does the weather get depressing at any point?
8. (For anyone who graduated or is a senior) How easy was it to find a job after graduating? Do you feel prepared for the rest of your life, and is there anything you wish your high school self would have known?

Thank you so much! Much appreciated."
WFU vs UNC LoL,https://www.reddit.com/r/wfu/comments/jsxjiq/wfu_vs_unc_lol/,9,1,2020-11-12 16:20:57,Come support our Demon Deacons when they take on the Tarheels this Friday at 8pm at Summoners Rift! I will be trying to cast while learning the new s11 item updates! watch @ twitch.tv/wfu\_esports.
is admissions need blind for domestic applicants?,https://www.reddit.com/r/wfu/comments/jrwvav/is_admissions_need_blind_for_domestic_applicants/,7,2,2020-11-10 23:59:42,title
Survey of wfu students on who they are voting for in this election (wfu_ogb on insta),https://www.reddit.com/gallery/jnklle,21,0,2020-11-03 22:38:04,
"Sorry, this is an application question. If I apply to wfu right before the merit scholarship deadline, which I believe is in December, when will I know if I got in?",https://www.reddit.com/r/wfu/comments/jm3wqu/sorry_this_is_an_application_question_if_i_apply/,8,8,2020-11-01 15:19:18,"I have been searching the internet but I haven’t found a reliable answer. I’m trying to decide if I should apply early action for a different school. Thank you so much, Go Deacs!"
Wake Forest VS Syracuse LoL Stream.,https://www.reddit.com/r/wfu/comments/jkyae1/wake_forest_vs_syracuse_lol_stream/,14,2,2020-10-30 14:57:15,"Come support our Demon Deacon League of Legends players at 6pm EST tonight where we face off against Syracuse on Summoners Rift! The stream will be hosted by Deacons but anyone is welcome to watch!

[https://www.twitch.tv/wfu\_esports](https://www.twitch.tv/wfu_esports)"
Fundraiser for a good cause!,https://www.reddit.com/r/wfu/comments/jk22kj/fundraiser_for_a_good_cause/,15,7,2020-10-29 02:39:58,"I've had it. I relapsed again for the first time in 15 months. I ate Moe's three days ago. I went for the steak stack, but when they didn't have the shells (wtf?), I settled for a burrito (they ran out of rice, too). 

Effective immediately, I will be creating an OnlyFans where I eat chocolate bunnies in the shower. All proceeds will go towards the Moe's Buyout Fund. Please DM me for info or if you want to collab. 

&#x200B;

\#NoToMoes"
WFU vs. VT post match discussion,https://www.reddit.com/r/wfu/comments/jjhxyz/wfu_vs_vt_post_match_discussion/,6,2,2020-10-28 05:18:12,"1-2 VT. We only won one game cause they let us have it. Tune in friday for our game vs syracuse, where ill hopefully be casting."
Inspired by u/efdmbo,https://i.redd.it/c4i0lx6dkgv51.jpg,16,2,2020-10-26 15:33:12,
WFU league of legends esports versus Virginia Tech tonight at 8pm streamed live on twitch,https://www.reddit.com/r/wfu/comments/jfj4es/wfu_league_of_legends_esports_versus_virginia/,8,1,2020-10-21 18:55:03,"https://www.twitch.tv/wfu_esports

Come and hype up the team in chat ❤️"
Do I have a chance at receiving merit aid from WF?,https://www.reddit.com/r/wfu/comments/je811z/do_i_have_a_chance_at_receiving_merit_aid_from_wf/,9,9,2020-10-19 18:56:24,"I understand that not that many students receive merit aid, and that it’s very competitive. However, I just thought I’d create a post and ask since I’m not sure if I’d qualify.

Stats:
•SAT: 1540
•GPA: 4.57
•Coursework: 12 honors, 9 APs; AP Psych (5), AP World (5), APUSH (5), AP Chem (4), AP Lang (4), AP Comp Sci, AP Calc BC, AP Enviro, and AP Gov this year
•ECs: 3 jobs since sophomore yr, President of Spanish Club, study abroad, volunteer all 4 years, guitar for 10 years"
WFU 2025,https://www.reddit.com/r/wfu/comments/jdoem0/wfu_2025/,10,13,2020-10-18 21:10:46,"Hey y’all I’m a senior from upstate ny and I’m lowkey really interested in wake forest and I might apply ed2 if I don’t get into NYU for Ed1. 

I was wondering if y’all could tell me some stuff that I should know and if anybody knows anything ab poli sci/pre law over there plz lmk. 

Thank you"
>:),https://i.redd.it/uwu431wpart51.jpg,17,1,2020-10-18 01:30:07,
"Early Voting is from Thursday, Oct 15 - Saturday, Oct. 31, You CAN register or change your registration at early voting but NOT on election day. Students can register at home OR school. Here's everything you need to know. Be a voter!",https://www.reddit.com/r/wfu/comments/jb1sif/early_voting_is_from_thursday_oct_15_saturday_oct/,15,0,2020-10-14 14:33:29,"**From Thursday, Oct. 15th through Saturday, Oct. 31st you can vote at ANY early voting location in your county.** 

* Find the locations and times for your county at https://vt.ncsbe.gov/ossite/

**In NC, college students can register to vote at school OR home (your choice)**

* Info specific for college students: https://www.campusvoteproject.org/stateguides/North-Carolina

**You can register or change your registration at any early voting site in your county** 

* You will need to prove your residence with ID or a utility bill, paycheck, etc.  [Info is here](https://www.ncsbe.gov/registering/how-register/register-person-during-early-voting).  You *cannot* register or change your registration on election day.  

**Make a plan for when and where you're going to vote and put it on your calendar.**

* It is generally super convenient.  Some times and locations are more or less busy.  If you have the flexibility, avoid the first and last days and weekends.  Early in the day tends to be better.  If I find a wait time estimator I will add it here.  

**All races are important so make sure to vote the whole ballot!**

* Before you vote you can [check your sample ballot](https://vt.ncsbe.gov/RegLkup/) so you’re not surprised by anything when you get there.

**If you have a mail-in ballot**

* You can also hand deliver it to any [open early voting location in your county](https://vt.ncsbe.gov/ossite/).  Make sure you and your witness signed it and that your witness filled in their complete address!  You can also choose to vote early in person instead of handing in your ballot.  But don’t vote twice under any circumstances.  

**If you vote on election day, November 3rd**  

* Your polling place will be different. Find it here: https://vt.ncsbe.gov/RegLkup/

* On Election Day all polling places are open from 6:30 a.m. to 7:30 p.m.  Any voter in line at 7:30 p.m. will be able to vote. The busiest times tend to be early in the morning and just before the polls close. Avoid longer lines by voting at off-peak times.

**You do NOT need ID to vote in NC in 2020**

* If you present to vote and your name is not on the voter list for any reason, you have the right to cast a provisional ballot.

**You can vote from your car if you are at increased risk of Covid or are unable to enter the voting place without physical assistance due to age or disability**

* Read more about curbside voting here: https://www.ncsbe.gov/voting/help-voters-disabilities/curbside-voting  It is available at ALL early voting sites and all election day voting sites.

**PLEASE WEAR A MASK AND MAINTAIN SOCIAL DISTANCE!**  

* Remember, the people who are working there are citizens like you and me wanting to their part for our democracy.  Please do your part to protect them.  Read more about covid plans here: https://www.ncsbe.gov/voting/voting-and-coronavirus

**The State Board asks that all voters respect the right of others to participate in the election**. 

* Intimidating any voter is a crime. Voters who feel harassed or intimidated should notify an election official immediately.

**Still need more info?**  

* https://www.ncsbe.gov/voting"
"It’s official, Nathan O. Hatch is retiring.",https://www.reddit.com/r/wfu/comments/jahqoc/its_official_nathan_o_hatch_is_retiring/,19,2,2020-10-13 17:10:52,"An email was just sent out saying that good ol’ Natty O. will be retiring and out of office by June 30, 2021. Here’s the full email: https://pastebin.com/p3WiHy2Y"
Will there be a LoL viewing party at wake?,https://www.reddit.com/r/wfu/comments/j9izsu/will_there_be_a_lol_viewing_party_at_wake/,7,1,2020-10-12 02:55:52,"As an avid league of legends fan, I was wondering if there would be any event hosted by the WFU esports community."
