title,url,score,num_comments,created_date,selftext
Things to do Sunday 3/19?,https://www.reddit.com/r/wfu/comments/11v2wdl/things_to_do_sunday_319/,3,0,2023-03-18 22:27:52,"I will be visiting this Sunday from MA, arriving in the afternoon.

I would love to get a feel for the WFU college life, are there any campus events going on where I could stroll by or even check out? Any suggestions for spots where undergrads hang out?

TIA"
Roommates?,https://www.reddit.com/r/wfu/comments/11s9zd6/roommates/,2,7,2023-03-15 21:31:48,"What resources are out there for finding roommates? (Facebook groups, groupmes, etc.) For context I’m an incoming graduate student looking for another woman to split a two bed place with off campus."
Let’s grow this subreddit: r/teafriends,https://www.reddit.com/r/wfu/comments/11d35f1/lets_grow_this_subreddit_rteafriends/,4,2,2023-02-27 04:54:39,Been grinding Reddit and started a Reddit community with my friend for our startup. Love to see some fellow deacs to hop on r/teafriends or if you’re hella slick with Reddit love to chat about ways to really create a community wit it!
What are thoughts of our tea club on campus?,https://www.reddit.com/r/wfu/comments/11d31pz/what_are_thoughts_of_our_tea_club_on_campus/,3,0,2023-02-27 04:48:57,
I'm Hiring Wake Forest Students This Semester,https://www.reddit.com/r/wfu/comments/10jqza1/im_hiring_wake_forest_students_this_semester/,7,1,2023-01-23 23:28:32,"I own a bar/ brewery trivia company that recently started doing games in the Winston area. I'm looking for people to host games for us! We are adding new clients soon and are needing new hosts. All you have to do is show up and host for a little over an hour and get paid $50. It's a ton of fun and you usually get free beer. You can commit to as little as one night per week, or more if you'd like! If you'd like more information on the job or to apply, check out my website!

[https://www.notrocketsciencetrivia.com/become-a-host](https://www.notrocketsciencetrivia.com/become-a-host)"
Best Bars for Wake Forest Football Games?,https://www.reddit.com/r/wfu/comments/1088sv0/best_bars_for_wake_forest_football_games/,0,0,2023-01-10 12:36:52,"Hello all,

I am writing this post as I am wanting to gather some information as it pertains to best bars on campuses around the nation to create a website so college football fans know where the best bars are at for their favorite college football team.

Below are some questions I am looking for a response?

Best pregame bar before Wake Forest football games? Why is it the best pregame bar?

Best bar to watch Wake Forest football games? Why is it the best watch party bar?

Best postgame bar after Wake Forest football games? Why is it the best post game bar?

Any information is extremely helpful and appreciated. I can’t wait to see some of the responses.

Thank you"
Is WFU still doing that thing where you have to reapply to the Business School again as a finance major?,https://www.reddit.com/r/wfu/comments/zsy5l6/is_wfu_still_doing_that_thing_where_you_have_to/,1,5,2022-12-22 22:01:25,I have learning disabilities and I don’t want it to mess my chances up.
Hishgschool students,https://www.reddit.com/r/wfu/comments/zsc1j3/hishgschool_students/,3,4,2022-12-22 04:23:52,"Hi, I'm an international student who is interested in Wake Forest!

I am applying to Wake Forest and have a few questions regarding academics and student life/

1. Would you mind sharing your experience in Wake Forest with me. How is the town, atmosphere, people, etc
2. What is Wake Forest strong for in terms of academics?"
Wake Forest Financial Aid email,https://www.reddit.com/r/wfu/comments/zpj1nh/wake_forest_financial_aid_email/,4,5,2022-12-19 05:29:44,"Hi did anyone receive an email from Wake asking to confirm that you will not be applying for “Institutional based financial aid?” I sent in my ED2 app a few days ago, they look at FA so soon? Wouldn’t they want to decide if they’re gonna accept or reject me before we get to aid lol"
For those who have been accepted for ED1 at Wake can you share just your GPA and your SAT score? Thank you…,https://www.reddit.com/r/wfu/comments/zo2rlk/for_those_who_have_been_accepted_for_ed1_at_wake/,3,10,2022-12-17 09:35:48,
Basketball Season Is Here! Join the Atlantic Coast Conference Discord Server!,https://discord.gg/Cy4EjzB4Sp,0,0,2022-12-03 17:15:42,
Free Ticket to SC @ WF MBB,https://www.reddit.com/r/wfu/comments/z0g0uf/free_ticket_to_sc_wf_mbb/,5,0,2022-11-20 21:34:41,"Hey all, I have season tickets and won't be able to make this week's game. If you'd like the ticket and can definitely go, just send me a DM. Section 121."
Does Deacon Hill sell out?,https://www.reddit.com/r/wfu/comments/ytgz8h/does_deacon_hill_sell_out/,2,1,2022-11-12 20:06:53,Im planning on going to my first game tonight against Carolina. I'm planning on trying to get a general admission Deacon Hill ticket as the actual seat tickets are a bit pricey. I couldnt find Deacon Hill tickets online does that mean their sold out or just sold through GA?
Apartment Sublease- perfect for transfer or other students!,https://www.reddit.com/r/wfu/comments/yjgz78/apartment_sublease_perfect_for_transfer_or_other/,2,0,2022-11-01 18:34:47,"2 bed 2 bath apartment on the first floor, comes with appliances in kitchen, screen in porch, and plenty of room. Pets welcome. Apartment complex has free parking and no limit on spaces to use. Complex also has a swimming pool, small dog park, and laundry facilities to use, as well as in-unit w/d hookups. 

Friendly maintenance staff, recently fixed the heater so that will be in great condition for the winter. Stays cool during the summer too. 

Great location, not too far from the highway but not too close either, near Wake Forest university and less than 10 minutes from downtown WS. 

You will rent at current rate of $1165/month until the end of May, other updated rooms at this complex are currently going for over $1300/month so this is a good deal. 

Found work closer to Greensboro and that is why we are moving out. Take advantage of this deal and PM me with your interest!

Here is the link to the floor plan and information: https://brandemereapts.com/floorplans/jefferson/"
Bangs trimming help,https://www.reddit.com/r/wfu/comments/yj91fj/bangs_trimming_help/,2,0,2022-11-01 13:42:12,Hi all. Tried cutting my bangs by myself and messed it up pretty bad. Any student out there that can help fix this disaster? (Haircuts are a bit pricey so I would love the help if possible)
UNC School Systems Discord Server,https://www.reddit.com/r/wfu/comments/ye3pew/unc_school_systems_discord_server/,1,0,2022-10-26 17:25:39,"Hey so I know you guys aren’t in the UNC school system, but I made a server where students from across the state are joining and [thought it would be cool if you guys could join too!](https://discord.gg/sdZDJhtaWv) Come chat and make friends!"
"Does Wake Forest offer any Artificial Intelligence programs, or anything related to information sciences?",https://www.reddit.com/r/wfu/comments/ycpftn/does_wake_forest_offer_any_artificial/,4,4,2022-10-24 23:06:24,"Also if there are any cool computer science opportunities at Wake, pls mention them below. Thanks!"
Does Greek rank matter?,https://www.reddit.com/r/wfu/comments/xzf534/does_greek_rank_matter/,0,4,2022-10-09 07:08:27,I’m asking because I meet many girls from “bottom-tier” sororities but they are really nice.
Former Mens demon deacons soccer player Calvin Harris scores in Leagues Cup play tonight for FC Cincinnati against Chivas of Mexico,https://v.redd.it/18uz42f33cp91,9,0,2022-09-22 03:59:54,
Football Gameday Advice,https://www.reddit.com/r/wfu/comments/xj9tuq/football_gameday_advice/,7,8,2022-09-20 14:09:13,"Hey y'all, Clemson fan living in the Triad finally going to catch a Wake game this weekend, have some questions. 

I saw in a post from a few years back saying to park by Putters/Elizabeth's, is that still the move? 

Is there a time I should probably try to get there by to avoid getting into too much traffic? I usually like to be way early and grab a drink and some food nearby, but noon game probably makes that a little trickier."
Prospective Student,https://www.reddit.com/r/wfu/comments/xhjcb9/prospective_student/,6,4,2022-09-18 15:16:59,"Hello everyone! I have just completed my application to Wake Forest and I cannot wait for a decision! I have a few questions regarding the application process and student life.

1. When submitting my transcript, does my counselor submit it to Wake using the Common App or do I submit it using Parchment?

2. How is student life? How are the dorms? What is the difficulty of the STEM classes? What is the proximity of stores like Walmart or Target. Is shipping items to campus reliable?

3. If you don’t mind, what were your stats that for you in? 

4. Lastly, for out of state students, what is the best transportation plan by plane to Wake? Do I Uber to campus from the airport or is there a bus, and which airport so you fly from? 

Thanks so much everyone!"
FHS will be on Campus this Monday,https://i.redd.it/ujv4ant3h3n91.jpg,10,1,2022-09-10 20:55:01,
WiFi in south dorms,https://www.reddit.com/r/wfu/comments/xa1u57/wifi_in_south_dorms/,1,1,2022-09-09 17:47:45,Anyone running a gaming console like Nintendo Switch on the dorm WiFi? Which network are you using? When I connect the switch to wfuMyDevices it says it requires a step but then returns a 404. What’s the trick?
I am asking every cfb top 25 team to add 1 feature to my rankings board! Comment away!,https://i.redd.it/iqr5sen28hm91.jpg,6,0,2022-09-07 18:04:00,
Hartman’s back baby,https://www.reddit.com/r/wfu/comments/x7ilzl/hartmans_back_baby/,18,0,2022-09-06 18:56:20,[https://twitter.com/PeteThamel/status/1567223868888154114?s=20&t=4PTpx7Dpo3Flr373wal-h](https://twitter.com/PeteThamel/status/1567223868888154114?s=20&t=4PTpx7Dpo3Flr373wal-h)
"A.T Perry doesn’t get the respect that fellow ACC receiver Josh Downs gets, but he is every bit as dynamic",https://mipscouting.com/2023-ncaa-football-player-watchlist-acc-atlantic/,9,0,2022-08-24 12:53:25,
Transfer Question,https://www.reddit.com/r/wfu/comments/ww7rse/transfer_question/,6,1,2022-08-24 02:45:40,"Hey, I’m interested in applying to Wake as a transfer— I want to know if anyone on this sub has done it with poor high school grades. I had a 3.3 weighted and 24 ACT. I’ve only been in college for one semester and got a 3.89 and hopefully I keep it up this following semester. I joined a scholars program at my school (UTK) and am gonna join a few clubs and possibly get a leadership position. I honestly don’t like my chances but I’ll apply anyway. Any input would be appreciated! Thank you!"
I'm Hiring Wake Forest Students for the Fall Semester,https://www.reddit.com/r/wfu/comments/ww3y4x/im_hiring_wake_forest_students_for_the_fall/,9,0,2022-08-23 23:49:03,"I own a bar/ brewery trivia company in the Winston Salem area. I'm looking for people to host games for us! We are adding new clients soon and are needing new hosts. All you have to do is show up and host for a little over an hour and get paid $50. It's a ton of fun and you usually get free beer. You can commit to as little as one night per week, or more if you'd like! If you'd like more information on the job or to apply, check out my website!

[https://www.notrocketsciencetrivia.com/become-a-host](https://www.notrocketsciencetrivia.com/become-a-host)"
Hey Wake Fans! Joi the ACC Discord to Interact witb fans from across the conference!,https://discord.gg/jXec3bYr,1,0,2022-08-22 20:15:31,
"We know the Deacs had their best season in over a decade last year, but can they come back strong again this year?",https://mipscouting.com/college-football-is-back-previewing-top-25/,5,1,2022-08-19 12:21:59,
"ACC CHAMPIONSHIP ODDS, PICKS AND PREDICTIONS – COLLEGE FOOTBALL BETTING PREVIEW",https://www.reddit.com/r/wfu/comments/wruzsv/acc_championship_odds_picks_and_predictions/,5,0,2022-08-18 21:12:44,[https://blog.ownersbox.com/college/acc-championship-odds-picks-and-predictions-college-football-betting-preview/](https://blog.ownersbox.com/college/acc-championship-odds-picks-and-predictions-college-football-betting-preview/)
We are officially a football school (#22),https://apnews.com/hub/ap-top-25-college-football-poll,24,1,2022-08-15 16:05:55,
[Adelson] Wake Forest just announced starting QB Sam Hartman is out for an extended period of time for a non-football related medical condition. Praying everything is OK first and foremost.,/r/CFB/comments/wkvuge/adelson_wake_forest_just_announced_starting_qb/,11,1,2022-08-10 14:10:41,
Econ 150 Textbook,https://www.reddit.com/r/wfu/comments/whkmux/econ_150_textbook/,0,3,2022-08-06 09:53:50,"Hi, I was planning on taking Econ 150 with Calabrese but no longer am. I bought the Microeconomics book for the class and am now selling it (ISBN: 9781264364763). It’s fully new and unused.

DM me if you’re interested or know someone who is, thanks."
Wake students during registration,https://v.redd.it/gu1b0ld4g7a91,25,5,2022-07-07 20:21:57,
FRH 200 Level Advice,https://www.reddit.com/r/wfu/comments/vtms5i/frh_200_level_advice/,3,8,2022-07-07 16:34:59,Incoming freshman here! I tested into the 200s level of French through AP credit and I'm waiting until phase II to schedule my French class. I tried finding info on different professors and classes but couldn't find anything at all. Have you guys heard anything of note about different 200s level French classes/professors that might help me choose mine? Thanks!
Question,https://www.reddit.com/r/wfu/comments/vrbwd5/question/,2,3,2022-07-04 16:56:41,"I’m in an incoming freshman and had two majors in mind when applying which were biochem and computer science, with biochem being my top choice. Registration for classes begins in a few days and I ultimately decided to pursue Computer Science. Does anybody know the classes I should take my first semester for computer science?"
Would ECN205 be challenging for freshman?,https://www.reddit.com/r/wfu/comments/vqfh4c/would_ecn205_be_challenging_for_freshman/,5,8,2022-07-03 11:24:36,"Hey y’all, i’m an incoming freshman to wake and planning for registration now. I’m currently deciding between ECN150 and ECN205 to take in my first semester. I just had an advising session and was suggested to do 205 since I have APs for micro&macro. However I did both exams in grade 11 and that’s more than a year ago, i’m afraid these knowledges had gone unfamiliar and therefore i might not keep up in 205. So which econ course should I take in terms of difficulty, workload, gpa, etc? Appreciating for all suggestions!"
Help for course selection!,https://www.reddit.com/r/wfu/comments/vq1jj3/help_for_course_selection/,3,6,2022-07-02 21:21:48,"Hey y’all, I’m an incoming freshman to Wake and I’m planning on majoring in finance. I’m looking for help on what courses I should take my first year. Thank you!"
psych on pre med track courses,https://www.reddit.com/r/wfu/comments/ve4qjt/psych_on_pre_med_track_courses/,2,7,2022-06-17 04:36:02,"hello, i am an incoming member of the 26 class and i’m currently planning on studying psych for pre med ? i was wondering if anyone could recommend the courses to take on this track freshman year, i had my advising call and they were basically no help at all. also any professor recommendations would be greatly appreciated :)"
climbing walls,https://www.reddit.com/r/wfu/comments/vccqvk/climbing_walls/,2,2,2022-06-14 20:27:37,are the bouldering walls open to the public? how much is a membership if so?
Cars on campus?,https://www.reddit.com/r/wfu/comments/vc3v3x/cars_on_campus/,1,4,2022-06-14 13:46:08,"Hey guys! I’m an incoming freshman and I’m wondering if bringing a car on campus would be a smart idea. The flexibility having a car would bring would be nice, but if parking is super expensive and there are barely any spots, I don’t think it would be worth it. Any insight would be greatly appreciated!"
"Can you suggest a place to eat around campus that has good food? My daughter and I will be going on campus tours next week. Would love some good recs, thanks!",https://www.reddit.com/r/wfu/comments/v4vzvr/can_you_suggest_a_place_to_eat_around_campus_that/,7,9,2022-06-04 19:19:38,
Incoming freshman. What's the soonest I can declare a major?,https://www.reddit.com/r/wfu/comments/v0sm2f/incoming_freshman_whats_the_soonest_i_can_declare/,3,2,2022-05-30 04:58:13," I have read that at Wake Forest you can declare a major in the spring of  sophomore year. However, some things also say you can declare after 40  hours. I am considering a biophysics major with a minor in French. In  high school I did a lot of AP classes and I will coming to Wake with a  fair amount of credits. Can I declare my major as soon as I get 40  hours, or do I have to wait until sophomore year? Do high school credits  even count towards the 40 hours required to register?"
Double Majoring?,https://www.reddit.com/r/wfu/comments/uuafzk/double_majoring/,6,8,2022-05-20 23:21:26,"I’m a prospective Applicant for the 2023 cycle. I’m interested in potentially double majoring in Comp Sci and Mathematical statistics or economics. Is this possible?

What are some other common double majors with a Computer Science major or do people usually not double major when completing a Computer Science degree?"
Should next year’s WFU commencement add a parent/guest tunnel after the faculty tunnel for grads to walk through?,https://www.reddit.com/r/wfu/comments/uum1xn/should_next_years_wfu_commencement_add_a/,0,0,2022-05-21 12:25:20,"

[View Poll](https://www.reddit.com/poll/uum1xn)"
Looking for housing - looking to move in 5/27/2022,https://www.reddit.com/r/wfu/comments/urue75/looking_for_housing_looking_to_move_in_5272022/,5,0,2022-05-17 19:35:52,"Hi! I’m Dylan, I’m 22, I’m moving to Winston Salem from May to December for my co-op at Collins Aerospace. I have a dog, he’s been through obedience training, he’s well trained.   He’s a very sweet dog. I’m looking for housing, if anyone is looking for a roommate or someone to cover their lease for 6 months that would be greatly appreciated.   I was told the job was remote, but then they said it was going to be in person instead.  Thank you!"
"Help!!! Due to family emergencies, can’t go to the summer school at WFU. But already applied for housing and meal plan. The lady from office of residence life tells me I have to pay 2000$ even I can’t go. Tell me what to do",https://www.reddit.com/r/wfu/comments/umqlhm/help_due_to_family_emergencies_cant_go_to_the/,4,5,2022-05-10 19:27:43,
Truist Field,https://www.reddit.com/r/wfu/comments/ul9q37/truist_field/,2,1,2022-05-08 19:55:10,"

Hello, we are coming from SC to see the Paul McCartney concert in two weeks. Are vaccination cards needed to get into the show? Also, we will be on the hill and were wondering if we could bring blankets or even foldable chairs to sit. TIA."
Cheering From the Cheap Seats Ep. 19: Wake Forest Baseball Review,https://www.reddit.com/r/wfu/comments/ub0o80/cheering_from_the_cheap_seats_ep_19_wake_forest/,7,0,2022-04-24 18:13:23,"Hi all! My buddy and I run our own sports-themed podcast where we spend some episodes rating and reviewing our experiences at sporting events we attend. We just recently released a new episode where we rate and review our experience at our first ever college baseball game at Wake Forest baseball! We would really appreciate anyone willing to give us a listen and some feedback. I will leave a link below where y'all can find our audio. Thanks everyone and keep cheering 😊

https://pod.link/1576845310"
urgently wanna speak to a WFU student!,https://www.reddit.com/r/wfu/comments/u7umzl/urgently_wanna_speak_to_a_wfu_student/,3,17,2022-04-20 11:47:48,"Hi, I’m from Delhi, India and was recently committed to a communications program for undergrad at WFU! Looking to explore other majors as well! Most probably gonna commit 

I wanted to speak to a current student about the lack of diversity, curriculum, social scene etc. would really appreciate if someone would pm me so we can discuss :)"
university of washington vs wfu,https://www.reddit.com/r/wfu/comments/u3wnah/university_of_washington_vs_wfu/,4,7,2022-04-15 01:26:44," 

I recently got admitted into UW but not into foster school of business. I also got into wfu but I can't apply to the business school until end of sophomore year, so admission isn't guaranteed. I was wondering if anyone has opinions on which I should attend considering that I have to apply to the business school of the college once I am already in college. I've heard some bad things about uw's competitive major system and wfu's business acceptance rate is kinda unknown so if anyone has any first-hand experiences pls comment them down below. Tuition is the same price for both schools btw.

Thanks."
Being Black at Wake,https://www.reddit.com/r/wfu/comments/typkln/being_black_at_wake/,14,5,2022-04-07 23:16:27,I was recently admitted to an MA program at WFU and I’m just curious if any poc could speak to their experience at the school/in Winston Salem? I know it’s predominantly white and NC is on the conservative side. Are there any dynamics I should be aware of or clubs/professors/neighborhoods/etc I should avoid? Anything you wish you knew before coming to the school/city?
Wake Forest Business school,https://www.reddit.com/r/wfu/comments/tyse8j/wake_forest_business_school/,4,21,2022-04-08 01:44:03,"Hey guys, I was recently admitted to Wake Forest and I have a few questions about their business school. I read online that those that want to to study a business major must apply around their sophomore year (correct me if I’m wrong) and admissions is not guaranteed. How is the application process to their business school like? What are the prerequisites to study business like and how hard are those classes? What would happen if I wasn’t accepted to their business school but still wanted to study finance (my intended major). Thanks!"
How do Wake's food + dorm conditions compare to William and Mary?,https://www.reddit.com/r/wfu/comments/tyebwp/how_do_wakes_food_dorm_conditions_compare_to/,5,6,2022-04-07 14:31:00,"I am a high school senior deciding between Wake and W&M and it is the hardest decision I have ever had to make, especially because the academics and overall feel of the two schools are so similar. One major downside to W&M is the food and dorm conditions, so I was wondering if people generally have anything negative to say about those aspects of Wake Forest. 

I'm touring Wake in a few weeks, but the tour will not take us inside buildings and other facilities, so I won't get to see firsthand for myself. Any insight is appreciated! :)"
Graduate Student Housing??,https://www.reddit.com/r/wfu/comments/tw7ytq/graduate_student_housing/,5,7,2022-04-04 17:37:49,Does anyone know any good apartments options for graduate students?
WF vs BU vs UGA,https://www.reddit.com/r/wfu/comments/tvoq2r/wf_vs_bu_vs_uga/,5,4,2022-04-04 00:42:39,"Got accepted into these three schools, and I am having a hard time picking between these three. WF is nice because it has a very good reputation and I like that it seems to be a bit more personalized than BU and UGA. BU is nice because my dad went there and he liked it a lot and it seems to be more diverse. UGA is nice because they have a good business school and it’s cheap although my parents are paying my tuition. Right now, I’m kind of leaning WF, but I don’t know how the business school  is. Any thoughts and options? Also, could I get into investment banking after graduation at Wake? Sorry for the long post."
Placing a small WF at 1515 1775 in r/place if you could help make a box with us,https://www.reddit.com/r/wfu/comments/tvhdyn/placing_a_small_wf_at_1515_1775_in_rplace_if_you/,9,6,2022-04-03 19:23:18,
WF Logo,https://www.reddit.com/r/wfu/comments/tvnh3j/wf_logo/,3,1,2022-04-03 23:41:25,"Do you think it is possible to create a WF logo by the ACC teams around (282,1640) on r/place ???"
ACC r/place Alliance Discord,https://www.reddit.com/r/wfu/comments/tury8z/acc_rplace_alliance_discord/,7,0,2022-04-02 20:08:44,"Hey guys, I come in peace from Virginia Tech. There is now an ACC alliance discord server for collaborating with schools from our conference. Feel free to join and work with us!

Link: [https://discord.gg/b3M5mZBre5](https://discord.gg/b3M5mZBre5)"
"WFU vs BU, help me pick",https://www.reddit.com/r/wfu/comments/tuqrhk/wfu_vs_bu_help_me_pick/,4,25,2022-04-02 19:16:25,"Right now my top two are BU/WFU but I am struggling choosing between the two.

BU has a better environment in my opinion. College town, diverse student body, bigger school which I think I'd like, and easy to switch majors

My biggest con are the grade deflation rumors that I've heard

**WFU:** perhaps a better business program, open-curriculum, better campus, small class sizes which may make class quality better

cons: no diversity (predominantly white), location is meh not much to go and see

I also got admitted into UW (not into my major though), Villanova and Santa clara.

&#x200B;

Let me know if you have any recommendations or opinions, would be really helpful. Thanks."
Scholarships,https://www.reddit.com/r/wfu/comments/tqnfh8/scholarships/,4,2,2022-03-29 00:28:52,Hey I recently was admitted to Wake Forest but have no news on merit scholarships. If we were to get one would they have come out with our decisions or will we be notified of it on a later date?
