title,url,score,num_comments,created_date,selftext
Can I buy tickets in person for the Boston College hockey/basketball games?,https://www.reddit.com/r/bostoncollege/comments/18yk6nv/can_i_buy_tickets_in_person_for_the_boston/,14,7,2024-01-04 18:32:52,
Any volunteering opportunities for senior last semester? Or any entrepreneurial stuffs that I could be involved with?,https://www.reddit.com/r/bostoncollege/comments/18y7cso/any_volunteering_opportunities_for_senior_last/,1,2,2024-01-04 07:29:19,"Trying to put something on my schedule when my classes are less loaded, trying to give back before I head off."
looking for name of old (2019) english lit. professor,https://www.reddit.com/r/bostoncollege/comments/18y54ad/looking_for_name_of_old_2019_english_lit_professor/,1,2,2024-01-04 05:16:13,"I was wondering if anyone on here knows the name of a professor of english literature (I think that was the course name) in roughly 2018 or 19 who had a phd from mit and used to work for the cia.  I loved talking to him and would like to reach out again, but unfortunately our email addresses are deleted a few years after graduating with no option to setup a forwarding address for no good reason at all."
100% Not Supplement Help,https://www.reddit.com/r/bostoncollege/comments/18w6vuw/100_not_supplement_help/,3,3,2024-01-01 21:12:45,"If someone were to be in need of a quick review of an essay, that is definitely not for application purposes where might they look and/or would someone on here have those capabilities? (asking for a friend) (totally random) (not an admissions question)"
Latin diploma,https://www.reddit.com/r/bostoncollege/comments/18v57wh/latin_diploma/,6,4,2023-12-31 10:38:50,"Hi all,

As a graduate student in CSOM, are all diplomas issued by BC issued in Latin? Or is it only certain schools/majors?

Thank you all in advance"
Pre-Med/Psych at BC,https://www.reddit.com/r/bostoncollege/comments/18u318p/premedpsych_at_bc/,7,5,2023-12-30 01:14:09,"Prospective BC student here! For anyone pre-med at BC, how was your experience getting clinical experience and having access to any hospitals? Also, for anyone who is a psych major, could you easily participate in research on something related to human behavior? Thanks!"
When can grades be seen if I missed the course evaluation deadline?,https://www.reddit.com/r/bostoncollege/comments/18o8meh/when_can_grades_be_seen_if_i_missed_the_course/,5,5,2023-12-22 06:39:22,
Do teachers round up grades in CSOM,https://www.reddit.com/r/bostoncollege/comments/18o2gr6/do_teachers_round_up_grades_in_csom/,5,2,2023-12-22 00:58:18,
Looking for a specific bio textbook,https://www.reddit.com/r/bostoncollege/comments/18ni103/looking_for_a_specific_bio_textbook/,2,1,2023-12-21 08:12:52,"Can someone give me a list of the textbooks that were used for Molecules and Cells between 2015 and 2020? I am looking for a specific textbook that was used, all I can remember about it was that there was a graph near the beginning which displayed mating data for sea lions or walruses. Thanks!"
Can you switch the school when accepted?,https://www.reddit.com/r/bostoncollege/comments/18mb4mb/can_you_switch_the_school_when_accepted/,5,9,2023-12-19 20:07:17,So I wondered if I applied for lets say the Lynch School of Education can I switch to the Carol School once I get accepted. 
comp sci undergrad looking at bc mba stem-track,https://www.reddit.com/r/bostoncollege/comments/18m8at6/comp_sci_undergrad_looking_at_bc_mba_stemtrack/,6,4,2023-12-19 18:09:16,what are the odds i get accepted to bc for next fall for mba after i graduate from undergrad this upcoming spring? are there actually undergrads that get accepted to bc?
Largest Data Science Hackathon at Georgia Tech,https://www.reddit.com/r/bostoncollege/comments/18kbq07/largest_data_science_hackathon_at_georgia_tech/,5,0,2023-12-17 07:11:30,"The largest data science hackathon in USA is back and we're now accepting applications!!

Data Science @ Georgia Tech is hosting Hacklytics 2024 from \***Feb 9 to 11**\* on Georgia Tech campus for a 7th year running. We have something for everyone - mentorship and workshops for beginners, big companies like **\*Amazon, Google, DE Shaw, Microsoft, Intel, John Deere, Capital One and NSA**\* for job-hunters, VCs and investors for entrepreneurs (in fact, the winner of the hackathon will get a $25000 investment to build a company!), not to mention over **$80,000 in prizes across the spectrum**.

But this year is special because we're offering **travel reimbursements** too! Yes, you read it right - if you live far away, we're reimbursing travel to come down to Georgia Tech so send this to your friends across the country too!

It's going to be 36 hours packed with sponsor fairs, workshops, fun activities, some delicious food and a lot more - trust me, you don't want to miss out!

So there's only one thing left for you to do - apply on our website [hacklytics.io](https://hacklytics.io/)! If you have any doubts or questions, you can always reach out to us at [info@hacklytics.io](mailto:info@hacklytics.io) and we'll be happy to help out."
Applying as a Transfer,https://www.reddit.com/r/bostoncollege/comments/18j1g8c/applying_as_a_transfer/,3,2,2023-12-15 14:34:09,I'm considering to apply to BC as a Fall 2024 transfer(currently a freshman) and I was wondering if anyone is willing to give me some advice and help guide me through the process. I'm currently at a state college and in the Business School there. Any feedback would help and would be most appreciated.
Do you pay extra if you take a 6th course?,https://www.reddit.com/r/bostoncollege/comments/18ingyp/do_you_pay_extra_if_you_take_a_6th_course/,10,12,2023-12-15 00:42:54,"I'm thinking of taking a 6th course next semester and I am a bit confused as to whether I would have to pay additionally for the 3 credits. For context, I am sophomore double majoring in CSON and MCAS and the course will be in MCAS. I also do not quality for financial aid, but my family doesn't live  too comfortably either. "
How supportive is the Boston College alumni network?,https://www.reddit.com/r/bostoncollege/comments/18hmt0a/how_supportive_is_the_boston_college_alumni/,28,13,2023-12-13 17:58:37,"When it comes to networking, coaching, finding jobs etc"
Hockey jerseys,https://www.reddit.com/r/bostoncollege/comments/18gczyt/hockey_jerseys/,10,0,2023-12-12 03:58:39,"Hi, not sure where else to ask this but I saw some people wearing the new BC hockey jerseys with the names on the back. I can’t find it anywhere online and was wondering where to get them. Thanks"
Four Years Guaranteed Housing???,https://www.reddit.com/gallery/18d9bd0,32,24,2023-12-07 23:52:31,"Hi! I was recently accepted ED 1 (woohoo!), and I saw that was assigned 4 years of guaranteed undergrad on-campus housing. Upon visiting the website, it says that this is only for nursing students (I’m not in the nursing school), student athletes (nope) and presidential scholars (!!!). Could this mean what I think it means?"
Admitted Students Merch,https://www.reddit.com/r/bostoncollege/comments/18ciaql/admitted_students_merch/,2,19,2023-12-07 00:05:37,Random question. I just got admitted and was wondering what swag or free stuff do I get in the mail from BC?
ED 1 Acceptance,https://www.reddit.com/r/bostoncollege/comments/18bqrxg/ed_1_acceptance/,17,17,2023-12-06 00:12:45,Just got accepted to BC!!! I'm so excited I literally can't process anything. Congrats to everyone else who got in I can't wait for next year
ED Decision time,https://www.reddit.com/r/bostoncollege/comments/18bemr0/ed_decision_time/,17,28,2023-12-05 15:37:59,"If I understand right, they release decision letters today. Does anyone know what time?"
mid year report request?,https://www.reddit.com/r/bostoncollege/comments/18b2azz/mid_year_report_request/,2,1,2023-12-05 03:13:02,does bc ask for final and/or mid-year senior grades after being accepted?
"Seeking Feedback on ""Internship in Applied Analytics"" Course",https://www.reddit.com/r/bostoncollege/comments/18b53o7/seeking_feedback_on_internship_in_applied/,1,0,2023-12-05 05:46:07,"Hey BC community! 👋 I'm currently considering enrolling in the ""Internship in Applied Analytics"" course as a graduate student. Can anyone who has taken this course share their experience? How did you find the class overall? Any insights or tips for someone considering this course?

Thanks in advance. 

📚 #BCGradStudents #AppliedAnalytics #CourseFeedback"
Just got accepted into BC through QuestBridge. How's the chemistry major for those taking it?,https://www.reddit.com/r/bostoncollege/comments/18ao38x/just_got_accepted_into_bc_through_questbridge/,8,15,2023-12-04 16:38:25,"Pretty much just the title but I'll give some context here. Interested in the materials science field as a potential job and am planning at at least going for a masters degree after my undergrad is done (maybe a PhD). 

But as far as actual questions go...

\- How are the professors? Are they respected for their field? Are they nice? 

\- How well did the education you got set you up for potential jobs, etc.?

\- I know that research is limited at BC but how was things like lab equipment, budget, idk things like that 

\- Overall, do you like it?"
transferin from Morrissey to Connell,https://www.reddit.com/r/bostoncollege/comments/18a2zbn/transferin_from_morrissey_to_connell/,6,5,2023-12-03 20:51:28,"i just got accepted into bc on Friday to Morrissey as an undecided major, how hard would it be to transfer to connell and how would i go about doing that when the time comes? this is all hypothetical since I'm not officially registered or attending yet."
Questions about BC,https://www.reddit.com/r/bostoncollege/comments/189kjfv/questions_about_bc/,7,3,2023-12-03 03:31:02,"I am a junior in hs and looking at colleges and have some questions about the school 

1.How’s the CS program at BC (Education wise and career wise post college)

2. How’s the social scene (greek life, clubs, types of people)

3. How’s the food 

4. How hard is it to transfer majors or schools"
ED 1 Admissions Decisions Release Date,https://www.reddit.com/r/bostoncollege/comments/187tl93/ed_1_admissions_decisions_release_date/,9,9,2023-11-30 21:24:02,"I just received an email saying ED decisions will come out ‘early next week.’ However, before I click on the email, it says they will come out ‘the evening of Thursday, December 2.’ Not really sure what calendar BC uses…"
Did I mess up applying to HCE?,https://www.reddit.com/r/bostoncollege/comments/187mrjw/did_i_mess_up_applying_to_hce/,6,11,2023-11-30 16:35:51,"(I do ramble a bit, sorry!) Current 12th grader here, I'm just having anxieties over a school I haven't even gotten into yet (I applied ED1 so I'll know around the 15th, but I've been told I have good stats for it.)

I'm someone who doesn't really know what I want out of college. I guess I got excited I could still be an engineer like I told everyone without having to feel forced to let go of the more artsy things I love. (I have a huge love for theater, and plan to minor or double major in it.) This feeling was only reinforced after reading the course catalog for the program. I also trusted what the website said about it becoming accredited in 2025, and I'd be a 2028 graduate. As for the college itself, I enjoyed the lack of Greek life, the suburban feel of where it was in relation to the city, and everyone I interacted with seemed nice. (I'm aware of the stereotype. I've been going to Catholic school for years. I'm used to the crowd, despite not usually fitting in with them.) 

I've just been given a hard time over my choice to apply ED here. That I'm wasting my time by not doing a ""real"" engineering program at a better school, or that I'll be outcast for my sexuality or interests.

Sorry for the ramble, but I just wanted to ask: Is this true? Am I wasting my time in a ""fake"" program? Will it really be that hard to find people I fit in with? Any input is helpful, thanks to whoever reads this."
Looking for a tutor for Advanced Algebra I/II,https://www.reddit.com/r/bostoncollege/comments/1863634/looking_for_a_tutor_for_advanced_algebra_iii/,1,3,2023-11-28 18:38:02,"a local 10th grader is looking for a tutor for Advanced Algebra I/II. In person or online help is fine. 

&#x200B;"
What time should I arrive at Conte Forum tomorrow for the Harvard-BC basketball game?,https://www.reddit.com/r/bostoncollege/comments/17xxm56/what_time_should_i_arrive_at_conte_forum_tomorrow/,6,5,2023-11-18 03:42:59,"I know they are giving out the really cool Eras Tour styled T-shirts, so I need to know what the earliest time possible to arrive is."
Applying as a Transfer,https://www.reddit.com/r/bostoncollege/comments/17wap1q/applying_as_a_transfer/,5,29,2023-11-16 01:51:28,I’m planning to apply to BC as a Fall 2024 transfer and I was wondering if anyone knows how difficult it can be to apply in. I’m currently at another similar college and in the Business School there and I was wondering if that would make my application better or worse. Any feedback would help.
Black Friday Football Game,https://www.reddit.com/r/bostoncollege/comments/17vk9g0/black_friday_football_game/,3,1,2023-11-15 03:14:35,Coming to the game on the 24th vs Miami. Just curious if parking is any different than a normal game because of the Thanksgiving  break. Any help on this or where to park and what not would be great. Sorry if this has been asked before.
"Fulton, heads",https://www.reddit.com/r/bostoncollege/comments/17vgx1v/fulton_heads/,3,0,2023-11-15 00:30:41,Why?
Question regarding professor,https://www.reddit.com/r/bostoncollege/comments/17usmtg/question_regarding_professor/,3,1,2023-11-14 03:01:13,"Hi, I will be taking chemistry II next semester and I'm deciding between Hartmann and Young. Does anyone have professor Young's syllabus as a reference? Thank you"
transfer,https://www.reddit.com/r/bostoncollege/comments/17u2k89/transfer/,11,17,2023-11-13 04:11:16,"Hi guys. I am a current Freshman at Boston College and I am considering transferring. I know everyone says that freshman year is rough and that I should stick it out cuz it will get better, but I feel like I really don't like the culture here. Everything is all about sports, and I am a big theater person who doesn't even like going to the sports games - I go cuz I feel FOMO if I don't, but I don't really like the games or how sports-centered this school is. I also am not making good connections with people here. There also isn't much to do right around campus, and everyone is SO concerned about partying, drinking, hooking-up, etc. I really don't like that vibe at all, but that's what it's like here. I am seriously considering applying to transfer, but I would love some advice. Has anyone else felt this way about BC? Has anyone else transferred out of BC? And what is the transfer process like? Any help would be appreciated <3"
MS in Applied Analytics (online),https://www.reddit.com/r/bostoncollege/comments/17t53tq/ms_in_applied_analytics_online/,7,1,2023-11-11 22:00:05,"Hello everyone, 
I just got accepted into the program and done my fair share of research. Curious what’s everyone’s opinion on the program. Tell me about the workload, flexibility, value of the program, etc."
How do you guys pick good professors?,https://www.reddit.com/r/bostoncollege/comments/17rtyt3/how_do_you_guys_pick_good_professors/,3,3,2023-11-10 02:30:59,"Freshman here. I didn't think about professors at all when doing registration for this semester and I kinda regret it. I've had a few people recommend looking at course evaluations, but what should I be looking for exactly?"
Looking for info on football tailgating at BC,https://www.reddit.com/r/bostoncollege/comments/17qb9sh/looking_for_info_on_football_tailgating_at_bc/,3,3,2023-11-08 02:14:23,"We have a group of friends interested in tailgating for the upcoming VT / BC game, but the prices seem a bit ridiculous. We were considering getting a cheaper parking spot in Lower Brighton, but unfortunately these seem to be non-tailgating. Is there a place we can set up our own tent and a table nearby Lower Brighton or on campus? Thanks! "
Any students in the MS in applied statistics and psychometrics program?,https://www.reddit.com/r/bostoncollege/comments/17oy7ka/any_students_in_the_ms_in_applied_statistics_and/,1,9,2023-11-06 08:26:24,"Looking at potentially studying tin this degree program. I studied accounting and mis at the University of Arizona for my undergrad and have a background in various quantitative roles. Always had a passion and interest for statistics but was already into my program.

I'm curious to hear what students think of it. I know it's a more niche program, so not expecting a ton of replies."
How much do RAs make,https://www.reddit.com/r/bostoncollege/comments/17oevjc/how_much_do_ras_make/,1,1,2023-11-05 15:55:52,"Need to get a job and thinking about applying to be an RA, how much do they make?"
"Found these vintage Boston College hats, all brand new, almost 30 years old.",https://i.redd.it/azmwno87tyxb1.jpg,45,22,2023-11-02 16:55:43,
Exchange at BC,https://www.reddit.com/r/bostoncollege/comments/17l0wtx/exchange_at_bc/,3,2,2023-11-01 01:25:37,"Hii guyss! I am considering to go to BC for an exchange in Spring 2025. I have some questions that I would like current students' advice on!

1. How's the people and atmosphere on campus? Is it easy to make friends and join activities?
2. I am planning to take health-related courses, how's the course load there and do I need to devote a lot of time to study?
3. I saw that for exchange students, on-campus accommodation is not available. How's it like to stay off-campus?
4. Would you guys suggest me to go on exchange in BC? Why or why not?

Thank you in advance!"
Have you ever seen a GED student in BC,https://www.reddit.com/r/bostoncollege/comments/17kibnj/have_you_ever_seen_a_ged_student_in_bc/,9,13,2023-10-31 10:58:21,Have you ever seen a student with partial high school transcript + GED diploma and homeschooling stuff who got into BC??
Dogs at tailgate,https://www.reddit.com/r/bostoncollege/comments/17kcxot/dogs_at_tailgate/,5,3,2023-10-31 04:29:00,"I have family coming to town in a few weeks who are going to the BC vs. Miami game. They’ll be tailgating before with a friend who has an on-campus parking pass at one of the garages. I was planning to stop by on my way out of town for vacation with my husband and dog and was wondering if it will be an issue if I have my (leashed) dog with me in the parking lot? We aren’t going into the stadium and will only be there for a half hour to an hour but given that we’ll be parking off campus and meeting them there I’m not going to leave her in the car. I looked on the website and couldnt find their policy on dogs outside the stadium, only about in Alumni. No—I am an obnoxious owner who will be playing fetch in the middle of the parking lot and letting her run wild through strangers tailgates—I just want to make sure event security isn’t going to kick us out the minute we get there for having her sitting in our area"
How often does bc students go to downtown boston?,https://www.reddit.com/r/bostoncollege/comments/17fpu18/how_often_does_bc_students_go_to_downtown_boston/,12,5,2023-10-24 22:48:02,Do u get to be friends with students from other schools in boston? Also do bc students people not like drinking at all?
Off Campus Apartment,https://www.reddit.com/r/bostoncollege/comments/17e0rtp/off_campus_apartment/,0,3,2023-10-22 19:12:04,I have a one bedroom apartment for rent. It’s located on Kinross road. $2300 a month. The complex has a pool.
Can one of you please help me save $70 to use your BC library access to send me a pdf of this article please? The website is Future Medicine. Thanks.,https://i.redd.it/wh6l8ck8kfvb1.png,5,3,2023-10-20 22:03:24,
Swim Team Sues School Over Hazing Allegation,https://www.espn.com/college-sports/story/_/id/38691811/boston-college-swim-team-files-suit-asks-lift-hazing-ban?platform=amp,20,1,2023-10-19 23:55:34,BC swimming & diving  is taking the school and it’s athletic department to court for defamation and seeking to have he indefinite suspension of the entire team lifted.
Doing my supplemental prompt and has a question. I feel like the only viable option for me is the one about a global issue so my question is does it have to relate to my major?,https://www.reddit.com/r/bostoncollege/comments/17bszm6/doing_my_supplemental_prompt_and_has_a_question_i/,1,2,2023-10-19 20:38:20,I’d like to major in finance and I’m having a really hard time finding a global issue that relates to it. Does it help to have it related to finance or can I do it on something that recently happened where the water supply near me was contaminated by fuel because of the Navy?
best place to live as a sophomore,https://www.reddit.com/r/bostoncollege/comments/17bi9jg/best_place_to_live_as_a_sophomore/,2,5,2023-10-19 12:44:33,can someone give me the rundown of sophomore housing options and give me a general sense of what they're like?
UPF Abroad Winter Roommate Searching,https://www.reddit.com/r/bostoncollege/comments/17b8b83/upf_abroad_winter_roommate_searching/,4,1,2023-10-19 02:26:07,"Hello!

This is a very niche post but let me explain - I go to Drexel and I am going abroad to UPF in Barcelona this winter term. BC is one of the only other American schools that is a part of the abroad program and I am in need of someone to split a two-bedroom flat with (studios/one-beds are crazy expensive). I'm born and raised in New Hampshire so chances are I could swing by and meet up before we even go abroad. So ***please*** if you know someone in the program at BC who might be interested in rooming please send them my way.

A little about myself:

My name is Ian and I'm a pre-junior (Drexel is weird, I'm essentially 3/5 done). I’m studying Marketing, Esport Business, and Brand & Reputation Management. I’m a gay man (like in a serving cunt at all times, drag-race stan, eat hot chip way), an ex-fraternity member (with those remaining alcoholic tendencies), alt-adjacent, a Kim Petras lover, anti-capitalist, studio ghibli enjoyer, usually baked, a certified happy hour enthusiast, streaming Rush by Troye Sivan, and living my himbo dreams in college.

I’m looking for roommates with similar “fuck it we ball” mindsets, who are always down to drink and go out because it’s five o’clock somewhere, who want to put in the effort to make the apartment well-decorated, and willing to throw some of the best parties El Born (the neighborhood) has ever seen. I have no preference in terms of gender (but a queer individual is ideal). I’m envisioning themed cocktail nights, lots of beer-pong, gay bar crawls, and family dinners.

If we sound like a match, please feel free to reach out and we can exchange socials!"
PSYC3393 Neuroscience of Pain,https://www.reddit.com/r/bostoncollege/comments/179iljp/psyc3393_neuroscience_of_pain/,5,1,2023-10-16 22:22:57,"Has anyone here taken this class? How was difficult was it? Workload, Professor, etc."
Freshman looking to join or start a band. Any tips/advice?,https://www.reddit.com/r/bostoncollege/comments/178w7ng/freshman_looking_to_join_or_start_a_band_any/,9,9,2023-10-16 02:58:22,"I play bass guitar, I'm not great but I want to find or start a band, but I haven't felt like I've met many musicians, anyone have any advice?"
Best Places to Live Junior Year,https://www.reddit.com/r/bostoncollege/comments/177qkrm/best_places_to_live_junior_year/,3,0,2023-10-14 14:17:13,Anyone have tips on the best place to live off campus junior year?
Tailgating in 300 Hammond parking lot for football?,https://www.reddit.com/r/bostoncollege/comments/174wvs9/tailgating_in_300_hammond_parking_lot_for_football/,3,2,2023-10-10 21:35:40,I'll be heading to Alumni stadium for the Uconn game at the end of the month. we have 4 cars with 16 people and have parking passes at the lot in Chestnut Hill on Hammond. I understand there is no tailgating allowed here but what does that mean? Are these lots patrolled on game day? We want to hang out somewhere and meet up before the game and all head to the game together. So we are thinking we would congregate around a truck bed in the parking lot. Perhaps a few beverages but don't plan on a grill or tent or anything like that. Is that do-able? Been sometime since I have been back there for a game.  thx
Easy Lv3 CS Electives,https://www.reddit.com/r/bostoncollege/comments/174bem2/easy_lv3_cs_electives/,5,6,2023-10-10 03:27:45,"What are some easy CS level 3 electives? Have a really heavy workload next sem and trying to have a more relaxed senior spring.

Thank you!"
Uni Application,https://www.reddit.com/r/bostoncollege/comments/170768w/uni_application/,1,4,2023-10-05 03:11:09,"My sister is applying this year, and due to tight budget, she is considering going to Canadian universities and then apply for US grad school. Is this gonna work?"
Student-Athlete: Is having a life with the course load possible?,https://www.reddit.com/r/bostoncollege/comments/16u3zh1/studentathlete_is_having_a_life_with_the_course/,1,0,2023-09-28 02:30:11,"Hi- I’m a high-school senior looking into Boston College t&f. I was wondering if anyone has experience as a student athlete at the college; is it impossible to get work done successfully or overwhelming?
Also what’s life like for black lgbtq+ students on campus?"
