title,url,score,num_comments,created_date,selftext
Rules Reminder: Questions about Admissions should be posted in r/chanceme. Not here.,https://www.reddit.com/r/bostoncollege/comments/175d4bg/rules_reminder_questions_about_admissions_should/,17,0,2023-10-11 12:42:37,"We are a bunch of current & former BC students who don’t pay close attention to BC’s changing admissions standards. Your GPA and SAT scores are better understood in r/chanceme and other similar subs. 

This sub is better for asking specific questions about student life, school culture, etc."
Visiting for UNC game (neutral fan); Am I missing anything?,https://www.reddit.com/r/bostoncollege/comments/1gwkvhm/visiting_for_unc_game_neutral_fan_am_i_missing/,12,16,2024-11-21 17:28:57,"Hello Eagles,

I'm a Florida-based guy who travels all around the country to watch college football games and take in each school's unique way of experiencing the best sport on the planet. I'll be arriving in Chestnut Hill on Friday to check out the game against North Carolina, my first time seeing a game at Alumni Stadium (although I did walk through Alumni Stadium prior to the Army-Navy game last year).

I typically compile a pretty in-depth list of things to do around town, places to eat & drink, and info about the gameday experience, but if there are any great food spots, cool dive bars or breweries, beloved campus-area institutions, campus highlights, or gameday traditions (the weirder the better) that you feel are can't-miss experiences, I would love to learn about them and make sure I don't overlook something important.

My plan is to spend Friday and Saturday focused primarily on BC and the Chestnut Hill area, then maybe hit a couple of spots in the wider Boston area on Sunday before flying out late. So I'm more interested in stuff near campus that would be part of the typical BC student/alumni experience, but if there's something uniquely Boston (for example, I only recently heard about steak tips being a unique local food item) that I should check out on Sunday, I'd love to hear those recommendations too.

Also, if there are any cool or even dumb/goofy cheers, traditions, marching band performances, etc. that may fly under the radar, I'd love to know about them.

Essentially, my goal is to cram as much of the college/gameday experience into one weekend as I can, so whatever you think may help me accomplish that, feel free to douse me in nostalgia of the places you loved during your time on campus. 

Anyway, sorry for the long post. I look forward to hearing any tips y'all may have!"
I was accepted for the MBA program and am going for the BC vs. Unc football game Saturday. Is it weird to go alone? 25f ,https://www.reddit.com/r/bostoncollege/comments/1gwmw14/i_was_accepted_for_the_mba_program_and_am_going/,7,6,2024-11-21 18:46:46,
Ed Decisions,https://www.reddit.com/r/bostoncollege/comments/1gwpk0o/ed_decisions/,0,1,2024-11-21 20:34:23,Has anyone heard any word about when ed1 comes out?
How does season ticket parking work? ,https://www.reddit.com/r/bostoncollege/comments/1gwov9a/how_does_season_ticket_parking_work/,1,0,2024-11-21 20:06:15,I know it’s in one of the garages but isn’t that garage open to everyone for free? Do I have to show up wicked early to get a spot? 
Anyone get a decision back as a Spring25’ transfer? ,https://www.reddit.com/r/bostoncollege/comments/1gvqsba/anyone_get_a_decision_back_as_a_spring25_transfer/,1,0,2024-11-20 14:31:21,
course registration ,https://www.reddit.com/r/bostoncollege/comments/1gv7v87/course_registration/,6,7,2024-11-19 21:02:20,i'm a freshman history major and why the fuck was every 2000-level history elective full lmfao. bruh
Premed at Boston College,https://www.reddit.com/r/bostoncollege/comments/1gv7j3g/premed_at_boston_college/,1,0,2024-11-19 20:48:09,"If you took AP Calculus B/C in high school - do you need to repeat it as a pre-med requirement?  I read that some med schools will accept AP classes if it’s on your college transcript with credit, but I didn’t think BC gave actual credits for AP classes - just a pass on requirements. Anyone know?"
Can somone in dynamical systems or Differential Equations Please drop,https://www.reddit.com/r/bostoncollege/comments/1gv21p6/can_somone_in_dynamical_systems_or_differential/,0,1,2024-11-19 17:02:55,I really need a seat in one of theese courses to be on track to graduate and am wondering if there's any way I could get in. I tried to register but by the time of my registration appointment both classes were fully :(. Talked to the math department head and she said no overide fuuck :(
Orgo,https://www.reddit.com/r/bostoncollege/comments/1gu82xt/orgo/,1,0,2024-11-18 16:02:08,"currently in orgo, been here once before... nerd central yall "
"Bill O'Brien Responds to Boston College Loss vs. SMU, Thomas Castellanos Leaving Boston College",https://youtu.be/mCRcDB_Eghw,9,2,2024-11-17 23:03:42,
Class Recommendations for Spring Freshman,https://www.reddit.com/r/bostoncollege/comments/1gtlip8/class_recommendations_for_spring_freshman/,6,1,2024-11-17 19:31:19,"I am a Finance student at BC right now, and I am looking for recommendations for teachers+classes to complete some of the main requirements. I have to take statistical analysis and am in perspectives right now, so I am looking to take some easier classes to lighten my workload. "
CLASS REGISTRATION HELP,https://www.reddit.com/r/bostoncollege/comments/1gtv68p/class_registration_help/,1,1,2024-11-18 03:06:46,Hi! All of my classes got filled and I register tommorow!! I am looking for some good MCAS electives... either easy or just genuinly good/interesting classes. 
Avner Ash for Intro to Number Theory?,https://www.reddit.com/r/bostoncollege/comments/1gt1vet/avner_ash_for_intro_to_number_theory/,2,1,2024-11-17 01:00:48,"Need math elective…how’s Intro to Number Theory with Avner Ash? I found linear algebra easy, but logic and computation hard."
BC MHA,https://www.reddit.com/r/bostoncollege/comments/1gs9okx/bc_mha/,1,0,2024-11-15 23:19:52,"Hi all!
I was recently admitted to the WCOS at Boston College for their masters in healthcare administration program. I’ve always wanted to attend BC, and I am about to finish my BSN- so it’s definitely an exciting time !
My goal is to become more involved in management and community outreach for healthcare organizations in the Boston area. 
Other than the BC site itself and the helpful people I’ve interacted with from their staff, I don’t know much about the reputation of the program. 
BC is not cheap, so I am looking for input about whether or not grads of the program have had good experiences during their time at BC and afterwards. 

TIA!"
Donovan Ezeiruaku is READY for SMU,https://youtu.be/oyD7shJUVOE?si=C9BbzlBJw2bpQSZO,9,1,2024-11-14 17:45:52,Came across an interview with Donovan Ezeiruaku from NESN this week. This guy is absolutely going places!!
ID Checks for a student ticket?,https://www.reddit.com/r/bostoncollege/comments/1graqz7/id_checks_for_a_student_ticket/,3,5,2024-11-14 17:53:57,"I purchased a ticket from StubHub for this Friday's men's basketball game against Temple. I’m fine with sitting in the student section or finding an open seat elsewhere, but I’m not a student. Will I still be able to enter Conte Forum without a student ID?  Do I need to use a specific gate?"
Yikes….,https://www.bcheights.com/2024/11/10/boston-college-republicans-statement-to-the-bc-community/,80,67,2024-11-13 00:19:17,
Econ Electives,https://www.reddit.com/r/bostoncollege/comments/1gqmrmz/econ_electives/,1,1,2024-11-13 20:32:37,What are the chances I will be able to get an econ 2000 elective as a sophomore with a 10am pick-time 
Best Writing Intensive Seminars?,https://www.reddit.com/r/bostoncollege/comments/1gqbz4c/best_writing_intensive_seminars/,4,1,2024-11-13 12:40:53,Stuck between Comedy Studies or Television Criticism. Any feedback on these courses (or others) would be greatly appreciated! 
Any reviews of professor Juliana Belding for Linear Algebra?,https://www.reddit.com/r/bostoncollege/comments/1gmxmr8/any_reviews_of_professor_juliana_belding_for/,7,4,2024-11-09 00:31:07,I’m thinking of taking Professor Beldings linear algebra course this upcoming semester but I want to gather some reviews beyond Eagle Eval and rate my professor. What do you think of her? Should I take her course if I haven’t taken multi variable calculus yet? Any feedback is appreciated.
Dogs at tailgate?,https://www.reddit.com/r/bostoncollege/comments/1glwsbh/dogs_at_tailgate/,2,5,2024-11-07 18:04:12,Am I allowed to bring a small dog to tailgate the football game?
Premed/Neuroscience/STEM at BC?,https://www.reddit.com/r/bostoncollege/comments/1glewww/premedneurosciencestem_at_bc/,5,7,2024-11-07 01:26:28,"How does Boston College compare in these areas? I had an internship at MIT over the summer, and while my lab PI recommended BU, I fell in love with BC during my visit. The campus, the college atmosphere, the football team—it all really appealed to me. Is anyone here majoring in these fields, and if so, what has your experience been like?"
SU football tailgates this weekend @BC 11/9.,/r/SyracuseU/comments/1gknei7/su_football_tailgates_this_weekend_bc_119/,2,0,2024-11-06 02:21:30,
Would I have to take calc 2,https://www.reddit.com/r/bostoncollege/comments/1gkhdx0/would_i_have_to_take_calc_2/,5,9,2024-11-05 21:08:17,Say the world blessed me and I was an accounting major at ur lovely school… would I have to take calc 2? I can’t find much online. I’m in calc ab rn and hoping to get the credit.
Pursuing BS in math/science major,https://www.reddit.com/r/bostoncollege/comments/1gkcku0/pursuing_bs_in_mathscience_major/,2,4,2024-11-05 17:46:39,I’m a freshmen and I took calc II that is not for math/science majors but I want to pursue a bs in a math/science majors. Would I retake calc II designated for math/science majors or is it only a recommendation?
When do early decision results come out?,https://www.reddit.com/r/bostoncollege/comments/1gkb827/when_do_early_decision_results_come_out/,1,5,2024-11-05 16:50:23,
Singles on Lower,https://www.reddit.com/r/bostoncollege/comments/1gjmw4n/singles_on_lower/,1,0,2024-11-04 19:29:11,Are there any singles on lower or for any upperclassmen that aren’t in roncalli? 
Comp. Sci. 2 Professor,https://www.reddit.com/r/bostoncollege/comments/1giw3cm/comp_sci_2_professor/,8,3,2024-11-03 20:15:26,"Hi Guys, 

I am planning my classes for the spring semester, and since I am a CS major, i need a professor for CS 2, but there’s only two… 

They are Naomi Bolotin and Maira R Marquez Samary. They both have terrible reviews and don’t know what to go for. Maira only has one class at 9am, meanwhile Naomi has plenty. Pls help…"
Gameday,https://www.reddit.com/r/bostoncollege/comments/1ginjzx/gameday/,2,2,2024-11-03 14:03:48,"Hi,

Coming up for gameday next week and could use a couple pointers. Can anyone share some insight into the following:

1. Where to tailgate? Based off prior posts it looks like the only place is right outside the stadium? 

2. Bars/Restaurants before and after? (Preferred walking distance)

3. Any BC gameday/other traditions to view? 

Thank you for any and all help! "
party/social scene?,https://www.reddit.com/r/bostoncollege/comments/1gicnf3/partysocial_scene/,8,5,2024-11-03 02:10:27,applying this year and absolutely loved the campus and its programs. I was just wondering what the party/social scene is like. I have a lot of friends and neu and ik they go to other schools to party lol. 
How selective is the Human Centered Engineering Program at BC?,https://www.reddit.com/r/bostoncollege/comments/1ggo0yc/how_selective_is_the_human_centered_engineering/,9,15,2024-10-31 20:18:57,my kid is likely going to apply for HCE at BC but i can't find any stats that show how hard it is.  i heard there are only 45-50 spots per class so that means if only 500 people apply that's a 10% admit rate which sounds quite low but doesn't take much.  has anyone heard of any statistics specifically for the HCE admit rate?
What are your favorite and least favorite things at BC? ,https://www.reddit.com/r/bostoncollege/comments/1geld19/what_are_your_favorite_and_least_favorite_things/,7,6,2024-10-29 03:27:02,
How is the neurodiversity scene at Boston College?,https://www.reddit.com/r/bostoncollege/comments/1gf0cu0/how_is_the_neurodiversity_scene_at_boston_college/,0,7,2024-10-29 17:32:50,As someone who is 
"I'm switching from Verizon to either T-Mobile or AT&T cell phone service. Anyone have any feedback, positive or negative, on either of these in the Chestnut Hill/Newton area? Thanks!",https://www.reddit.com/r/bostoncollege/comments/1ge9qgw/im_switching_from_verizon_to_either_tmobile_or/,3,3,2024-10-28 18:43:36,
"Newton Campus in the 1960s, complete with nuns strumming guitars",https://www.instagram.com/p/DBRzW-Lust0/,9,0,2024-10-28 12:13:22,
Any organizational behavior professor recommendations? ,https://www.reddit.com/r/bostoncollege/comments/1gd1205/any_organizational_behavior_professor/,7,2,2024-10-27 02:26:30,"Does anyone who has taken this course have any recommendations for good/easy professors or professors to avoid? 
Or even any good professors for Management classes in general "
Any BC nursing students?,https://www.reddit.com/r/bostoncollege/comments/1gcv06w/any_bc_nursing_students/,8,3,2024-10-26 21:10:16,"BC nursing is my dream program, and there are many things I am curious to know about the application process. How often are middle-income students admitted with financial aid? What are your stats and ecs that got you into BC nursing? What do you think made you stand out from a large pool of applicants? Did you submit your AP scores?"
How far is it really from Boston proper?,https://www.reddit.com/r/bostoncollege/comments/1gc8e2m/how_far_is_it_really_from_boston_proper/,1,2,2024-10-25 23:59:29,Hi guys I’m a hs senior strongly considering applying ED to BC. I just wanted to know; is it really that much trouble to get into Boston? Is the T ride really 45 minutes? 
homecoming football game 10/25,https://www.reddit.com/r/bostoncollege/comments/1gbed9g/homecoming_football_game_1025/,9,6,2024-10-24 21:49:36,just a question- would it be seen as weird to wear a costume to the game tomorrow? my bf (bc grad) and i planned a costume because we saw some people last year wearing them but now we're not so sure if it'll seem silly. TIA for the advice 😅
Fun/memorable classes!,https://www.reddit.com/r/bostoncollege/comments/1gb74at/funmemorable_classes/,10,17,2024-10-24 16:41:56,"I’m gonna be graduating next semester, so I wanted to see if anyone would recommend some fun, memorable classes that they took at BC so far!"
I'd it possible to go random for on campus junior year housing? ,https://www.reddit.com/r/bostoncollege/comments/1g98lyo/id_it_possible_to_go_random_for_on_campus_junior/,12,8,2024-10-22 03:16:42,"I'm a sophomore with 4 years of housing. I'm in an 8 man with a group of people that I thought I would click with but I've realized that it just doesn't feel right. I feel terrible about it. I struggled with making friends freshman year and I was so grateful to be able to room with these guys. I feel bad but I just don't feel like I'm part of the group you know... like I feel like I still haven't truly found ""my people."" so I'm thinking of just staying on campus next year and potentially getting random roommates if that's a possibility... might as well avoid the stress of finding off campus housing if I don't know who to live with anyway. Any advice? Sorry for the long post "
Accounting for CPA ,https://www.reddit.com/r/bostoncollege/comments/1g98w7a/accounting_for_cpa/,7,4,2024-10-22 03:31:50,"I am a current freshman at BC and I am thinking about my opportunities in the future. I initially came to BC wanting to be a finance major, but after taking my financial accounting class, I have considered pursuing a CPA. Is anyone currently on the CPA route who can give opinions on how it is going and the program's difficulty? Does BC offer a good amount of support for those pursuing a CPA?"
Curfew Policy?,https://i.redd.it/swjpqixye7wd1.jpeg,2,5,2024-10-22 00:41:23,I’m thinking about applying to bc and was looking through the handbook and saw this curfew policy. Is this a thing that is enforced or does nobody care? I’ve never seen this at a college before.
Should I apply to CSOM? ,https://www.reddit.com/r/bostoncollege/comments/1g9971q/should_i_apply_to_csom/,1,2,2024-10-22 03:48:51,"I want to major in something business related, but I think my application feeds better into political science/international studies/ something along those lines -- my supplemental essay (the thing that would set me apart from other candidates) is about that, and that's what my extracurriculars are centered around. 
Should I just apply to CSOM anyways? Or apply to a different college and try to transfer in right away? "
[Forbes] Boston College a new “Private Ivy League”,https://i.redd.it/3zpkzno108wd1.jpeg,1,0,2024-10-22 02:39:50,
Is an Econ/History Double Major Doable,https://www.reddit.com/r/bostoncollege/comments/1g89rvk/is_an_econhistory_double_major_doable/,10,7,2024-10-20 21:36:59,Just applied to MCAS under a history major ED (took AP World/US/Euro/Gov and got all 5’s). I want to go to law school. Would both at once be doable? Are you usually able to tackle all the requirements? I’m also not a super good math student (taking AP Calc AB now). Any help appreciated
Thank you to Boston college for being a classy and respectful school/ program everytime. -VT fan,https://i.redd.it/2mi33ndiasvd1.jpeg,78,4,2024-10-19 21:49:38,
Anyone here transfer from a community college?,https://www.reddit.com/r/bostoncollege/comments/1g7ld5r/anyone_here_transfer_from_a_community_college/,17,9,2024-10-19 23:18:03,Has anyone here transferred to bc from a community college? If so how much more difficult was it academically? I have a 4.0 gpa at my cc and want to apply to bc next year but I’m worried it will be a giant leap in academic rigor.
feed back on supplemental essay ,https://www.reddit.com/r/bostoncollege/comments/1g6lx3c/feed_back_on_supplemental_essay/,5,4,2024-10-18 16:11:33,"would like some notes (ex. i think you should expand more on this.... maybe include this because BC values ____) and literally even just getting it skimmed through and providing feed back would mean the world to me!! im applying into MCAS and kind of framed my essay around the global public health major, but I would appreciate feedback from anybody!"
Watching the BC-VT Thursday Night Game in ACC Club!,https://discord.gg/2TmQXfApj2,14,0,2024-10-18 01:54:24,"We don't have many BC fans repping the Eagles rn, so can we get some in here! Watch the game with us and enjoy! "
Exchange student,https://www.reddit.com/r/bostoncollege/comments/1g67h5k/exchange_student/,1,0,2024-10-18 02:05:34,"Exchange student Milan

Has anyone studied in Milan?
Can you suggest living arrangements. 
Was there anything you wish you knew before hand. 
Did you stay at Aparto Giovenale "
Senior Quarter Grades Significance,https://www.reddit.com/r/bostoncollege/comments/1g5jqhq/senior_quarter_grades_significance/,7,5,2024-10-17 05:33:47,"Hi, My cousin is a senior planning on applying to BC's Connell School of Nursing. She is a MA resident.

She goes to a pretty nice public school in MA and from what I know, her GPA is 4.0 unweighted (4.06/4.33) up til junior year. She also took a lot of AP courses and did pretty well in them. Her SAT superscored is 1510. She doesn't have many academic awards (besides honor roll and AP scholars with distinction), but she leads two clubs and participates in a lot of volunteer service.

From what I know, she's really stressed because she is currently taking AP Calc BC, AP Physics C, and AP Psych. She is doing well in Calc BC and Psych, but she's terrified because of her low Physics C grade. She's thinking she could get anywhere from a low C to a low B.

**I don't know her actual grade, but does anybody know if this drop would significantly reduce her chances of getting in?** She's one of the best students I've ever known, and she has always been hardworking (which makes it kind of hard for her grades to improve over the course of high school)."
Job Board Location,https://www.reddit.com/r/bostoncollege/comments/1g4o8g9/job_board_location/,1,0,2024-10-16 01:43:23,"Where is there a job board for BC students (Not Handshake, that is for corporate jobs)?"
can a cross-listed course count for multiple requirements,https://www.reddit.com/r/bostoncollege/comments/1g3nqqd/can_a_crosslisted_course_count_for_multiple/,4,3,2024-10-14 19:01:04,"i'm a freshman year history major theology minor, thinking about taking a roman religion course next year that is crosslisted as HIST4211/THEO2241/CLAS2242. would this count as both a history elective for my major and a theology elective for my minor? if not, can i choose which one it applies to?"
"Register to vote by October 26th, and vote in the 2024 elections!",https://www.reddit.com/r/bostoncollege/comments/1g254a6/register_to_vote_by_october_26th_and_vote_in_the/,19,0,2024-10-12 17:24:49,"On November 5th, Massachusetts will vote not just for President, but for Congress, and for state and local offices.  Register and vote so you'll have a say in what kind of country America will be!

##Register to vote

In Massachusetts, you must register by October 26th to vote. You can register here: https://www.sec.state.ma.us/ele/eleifv/howreg.htm

##Voting in person

Massachusetts offers early in-person voting from October 19th - November 1st.  [Find your early voting location here](https://www.sec.state.ma.us/divisions/elections/voting-information/vote-early.htm).

You can vote early every week day between 830am and 5pm and every weekend between 11am and 5pm at Newton City Hall, about 2 miles from campus at 1000 Commonwealth Ave. You may also early vote at Brookline Town Hall (also about 2 miles from campus at 333 Washington St.) from 8am-4pm on weekdays and 10am to 4pm on weekends.

If you prefer, you can vote [at your polling place](https://www.sec.state.ma.us/WhereDoIVoteMA/WhereDoIVote) on Election Day, November 5th. 

If you are a first-time voter, or on the inactive voter list, you will need to show [a valid form of identification](https://www.sec.state.ma.us/divisions/elections/voting-information/identification-requirements.htm).

For residents listing Boston College as their voting address, your voting location on election day is John Ward Elementary located roughly 1 mile from campus at 10 Dolphin RD -- This location is not included in early voting and is only open for voting on November 5th.

##Voting by mail

Any voter in Massachusetts may choose to vote by mail.  [Apply for a mail-in ballot here](https://www.sec.state.ma.us/divisions/elections/voting-information/vote-by-mail.htm).

Ballots must be postmarked by November 5th and received by November 8th, so mail your ballot back promptly.  You can also return your ballot in person to an early voting location, a dropbox, or your local elections office.  See [this website](https://www.sec.state.ma.us/divisions/elections/voter-resources/find-my-local-election-office.htm) for a list of elections offices and dropboxes.  If you return your mail ballot in person, you must do so by November 5th.

If you mail your ballot, [you can track it here](https://www.sec.state.ma.us/wheredoivotema/track/trackmyballot.aspx).

Please let me know if you have any questions!"
"Data center in Gasson, 1960s or70s",https://www.instagram.com/p/DA6Mv84u4_e/,11,0,2024-10-12 00:18:38,
Opinion on BC,https://www.reddit.com/r/bostoncollege/comments/1fzxafh/opinion_on_bc/,3,2,2024-10-09 17:40:14,"For current student:

How has BC helped you become a better person?"
What’s competition like to join BC’s PhD in theology program?,https://www.reddit.com/r/bostoncollege/comments/1fzplzc/whats_competition_like_to_join_bcs_phd_in/,2,4,2024-10-09 11:55:34,"Howdy!

I’m looking into this program, and am just trying to gauge my chances. I have an MTS (Master of Theological Studies) from a conservative Church of Christ school here in Oklahoma with a 3.9 GPA. 

One thing I’m missing is experience in Research Languages (most PhD programs want German and French). That said, what’re my chances looking like? Is there a possibility I get in on condition that I take German and French classes over the summer?"
Best network for cell signal on campus?,https://www.reddit.com/r/bostoncollege/comments/1fzccyx/best_network_for_cell_signal_on_campus/,6,4,2024-10-08 22:22:27,"I have Verizon, and there is no signal whatsoever in most of upper campus. Does anyone with AT&T or Xfinity have better luck? "
How conservative is BC,https://www.reddit.com/r/bostoncollege/comments/1fzdji8/how_conservative_is_bc/,2,5,2024-10-08 23:17:56,Hello everyone I’m currently a senior in high school and was wondering what the political climate was like at Boston college-I know it’s certainly no UC Berkeley or BYU. Is there any feeling of isolation for having certain beliefs? Thanks! 
