title,url,score,num_comments,created_date,selftext
Integrating into BC as a transfer student ,https://www.reddit.com/r/bostoncollege/comments/1cjz9ke/integrating_into_bc_as_a_transfer_student/,13,18,2024-05-04 12:32:24,"Hi! Looking for some advice because I was recently admitted to BC as a sophomore transfer. I really love BC and I actually applied EDII last year and was waitlisted. I’m someone who really loves sports and school spirit and getting involved in a variety of clubs. I’m a bit worried about how cliquey BC is tho and if I’m going to be able to find my group, because social division and general toxicity is a major reason why I applied to transfer in the first place. I also enjoy going out and I’m wondering what that’s like at BC. Thank you for the advice!!!"
Aid for Transfers,https://www.reddit.com/r/bostoncollege/comments/1cjbyqh/aid_for_transfers/,0,0,2024-05-03 15:49:06,"Hi, I got accepted to BC just now as a transfer but they gave me no aid, only a loan and student job, and I am being asked to pay 60k more than my expected family contribution on FAFSA. Is this normal for BC? Has anyone had a similar experience and got it appealed?"
How is BC for trans students?,https://www.reddit.com/r/bostoncollege/comments/1cif0ni/how_is_bc_for_trans_students/,0,25,2024-05-02 12:58:42,"edit: just an FYI, im already planning to apply to transfer to known lgbtq+ friendly schools like NEU, BU, Tufts, etc. 

I'm considering transferring to BC since the campus is nice and it seems to be a good college. However, I'm a trans guy and would like to be out in college about my identity.

Id like to know from any LGBTQ BC students or just current BC students: Would I get any support from this college? (Like those rooming options other unis have for LGBTQ+ students, name change in their system, etc.) Or is it a lost cause?"
Dress code for interview with admissions committee member (CSOM)?,/r/MBA/comments/1chxew3/dress_code_for_interview_with_admissions/,5,10,2024-05-01 21:30:54,
Open Skate or Figure Skating on campus?,https://www.reddit.com/r/bostoncollege/comments/1ch2iqn/open_skate_or_figure_skating_on_campus/,8,8,2024-04-30 20:13:35,"My daughter is considering BC. She was a figure skater when she was younger. Does Conte Rink (did I spell it right?) offer open skate for the general public or figure skating hours?  Or is it entirely reserved for the hockey teams?

Many thanks for any advice. "
[Forbes] Boston College a new “Private Ivy League”,https://i.redd.it/odw7k5w61jxc1.jpeg,108,26,2024-04-30 02:20:48,"These 10 private schools, located in nine states and Washington D.C., are attracting the smartest students and plaudits from employers. Our analysis excluded schools with fewer than 4,000 students, the eight old Ivies and four Ivy-plus schools—Stanford, MIT, Duke and Chicago ([Forbes](https://www.forbes.com/sites/emmawhitford/2024/04/29/exclusive-employers-are-souring-on-ivy-league-grads-while-these-20-new-ivies-ascend/?sh=5a59ef558534)).

"
Who should I ask for a rec letter for Econ/other related major?,https://www.reddit.com/r/bostoncollege/comments/1cfon9w/who_should_i_ask_for_a_rec_letter_for_econother/,1,5,2024-04-29 02:58:01,I have one letter than I am definitely going to submit (he knows me well) but I am questioning which other one to send in. One option is my foreign language teacher who has known me for 6 years and the other is a Pre Calc teacher who has only known me for one. I am not sure because my foreign language teacher has nothing to do with what I would apply for but she knows me better. Any insight?
How do I get tickets for Boston College Softball,https://www.reddit.com/r/bostoncollege/comments/1cflh60/how_do_i_get_tickets_for_boston_college_softball/,1,2,2024-04-29 00:18:23,"Visiting USA from Australia and we want to watch a college softball game. 

How do we get tickets? Can we turn up on the day or do we buy online?

We visiting early May 2024."
CSON Graduates,https://www.reddit.com/r/bostoncollege/comments/1cf8raz/cson_graduates/,2,3,2024-04-28 15:16:51,I’m wondering if CSON does cum laude and all of that? Or is it a general graduation?
"People with “lower” GPAs (3.6-3.8), how did you get in?",https://www.reddit.com/r/bostoncollege/comments/1cesrpi/people_with_lower_gpas_3638_how_did_you_get_in/,2,23,2024-04-27 23:58:08,
Help me decide between BC and Rochester,https://www.reddit.com/r/bostoncollege/comments/1cdz1f4/help_me_decide_between_bc_and_rochester/,5,22,2024-04-26 22:49:37,"So I’ve gotten into both Boston college and university of Rochester for Mathematics and physics, and I’m very stuck deciding between the two.

On the one hand, Rochester has an open curriculum and plenty of math and physics courses that I can take, meaning I can really dive deep into all the material I find super interesting. Additionally they have an unbelievable emphasis on research, enough so that I can get 4 years of research on top of being able to take lots of graduate courses due to the open curriculum. As I want to go to grad school, this is crucial. At the same time, I worry about the weather and the overall environment of the school. I’ve always handled the cold and rain well, but I don’t want a dreary social environment. Similarly, I worry the people who go might be too academically driven, of course this is how I am, but I’d want an environment that’s more colorful than a bunch of  hard working kids. Lastly, I toured inside of the math and physics departments and they are abysmal, seemingly no personality with almost no posters or any real excitement that I would like to see. Then again I went on a Saturday.

For Boston college it is almost the opposite. I wont be able to pursue as in depth to my classes due to the tight curriculum, however then again the general philosophy of education there is something I appreciate much more- it may help me greatly to expand my perspectives and really engage with other subjects. The campus is lovely and the people seem more socially diverse and friendly. However I most specifically worry about the physics department, and the research opportunities all around, it seems a lot less accessible and sufficient compared to Rochester. 

Generally, I feel like at Rochester I will do better academically and be more able to pursue the subjects I’m very interested in. However at BC I also respect the overall social scene better as well as the required classes. 

Any help would be much appreciated,
Thanks."
Diplomas,https://www.reddit.com/r/bostoncollege/comments/1cdubvp/diplomas/,3,6,2024-04-26 19:33:56,Does BC mail us our diplomas or do we get the real one at commencement?
Kurt Vonnegut at BC in the 1970s,https://www.instagram.com/p/C5-_aT0uGa_/?img_index=2,22,1,2024-04-26 01:41:17,
how is the physics major like here?,https://www.reddit.com/r/bostoncollege/comments/1cd6ecd/how_is_the_physics_major_like_here/,10,10,2024-04-25 23:38:04,"hi,

i'm a current high school senior deciding where to go next year. i plan on majoring in physics, potentially double majoring in math as well. there is a very high chance that i am going to grad school, and i might get my PhD in physics. i would like to explore theoretical physics more than experimental, but would not mind dabbling in experimental physics. i like how physics uses math to answer the why's of the world. i like knowing why things are the way they are.

bc is one of my top schools, and i wanted to see how physics majors at bc think/thought of their time here."
Study abroad info,https://www.reddit.com/r/bostoncollege/comments/1cd3kqh/study_abroad_info/,1,0,2024-04-25 21:37:25," hi, does anyone know if you can do more than one semester abroad in bc? i know you have to stay for the entirety of freshmen and sophomore years, but could you spend all of junior year and fall semester senior year abroad if you wanted?

i'm planning on pursuing international relations & the study abroad opportunities are going to be the deciding factor for if i go to bc or not. i know there are summer internships but i've heard they're heavily reliant on professor recommendations and i don't like my chances with the class sizes bc promotes."
Best freshmen housing,https://www.reddit.com/r/bostoncollege/comments/1ccbkhh/best_freshmen_housing/,5,13,2024-04-24 22:26:01,I was wondering what the best forms are for freshman year. Should I try and join a specific living and learning community if I want the best housing? 
Are there any public study spaces available at Boston College for non-students?,https://www.reddit.com/r/bostoncollege/comments/1cc7ied/are_there_any_public_study_spaces_available_at/,8,8,2024-04-24 19:41:20,"Hello everyone,

I'm currently staying near Boston College and am looking for a place to study. I'm not a student at BC, but I'm wondering if there are any areas, like libraries or common spaces, that are open to the public where I could study. Does anyone know if non-students can access any study areas on campus? Any information would be greatly appreciated!

Thanks!"
Senior Sunrise,https://www.reddit.com/r/bostoncollege/comments/1cbjgrf/senior_sunrise/,15,15,2024-04-23 23:31:20,I’m graduating this semester. Will I regret not going to the senior sunrise? 
When does course registration for MCAS students end?,https://www.reddit.com/r/bostoncollege/comments/1cb9li9/when_does_course_registration_for_mcas_students/,3,4,2024-04-23 16:53:10,"
I’m an international exchange student and basically, I have only been registered for 4/5 of the courses that are mandatory for my home university. I am completely unable to register for the fifth course or make changes to my courses until the 20th of August. Ive already emailed the exchange team about this and they can’t help me :( 
I’ve been keeping an eye on the course and there’s still some places left - is everyone else still able to register for it or does everyone have a deadline to register?

Basically, I’m asking if there’s any chance of me registering for this course in August or if it’s all going to be full and I won’t be able to come to Boston since it’s a mandatory course for me. 

EDIT: I should add this is for fall 2024

"
how do you guys afford bc😭,https://www.reddit.com/r/bostoncollege/comments/1cavfvq/how_do_you_guys_afford_bc/,30,21,2024-04-23 04:12:24,"I was admitted and the coa is about 95k! this is way above the estimated cost and when i emailed the office they essentially just linked the loan information. I have already accepted i’m not going to be able to attend, but was genuinely curious on how some people are able to afford this besides the obvious aid?"
Messina College,https://www.reddit.com/r/bostoncollege/comments/1cahmkn/messina_college/,11,5,2024-04-22 18:04:21,I just saw that BC just started the Messina College this year and was just wondering what is it all about? Would people say that it's easier to get into Messina College than through BC the regular way? Somewhat like Northeastern Foundation Year?
What is it like here?,https://www.reddit.com/r/bostoncollege/comments/1c9lhny/what_is_it_like_here/,1,0,2024-04-21 16:03:23,"Hi, I’m an international student looking to do a year out in USA. Just wondering what life is like at this university, what are the classes like and the nightlife? Clubs and societies etc. Thanks!"
Electric Bikes,https://www.reddit.com/r/bostoncollege/comments/1c85stl/electric_bikes/,2,1,2024-04-19 19:37:33,"Hello everyone, I am an incoming student and I had a question regarding electric bikes. From my understanding, most electric vehicles are banned however electric bikes are allowed. My question is, where would one charge there electric bike? Are there any exterior outlets on campus?"
Advanced Standing,https://www.reddit.com/r/bostoncollege/comments/1c7gsf8/advanced_standing/,12,11,2024-04-18 22:34:41,"Hi everyone, I’m a prospective student and I realized that I would have enough AP credits to make me eligible for advanced standing. Can anyone speak on this or rate it? Wondering if I should do it. TIA"
pre law,https://www.reddit.com/r/bostoncollege/comments/1c6uu5b/pre_law/,8,4,2024-04-18 04:45:53,"current freshman at bc (MCAS), I didn’t declare a pre professional program (pre law) on my application but I decided I want to try for law school. Can I and if so, how, declare a pre law track?"
Ryan Leonard Will Return To Boston College For His Sophomore Season,https://www.bcinterruption.com/2024/4/17/24133491/ryan-leonard-return-boston-college-his-sophomore-season-bc-eagles-hockey-washington-capitals-caps,18,0,2024-04-17 23:38:57,
MBA total expense - Boston College - Carroll School of Management,/r/MBA/comments/1c6xqbl/mba_total_expense_boston_college_carroll_school/,2,1,2024-04-18 07:53:06,
PLEASE HELP: Need to Know Graduate Program Waitlist Reveal Date,https://www.reddit.com/r/bostoncollege/comments/1c6xpk9/please_help_need_to_know_graduate_program/,2,3,2024-04-18 07:49:41,I’ve been waitlisted by the M.A. in Mental Health Counseling. This is a graduate program. I am very curious when will they announce if I’m in or not. This is really important to me because I need to plan ahead what I’m doing for the next few months. Does anyone know what date it’ll be. 
Premed ,https://www.reddit.com/r/bostoncollege/comments/1c6rzwq/premed/,2,1,2024-04-18 02:11:01,"I’m an incoming freshman who just got into bc undeclared into MCAS, and I’ve been wondering if I needed to state in my application that I intend on majoring in biology to be able to declare a premed track. Is it too late to declare premed so that I can fulfill any requirements next year? "
Dual Major ,https://www.reddit.com/r/bostoncollege/comments/1c66al2/dual_major/,6,6,2024-04-17 10:21:46,"As a prospective freshman, how can I enroll in a Dual Major program? Do I simply email the admissions office to inquire about the process?"
Is It Difficult To Get AP Credit Towards Graduation?,https://www.reddit.com/r/bostoncollege/comments/1c5glch/is_it_difficult_to_get_ap_credit_towards/,12,22,2024-04-16 13:50:03,My son calculated he has approximately 30 AP credits that should be accepted by BC. From what I understand he would need to get approval if he wanted to graduate in three years. Is this a common path? Is it difficult to get approval for this? Are there any BC students here that are using their AP credits to graduate early? Thanks!
Is Boston College good for entering into quant finance?,https://www.reddit.com/r/bostoncollege/comments/1c5hza6/is_boston_college_good_for_entering_into_quant/,4,2,2024-04-16 14:49:00,If committed I will study Applied Physics or Math  + Comp Sci at MCAS. Is there a big difference in terms of finding internships and recruiting between MCAS and CSOM?.
rescind policy ,https://www.reddit.com/r/bostoncollege/comments/1c53if4/rescind_policy/,13,10,2024-04-16 01:18:47,"i've been admitted to the class of '28 and have committed to BC, but due to some family circumstances my grades have slipped significantly the third quarter of my senior year (2 d's in AP classes for the quarter, year grade is a B for both.

i've started seeing a therapist and making use of my school's counseling resources as well as meeting with my teachers to determine what i can do to finish out the year strong and get my grades back to normal fourth quarter, but will this be a major concern to BC, and is there a chance i might get my admission rescinded? do they send an email first where i may be able to explain that this isn't senioritis affecting me but is actually a personal issue i'm working to resolve? I'm extremely nervous about this so any info helps, thank you"
Core Requirements,https://www.reddit.com/r/bostoncollege/comments/1c4w9mw/core_requirements/,18,15,2024-04-15 20:13:56,"Hi! I'm going to BC this fall trying to go down the pre-med route. I did some research on the core requirements here, and they seem pretty extensive. I heard that some classes can fulfill multiple requirements, so at least I don't have to take 15 classes for just the core lol. 

I was wondering if some upperclassmen had any insights/advice on choosing my first classes here. Are there any classes you think I should/shouldn't go for? Especially considering my focus on pre-med. I'm also kinda freaked out about the philosophy and theology requirement here, especially since I feel like I'm pretty bad at writing essays and stuff. 

Thanks everybody!"
Applied Physics ,https://www.reddit.com/r/bostoncollege/comments/1c4qnm7/applied_physics/,3,2,2024-04-15 16:33:24,"Hi, I have recently been accepted to BC as an applied physics major, so I am interested in knowing what classes I would be taking and how it works. If possible, is there any senior willing to share their notes or syllabus?

Also, how do I sign up for a double major? I want to double major in CS
"
BC vs Stony Brook ,https://www.reddit.com/r/bostoncollege/comments/1c47bck/bc_vs_stony_brook/,5,6,2024-04-14 23:19:46,"I am an NYS resident so stony is a lot cheaper but I love BC. I am majoring in mathematics with a minor in data science, any advice on what to pick? What makes BC stand out that I will not get at stony? "
Which language should I take?,https://www.reddit.com/r/bostoncollege/comments/1c47o40/which_language_should_i_take/,1,3,2024-04-14 23:35:56,"I am really not a foreign language person, and was wondering what the “easiest” language to take is at BC. I took Spanish in High School, but dropped it senior year. Any advice?"
Outcomes For Seniors - is it like this ND senior class,https://www.reddit.com/r/bostoncollege/comments/1c34j7t/outcomes_for_seniors_is_it_like_this_nd_senior/,3,4,2024-04-13 15:26:58,"I feel for this senior at Notre Dame (and another friend's son is in a similar situation), it is not an easy market out there for graduating seniors in many different professions, not just finance and consulting.  As the parent of an incoming freshman I would love to get any feedback and input from BC's seniors (and families) about how effective the BC career placement office is and how valuable the alumni network has been. 

[https://www.reddit.com/r/notredame/comments/1c03q6j/notre\_dame\_finance\_no\_interview\_opportunities/](https://www.reddit.com/r/notredame/comments/1c03q6j/notre_dame_finance_no_interview_opportunities/)"
Student Visit This Weekend,https://www.reddit.com/r/bostoncollege/comments/1c2mgu5/student_visit_this_weekend/,11,7,2024-04-12 22:38:18,We are visiting with our daughter this weekend and hope to seal the deal w BC (she had been admitted).  Is it possible to get tickets to the Spring Game and where should we go to watch BC win the Frozen Four?
Frozen Four Finals Watch Party???,https://www.reddit.com/r/bostoncollege/comments/1c2g7t1/frozen_four_finals_watch_party/,15,1,2024-04-12 18:17:18,"Are there any coordinated off-campus watch parties for the Frozen Four tomorrow night? Not a BC student, but looking to watch them destroy Denver with other eagle fans :))))"
Boston College Mathematics Major,https://www.reddit.com/r/bostoncollege/comments/1c220sd/boston_college_mathematics_major/,4,4,2024-04-12 06:18:57,"Hello, I have recently been admitted to MCAS and plan on majoring in Mathematics and minoring in Data Science. I am currently taking AP Calculus BC in high school and am finding it a little challenging and am wondering if I will still be able to mange majoring in mathematics. Anyone have any information on how challenging the math major is at BC?"
NCAA Division I Hockey ,https://www.reddit.com/r/bostoncollege/comments/1c25izd/ncaa_division_i_hockey/,1,0,2024-04-12 10:14:21,BC onto the National Title game after demolishing Michigan last night. GO EAGLES!!!
CSOM Summer Internship Outcomes,https://www.reddit.com/r/bostoncollege/comments/1c1xneo/csom_summer_internship_outcomes/,3,2,2024-04-12 02:19:46,"I’m an ED student for finance in CSOM. I’m trying to get a grasp of what the internships are actually like for finance students. Like, are you mostly rejected or is the acceptance rate good? Also how is the ability for a person to choose a location, I live on the west coast, are there good connections to work in LA. And finally, how’s the compensation as a summer intern? Any info is much appreciated. "
Any seniors/recent grads going to the bars tonight to watch the frozen four semifinals tn?,https://www.reddit.com/r/bostoncollege/comments/1c1rf61/any_seniorsrecent_grads_going_to_the_bars_tonight/,6,1,2024-04-11 21:50:01,Im a recent grad and just wanna watch the game with other BC fans tonight 😩 help me out 
M.A. in Mental Health Counseling Question,https://www.reddit.com/r/bostoncollege/comments/1c1jefi/ma_in_mental_health_counseling_question/,7,6,2024-04-11 16:27:19,"Hello! 

I was recently accepted into the MHC grad program and was wondering if any students either in it could or with information about it could answer the followig questions. It would be greatly appreciated :) 

1. The one thing holding me back from the program is the cost. **How do you feel about it? What about the program did you feel justified it (over going to a cheaper program for example)**
2. My interest in psychology grew in tandem with my interest in philosophy. I hope to continue exploring both of these interests as a graduate student by continuing to consider and discuss the human condition; ""Who am I?"" ""Why am I the way that I am?"" ""Who are we?"" ""Why are we the way that we are?"" ""How can I learn to cope with all of this?"" are questions I long to keep asking. For this reason I have been drawn to psychodynamic models of therapy (as well as humanistic and spiritual ones). **I was wondering how you would describe the program's philosophy or emphasis? Is there a particular or consistent philosophy or model within it? If so, how? And if not, would it be possible for me to continue to explore these questions in my work and classes?**

&#x200B;

Thank you so much!"
BC or UMN (twin cities) for finance,https://www.reddit.com/r/bostoncollege/comments/1c11nx4/bc_or_umn_twin_cities_for_finance/,13,5,2024-04-11 00:44:49,"i’m currently a high school senior who got accepted into the business schools at BC and UMN and was wondering which one i should choose. i come from a high income family and received no aid, so BC would be 95k and UMN is 56K. i also wanted a minor in CS, but umn has the better CS program. i’m leaning towards, BC but i don’t really know if it’s worth the cost? i hope to work in IB or consulting and might later complete an MBA. please let me know your thoughts on what i should do!! "
BC or Wake Forest premed??,https://www.reddit.com/r/bostoncollege/comments/1c0og69/bc_or_wake_forest_premed/,14,22,2024-04-10 15:32:59,"I’m currently a senior in high school choosing between Bc or wake for premed and I was wondering which one is better. I like the weather much better in Wake, but less so the dominant Greek life. Boston is a “better location” but I’m not sure how much that matters for premed. Any Advice?"
CS Program + Prep,https://www.reddit.com/r/bostoncollege/comments/1c0em5p/cs_program_prep/,7,7,2024-04-10 06:09:54,"Hello Everyone, I was recently accepted into BC for the class of ‘28 as a Computer Science Major. I overall love BC and it’s mission, but I am concerned that I might miss out on crucial CS knowledge and preparation for internships and jobs, especially since my dream is to get into a FAANG company. 

Can any CS majors reaffirm me and let me know their thoughts on the major and it’s opportunities at BC? 

I have narrowed my schools between the University of Maryland which is a T20 CS school and it’s instate, and BC which good overall, but now known for CS. I don’t know where to choose. I want to choose BC but i am concerned career wise. Please someone tell me what to do.

Also: BC is generous with aid, so money isn’t an issue nor at UMD #blessed"
How do you finance your education at BC?,https://www.reddit.com/r/bostoncollege/comments/1bzvvdk/how_do_you_finance_your_education_at_bc/,5,4,2024-04-09 16:04:44,"Hi, I'm an international student who has been admitted to BC CSOM, I'm not eligible for financial aid or scholarships due to not being a legal resident of the US. However, considering the significantly high tuition fees (approximately $90,000 per year), I'm curious to learn how current international students are financing their education. 

Could people who experienced the same struggles provide some insights or methods that you and other students have used to alleviate the costs? Are there any smaller scholarships available within the school or outside scholarships that you have applied for or recommend? Or do I simply need to accept the situation and pay the full amount? 😅"
pre pa reqs,https://www.reddit.com/r/bostoncollege/comments/1bzjnyg/pre_pa_reqs/,1,2,2024-04-09 04:46:57,"for those on a pre pa track, what courses did/are you planning to take?

- i want to avoid orgo and biochem as they aren’t required for all pa schools and would honestly like to save myself the torture.. i know i might be limiting my options this way but i’ve been looking at a lot of pa school pre reqs and the ones i’m interested only have like gen chem 1+2 if they even have a chem pre req"
