title,url,score,num_comments,created_date,selftext
Questions about BC,https://www.reddit.com/r/bostoncollege/comments/1epy7qt/questions_about_bc/,2,1,2024-08-11 23:04:50,"1. How easy is it to add finance as a second concentration in CSOM? My math grades are not very high and I’m only taking calc ab this year, so I think it’ll be harder to get admitted as a finance major compared to another concentration like general management. 
2. How are the dining halls and dorms? I heard that some BC dorms are not very nice, so it’ll be nice to hear some more insight into that. Are there good food options in the dining halls and around the local area, and how are the meal plans?
3. What is the social scene like? Is it hard to make friends and how easy is it to be invited to parties? Are the parties fun and what you expected of the college experience? 
4. Are there things to do around the local area or do most people go to Boston during the weekends? 
5. Is the academic environment more collaborative or competitive?
6. Does BC give good financial aid to low income students? I know that they meet 100% of need with loans, but are the loans a large part of the financial package or is it mainly need based aid?
"
Where did you live?,https://www.reddit.com/r/bostoncollege/comments/1eppec6/where_did_you_live/,6,35,2024-08-11 16:48:07,Where did you live each of your years at BC and what year did/will you graduate?
Fenwick Triple,https://www.reddit.com/r/bostoncollege/comments/1eplcq5/fenwick_triple/,4,2,2024-08-11 13:54:49,I’m an incoming Freshman and I ended up in a natural triple on the top floor of Fenwick Hall. I was wondering if anyone had any opinions or advice for this dorm/hall.
Quiet places on campus,https://www.reddit.com/r/bostoncollege/comments/1ep9pvi/quiet_places_on_campus/,12,14,2024-08-11 02:15:54,"Are there any good spots on campus where you can be alone? I’m in a triple freshman dorm this year, which is fine, but I like my solitude and I would rather do  FaceTime calls in private. Thanks for any suggestions!  "
Mattress Toppers,https://www.reddit.com/r/bostoncollege/comments/1eou6dx/mattress_toppers/,3,3,2024-08-10 14:20:36,"At orientation parents were told that mattress toppers need to meet some CA flammability regulation, do they actually check this? "
Christopher Constas or Martin Maira Sotomayor for PHIL1070,https://www.reddit.com/r/bostoncollege/comments/1eojijs/christopher_constas_or_martin_maira_sotomayor_for/,1,4,2024-08-10 03:43:21,"Hi, curious what Christopher Constas is like for Philosophy of the Person I (PHIL1070). Test heavy? Are tests hard? Also, what's Martin Maira Sotomayor like for PHIL1070? TIA!"
Are there any pickleball courts at BC and Newton campus? ,https://www.reddit.com/r/bostoncollege/comments/1eoji2n/are_there_any_pickleball_courts_at_bc_and_newton/,0,1,2024-08-10 03:42:32,
Is an electric kettle allowed in a dorm? ,https://www.reddit.com/r/bostoncollege/comments/1eoibxj/is_an_electric_kettle_allowed_in_a_dorm/,1,4,2024-08-10 02:40:47,
Is there carpeting in freshman dorms?,https://www.reddit.com/r/bostoncollege/comments/1enirgl/is_there_carpeting_in_freshman_dorms/,5,10,2024-08-08 22:05:17,
Foosball at BC?,https://www.reddit.com/r/bostoncollege/comments/1eneg0m/foosball_at_bc/,7,5,2024-08-08 19:07:45,"Hello, I’m pretty big into foosball. I feel like this is pretty niche but are there any tables at BC, or even a club? I haven’t found anything online so lmk please! "
Medeiros top floor ,https://www.reddit.com/r/bostoncollege/comments/1emd6qh/medeiros_top_floor/,2,19,2024-08-07 14:26:28,"Hi! I just got assigned the top floor to Medeiros hall and found out that the roof is slanted. anyone who has lived in those, thoughts? are they smaller than “regular dorms”? i am in a double and feel as if they’d feel a lot more cramped because of it. or just any general thoughts on that dorm?

Additionally, heard they also don’t have the extra shelving on the wall 😅 how’s storage?

Thank you!!"
Xavier housing on upper,https://www.reddit.com/r/bostoncollege/comments/1emcjt0/xavier_housing_on_upper/,2,4,2024-08-07 14:00:24,"Hi, just got assigned Xavier on Upper for this freshman year... is this good? What's the vibe? 

Thanks"
BC track star training for 1924 Paris Olympics,https://www.instagram.com/p/C-QCfmbuodK/,7,0,2024-08-06 01:26:15,
Tailgate. ,https://www.reddit.com/r/bostoncollege/comments/1el0x9b/tailgate/,14,18,2024-08-05 22:17:25,"Coming down first time. I know you can tailgate at some of the higher priced lots. 

But can you tailgate at the train station or places like newton, lower Brighton, or Hammond. As I’m finding good priced parking there. When I say tailgate I’m talking no alcohol  and forgo the tents and such. Are they really monitoring it. 

Worst case a few bag chairs with two adults and kid eating a sandwich I can’t image being a big deal "
Vector LMS Modules required??,https://www.reddit.com/r/bostoncollege/comments/1ele541/vector_lms_modules_required/,1,0,2024-08-06 10:19:48,"Does anybody else have to do the LMS alcohol / diversity / mental health videos? Is it required? 

My videos keep replaying despite me finishing them, does anybody know how to get past that?"
Other gym options beside the plex?,https://www.reddit.com/r/bostoncollege/comments/1ekefzo/other_gym_options_beside_the_plex/,0,14,2024-08-05 03:57:34,"Hey, just wanted to check if other people go to other gyms around BC. The plex has been meh for me in my experience at BC and not worth it by how crowded and congested it’s been all the time. Anyone ever try the equinox or lifetime down the street? Ive done a guest pass at both when its been like busy hours normally at Bc and I have to wait ages for a machine, but at equinox and lifetime it’s always so much more quick and machines are available. I already go to Barry’s & soulcycle and enjoy those more because they’re just way better than the plex classes, haven’t found any instructors that are good, so just looking for an extra gym place nearby! "
How is the financial aid for BC??,https://www.reddit.com/r/bostoncollege/comments/1ejdtei/how_is_the_financial_aid_for_bc/,1,8,2024-08-03 20:59:49,I am a rising senior and my dream school is BC however I saw that BC practices need blind so I am really scared. I am scared to ED to BC. My family income is around 160k-200k. My grades are average and i am top 20% percent of my grade. 
Fitzpatrick,https://www.reddit.com/r/bostoncollege/comments/1ej6851/fitzpatrick/,1,2,2024-08-03 15:37:19,My housing for year 1 is Fitzpatrick on upper in a standard double room. Anyone know what the building and rooms are like? Are the communal bathrooms absolutely awful? I also couldn’t find much information on laundry. Thanks!
"For the supplemental essays, what would be a good topic to write on?",https://www.reddit.com/r/bostoncollege/comments/1eimc1n/for_the_supplemental_essays_what_would_be_a_good/,6,4,2024-08-02 21:51:26,I'm all over the place and I would love some ideas from students that already went through this process.
Moogy’s has gone way downhill,https://www.reddit.com/r/bostoncollege/comments/1ehronn/moogys_has_gone_way_downhill/,16,7,2024-08-01 20:59:54,"Loved Moogy’s while I was in school and post graduation.  Went this week and it was TERRIBLE. The food was unseasoned and felt “cheap” even though it’s not cheap.

Worse though- it was filthy. Like gross and dirty floor, walls etc.  I’m sad 😢 I enjoyed it back in the day."
"
favorite and least favorite thing about BC?",https://www.reddit.com/r/bostoncollege/comments/1eh83we/favorite_and_least_favorite_thing_about_bc/,15,24,2024-08-01 04:43:43,high school senior applying this fall. just trying to do research in different schools. what do you like and not like about BC
Who should I contact for add drop classes help,https://www.reddit.com/r/bostoncollege/comments/1ehgs6u/who_should_i_contact_for_add_drop_classes_help/,1,3,2024-08-01 13:32:54,"Im a freshman  in CSOM and just did my add drop classes but i couldn't register for Portico, all classes said 15/5 and it is a mandatory first semester class. Who should i contact to get this resolved"
Clubs and social scene,https://www.reddit.com/r/bostoncollege/comments/1eh4ia9/clubs_and_social_scene/,7,6,2024-08-01 01:36:27,"Hi I’m a rising senior and planning on applying to bc ED. I just had a few questions…What are the most popular clubs students join? Is the school super cliquey/exclusive? Is the social scene that awful for freshman? Sorry if these questions have already been asked, but any insight on the social scene would be much appreciated!"
how does the federal work study program work? ,https://www.reddit.com/r/bostoncollege/comments/1efxml6/how_does_the_federal_work_study_program_work/,5,4,2024-07-30 16:22:03,"Does on campus recruiting give priority to people who have been placed in this program? and what does the amount awarded as the federal work study program mean? I was given 1500 per semester, is that the max amount i can earned from an on campus job? "
What’s student life like?,https://www.reddit.com/r/bostoncollege/comments/1efk7uw/whats_student_life_like/,7,6,2024-07-30 04:15:09,I’m planning on applying ED to BC but before I commit to doing so I’d like to learn more about the student life and social scene. Sorry if this is posted often but I couldn’t find any recent updates on this sort of question. 
Average Commute Time,https://www.reddit.com/r/bostoncollege/comments/1efflu4/average_commute_time/,6,6,2024-07-30 00:26:07,"Hi!

I’m deciding between an apartment in Newton, which is 5 min drive from the Newton campus, and another apartment in Waltham, which is 20 min drive from the campus. I actually like the Waltham apartment a lot better but I’m kinda worried about the commute time. So I was wondering how long you guys (esp those of you who drive) take to commute to school and how bad the traffic gets in the morning. 

Thank you so much in advance! 🙏🏼❤️"
Classes in CSOM to take ASAP for investment banking prep and technicals? ,https://www.reddit.com/r/bostoncollege/comments/1efgs0v/classes_in_csom_to_take_asap_for_investment/,0,10,2024-07-30 01:21:04,
On-Campus Jobs,https://www.reddit.com/r/bostoncollege/comments/1eeqoeb/oncampus_jobs/,4,3,2024-07-29 04:26:37,"Hi, I am a undergrad student looking for an on-campus job. I am asking my fellow students who have worked on campus what they did (besides the usual  job in the dining hall).

Some of my interests: teaching, tutoring, writing/journalism, counseling, mental health, diversity

If anyone knows of any jobs that are routinely hiring in those fields for the academic year, please let me know! What was your experience, would you recommend, etc. Thank you!"
BC Dining for a healthy eater?,https://www.reddit.com/r/bostoncollege/comments/1eejovr/bc_dining_for_a_healthy_eater/,9,14,2024-07-28 22:33:05,"I'm an incoming freshman and I'm worried about the healthy options for BC Dining. I eat pretty clean, very little processed foods or foods with filler ingredients. At orientation the food was mostly bagels, mac and cheese, sandwiches etc which scared me a little bit.  "
Calc 2 + linear algebra,https://www.reddit.com/r/bostoncollege/comments/1eesh3y/calc_2_linear_algebra/,2,1,2024-07-29 06:18:50,"I’m an incoming math major currently enrolled in calc 2 and linear algebra. I have received mixed advice concerning this plan as some have said It’s a good idea while others have said to wait on linear algebra until I have finished calc 2, thoughts?"
Newton (Keyes),https://www.reddit.com/r/bostoncollege/comments/1ee30me/newton_keyes/,11,11,2024-07-28 08:47:59,I just got assigned to Keyes? Can anyone tell me about living on Newton as a first year? I’d love to hear about the ugly as well as the pretty. Any hacks or like tips for how to go about living there? 
Dorms,https://www.reddit.com/r/bostoncollege/comments/1eeb1eo/dorms/,1,1,2024-07-28 16:12:27,Is gonzaga hall co ed by floor?? 
Hardey Triple Pictures,https://www.reddit.com/r/bostoncollege/comments/1edr5kz/hardey_triple_pictures/,7,2,2024-07-27 21:29:29,Does anybody have a picture of a triple room in Hardey? I have the floor plan but the angles are confusing me and it would be helpful to get an actual image.
Gonzaga,https://www.reddit.com/r/bostoncollege/comments/1edpj66/gonzaga/,7,7,2024-07-27 20:17:35,Just heard I’m gonna be staying there as a year 1. Anything special I should know? The good and the bad?
is Excel for Business Analytics (Online Asynchronous) hard? Is it just basic excel? ,https://www.reddit.com/r/bostoncollege/comments/1edo0vp/is_excel_for_business_analytics_online/,5,2,2024-07-27 19:10:41,I want to start studying for that class early because I literally have no experience using Excel LOL
Williams Hall?,https://www.reddit.com/r/bostoncollege/comments/1edkud3/williams_hall/,6,3,2024-07-27 16:51:04,Can someone tell me about williams hall. Im a freshman if that changes anything who will be living there. tell me everything. the good the bad and the ugly
Welch Hall,https://www.reddit.com/r/bostoncollege/comments/1edpr9o/welch_hall/,1,1,2024-07-27 20:27:14,Hi! I just got placed in Welch as a sophomore transfer. Can anyone tell me about their experience living there? Thank u!!
Does a lofted triple ever get de-tripled? ,https://www.reddit.com/r/bostoncollege/comments/1ed97ir/does_a_lofted_triple_ever_get_detripled/,8,8,2024-07-27 05:49:31,💀
Acceptance rate of CSOM?,https://www.reddit.com/r/bostoncollege/comments/1ed9dhe/acceptance_rate_of_csom/,5,11,2024-07-27 06:00:40,"I'm an international student and considering to apply to BC at ED1. Pretty interested in CSOM, and my friend told me that only 500-600 students will be accepted. Is that right?"
Lofted Triple,https://www.reddit.com/r/bostoncollege/comments/1ed0lhu/lofted_triple/,10,19,2024-07-26 22:17:30,"I just got assigned into a lofted triple, and want to see what people's opinions are on this dorm. Is it really that cramped, and how do most people manage their clothing?"
Does legacy matter at all on apps?,https://www.reddit.com/r/bostoncollege/comments/1ed1wjh/does_legacy_matter_at_all_on_apps/,7,8,2024-07-26 23:16:36,"I’m a double legacy. Parents didn’t donate anything. I have pretty outstanding extracurriculars and course rigor, solid GPA, hopefully a good essay, and probably applying test optional as of now (1330 is my current score but I’m retaking it). I’m applying ED. Will legacy have any influence?"
Housing assignments,https://www.reddit.com/r/bostoncollege/comments/1ecy8ly/housing_assignments/,2,2,2024-07-26 20:35:22,Is anyone else unable to get into myreslife to view house assignments? I’ve been trying since they came out over an hour ago.
WOODS student applying Grad school at BC,https://www.reddit.com/r/bostoncollege/comments/1ec8hy3/woods_student_applying_grad_school_at_bc/,7,2,2024-07-25 22:52:38,"Are there any alumni’s that graduated from Boston college woods and are applying to grad school or trying to get their JD? How has the process been going? Are there school not giving you any recognition because it’s a woods degree? 

I am graduating in the spring and I would like to apply to the MSW and JD dual degree program that BC offers "
"Just returned from orientation. BC is intimidating. It's a concentration of smart, wealthy, good looking students. How will an Average Jane or Average Joe do there? ",https://www.reddit.com/r/bostoncollege/comments/1ebwt6l/just_returned_from_orientation_bc_is_intimidating/,25,17,2024-07-25 14:50:47,
herrd,https://www.reddit.com/r/bostoncollege/comments/1ecags9/herrd/,2,3,2024-07-26 00:20:56,i’m tryna get into herrd and it let me in initially. now it says i’m on the waitlist??
What was something you didn’t like about Boston college?,https://www.reddit.com/r/bostoncollege/comments/1ebrwhf/what_was_something_you_didnt_like_about_boston/,14,41,2024-07-25 10:53:07,
Dehumidifier in freshman dorm?,https://www.reddit.com/r/bostoncollege/comments/1ebkqk6/dehumidifier_in_freshman_dorm/,8,7,2024-07-25 03:18:16,"Should I purchase a dehumidifier for my freshman year dorm? I'm very sensitive to high humidity, not so much high heat. Are small ones even allowed at BC?"
On Bc off-campus housing website,https://www.reddit.com/r/bostoncollege/comments/1ebp1wk/on_bc_offcampus_housing_website/,1,3,2024-07-25 07:40:27,"I am a returning junior this fall, looking for off-campus housing. I came across this BC off-campus housing website (https://offcampushousing.bc.edu/), and found some good places comparing other platforms lime zillow (some of them are too good to be true). Anyone used this to find a good housing? Plz share ur experience. "
Printing Documents at Newton ,https://www.reddit.com/r/bostoncollege/comments/1ebd3ki/printing_documents_at_newton/,1,5,2024-07-24 21:25:02,Is there somewhere around Newton Campus to easily print documents or would it be more convenient to invest in a small portable printer while living on Newton Campus?
Swapping Majors? ,https://www.reddit.com/r/bostoncollege/comments/1eaylks/swapping_majors/,1,5,2024-07-24 11:00:16,I’ve applied for sociology to MCAS and I’m about to start my first semester in the fall. I want to study Psych or Econ but I have no idea how to “change” my major or sign up for classes. Any tips for how I should create my schedule? What classes do you guys recommend? How do I figure out which professors I should try sign up for? 
Dorm Photos,https://www.reddit.com/r/bostoncollege/comments/1eamyvz/dorm_photos/,1,5,2024-07-23 23:49:33,I’m an incoming freshman and I’d like to see photos of the specific dorm rooms/halls on upper and lower campus but I can’t find anything except for stuff on bc’s YouTube channel. Do students get a photo or model of their dorm when housing comes out? 
Boston College Health Insurance ,https://www.reddit.com/r/bostoncollege/comments/1eafzeb/boston_college_health_insurance/,2,4,2024-07-23 19:01:17,I’m an incoming graduate student and I wanted opinions on if the university health insurance/university healthcare is good/worth it.
1983 ad for opening of White Mt Creamery,https://www.instagram.com/p/C9vGlXyOdBh/,13,0,2024-07-22 22:36:32,
Parking on Law School Campus,https://www.reddit.com/r/bostoncollege/comments/1ea0wqx/parking_on_law_school_campus/,3,5,2024-07-23 06:33:22,Is it hard to find parking there? Thank you so much in advance!
Where to find jobs on campus?,https://www.reddit.com/r/bostoncollege/comments/1e92nsl/where_to_find_jobs_on_campus/,9,5,2024-07-22 01:53:46,"Hi! Incoming freshman here. Does anyone know where I can apply for jobs on campus? Most of them I heard mentioned I can't find many on the websites. I've also heard that the form for the library jobs aren't too reliable also. is there another way to contact? Also, does anyone know if there are jobs for grading papers? Someone mentioned that they got it as a job second semester freshman, but I'm not sure if that's really a thing."
Avid Gym-Goers,https://www.reddit.com/r/bostoncollege/comments/1e8wpcd/avid_gymgoers/,1,2,2024-07-21 21:09:46,"While this question may seem as that of jest, how do you guys (assuming you live on campus) manage to maintain necessary protein each day and hit your macros? I’ve heard that the meal plan offers expensive food for very small portions and i’m concerned about hitting my daily goals in terms of calories/macros. Thank you!"
What graduate year/ occasion is this shirt for? ,https://www.reddit.com/gallery/1e83s80,11,6,2024-07-20 19:40:24,Was at a thrift store and saw this. 
Recommendations and Opinions on Classes for Freshman,https://www.reddit.com/r/bostoncollege/comments/1e8csa1/recommendations_and_opinions_on_classes_for/,1,3,2024-07-21 03:08:31,"I am about to head out for my first semester at BC and I am soon to register for my classes. I am currently allowed to look at courses and create a mock schedule, and I want to get the opinions from other people for classes. As a CSOM student I really want to take some buisness classes because I would love to start learning more in business so any reccomendations would be great!!"
Parking overnight,https://www.reddit.com/r/bostoncollege/comments/1e7wo37/parking_overnight/,0,2,2024-07-20 14:17:30,Anyone know if you can park overnight in the garage?
Difference between intramural sports vs club sports ,https://www.reddit.com/r/bostoncollege/comments/1e77yut/difference_between_intramural_sports_vs_club/,8,8,2024-07-19 16:29:41,What is the difference between intramural and club sports? 
where do i find these two financial aid forms?,https://www.reddit.com/r/bostoncollege/comments/1e7mgf7/where_do_i_find_these_two_financial_aid_forms/,1,4,2024-07-20 03:37:31,"https://preview.redd.it/6bx0ilyngldd1.png?width=1387&format=png&auto=webp&s=fd8d3b94329910689dd2698191bbffb400422fc7

"
LLC or compass program?,https://www.reddit.com/r/bostoncollege/comments/1e74a2i/llc_or_compass_program/,1,3,2024-07-19 13:52:55,"I’m currently enrolled in an LLC but I was also thinking about applying for compass. Would it be too much to do both? 
"
"Black at BC, 1932: William Bradford Pratt (1904-1975)",https://johnjburnslibrary.wordpress.com/2024/07/15/black-at-bc-1932-william-bradford-pratt-1904-1975/,4,1,2024-07-19 00:14:47,
Applied Psych and Neuroscience double major??,https://www.reddit.com/r/bostoncollege/comments/1e6hsaq/applied_psych_and_neuroscience_double_major/,1,9,2024-07-18 18:03:55,"Is this a bad idea? I am an incoming freshman in the Lynch School this fall. I know Neuroscience calls for a LOT of credits (57), whereas Applied Psychology & Human Development is only 36 credits. I was also considering majoring in Sociology if I don’t do Neuroscience. I’m a bit bummed that there’s no Neuro minor— but maybe I could go with Biology? 

For reference, I want to be a nutritional psychiatrist or psychologist. I’m mainly interested in researching the link between gut health and brain function. If anyone has an opinion on which direction I should take (or any other suggestions) that would be great, I have my orientation this upcoming weekend!

edit: I also have a lot of my core requirements fulfilled, specifically both histories, 1 natural science, and both social sciences. I will fulfill my mathematics via Stats for Applied Psych and I will fulfill my cultural diversity via Family, School and Society. And I’ll probably also be taking a writing class first semester which would fulfill that requirement. (Meaning the only ones I have left to worry about are: 1 art, 1 literature, 1 natural science, 2 philosophy, 2 theology) "
Are there gay Jesuits in Boston College?,https://www.reddit.com/r/bostoncollege/comments/1e5z9ah/are_there_gay_jesuits_in_boston_college/,2,13,2024-07-18 01:26:51,
Drinking Culture ,https://www.reddit.com/r/bostoncollege/comments/1e4dv3w/drinking_culture/,6,11,2024-07-16 02:51:05,"https://preview.redd.it/qreuyi2noscd1.png?width=860&format=png&auto=webp&s=04526510921d38803fe0f7955ba51ce94291ef84

Just saw this and it got me thinking; I don't plan on drinking at all, will this be a big issue in my social life here? "
housing notifications?,https://www.reddit.com/r/bostoncollege/comments/1e453p3/housing_notifications/,4,18,2024-07-15 20:21:35,"Have any incoming freshmen received their housing notifs? Regardless, where am I supposed to be checking for my housing status? MyResLife hasn’t sent messages or anything, and I know we have to sign up for a move-in time but I still don’t have my housing info. "
Library job application,https://www.reddit.com/r/bostoncollege/comments/1e40nv3/library_job_application/,3,7,2024-07-15 17:27:54,Has anyone applied for a job in the library and if so have you heard back about an interview yet? I know they said they wouldnt contact you directly if you didnt get it so wanted to check
Will I regret it if I don’t buy the gold pass? ,https://www.reddit.com/r/bostoncollege/comments/1e3s5k5/will_i_regret_it_if_i_dont_buy_the_gold_pass/,6,18,2024-07-15 11:12:04,Does it help a lot? Incoming freshman here don’t rly know what to do lol 
Why should I apply to BC early decision?,https://www.reddit.com/r/bostoncollege/comments/1e3d5x0/why_should_i_apply_to_bc_early_decision/,2,24,2024-07-14 21:20:09,"Hi everyone, I'm a rising senior currently finishing up my college list. I've narrowed my ED choices down to BC, BU or Northeastern. What are some pros and cons of BC, especially compared to the other Boston schools. I'll likely be an econ/ business major

Thanks in advance!

"
Undecided Business Major ,https://www.reddit.com/r/bostoncollege/comments/1e3bzmj/undecided_business_major/,2,3,2024-07-14 20:30:01,I know I definitely want to major in business and apply to the CSOM but I am not entirely sure on which concentration to pursue. The Common App offers an option to apply as undecided for CSOM. Will selecting that option harm my application? There is varying answers online but I want to know specifically for BC admissions. 
Honest opinions about this school,https://www.reddit.com/r/bostoncollege/comments/1e2dcf4/honest_opinions_about_this_school/,23,14,2024-07-13 15:40:45,"I’m a senior who is planning on applying to Boston College (specifically Caroll) in the fall. I want to hear from current students: do you like this school? Does it provide good opportunities in and outside of class? Networking? Social life? Honestly you can respond however way you’d like. I feel like way too often I see glorified versions of schools but I want to hear raw and honest first hand accounts and opinions. Lastly for those who are BC grads: do you feel like education at BC was a good investment? Were you able to get a solid job with good pay (if so, how long did it take and did BC assist it that)."
