title,url,score,num_comments,created_date,selftext
Will Accelerated Research Program be beneficial for a prospective CS major?,https://www.reddit.com/r/UNC/comments/1fp7whf/will_accelerated_research_program_be_beneficial/,3,2,2024-09-25 15:55:50,I am applying to UNC right now and am wondering if this program would be useful for my field of study. Do I get to choose the type of research I dive into? Have any other CS majors found this program to be useful for them?
Do Ds get Degrees?,https://www.reddit.com/r/UNC/comments/1fpkkxu/do_ds_get_degrees/,0,9,2024-09-26 01:16:21,Will a D in Calc 2 be considering passing? For reference I'm a CS major and would still need to do Calc 3 and linear algebra.
vending machines are being replaced around campus ,https://www.reddit.com/r/UNC/comments/1fojibx/vending_machines_are_being_replaced_around_campus/,52,11,2024-09-24 18:24:34,I noticed first at the Union but now I see even dorm's vending machines are being replaced with no-cash option vending machines with price increases. $1.85 purchases have gone up to $2.35 . Just wondering if others have noticed or if I'm going crazy. I've stopped purchasing as it seems greedy. 
How to buy tix for UNC vs Dook at home March 2025,https://www.reddit.com/r/UNC/comments/1foul5o/how_to_buy_tix_for_unc_vs_dook_at_home_march_2025/,5,3,2024-09-25 02:55:13,"My husband is a UNC ‘10 alum and I’d love to surprise him with tickets to see UNC vs Dook men’s basketball at home in March 2025. Am I relegated to buying them on the secondary market, or is there a way to get a shot at buying tickets directly from UNC?"
Broken Foot,https://www.reddit.com/r/UNC/comments/1foj0zn/broken_foot/,13,8,2024-09-24 18:04:22,"Hi, I broke my foot and wanted to know if anyone knew resources to get through it. Right now it’s very hard for me to walk more than 20 feet. I usually drive to campus and then walk about 20 minutes to get to my class. That being said I don’t think I can make it from my parking spot to my class on crutches currently. Recovery time is 4-6 weeks."
working in one card office?,https://www.reddit.com/r/UNC/comments/1follkr/working_in_one_card_office/,7,3,2024-09-24 19:50:10,hey! i’m a freshman trying to find a chill place to work for the semester and i just picked up a once card office application :) if anyone works/has worked there how was it? were you allowed on your laptop if it was slow? (i know during the semester it’s not very busy and i really would like to not waste that time if i could be doing schoolwork)
Interesting Electives,https://www.reddit.com/r/UNC/comments/1fou1su/interesting_electives/,1,6,2024-09-25 02:27:31,"I've been looking through my schedule, and I've realized that I have some extra space to take some fun classes. Does anyone know of any cool (ideally science related) courses that don't involve much in the way of essays?"
UNC fans london ?,https://www.reddit.com/r/UNC/comments/1fogpws/unc_fans_london/,7,1,2024-09-24 16:29:25,Kinda random but I'm studying abroad in London and wanted to see if there are any other tarheels who might want to watch the game together ? 
CHEM 481 Help??,https://www.reddit.com/r/UNC/comments/1fo324m/chem_481_help/,4,5,2024-09-24 03:17:40,"Ok, so I just got a D on my first p-chem exam. Not sure what the average was, but I'm struggling to figure out how to do better in this class. The prof doesn't give homework or anything, and her office hours aren't helpful. The exam also felt very rushed-- I left an entire 14 point question blank. I've been able to do well in chem classes so far, but the upper level 400 classes are really stumping me because it's just research profs who don't seem to care that much and there's no TAs or outside resources. 

Does anyone have advice for 481 specifically, or even just in general for how to do well in 400-level chem classes? Any help is appreciated since I'll need to improve my strategy a lot to do well in the class. Thanks!"
Anyone like playing rhythm games?,https://www.reddit.com/r/UNC/comments/1fnstdf/anyone_like_playing_rhythm_games/,13,6,2024-09-23 19:17:15,Maybe we can be a good friend
how to start dating as a femme around here?,https://www.reddit.com/r/UNC/comments/1fntcv5/how_to_start_dating_as_a_femme_around_here/,6,7,2024-09-23 19:39:54,"hey, im in my second year and I'm ready to start dating.. however I don't know how to get started! I'm from Asheville so I'm used to there being a lot of visibly queer masc/butch lesbians pretty much everywhere but there doesn't seem to be as many here... how do I start dating as a femme lesbian who's into butches in chapel hill? or even where should I go to meet other lesbians? are there clubs for queers or should I try out the apps?

ty xx"
Do I only begin studying my major in my third year?,https://www.reddit.com/r/UNC/comments/1fnl6ff/do_i_only_begin_studying_my_major_in_my_third_year/,11,18,2024-09-23 14:01:47,"On the CommonApp, I noticed that it said: ""At Carolina, you’ll begin your studies in the College of Arts and Sciences, where you’ll explore your interests, build on your strengths, and develop your skills for citizenship, leadership, lifelong learning, and the careers of the future. Our general education curriculum will prepare you to think critically, work collaboratively, solve problems, take risks, and be resilient. At the end of your second year, you’ll declare your major(s) and minor(s).""

  
Does that mean the first two years of study at UNC Chapel Hill will be classes that do not align with my major? How does this work?"
PHYS 119,https://www.reddit.com/r/UNC/comments/1fnp77z/phys_119/,6,5,2024-09-23 16:50:03,Is exam 1 usually the hardest? 
COVID policy,https://www.reddit.com/r/UNC/comments/1fnqt3j/covid_policy/,3,0,2024-09-23 17:55:26,"What's the COVID policy now?

If I isolated for 6-7 days but am still testing positive, can I go to class with a mask on?"
How do withdraw Morehead Cain? ,https://www.reddit.com/r/UNC/comments/1fnvfhh/how_do_withdraw_morehead_cain/,0,2,2024-09-23 21:06:07,"I got some personal stuff going on and I just can’t get it done. Is there a formal way to withdraw my application, or do I just let it expire? And if I let it expire, is that going to hurt my chances of getting into UNC?

Thanks "
How to study for Psyc 101 Exam?,https://www.reddit.com/r/UNC/comments/1fnu9ot/how_to_study_for_psyc_101_exam/,1,0,2024-09-23 20:17:25,"Hello! This is my first year taking psychology at UNC. I am in Psyc 101 with Dr. Jeannie Loeb. Does anyone have any recommendations for Quizlets or information to focus on for the exam? She told us the test problems would be harder than the quiz questions, but she's never given us any examples of what possible test questions would look like. Has anyone taken her class before and found a good way to prepare for her exams? Thank you SO much in advance!!! Test is tomorrow!"
washing dishes in suite bathroom???,https://www.reddit.com/r/UNC/comments/1fo08qk/washing_dishes_in_suite_bathroom/,0,7,2024-09-24 00:51:22,surely this is not normal right? like there are kitchens for a reason??? especially considering the kitchen is RIGHT next door SO WHY ARE PEOPLE DOING IT IN THE BATHROOM 
apartment applications,https://www.reddit.com/r/UNC/comments/1fn9hj0/apartment_applications/,3,0,2024-09-23 01:48:44,does anyone know when warehouse leases come out/when they have in past years? thanks :)
BIO 252 EXAM SHEMER TIPS,https://www.reddit.com/r/UNC/comments/1fn7917/bio_252_exam_shemer_tips/,3,2,2024-09-22 23:54:12,"Hello all. Please drop any tips/recs on how to get A's/B's in Shemers BIO 252! I have asked chat gpt to make me hard questions on the topics, gone over lecture slides and reviewed his study guides.

Additionally, any tips on how to make the cheat sheat beneficial, please let me know. 

I am terrified for the exams to start and can't gauge if I will succeed. "
Priority Registration,https://www.reddit.com/r/UNC/comments/1fn4xte/priority_registration/,3,6,2024-09-22 22:02:59,"Is it true that if I have priority registration as an accommodation, I register the first day it opens, before everyone else? This summer, I just got to register 2 hours early on the day I was assigned, but I am looking at the schedule from last year for spring registration, and it appears that priority registration means before everyone (event those with far more credits than me)."
Guitar teachers near UNC?,https://www.reddit.com/r/UNC/comments/1fmhkna/guitar_teachers_near_unc/,5,3,2024-09-22 01:01:22,"Hey guys, I’ve been playing electric guitar on and off for about a year now and feel like I’m not really advancing so I’m looking to try guitar lessons. 

I’m mainly wanting to play somewhat heavier stuff like hardcore punk, metal, and heavy rock so if you are or know a guitar teacher in the area that’s sort of familiar with playing that genre please put me on

I am a student so I’m not loaded so the more reasonable the prices the better :)"
Does anyone know what this post was about?,https://i.redd.it/3dhk9iit54qd1.jpeg,33,2,2024-09-21 07:19:55,
UNC Hospitals Role in April 30 Protest,https://www.reddit.com/r/UNC/comments/1fn055q/unc_hospitals_role_in_april_30_protest/,0,14,2024-09-22 18:34:44,It has come to my attention that Chief White of UNC Hospital Police had a key role in the violent breakup of the encampment and was actually “incident commander” at one point.  
What is this alert about?,https://www.reddit.com/r/UNC/comments/1flbpnn/what_is_this_alert_about/,56,84,2024-09-20 13:13:56,"Got this alert on AlertCarolina. Does anyone know what happened?

*""Please be advised that around 1pm today, Sept. 19, a demonstration occurred on campus and impacted some operations. A group of approximately 150 people entered academic buildings and disrupted classes. While we do not believe there is an ongoing threat to personal safety, the group caused disruptions, vandalized a number of buildings and caused significant damage. Police continue to monitor campus and will conduct any necessary investigations.*  

*If you have information on this incident, you can contact UNC Police at 919-962-8100. ""*

https://preview.redd.it/vtvo1y67sypd1.png?width=1720&format=png&auto=webp&s=9908ceac1ef5ec395a90a9d6fd3709fb8c64ad88

  
Edit: tried to attach a screenshot but I don't think it worked so I just copy pasted the alert text"
Apolitical Gun Club,https://www.reddit.com/r/UNC/comments/1fkzc12/apolitical_gun_club/,77,31,2024-09-20 00:22:59,"Hey reddit, I’m looking into starting (reviving) a gun club here at UNC, with the goal of teaching beginners the basics of marksmanship and safety. Would anyone be interested in participating? 

While much of the club’s foundation and legality is established by its predecessor, the Tar Heel Rifle and Pistol Club from 2006, please keep in mind that this year, SLL is only accepting 40 new student organizations; and with the sensitive subject in discussion here, the club might never be approved.

Feel free to ask any questions."
CAPS,https://www.reddit.com/r/UNC/comments/1fl9598/caps/,9,4,2024-09-20 10:55:02,I’m looking into getting counseling and was wondering if it’s even worth looking into the on campus services? I’ve seen really bad reviews and wondering if I should try to look straight into off campus help. 
Can I remove transfer credits?,https://www.reddit.com/r/UNC/comments/1fl2n76/can_i_remove_transfer_credits/,7,10,2024-09-20 03:17:57,"Hi! So I really want to do a certain major, and I have some classes I took from another college (in the summer) that would fulfill the major classes, but I’m at my limit I believe for having max 75 transfer credits (from associates degree in hs). Is there anyway I can remove those transfer credits? Because some of them are really useless and are taking up space for the transfer credits I actually want to be counted. Thank you for any information or advice you can give!"
"We did it! UNC Chapel Hill will give out free physical One Cards at no cost for students, faculty and staff to use as voter ID",https://triangleblogblog.com/2024/09/18/we-did-it-unc-chapel-hill-will-give-out-free-physical-one-cards-at-no-cost-for-students-faculty-and-staff-to-use-as-voter-id/,199,16,2024-09-18 23:43:32,
Professional Frat Dues,https://www.reddit.com/r/UNC/comments/1fkpps0/professional_frat_dues/,9,1,2024-09-19 16:56:05,I was curious the range of costs/dues for professional frats. Do most of these orgs have a spring rush or just fall?  Are more “exclusive“ orgs more expensive or just harder to get into?  Thanks!
Test Accommodations ,https://www.reddit.com/r/UNC/comments/1fk7aar/test_accommodations/,20,21,2024-09-18 23:52:11,"I am a new student at UNC and I have autism. I have registered accommodations with ARS. My test accommodations are to have a distraction free environment and 100% extended time. I have scheduled all my tests for the semester. 

However, today in my foreign language class (don’t want to name drop because then it will be obvious lol), my professor surprised us and told us that the dictation portion of the exam would be taken today. I didn’t know that was happening and so of course it didn’t occur to me to ask for accommodations. So I took it in class, and it went way too fast for me, and I’m sure I did horribly. She told me that next time I can schedule time to come to her office and take it privately. I don’t know why she didn’t tell me this before.

Anyway, I am wondering if my grade comes back and it’s bad, if I can ask to retake that portion of the exam. I can imagine she might not want me to because I would already know the answers, but at the same time it’s not right that I wasn’t allowed my accommodations. Can I go through ARS about this?"
Missed Opportunity from HS English Teacher,https://www.reddit.com/r/UNC/comments/1fjxi7e/missed_opportunity_from_hs_english_teacher/,31,9,2024-09-18 16:46:17,"Having a flashback to the 10th grade in Durham, North Carolina, where at the beginning of the school year, I was excited to share with my English teacher that I enjoyed reading Michael Crichton books and her response was something like ""oh those are airplane books"". I didn't know what she meant and she said ""those are books that are good reads while flying on an airplane"". I took that to mean that these were unserious, frivolous books, and that there are plenty of better books out there, and that I should feel bad for enjoying them. Maybe my memory and interpretation were harsher than what she meant. But in this moment I can't help but feel that this was a missed opportunity for an educator to celebrate and recognize that one of her students actually enjoyed reading.

Anyway, **that teacher was a graduate of Duke University** and I think that says enough about that."
How hard is nutrition major(nhs),https://www.reddit.com/r/UNC/comments/1fkb61f/how_hard_is_nutrition_majornhs/,4,5,2024-09-19 03:06:41,I’m currently doing  physics and miss being outside more. Will doing nutrition drastically decrease the time I study for tests and give me more free time?
Computer Science B.S vs B.A,https://www.reddit.com/r/UNC/comments/1fjwb1m/computer_science_bs_vs_ba/,14,18,2024-09-18 15:56:43,"Hi, I’m currently a junior majoring in Computer Science. I’ve been working towards doing the comp sci B.S since my freshman year but right now I’m taking Calc 2 and it’s unbearable. Makes it worse knowing I still have Calc 3, linear, and stor 435 even if i get through calc 2. I wanted to know if me switching to the B.A would have a sizeable impact on getting jobs after I graduate. I find that my time left at Carolina would be significantly enjoyed more if I switched to the BA but will work hard if the BS makes a big difference. I know some schools only offer a BA.

For reference, I have an internship secured for summer 2025 at a Fortune 500 company and am very confident I will get the return offer for full-time. I plan on just being a software engineer and hope to transition to a FAANG/MAANG company at some point in my life.

So will me switching to BA limit my opportunities in the future?"
Pre-game bars for noon game?,https://www.reddit.com/r/UNC/comments/1fk9y5x/pregame_bars_for_noon_game/,3,2,2024-09-19 02:03:55,"Me and some friends are coming for the UNC vs JMU game, will there be any bars that open up early since it’s a noon game?"
Any spooky UNC lore?,https://www.reddit.com/r/UNC/comments/1fjiaar/any_spooky_unc_lore/,55,35,2024-09-18 02:31:17,I want to force my friends to listen to me talk about it
Water Bottle in Coker 201,https://www.reddit.com/r/UNC/comments/1fk250e/water_bottle_in_coker_201/,2,0,2024-09-18 20:02:12,Anybody pick up a white owala today? It's my friends :(
Tutor? ,https://www.reddit.com/r/UNC/comments/1fjwwdb/tutor/,1,0,2024-09-18 16:21:00,Any suggestion for Math 381 and Physic 115 Tutor? 
Math 233 advice,https://www.reddit.com/r/UNC/comments/1fjlms8/math_233_advice/,7,5,2024-09-18 05:41:49,"Hello! I’m currently lost in math 233 and wanted to know how hard the tests were compared to the homework because I’m struggling pretty bad on the homework. Also, if you have any tips/recommendations for improving, pls let me know"
b school transport,https://www.reddit.com/r/UNC/comments/1fjgu2k/b_school_transport/,6,3,2024-09-18 01:18:48,"hi guys! for anyone who lives behind/near franklin and is a business major, do you take the bus to the b school? trying to figure out the best mode of transport so i don’t have to walk 50 min lol. thanks!"
florry show tomorrow @ cats cradle,https://www.reddit.com/r/UNC/comments/1fje080/florry_show_tomorrow_cats_cradle/,5,0,2024-09-17 23:13:40,"hi! I live on campus and am headed to carrboro tomorrow to see florry, a folk rock band. I'm planning on going alone, just wondering if anyone else here is also going. "
finding SRO advisor,https://www.reddit.com/r/UNC/comments/1fj3equ/finding_sro_advisor/,2,2,2024-09-17 16:17:34,"I am interested in starting my own club here at UNC. How hard is it to find an advisor for your organization? I have read all the guidelines and expectations regarding advisors in SROs, but I was curious if anyone had any experience with this. Will *most* professors agree to be your advisors or is it relatively difficult to find a professor or staff member to say yes? Any tips appreciated."
First Year Class Is Less Diverse After Controversial Affirmative Action Ruling,https://ncvoices.com/unc-chapel-hills-newest-class-is-less-diverse-after-controversial-supreme-court-affirmative-action-ruling/,27,87,2024-09-16 20:14:17,How can we keep this from becoming a trend??
Missing Pen in Hamilton or Davis,https://www.reddit.com/r/UNC/comments/1fig9xc/missing_pen_in_hamilton_or_davis/,5,4,2024-09-16 21:17:49,Has anyone seen a Matt black pen in Hamilton or Davis?
how to make friends as an international ,https://www.reddit.com/r/UNC/comments/1fiid9k/how_to_make_friends_as_an_international/,2,0,2024-09-16 22:41:50,"hi, im a 21F from london studying at UNC for a semester. my dorm is external and v far from campus, i dont have classes as im doing a research project but i really want to meet people and get the college experience. im not sure how to do this as im way from campus and cant really meet people in class. my onyen for stayactive isnt working either... what can i do to get more involved? if anyone wants to meet for drinks or a party or coffee dm me!! x"
How is the Punk/Hardcore scene in the nearby area?,https://www.reddit.com/r/UNC/comments/1fhzrjc/how_is_the_punkhardcore_scene_in_the_nearby_area/,17,3,2024-09-16 08:45:57,Just recently moved to the Carrboro/Chapel Hill area for school and am super interested in getting involved in the local hardcore scene but know next to nothing about it in this area. Any venues you guys recommend? Bands? Good Instagram accounts with flyers/show announcements?
Benefits of being an Alumni?,https://www.reddit.com/r/UNC/comments/1fhvofy/benefits_of_being_an_alumni/,21,7,2024-09-16 03:58:49,"Hello! I was wondering if there are any direct benefits of being an alumni (other than the degree and chance to get jobs lol)? I am sure the General Alumni Association has a lot of ""benefits"" that they offer at a price, but are there any softwares/apps we can use for free? Does the library system let alumni use their database for research or to check out e-books? Can we still use office for free? 

Any benefits that alumni use on a daily basis whether it is for work/daily life?

  
Thank you! 
"
Busi 403,https://www.reddit.com/r/UNC/comments/1ficsiw/busi_403/,1,1,2024-09-16 18:59:13,"Hey if anyone has taken busi 403 and has recommendations on where to do the facility walkthrough, I'd greatly appreciate it!"
is anyone in plan 247???,https://www.reddit.com/r/UNC/comments/1ficlk5/is_anyone_in_plan_247/,0,1,2024-09-16 18:51:20,Please I’ve been sick twice during recitation so I couldn’t go idk whats on the midterm help please
" Might be a little biased, but is UNC Kenan-Flagler worth OOS tuition? ",https://www.reddit.com/r/UNC/comments/1fhu00b/might_be_a_little_biased_but_is_unc_kenanflagler/,13,27,2024-09-16 02:29:10,"So I'm thinking about transferring here from Ohio State, which is a mid B school.

The cost would be around \~42k tuition, \~7k housing, \~2k food. So around 50k/ year. KF students, is UNC's B school much more recognizable than OSU?

(Current freshman, 2028)

I'm not really sure how to say it but I'm paying instate @ osu, so around 20k/ year and I'm not sure if it's worth it to transfer to KF."
Best Sophomore Dorms?,https://www.reddit.com/r/UNC/comments/1fhx82b/best_sophomore_dorms/,7,14,2024-09-16 05:35:18,"My roomate and I are talking about where to form next. Currently, we live in Craige. I personally want to move to Morrison because I like our suite and that seems to be the only 8 person suite. My roomate wants to go to North Campus, or wants to do one with good bathrooms that doesn't have to be shared by 8 people. I'm not sure if I'm down for communal but I'm open to that and other ideas. Should we get an apartment?"
Should I Continue Studying 2 Languages As A Data Science Student (who's behind in major)?,https://www.reddit.com/r/UNC/comments/1fhx991/should_i_continue_studying_2_languages_as_a_data/,1,0,2024-09-16 05:37:35,"Hi, I am a Junior in Data Science / GS Double Major. I swapped majors several times before landing on one over the past 2 years, and I am about 1-2 semesters behind most data science majors. 

Right now two of my five courses are being held by Data Science, Korean and Japanese. Basically, I self taught myself Korean to KOR 204 and am on track to KOR 306. But I realized I have no reason to study Korean since I won't move there and I have lost all love for the language since most of the Koreans at UNC don't speak to foreigners. The country is gonna collapse and I don't want to live in that stressful society small country etc. I picked up Japanese because of contacts and whatnot I have in Japan and the society is much more ideal for me. 

Anyways, I'm about 3-4 courses left with Global Studies and I'm 6-8 courses left with Data Science. Should I just throw Korean away and focus on finishing these two?

Or should I switch GS to like Japanese or Asian Studies? 

Please let me know your thoughts. Thank you."
Help Me!!!,https://www.reddit.com/r/UNC/comments/1fhjdz6/help_me/,1,0,2024-09-15 18:25:15,"Okay Reddit, I’m asking for your help. I am currently a biology and environmental health major. I live off campus (my parents pay my rent) and my tuition is covered via scholarship. But I need to pay for groceries and utilities, which is probably about ($700/month). I work in a lab (20 hrs)(which does not pay me). And I also have a job at fast food place, which I work on weekends (20hrs). On top of all this I also take 15 credit ours in stem. I have realized I cannot work at Wendy’s because I simply do not have the time to study. But, I also need money so I can like eat and survive. Idk what to do. Pls someone suggest like jobs that are more manageable with studying, such as like a desk job or something idk. Pls help."
UNC Rug! ,https://i.redd.it/6p8q5hs4pood1.jpeg,101,6,2024-09-14 02:15:45,"Hey just wanted to share my handmade custom tufted UNC Rug! Makes a perfect a addition to any UNC fan cave. Unfortunately this one is already sold, but I would be happy to make another! For any questions go to my instagram @919.rugs !"
My iPhone battery is swelling and it won't turn on. Does anyone know of any phone repair shops that will replace the battery? ,https://www.reddit.com/r/UNC/comments/1fgo26l/my_iphone_battery_is_swelling_and_it_wont_turn_on/,10,6,2024-09-14 15:01:55,Does anyone know of any phone repair shops that will replace the battery? I went to the apple store already and they said they can't replace it lol. So I'm wondering if any local repair shops will. At least it doesn't hurt to keep asking.
Does anyone go to the gym around 9:30pm-1am?,https://www.reddit.com/r/UNC/comments/1fgd1xf/does_anyone_go_to_the_gym_around_930pm1am/,8,4,2024-09-14 03:22:48,"I was wondering if anybody goes to planet fitness or gold gym around this time, and if so if I could carpool to them. "
Bell tower climbs,https://www.reddit.com/r/UNC/comments/1fglylm/bell_tower_climbs/,1,0,2024-09-14 13:23:15,When are they starting the bell tower climbs back up before the football games?
