title,url,score,num_comments,created_date,selftext
"CHEM 261 + 241L in SS1? Too much, manageable, thoughts?",https://www.reddit.com/r/UNC/comments/1gif81v/chem_261_241l_in_ss1_too_much_manageable_thoughts/,4,5,2024-11-03 04:38:17,"I've heard Chem 261 itself is too much. My current/potential scheduling is as such

**spring 25**: chem 241 (didn't get lab) | **fall 25**: chem 262/L

2 options:

**SS1 25:** chem 261+241L | **fall 25:** chem 262/L

**SS1:** 241L + maybe gen ed | **fall 25:** chem 261 | **spring 26:** chem 262/L

**please lmk thoughts**/tips; anything is extremely appreciated

additional details: premed, pre-nutr, freshman"
ISO BeAM Wood Shop Partner,https://www.reddit.com/r/UNC/comments/1ghwfn5/iso_beam_wood_shop_partner/,8,6,2024-11-02 13:28:10,"As a 30-something research staff and alum, I'm having a hard time finding folks who have interest in using the makerspace with me on a regular basis. It's not sustainable depending on the BeAM staff to babysit me in the wood shop... it's a waste of their time, and they have students who need real assistance as opposed to me who is comfortable with all the tools.

Is anyone looking for someone to meet up with and do projects? We don't have to be friends, but sometimes it's nice to have an extra set of hands and brains in there anyway. 

Drop a comment if interested!"
"Please Note: Mail-In Ballots Must be RECEIVED by Election Day (not Postmarked by Election Day). If you have not sent back your mail in ballot yet, it is best to hand return it to an early voting site or county board of elections.",/r/NorthCarolina/comments/1gh2b76/please_note_mailin_ballots_must_be_received_by/,35,0,2024-11-01 13:33:52,
are CCI printers down? ,https://www.reddit.com/r/UNC/comments/1ghb6dj/are_cci_printers_down/,5,1,2024-11-01 17:39:22,Ive been trying to print out my notes for an open note test I have today but it keeps saying failed. is this something with my account or are the printers having issues? and does anyone know where I can print things out without having to use a CCI printer? 
Not registered to vote in Orange County? It's not too late!,https://www.reddit.com/r/UNC/comments/1ggtgfw/not_registered_to_vote_in_orange_county_its_not/,46,2,2024-11-01 00:37:53,"It's *not* too late to register to vote here, but the early voting period is the **last** chance to register to vote in Orange County if you've lived here for at least 30 days! Cannot be done after 3pm on Saturday. Here are some specifics that will hopefully help you if you're not sure where to start:

The closest early voting site to campus is Chapel of the Cross on East Franklin, across the lot from the Planetarium. 304 E. Franklin St -- [all early voting sites in Chapel Hill/Orange County](https://www.orangecountync.gov/3013/Early-Voting-Wait-Time-Tracker) are open Friday from 8am to 7:30pm and Saturday from 8am to 3pm.

Bring proof of residence with you -- if you live on campus, UNC has already provided the county with your address, so your physical (not mobile) OneCard is proof enough! Otherwise, a utility bill, bank statement, or [anything else listed here will work as proof of residence.](https://www.ncsbe.gov/registering/how-register/register-person-during-early-voting) Also bring an ID -- a physical OneCard will also work for this! If you don't have a physical UNC OneCard, [these will also work.](https://www.ncsbe.gov/voting/voter-id#acceptable)

You can just show up at an early voting site (again, before Saturday at 3pm) and tell the election worker at the check-in station that you'd like to same-day register and vote. You'll be guided to the help desk, and an election official will guide you through the process. After you're registered, you can immediately turn around and vote!

Consider going tomorrow; if something goes wrong, you can go back on Saturday before 3pm and fix it!

Hope this helps -- Happy Halloween!"
UNC application portal residency question ,https://www.reddit.com/r/UNC/comments/1gh99di/unc_application_portal_residency_question/,2,7,2024-11-01 16:18:13,"So in my UNC application portal, it says ""You are currently classified as a non-resident. If you would like to apply for reconsideration or appeal of your NC Residency determination, please visit the [NC Residency Reconsideration or Appeal](https://mycarolina.unc.edu/register/resappeal?sys:id={{Prospect-ID}}&person={{Prospect-ID}}) form."" but I am a resident of NC. I already put in my Residency Certification Number (RCN) when I initially submitted the app but it thinks im not a resident right now? So, I clicked on the reconsideration of appeal form and just typed in my RCN again. Is this all I have to do? and wait until it updates my status to a resident of nc?"
Students: Please be sure to vote!,https://www.reddit.com/r/UNC/comments/1gge5e3/students_please_be_sure_to_vote/,169,34,2024-10-31 13:11:01,"Vote early even! Every vote counts and especially in a state like NC. 

Recognizing there are a limited number of out of staters at UNC…but you can and should still vote in NC. It is your right and your civic duty to vote. So make it count!"
Any Pokémon Go player on campus?,https://www.reddit.com/r/UNC/comments/1ggqpps/any_pokémon_go_player_on_campus/,5,2,2024-10-31 22:21:19,Any Pokémon Go player on campus? Trying to get someone to walk and do raids together. 
couldn’t get engl 105 as a freshman,https://www.reddit.com/r/UNC/comments/1ggox16/couldnt_get_engl_105_as_a_freshman/,4,8,2024-10-31 20:58:50,what should I do now
Survivor advanced screening,https://www.reddit.com/r/UNC/comments/1ggjf9g/survivor_advanced_screening/,8,5,2024-10-31 17:01:35,"I missed out on registering for the survivor screening Saturday, could anyone tell me who goes home Saturday and what guests they have?? I’m a super fan and cannot wait a whole week to know. Ty from a broken hearted UNC student "
Thoughts on freshman schedule?,https://www.reddit.com/r/UNC/comments/1ggo11u/thoughts_on_freshman_schedule/,3,1,2024-10-31 20:19:03,"I couldn't get into chem 101 😭

https://preview.redd.it/kscynaqih5yd1.png?width=1582&format=png&auto=webp&s=f77bc86b7eb7cd00eed4b1e4f3c717511c3b5a3e

"
How bad is this?,https://i.redd.it/gabag352l4yd1.jpeg,6,11,2024-10-31 17:18:26,
Work Study for Spring 25,https://www.reddit.com/r/UNC/comments/1ggrdon/work_study_for_spring_25/,1,1,2024-10-31 22:54:19,"Hey all. I have been abroad this semester and have a question regarding work-study. If a professor listed a research position in July and it is still there, does that mean the position is still open or is it more likely that they just forgot to take it down? Thanks!"
BIOL 631 workload,https://www.reddit.com/r/UNC/comments/1ggh7gd/biol_631_workload/,2,0,2024-10-31 15:26:32,"I'm a junior bio major signed up for advanced molecular bio (BIOL 631) along with BIOL 445 (cancer bio) next semester. I couldn't find a syllabus online and it's a grad-level course, so I'm not sure of the workload.  To anyone who's taken this class, how was the workload?"
How much are you paying in rent for an off-campus apartment?,https://www.reddit.com/r/UNC/comments/1ggdu15/how_much_are_you_paying_in_rent_for_an_offcampus/,3,10,2024-10-31 12:56:05,"Curious what the ranges in price/month are for folks who live off campus but within walking/biking distance to Franklin? My daughter is wanting to rent a 4BR with some friends at Union Chapel Hill complex on Hillsborough Street for next year. Her room quote rate is $1300/month for 12 months.

I'd feel better about the price if I knew that sub-letting the 2 wasted summer months was likely, but I'm guessing there is a glut of sub-let inventory over the summer and that she'd be lucky to get half the rent back if she found someone to sub-let for June & July.

What's everyone paying in rent who lives reasonably close to Franklin Street?"
MATH 233 Midterm 2,https://www.reddit.com/r/UNC/comments/1ggiyga/math_233_midterm_2/,1,1,2024-10-31 16:41:11,"I have rosansky and he has not prepared us at all for midterm 2, does anyone have notes, studyguides, or practice problems from other professors or recitations that they can send me to study? "
Advice on classes as a new Stats major switching from Chem?,https://www.reddit.com/r/UNC/comments/1gg7u99/advice_on_classes_as_a_new_stats_major_switching/,3,4,2024-10-31 06:03:21,"Currently a sophomore transfer student and recently switched to the Stats major... does this schedule seem feasible for someone who has never really done much with math/stats other than a few chemistry classes? It's about 17 credits, and I'm worried it might be too math heavy... thoughts?

COMP 110 or 116  
MATH 232  
STOR 155  
SOCI 101  
ECON 101"
Thoughts on my weird schedule for next Spring,https://i.redd.it/yq1ws6sz1zxd1.jpeg,7,21,2024-10-30 22:42:38,"Junior year Enviromental Science Student rn.
Ive kinda taken all of my courses out of order because I transfered in as a sophmore.

Chem 403 sounds incredibly interesting, but it requires orgo as a co requisite, which happens to also be an optional course for my major.

 I pretty much need to take a math course every semester if I want to graduate by 2026, so I cant change that.

Its gonna be a long Tues and Thurs, but essentially a 4  day weekend  is going to be amazing.

Im at 13 credits right now, but I probably wont add another class. 

Does this look manageable? 
"
Easy Focus Capacities,https://www.reddit.com/r/UNC/comments/1gfwuk1/easy_focus_capacities/,5,3,2024-10-30 20:46:19,"I transferred into UNC this semester as a sophomore in the BME program and still have a majority of my focus capacities to complete. Do you guys have any recommendations of classes that you’ve taken in the past that aren’t much work outside of the lectures? I’m fine with mandatory attendance and showing up to class but I’d prefer to not have much work outside of that. I still need to complete the Aesthetic, Values, Global, and Power capacities. Thanks"
Spring 2025 Private Room Sublease!,https://www.reddit.com/r/UNC/comments/1gfo65p/spring_2025_private_room_sublease/,11,0,2024-10-30 14:42:18,"https://preview.redd.it/o5kmsrrrnwxd1.jpg?width=4032&format=pjpg&auto=webp&s=37b5990bd8df0daa5725454a4186194446cbda96

https://preview.redd.it/v5sfijdunwxd1.jpg?width=4032&format=pjpg&auto=webp&s=e5d0af431a4c1c3cfc35f047b9908295b1254852

https://preview.redd.it/5xdc4905owxd1.jpg?width=4032&format=pjpg&auto=webp&s=4346abde1e78356bf3729f1956db7107a5e70941

https://preview.redd.it/vg7j2sp6owxd1.jpg?width=4032&format=pjpg&auto=webp&s=c34b0e5a4485dab9b5cc858b1a7289cee8cab6d6

4 bed, 2 bed apartment spring '25 sublease! Must be okay living with a (really cute) cat!  
  
Howell St, Chapel Hill, NC, 27514  
  
Rent is $800/month + utilities. Merritt's Grill area - it's a 20 minute walk from the hospital, and a 5 minute walk to the closest bus stop. The bus in to campus is about 5 minutes and super easy! Free parking + bike rack and an outdoor shed.  
  
The room + apartment is fully furnished, I will take down decor/personal items so you can make the room how you would like! Apartment has a washer/dryer, dishwasher, air fryer, microwave, oven, and Roku.   
  
The space is incredibly peaceful. We have huge windows that let in a lot of light and have a great view of the forest. Private front porch with a couch and chair to watch the birds. The brick floors are beautiful, and you can often find Clementine stretched out on them.   
  
Would be living with three other 3rd year girls. They are lovely, very clean, and sweet people.   
  
Please reach out with any questions! :)"
any easy fc quant classes with very little math? ,https://www.reddit.com/r/UNC/comments/1gfogtf/any_easy_fc_quant_classes_with_very_little_math/,3,11,2024-10-30 14:55:28,I need 1 more quantitative reasoning class that's not used for my psych major (I've already taken stats and I took math 231 in high school dual enrollment) but I hate and am terrible at math. does anyone know any classes that can fill the requirement that I won't fail lmao 
ECON 410 to 420,https://www.reddit.com/r/UNC/comments/1gfxmxg/econ_410_to_420/,1,2,2024-10-30 21:19:38,"I currently have an A in Econ 410; however, it doesn't feel like I fully understand everything. Does Econ 420 build off of 410 in any way? Or is everything totally new?"
BIOL 445 with Shemer or BIOL 546 with Ahmed,https://www.reddit.com/r/UNC/comments/1gfn0ln/biol_445_with_shemer_or_biol_546_with_ahmed/,3,0,2024-10-30 13:51:30,"Has anyone taken BIOL 445 with Dr. Shemer or BIOL 546 with Dr. Ahmed? I'm considering both courses and would love to hear any insights. How are the workload, difficulty, and overall experience in each?"
MAC online program vs in-person? ,https://www.reddit.com/r/UNC/comments/1gfomcm/mac_online_program_vs_inperson/,2,0,2024-10-30 15:01:58,"
Has anyone here done the online MAC program? Online would save me more $$$ since I have classes from undergrad that I would place out of. Just curious if it’s a bad experience doing it online. Everything I can find on their website makes it look like a robust online program with a good balance of asynchronous and live zoom classes. The idea of living in chapel hill for a year and going back to school in person after working for a couple of years isn’t super appealing, not sure how I’d fit in with people fresh out of undergrad. Admissions counselor told me that in-person has around 70% of students coming straight from undergrad at UNC so not as diverse as I was hoping for. "
Spring 2025 Schedule,https://i.redd.it/r22lzddkhwxd1.jpeg,2,3,2024-10-30 14:04:34,Does this seem like a manageable schedule? I’m a Psychology & Neuroscience major. Any tips for some of these classes?
Prerequisite registration ,https://www.reddit.com/r/UNC/comments/1gfmi7o/prerequisite_registration/,2,3,2024-10-30 13:27:35,"Can I sign up for a spring course that has a prereq which I am currently taking in the fall? I tried today and I wasn't able to register, but what about once grades finalize in January? Can I not sign up for it then because I'd have completed the prerequisite?

Edit: Hey guys, I went to drop in session with an advisor and basically I CAN sign up in the Spring with a prereq in the fall. The first lady I asked just straight up lied to me for no reason. Thank you all for the answers!"
I'm so confused about reserved classes...I am literally a psych major ,https://i.redd.it/s3nk0l4unqxd1.jpeg,22,7,2024-10-29 18:29:02,does anyone know what it's saying that I don't meet the reserved requirements for these psych classes when I'm a psych major? 
Rejected from CSTEP ,https://www.reddit.com/r/UNC/comments/1gf78nv/rejected_from_cstep/,9,30,2024-10-29 22:21:22,"So I just received my decision that I was rejected from the CSTEP program. I’m pretty bummed about it but I keep reminding myself that I still have another chance to apply in April. The only thing is I don’t have much time or access or extracurricular activities right now but I can join clubs at my community college if it’s via online meetings and I’m sure I can find some. Other than that I don’t know what to exactly do so I can build my new application, I am a freshman at my CC and I of course used my high school stats when I applied. My extracurriculars I feel were pretty good, I did an internship and got a little bit of volunteer hours and I also joined a club my last year of high school and got good hours in for that too. I feel the main reason I may have not gotten in was because I did pretty bad my senior year and kind of slacked of a lot ( I barely passed a couple of my classes and opted out of taking some exams) I did explain the reasoning in my application. However, I am very confident in my grades this semester and I know my GPA will be likable (side note: since i’ll be applying to the program again in spring, I will most likely be using my fall GPA, correct?) I’m just not sure what to do at this time to help my application. My question is for those who have gotten rejected from the program, reapplied and got in (or anyone who can answer), what did you do to help your application during that time between the two application waves and did you rewrite both essays? because I’m hoping to recycle mine and did you have to find new recommendations? 
"
What biochem class is correct- premed,https://www.reddit.com/r/UNC/comments/1gfe7o6/what_biochem_class_is_correct_premed/,3,4,2024-10-30 04:10:46,"Hey all, premed here. What is the correct biochem course to register for as i am not quite sure?"
Nursing Application,https://www.reddit.com/r/UNC/comments/1gffbp9/nursing_application/,2,1,2024-10-30 05:22:40,"Hello, I am just looking for some insight on anything I could possibly do to increase my chances of admission to the nursing program. My prerequisite GPA is on track for a 3.9-3.8, I have helped start club on campus relating to healthcare (also elected for an executive position for said club), I am taking my CNA skills exam Friday, and have various other volunteering experiences in many different fields. Any tips/ help would be greatly appreciated."
Halloween Reading Event Tomorrow ,https://i.redd.it/ay65rvht4qxd1.jpeg,18,0,2024-10-29 16:42:26,Please attend Poe by Candlelight tomorrow evening at 10:00 on the Top Floor of New East. We will be reading from the works of the great macabre poets. 
are my chances hurt significantly by applying ED? ,https://www.reddit.com/r/UNC/comments/1gfhb13/are_my_chances_hurt_significantly_by_applying_ed/,1,12,2024-10-30 07:55:48,UNC wasn't on my radar until recently when my talking with my counselor and some friends a few days ago. I am out of state for computer science how much were my chances hurt by not applying ea? I heard a lot of spots fill due to ea.
Looking for Spanish-Speaker,https://www.reddit.com/r/UNC/comments/1gf0uw3/looking_for_spanishspeaker/,8,2,2024-10-29 17:53:35,"I am a first year at UNC, and Spanish is my first language. However I fear that the continuous use of English in classes and daily life could dampen my speaking, writing, and comprehending abilities. I am writing to ask if anyone knows a or is a Spanish speaker who I can have chats with on the daily through phone or some other convenient mean for the both of us. A Spanish conversation club could also do, but please no Latinx heritage/culture type clubs. 

Thanks!"
easy COMP electives,https://www.reddit.com/r/UNC/comments/1gf0upk/easy_comp_electives/,4,3,2024-10-29 17:53:21,\^\^\^ (I mean like super easy)
Lightwork?,https://i.redd.it/0f44ahxttqxd1.jpeg,5,21,2024-10-29 19:02:38,
Spring semester course advice ,https://www.reddit.com/r/UNC/comments/1gf4qwa/spring_semester_course_advice/,3,11,2024-10-29 20:34:14,"Hello!  I’m a biology major and a neuroscience minor on the pre med track.  For next semester, I’m hoping to take chem 102 and biol 105.  I’m also hoping to take another stem class but not sure which one.  Right now, I’m thinking about either stor 120, biol 104, phys 114, nsci 175, or math 233.  I would greatly appreciate any advice or suggestions!  Thank you so much! "
Recommendations to fulfill focus capacities,https://www.reddit.com/r/UNC/comments/1gf7la6/recommendations_to_fulfill_focus_capacities/,2,2,2024-10-29 22:37:06,"Hi! Does anyone have any class + professor recs to fulfill these focus capacities!?

\- Engagement with the Human Past

\- Global Understanding and Engagement

\- Power, Difference, and Inequality

Thanks in advance!"
Housing group selection question ,https://www.reddit.com/r/UNC/comments/1gezvc4/housing_group_selection_question/,3,0,2024-10-29 17:12:31,"I have a group of four people that are looking to get into a suite together, what spots tend to fill up the fastest? Our ideal option is a four person suite in Hardin, is that unrealistic? We are also happy with an eight person. We have a junior by standing in our group, so that would be our earliest window. Any advice on the process in general would also be appreciated. "
POLI 400 Classes,https://www.reddit.com/r/UNC/comments/1gf2sbw/poli_400_classes/,1,0,2024-10-29 19:12:50,"Can any Political Science majors tell me which POLI 400 classes are best to take. I already took one but I've been told that 400 classes are easier than some 200 classes like 272. I wanna take POLI 411 or 432-- any thoughts on these?

"
ARS housing accommodations?,https://www.reddit.com/r/UNC/comments/1gettcy/ars_housing_accommodations/,2,3,2024-10-29 12:50:32,"I’m currently registered with ARS and have accommodations for priority registration, extended testing time, etc. and I was wondering if priority housing selection is an accommodation I can ask for? I’ve already filled out the priority housing application but I’m scared of having a late appointment and not getting on campus housing. If priority housing selection is an accommodation I could apply for could y’all let me know where to reach out? Thanks! "
Global Language Requirements for Graduation,https://www.reddit.com/r/UNC/comments/1gemnm0/global_language_requirements_for_graduation/,6,5,2024-10-29 04:42:31,"As we all probably know, we need three semesters (or transfer credit equal) of a different language to graduate. I'm going to be frank. I'm in Spanish, and it's not going too hot. If I get a D or a D+, will I still be able to graduate? Keep in mind that these language classes are not part of my major or minor, so I don't know if a prerequisite grade is required. In summary, will a D/D+ count toward my global language requirement, or will I have to retake the class?"
Is nc fellows worth it? ,https://www.reddit.com/r/UNC/comments/1gemm2h/is_nc_fellows_worth_it/,4,0,2024-10-29 04:39:39,"Hi, 
I am a freshman and I am considering applying to NC fellows program this semester. I want to major in Biomedical engineering and be pre med as well. I was wondering how is the nc fellows program? Is it worth it? Any info would be greatly appreciated! 

Thanks a lot! "
Join the CAER Study!!,https://i.redd.it/ocvqcwx6xixd1.png,12,8,2024-10-28 16:27:13,"Hi! My friend is conducting a research study and asked me to post about it!

Anyone can participate. You would complete a 1 hr survey and have the chance to win a $50 gift card. The flyer has all the information. DM me if you have questions.

Follow this link to receive the survey link: https://unc.az1.qualtrics.com/jfe/form/SV_8k4qYmjfrwyQdP8?Q_CHL=qr "
Opinions on my Schedule? (2nd Semester FY) ,https://www.reddit.com/r/UNC/comments/1gee31i/opinions_on_my_schedule_2nd_semester_fy/,4,9,2024-10-28 21:43:37,"https://preview.redd.it/h7z29rxzdkxd1.png?width=1674&format=png&auto=webp&s=81009527bbe48b66f3ba97c731b5772d878c2e77

Hi! I'm a first year bio major and trying to start working on degree requirements any recommendations on my schedule?  

I don't know why the professors aren't showing up but it's  
\- Pyhs 114 -  Duane Deardorff, Rosa Branca

\- Comp 110 - Izzi Hinks

\- Biol 104 - Jordan Claytor 

\- Biol 105L - Don't know the TA yet"
Photographer on Franklin?? For headshots ,https://www.reddit.com/r/UNC/comments/1geaknl/photographer_on_franklin_for_headshots/,6,0,2024-10-28 19:17:33,"Hi, do you know any place on Franklin for id photos/ headshots?? Thanks for recs! "
Does anyone know anything about this sweet cat?,https://www.reddit.com/gallery/1gdjc5p,317,12,2024-10-27 19:39:53,"He had a little insulated house and some water. I gave him kibble and a couple treats. I hope he's able to stay warm and healthy, he was really sweet and friendly <3"
Easy seminars classes? Advice needed! ,https://www.reddit.com/r/UNC/comments/1geapvx/easy_seminars_classes_advice_needed/,4,0,2024-10-28 19:23:41,"Hi, can you please recommend any easy seminar classes? I’ll be taking 3 stems next semester and I still need to take a seminar. What are some chill, low-effort, easy-A seminars? 

Thank you! "
Should I take COMP 283 or COMP 381?,https://www.reddit.com/r/UNC/comments/1geej9k/should_i_take_comp_283_or_comp_381/,2,1,2024-10-28 22:02:35,"COMP 283 with Professor Goodwin or COMP 381 with some other professor

If anyone could offer some insight about Professor Goodwin that would be great (there is nothing on rmp)

I want to take the class that will benefit me the most in my comp sci career. Thanks!"
Who should I take Math 381 with?,https://www.reddit.com/r/UNC/comments/1ge9822/who_should_i_take_math_381_with/,3,6,2024-10-28 18:23:01,"Hey, y'all. I'm taking Math 381 next spring and was wondering who I should take it with. I would greatly appreciate it if you had any experiences with the following teachers.

\-Philip Tosteson

\-Emily Burkhead

\-Joseph Compton

\-Daping Weng

\-PRAKASH BELKALE

\-SHRAWAN KUMAR

\-David Rose"
MATH 347 with Caroline Moosmueller/CS Schedule,https://www.reddit.com/r/UNC/comments/1gedxof/math_347_with_caroline_moosmuellercs_schedule/,1,1,2024-10-28 21:37:18,"Has anyone taken this class with her? She has pretty good RMP ratings but I wanted to get some firsthand responses. I would be taking it alongside COMP 311 and COMP 590 (Software Engineering). Any COMP majors who could chime in about the feasibility of this schedule, I would very much appreciate it. "
EMT COURSE,https://www.reddit.com/r/UNC/comments/1geb7rz/emt_course/,1,4,2024-10-28 19:44:10,"Hiii, i was planning on taking the ACERIP course on campus spring semester but I am a little nervous about the finances. I could technically take the course at Durham Tech but would have to bike 20ish min to my car then drive 20ish minutes there. I have also heard that durham tech doesn’t disclose the full on price of it, even after I went to the info session. Does anyone have any particular suggestions on which one? "
