title,url,score,num_comments,created_date,selftext
Need alternative major recs (rejected from b-school),https://www.reddit.com/r/UNC/comments/1g5d7y2/need_alternative_major_recs_rejected_from_bschool/,11,18,2024-10-16 23:30:36,"im particularly interested in business admin/general management. my original plan for post-grad was to become a project manager. i just love managing people and projects as well as event-planning. 

any suggestions would be great!"
Fall break traveling ,https://www.reddit.com/r/UNC/comments/1g5gww7/fall_break_traveling/,3,2,2024-10-17 02:43:08,Is there anyone going to the airport (RDU) tomorrow morning around 8:30AM? Or is anyone going to from the airport back on Oct. 19 at around 9PM? I want to share a ride
German @ unc?,https://www.reddit.com/r/UNC/comments/1g5blkp/german_unc/,7,5,2024-10-16 22:12:27,"can anyone who’s had experience with the German dept here share their experience, im thinking of taking German next semester :)"
Off campus housing,https://www.reddit.com/r/UNC/comments/1g54fxu/off_campus_housing/,14,17,2024-10-16 17:05:44,Hi! So I am a freshman looking for off campus housing next year. Can any upperclassmen share what apartments complexes they live at or what they recommend? (Preferably already furnished)
Hall vs Suite,https://www.reddit.com/r/UNC/comments/1g5cntq/hall_vs_suite/,5,3,2024-10-16 23:02:46,"Hey! i'm trying to choose between hall suite style, or suite. If you could give me any experience of yours would be nice. Thanks!!!!!"
Advice regarding fall 2025 prospective transfer,https://www.reddit.com/r/UNC/comments/1g5e6vr/advice_regarding_fall_2025_prospective_transfer/,3,1,2024-10-17 00:19:19,"Hi all,

I am currently a sophomore a small liberal arts college in Massachusetts. Originally from PA, I am looking to make UNC my home for my final 2 years of school. I am a sports journalism major currently and do not have an intention to change that, so I would love to transfer into Hussman. I just want to make sure my application is as strong as possible, hence why I’m jumping into this process early. I currently have a 4.0 and will do everything I can to make sure that doesn’t change by the end of the academic year. I would love any and all advice on how to give myself the best chance, as I’ve heard out of state transfer admission is super elusive. Thanks guys!"
LSAT Tutor,https://www.reddit.com/r/UNC/comments/1g4wyef/lsat_tutor/,3,0,2024-10-16 11:19:59,"I'm a UNC (undergrad, grad, law) graduate with over 20 years of experience teaching and tutoring the LSAT and have openings for new students currently.  I started teaching for Kaplan in 2002 while I was applying to law school and after graduation I moved to NYC where I took a full time job as the national LSAT Product Manager for Kaplan - I have over 20 years of experience as a LSAT teacher and tutor, much of it full time.  I'm admitted to the bar in NY and NC (moved back in 2010) and currently do LSAT tutoring and bar exam prep.

Without too many boring details, I'm offering tutoring sessions at a much lower rate than what you'll pay if you go through a big prep company - with way more experience, no need to buy a huge package of hours, etc - I know the LSAT inside and out, have written countless explanations, designed and revised courses, etc.  I'd go head to head with anyone else around in terms of my knowledge and understanding of the course, and I've worked with many thousands of students over the years.  My approach is to work smarter, not harder, on what is a very learnable skills test.

I'm currently offering remote (preferred) and in-person tutoring.  My base rate is $75/hour for a two hour session, and I generally work between 12 and 6 pm, Tuesday-Saturday.  Remote is over FaceTime or Google Meets, and in person is generally at a Starbucks or similar location around the Southpoint area (I usually don't travel, so I can spend my time tutoring instead of in the car, but this could be negotiated if need be). 

If you're interested, please email me at julielamberth @ [mac.com](http://mac.com) (without the spaces - trying to not end up on mailing lists) with questions, availability, etc."
Teaching Licensure,https://www.reddit.com/r/UNC/comments/1g55qdp/teaching_licensure/,1,8,2024-10-16 17:59:36,"Is there a program at UNC other than BEST that gives teacher licensure?

Are there any licensed teachers who went to UNC who can help me? 

I'm stressing because I need my license by May 2029 but I graduate with a bachelor's in May 2028. I'm not sure where to look for future licensure programs "
Italian 333,https://www.reddit.com/r/UNC/comments/1g4n7e2/italian_333/,5,0,2024-10-16 00:50:22,Has anyone taken ital 333? What are your thoughts and who did you take it with? TIA
Test-optional confusion / not sure if I should include.,https://www.reddit.com/r/UNC/comments/1g4p8if/testoptional_confusion_not_sure_if_i_should/,2,3,2024-10-16 02:36:24,"I'm not totally clear on how an omission of test scores is viewed from the perspective of admissions. I'm going to transfer to UNC after 1 year at UMN. UNC is test-optional for transfers. I have a 5 on the AP Gov, which I will probably submit, but my ACT is a 30 and my SAT is a 1390. This is literally right at the bottom of the[undergrad average stats](https://admissions.unc.edu/explore/our-newest-class/). I am currently doing a 7 month internship in Guatemala at a small healthcare and education nonprofit so that will probably help, but will adding my test scores ""cancel out"" the internship, add more, or do nothing? Does *leaving them out* tell the admissions officers that I must be below the averages, even if I'm not?

TLDR, I need help deciding whether adding ACT/SAT will hurt me, help me, or do nothing. My ACT is a 30, my SAT is a 1390, and the averages for UNC are 29-34 ACT and 1390-1520 SAT"
MATH 231,https://www.reddit.com/r/UNC/comments/1g4n57x/math_231/,2,3,2024-10-16 00:47:09,Elizabeth Mclaughlin vs Miranda Thomas. Who should I pick?
Which CS undergrad courses specifically use Visual Studio IDE?,https://www.reddit.com/r/UNC/comments/1g4h2hs/which_cs_undergrad_courses_specifically_use/,3,4,2024-10-15 20:08:17,"I've been working on a research project and wanted to enquire about the CS and data science courses that specifically use ""Visual Studio"" (not Visual Studio Code). So far, I've only come across COMP 110. If you're aware of any other courses that require students to use Visual Studio IDE, I would appreciate any suggestions!"
What classes should I take my first semester at Kenan-Flagler?,https://www.reddit.com/r/UNC/comments/1g4g7h4/what_classes_should_i_take_my_first_semester_at/,3,0,2024-10-15 19:31:40,"Hi! I am a current sophomore about to register for classes for the Spring. What core Busi classes should I take, and with who? How many Busi classes should I take in one semester?  Are there any professors to avoid? (also I have all my gen ed's done, and im Busi Admin with an emphasis in marketing btw.)"
Opinion on IDST Humans and the Cosmos (please🙏),https://www.reddit.com/r/UNC/comments/1g4hl4l/opinion_on_idst_humans_and_the_cosmos_please/,2,11,2024-10-15 20:30:17,"I’m looking into registration for spring 2025 and  IDST 122 (Humans and the Cosmos) looks pretty interesting. However, I’ve heard bad things about the class. If anyone has taken it before, if I put in a reasonable amount of effort into the class, will I be able to get an A in it? I just wanna make sure it’s not one of those classes where A’s are barely given. Thank you

Fyi, in the previous years, this course was called IDST 190 I believe"
Parking during Fall Break ,https://www.reddit.com/r/UNC/comments/1g49o48/parking_during_fall_break/,5,5,2024-10-15 14:56:58,Is parking free on-campus during fall break? 
Question About Class Load,https://www.reddit.com/r/UNC/comments/1g4b3cc/question_about_class_load/,3,4,2024-10-15 15:56:58,"I am a transfer student planning to double major. Because of that I had really wanted to do 15 credits a semester. I was a bit confused by connect carolina last semester and ended up with only 12. All my classes are humanities and I have had a ton of free time. I think I have spent a combined 10 hours on work outside of class. But they were all 100 series classes.

So, my question is if you think I would be OK taking 18 credit hours next semester to catch up? Or would I drown under the work load. 

I know all classes and profs have different work loads but I assume if all 4 of my classes are this light then the 6 I plan to take in the spring can't be too too much worse. Right?

A rough estimate based on your own experiences would be more than helpful.

thanks"
Looking for spring 2025 sublease,https://www.reddit.com/r/UNC/comments/1g45v31/looking_for_spring_2025_sublease/,1,2,2024-10-15 11:55:14,I’m a senior male looking to find a room to sublease from this coming semester (Jan-May). Wondering if y’all had any recommendations on where is best to look. 
Off campus housing sophomore,https://www.reddit.com/r/UNC/comments/1g3q4p5/off_campus_housing_sophomore/,9,12,2024-10-14 20:38:48,"Hey, I’m a Freshman at UNC considering off campus apartments for next year (2B, 2B). Lark is $1399/mo but comes fully furnished and has a bus shuttle. I’m hesitant because of the location as it’s not that close from Franklin/main Campus. Also, my roommate knows a guy that’s ready to transfer us the lease for a c square apartment, but it’s a 3B, 3B ($1600/mo unfurnished). Sophomores that live in Lark/Csquare, how was your experience? Do you think we should go for Lark and then get Csquare for Junior year?"
Rocketry at UNC,https://www.reddit.com/r/UNC/comments/1g3rwem/rocketry_at_unc/,4,1,2024-10-14 21:54:23,How many of you guys would be interested in joining a Rocketry Club at UNC if we were to start one (or know someone who would)?
Unlimited Meal Plan,https://www.reddit.com/r/UNC/comments/1g3msnr/unlimited_meal_plan/,8,2,2024-10-14 18:22:33,"How can you view how many swipes you have used if you have the unlimited plan?  Trying to figure out if my son should get a smaller block plan in the spring. He says he can tell how many plus swipes he used but isn’t sure how to see the regular swipes. 

Thanks!"
Applying to be an RA,https://www.reddit.com/r/UNC/comments/1g3m35k/applying_to_be_an_ra/,8,6,2024-10-14 17:53:38,"Hey guys, rising senior here, and I want to be an RA next year! If you were an RA at UNC within the past 10(ish) years, I would greatly appreciate any application tips/advice. Despite all the hate I see on here, I lived in Granville Towers my freshman year and absolutely loved it and would love to become an RA there. 

A few questions.... (feel free to answer any/all):

How competitive is it to become an RA? is RHA looking for a specific type of person? Is it hard to get the position at Granville Towers? Realistically, how much work did you have to do per week? What is the worst thing you've had to deal with as an RA? Could I live with a cat since its a single?   


TYIA!!!!💕"
Has anyone ever majored in *both* Info Science and Business? Is it even possible?,https://www.reddit.com/r/UNC/comments/1g3gt52/has_anyone_ever_majored_in_both_info_science_and/,4,9,2024-10-14 14:15:59,"HS Senior looking to apply to UNC. What I really want to do is Management Information Systems, which usually comes under a business school. But I was looking at the AOEs for Kenan-Flagler and they seem to be more focused on corporate finance.

A major that lines up pretty close to MIS is Info Science. But there's not a lot of business emphasis in the IS program. So, has anyone ever double majored in IS and Business? Is it even possible?

(Also, if I were to check off the Info Science and Business assured enrollment programs on my application and get into one of the programs, could I apply to the program I didn't get into at UNC while being guaranteed enrollment for the other?)"
Is this manageable?? Advice needed! ,https://www.reddit.com/r/UNC/comments/1g3hfu0/is_this_manageable_advice_needed/,2,2,2024-10-14 14:43:08,"Hey, I’m a freshman and I am going to apply for BME. I’m also pre-med. I am considering taking Physics 118, Calc 233 and Biol 103 together next semester. If I do so, I’ll only add one or two other easier courses. However, I am not sure how manageable it will be?

I have to take physics for sure as it is required to apply to my major. 

How hard is calc 3? I can switch it with Psychology 101 if it is going to be too hard otherwise. 

Btw I’m taking chem 101 and comp 110 this semester as my stem courses and I think I can manage a little more workload next semester. 

Any opinion will be greatly appreciated 🙏🙏 Thanks!! "
How to get into C-STEP,https://www.reddit.com/r/UNC/comments/1g376z9/how_to_get_into_cstep/,6,3,2024-10-14 03:32:35,"I am a wake tech student, and want to go to UNC for undergrad. what are some of the extracurriculars I should have and anything else that would help me get into C-STEP? What are some things that would hurt me in my application to UNC or C ste? "
Letters of recommendation are due when?,https://www.reddit.com/r/UNC/comments/1g33cjj/letters_of_recommendation_are_due_when/,2,4,2024-10-13 23:59:28,"Are the letters of recommendation due on the same day as the application or are they due on the materials deadline? I'm pretty sure they are due on the materials deadline but I've seen conflicting information...

Also when actually is the materials deadline??? This is stressing me out y'all 😭"
Opinions on BIOL 119,https://www.reddit.com/r/UNC/comments/1g2rmd2/opinions_on_biol_119/,3,18,2024-10-13 15:02:55,"Hi! I’m currently finalizing my schedule for next semester, and I was wondering if taking BIOL 119 was worth it. As a ✨neurotic premed✨ I’m a little worried about my clinical hours, and saw that BIOL 119 can help offer clinical experience/patient interaction. If anyone has taken the course, how is it? Would you say that it’s helpful? If not, any recommendations for other classes/things I could do?

Thanks! :)"
Where can I get free condoms? Asking for a friend,https://www.reddit.com/r/UNC/comments/1g2evof/where_can_i_get_free_condoms_asking_for_a_friend/,8,12,2024-10-13 01:31:34,Title
Band For A House Party,https://www.reddit.com/r/UNC/comments/1g2finb/band_for_a_house_party/,2,1,2024-10-13 02:09:10,If anyone is in a student band at UNC and has availability on November 1st message me. We’re looking to get a band that night for a Halloween party. 
Unable to drop classes through ConnectCarolina. Is it just me?,https://www.reddit.com/r/UNC/comments/1g2b1ic/unable_to_drop_classes_through_connectcarolina_is/,4,10,2024-10-12 22:03:30,"Hi I believe most of you received an email that says the drop deadline was extended to Oct. 25 (Normally the deadline is Oct. 11, yesterday). But today when I tried to drop a class online, it says I don't have the permission to do so. I emailed the advisor about this issue but I just want to get a quick concept of what is going on since they would only reply during weekdays. So has anyone encountered this issue so far or is it just me?

Edit: I checked with the school, they said it was a system glitch. They have now fixed it."
2 Free FB Tickets,https://www.reddit.com/r/UNC/comments/1g22ziq/2_free_fb_tickets/,8,1,2024-10-12 15:46:24,"UPDATE: The tickets have been claimed. 

2 Free tickets in section 104 for the GT game today to the first person that DMs. "
CHANCE ME - In state (am I cooked?) ,https://www.reddit.com/r/UNC/comments/1g2wu8c/chance_me_in_state_am_i_cooked/,0,24,2024-10-13 18:53:16,"Hi I'm a rising senior and I'm basically shi\*\*ing myself whether I can get into chapel or not

Weighted GPA: 4.43 ---- Unweighted GPA: 3.83 ----- SAT: 1390 (retook in october, waiting for score) --- rank 44/442---8 APs--11 DE--13 Honors-----

Location: Concord, NC, Cabarrus county

APs taken by the end of highschool: AP world, APUSH, AP Lang, AB calculus, AP CSP, AP CSA, AP Stats, AP psychology

DE taken by the end of highschool: MAT 141, MAT 241 (Calculus 2), CHM 151 (Chemistry), PHY 251 (physics), ART 111, ART 114, AST 151A, AST 151, SPA 111, POL-120, DRA-111

STEM related honor classes: Biology Honors, Chemistry Honors, Math 2 Honors, Math 3 Honors, Pre-calculus honors, drafting 1, drafting 2 engineering honors, drafting 3 engineering honors, and Python 1 honors

Activities: NASA research internship on discovering exoplanets, Two published research papers, electrical engineering research internship, Summer Ventures Research Physics Research Internship (120/2000+ selected), Founder/Co-president of free SAT/ACT preparatory club, Robotics (3 years), Distributing computers to those in need (205 volunteer hours), Assistant Coach for soccer camps teaching kids how to play soccer (140 volunteer hours), Math instructor teaching kids (Paid), and Captain of my soccer team

LORs: Physics professor from ECU, Drafting Engineering teacher, undergraduate Berkley student studying electrical engineering

Spanish two (B) (I know im dumb for this 😭)

Chemistry honors and pre calculus honors (B) (death of a close relative giving me depression while battling sleep apnea was giving me a hard time to do well in my two hardest classes, will say in my additional information section)

AB calculus (B)

Essay: experience of having six fingers

It might seem like im trying to get a ego boost but I genuinely wanna know what my chances are at chapel because it's been a dream for me to get into chapel😭"
Freshman year North campus—how was/is it? ,https://www.reddit.com/r/UNC/comments/1g22u8b/freshman_year_north_campushow_wasis_it/,6,5,2024-10-12 15:39:31,"For those who were freshmen IN THE LAST 10 years how was living on North Campus? Let’s assume you’re giving advice to someone who  wants to be social and make friends in their dorm, considering Greek life. "
How to see past professors?,https://www.reddit.com/r/UNC/comments/1g21tpg/how_to_see_past_professors/,3,5,2024-10-12 14:52:25,"I'm trying to find the name of a professor I had a few semesters ago. I looked on ConnectCarolina and Canvas but can't find anything. On ConnectCarolina/Tar Heel Tracker, it just says the class, the time, and my grade. And I can't see old classes on Canvas. Does anyone know if there's a place that lists the professors you've had with the classes?"
"Homophobia, sexism headed your way: don't give them a platform",https://www.reddit.com/r/UNC/comments/1g1i525/homophobia_sexism_headed_your_way_dont_give_them/,86,40,2024-10-11 19:36:58,"Howdy, Iowa State student here. Just wanted to warn you that there's a Christian fundamentalist group coming to NCSU and UNC October 28-30. They're the being-gay-is-a-sin, it's-women's-fault-for-being-raped type people. They'll yell offensive things in a public space to try to draw a crowd. Don't give them that. Don't post videos of them online either, it gives them visibility. I'm not even going to name the group because I don't want to give them a platform.

Do whatever you need to do. Just wanted to give you a heads up.

Happy coming out day!

Here are some useful resources about combating fundamentalism:

[https://pflag.org/resource/pao-howtostoparguingrecording/](https://pflag.org/resource/pao-howtostoparguingrecording/)

[https://religiondispatches.org/when-you-argue-with-a-fundamentalist-you-dont-know-what-youre-asking-for/](https://religiondispatches.org/when-you-argue-with-a-fundamentalist-you-dont-know-what-youre-asking-for/)

[https://www.repository.law.indiana.edu/cgi/viewcontent.cgi?article=1118&context=ijgls](https://www.repository.law.indiana.edu/cgi/viewcontent.cgi?article=1118&context=ijgls)"
Stadium Ticket,https://www.reddit.com/r/UNC/comments/1g22bs0/stadium_ticket/,2,0,2024-10-12 15:15:46,Anyone want a stadium ticket in the non-student section? 
Failed my first Calc 3 Midterm,https://www.reddit.com/r/UNC/comments/1g1hhpu/failed_my_first_calc_3_midterm/,31,18,2024-10-11 19:07:13,"Hey guys I'm a junior transfer and this is my first year at UNC. Just got my first Calc 3 midterm back and I got a 44/100. I was wondering if anyone had any good comeback stories for Calc 3, as I'm feeling fired up to get my shit together. My two midterms take up 25% and the final is a 50%, I'm taking Prof. Rozansky (fuck)."
BIOL101,https://www.reddit.com/r/UNC/comments/1g1s53i/biol101/,3,7,2024-10-12 04:13:28,"I need Bio 101 for my major, but I didn't take a ton of science in HS (bio, chem, APES), so I am kind of nervous. I have read pretty awful things about it at UNC, especially the lab. Should I take it at a community college instead? Is that allowed for a psychology major?"
Grad Student Senate passes no-confidence resolutions ,https://www.reddit.com/gallery/1g104in,247,111,2024-10-11 02:54:03,
Math 232 practice,https://www.reddit.com/r/UNC/comments/1g1p5bg/math_232_practice/,5,4,2024-10-12 01:17:11,"Hello!
I’m seeking for practice exams, past midterms/finals, and or any kind of problems that are helpful.  

Right now I have found some old exams, but I really hope to get some more. Any suggestions/recommendations would be much appreciated!!"
anyone want a free ticket to Saturday’s football game?,https://www.reddit.com/r/UNC/comments/1g1sdxd/anyone_want_a_free_ticket_to_saturdays_football/,2,0,2024-10-12 04:29:39,"You can just dm me either your phone number or email :) And for clarification, it’s a student ticket"
Gay Frat,https://www.reddit.com/r/UNC/comments/1g1e8q0/gay_frat/,13,11,2024-10-11 16:44:24,"I heard rumors of a gay fraternity on campus, anyone know anything?"
applying to hussman/b school as a junior,https://www.reddit.com/r/UNC/comments/1g1qkb9/applying_to_hussmanb_school_as_a_junior/,2,3,2024-10-12 02:38:14,hey guys! i’m a current sophomore who is unsure of if i want to continue pursuing medicine. (i am currently premed almost done with my mcat classes). i was thinking of adding on an advertising/marketing/business related major on top of biology. would it be too late to apply to hussman or kenan flagler as a junior next fall with no internships or business-related ec’s?
Thoughts on my spring 2025 schedule? ,https://www.reddit.com/r/UNC/comments/1g1ieal/thoughts_on_my_spring_2025_schedule/,5,7,2024-10-11 19:48:34,"https://preview.redd.it/7u8ysbi4l6ud1.png?width=2004&format=png&auto=webp&s=b2a5af22ebfc2565e8791da608d14edab835f4ed

Hi all, I'm double majoring in econ + stats with a minor in data science, and would love some input on how managable this schedule will be? Any advice is much appreciated, thanks :)"
BIOL 451 without PHYS 115?,https://www.reddit.com/r/UNC/comments/1g1o63x/biol_451_without_phys_115/,2,0,2024-10-12 00:23:19,"The professor said I'd be fine with only PHYS 114 as long as I review, but I wanted to see if anyone who's taken the class can tell me how much physics 2 content is used and if I'd really be fine with just a level 1 physics course."
UNC Questions!,https://www.reddit.com/r/UNC/comments/1g1kqk7/unc_questions/,2,3,2024-10-11 21:34:59,"Hi, I am an out-of-state student doing community college my first year, and I want to transfer to UNC next year (hopefully I get accepted). I just wanted to get your opinion on a few things:

1. How would you describe the financial aid? Does your GPA matter for scholarship opportunities? Are the financial aid packages decent enough to make you want to attend the school?
2. Lifestyle: Do you enjoy UNC? Is it boring? Are there things to do, parties, or activities? What do y’all do for fun?
3. Are the professors nice? Are the classes hard? Just wanted some of your opinions on this stuff. 😁"
Self-guided tour - accessibility?,https://www.reddit.com/r/UNC/comments/1g1gfe7/selfguided_tour_accessibility/,1,6,2024-10-11 18:20:07,"My kid is considering UNC-CH as a transfer student for Fall 2025. We tried to sign up for a campus tour, but everything is booked up through December. I'm an alumnus so I'm familiar with the campus. If I were to go and show her around, would be be able to access most of the buildings? I would want to show her the student union, bookstore, Lenoir dining hall, Davis and the undergrad libraries, and preferably Bynum Hall and the Media Arts space, since she wants to major in Communications.

I know that due to all of the gun violence, a lot of stuff is locked down now compared to when I attended UNC. Just wanted to see how much access we can have as visitors outside of a scheduled tour.

Thanks!

ETA: She wants to major in Communications but with a focus on film and television. She writes screenplays and is interested in the production side of the film business, so will probably choose a related minor, as well as internships in the film industry. We noticed that the Dept. of Communication has a Hollywood Internship Program, so that's pretty exciting. She's also looking at NC State. We visited UNC-W and didn't get a great vibe about it. She's also very interested in study abroad, and it looks like there are ample opportunities for that as well."
help please- rejected kf applicant,https://www.reddit.com/r/UNC/comments/1g11mb0/help_please_rejected_kf_applicant/,9,5,2024-10-11 04:21:21,"hey I got rejected from kf, I have a 2.3 gpa (I was dealing with some personal family issues that's why such a low gpa), I have good work experience and decent on campus involvement. I am very confused how I should prepare and do well to get accepted next year. please give any advice/suggestions you have, I know im in a bad state right now but I am willing to do better before next summer"
Course Schedule ,https://i.redd.it/zsgs8e1qi5ud1.jpeg,1,5,2024-10-11 16:10:35,"I’m in my sophomore year, and just changed from a Biol Major to EXSS but still on a pre-medicine track. I was hoping to have the least amount of credits possible as I would be doing the EMT course, my undergrad research, and work. I was wondering if this schedule is too stem heavy and would be a challenge?
"
