title,url,score,num_comments,created_date,selftext
Warning to UNC women!!,https://www.reddit.com/r/UNC/comments/1gw7es0/warning_to_unc_women/,128,17,2024-11-21 04:01:11,I was driving on South Columbia St and I looked over to see a man jerking off and staring at me. He was in a white boxy truck that made a bit of noise when driving. I did a double take and he was still staring and being disgusting. I realized he had pulled up to every light next to me from south campus past the hospitals all the way to the light near MLK but I didn’t notice he was staring and being weird til that last light. Please if you see this car or man try to avoid pulling up next to him. This was 11/20 at around 10:30pm 
"[HOUSING AVAILABLE] fully furnished, off-campus, mid dec'24 - end of jul'25",https://www.reddit.com/r/UNC/comments/1gwouow/housing_available_fully_furnished_offcampus_mid/,3,0,2024-11-21 20:05:37,"reason: exchange student leaving the us in dec, looking to transfer lease for the period written above.

property: union chapel hill

ㅤ

room availability: 2bed/bath in a 4bed/4.5bath apartment

\- included in apt: air conditioning, dishwasher, fridge, stovetop, microwave, oven, high-speed wifi, walk-in closet, laundry (washer + dryer)

\- key property amenities: elevator, fully-equipped fitness room, yoga room, trx, fitness on demand, private shuttle to campus, swimming pool, hot tub, sauna, billards, arcade games

\- other areas: tv lounge, indoor/outdoor lounge, fire pits, business center, study areas, clubhouse

\- leasing office also has weekly activities, including farmer's market, breakfast/lunch/dinner (e.g., full pizza per resident, taco tuesday, pie day), courtyard cookout



price: base rent is $1380, negotiable if lease is transferred before jan



personal note:

\- there are also lots of kitchen equipment in the apt that we bought (incl. saucepans & frying pans, sets of cutlery, kettle, etc.), we can leave them to you!

\- we also accept transferring the bedroom lease individually, so please reach out even if you're interested in only one of the rooms!

\- lmk if you're interested in seeing more pics of the flat / if you want to come over for a tour to check the flat and the property out!"
Parking Options for Commuters?,https://www.reddit.com/r/UNC/comments/1gwr9zl/parking_options_for_commuters/,2,1,2024-11-21 21:46:45,Me and my suitemates may have to live off campus next year and we may have to commute around 15-20 minutes to school. I know that there is most likely a low probability of us getting a parking pass for UNC as well. Does anyone have any tips for other parking options besides the school parking permit? 
Looking for a graduation stole ,https://www.reddit.com/r/UNC/comments/1gwjl76/looking_for_a_graduation_stole/,3,0,2024-11-21 16:38:48,"I'm graduating in a few weeks and have already purchased my cap and gowns. However, I'm looking for a stole to complete the look for some photoshoots. Any class of 2024 graduates willing to sell me your stole? can do any payment method and can pick it up from you if you are in the RTP area. DM me! Thanks!"
MSW from UNC or Columbia,https://www.reddit.com/r/UNC/comments/1gwmyme/msw_from_unc_or_columbia/,1,0,2024-11-21 18:49:12,I have been accepted into both UNC and Columbia’s online social work programs. I am torn between both and looking for advice. 
Can't enroll in class even though there are open unreserved seats?,https://www.reddit.com/r/UNC/comments/1gwhu4y/cant_enroll_in_class_even_though_there_are_open/,0,4,2024-11-21 14:41:47,"Error: You are unable to enroll in this class at this time. Available seats are currently reserved and you do not meet the reserve requirements. See class detail page for more information.

I want to change my STOR455 section from 02 the 9am one to 01 the 8am one. It says there's 4 open unreserved seats but I can't swap for some reason? I'm also have stats major and ds minor too so I don't understand why I can't get it. I'm on the waitlist now at number 5 for it."
Chemistry Launch,https://www.reddit.com/r/UNC/comments/1gw5tpf/chemistry_launch/,8,0,2024-11-21 02:39:55,I'm in a chemistry launch section next semester and I was just wondering if anyone knows how these classes differ from the normal chem sections. I registered for the chem launch so I wouldn't have to take an additional seminar class but I just want to know what to expect
odds of getting off waitlist?,https://www.reddit.com/r/UNC/comments/1gw95z1/odds_of_getting_off_waitlist/,4,1,2024-11-21 05:41:06,what are the odds of getting off the waitlist at position 19 with a class of \~120? it's at the perfect time but im not sure if that many people will drop the class. thanks!
Best water bottle fountain on campus? ,https://www.reddit.com/r/UNC/comments/1gw58ck/best_water_bottle_fountain_on_campus/,3,0,2024-11-21 02:11:18,Title 
Creep on bus,https://i.redd.it/mv0nibm67b2e1.jpeg,0,6,2024-11-21 19:49:39,"Anybody know this man? He looks like he works at some building on campus. He got on at the armory bus stop and was being creepy a.f.

There was plenty of open seating but chose to sit next to her.  He scooted so close to this woman and then was STARING at her and her phone. The woman was clearly uncomfortable. "
should i submit a 1360??,https://www.reddit.com/r/UNC/comments/1gw5kvg/should_i_submit_a_1360/,2,7,2024-11-21 02:27:58,i know it's 25th percentile but i don't feel good about it at all
carolina global launch,https://www.reddit.com/r/UNC/comments/1gw5dj4/carolina_global_launch/,2,3,2024-11-21 02:18:10,"hi! i was just wondering if anyone here has gone on the carolina global launch semester abroad? if so, what country were you in and what was your experience like? thanks in advance!! 🤍🩵"
"if you've maxed your transfer credits at UNC and retake a major requirement somewhere else, can you still graduate?",https://www.reddit.com/r/UNC/comments/1gvrjbg/if_youve_maxed_your_transfer_credits_at_unc_and/,5,3,2024-11-20 15:05:18,"I'm a graduating senior with enough credits to graduate and some classes that just transferred as electives, but still maxed my incoming credits. There is a class that due to extenuating personal and family circumstances has been very challenging, and I was hoping to re-take it over a winter-mester at a cc to still graduate. This is because retaking it as only 4 credits over the spring, I don't believe I would get financial aid, and would be financially out of reach. Is there any way to do this, or appeal for an incomplete? It's not a major specific class, but a quant requirement that is part of the major."
Did you get your summer credits posted to connectcarolina?,https://www.reddit.com/r/UNC/comments/1gw11rk/did_you_get_your_summer_credits_posted_to/,1,0,2024-11-20 22:45:25,"I took unc's study abroad in lse over the summer, I tooked the preapproved classes and my transcript was received by UNC in early september. I checked my connectcarolina today and the credits haven't been posted yet so I was wondering if anyone has received his yet?"
Math 523 vs Math 528,https://www.reddit.com/r/UNC/comments/1gvroty/math_523_vs_math_528/,3,3,2024-11-20 15:12:20,"Im kind of conflicted with taking MATH 523 with Govanni Granados vs MATH 528 with Roberto Camassa.

Any suggestions?"
math 347 - s. kovalsky,https://www.reddit.com/r/UNC/comments/1gvu57o/math_347_s_kovalsky/,2,3,2024-11-20 16:56:54,"Hello, I am considering taking the math 347 launch section with Kovalsky and was wondering if anyone had taken this class with him before as he has no RMP or coursicle ratings. Thanks!"
Parking Citation Interview ,https://www.reddit.com/r/UNC/comments/1gvgm7a/parking_citation_interview/,9,1,2024-11-20 03:48:00,Hey! I'm working on a story covering parking here on campus and want to get the perspective of a student who's been greatly affected by parking/parking citations by UNC. Ex. Maybe you've acquired a lot over the academic years. I'm sure this applies to a good amount of students as it's affected many. If you'd be down for a brief interview DM me!! Thank youuuu 
failing biol 103,https://www.reddit.com/r/UNC/comments/1gvdl5h/failing_biol_103/,13,9,2024-11-20 01:14:55,"I just received my last midterm for Biol 103 and I have failed every single midterm for the class :(. I really thought I understood the material for this exam at least so I would have at least one above F midterm, I don't know what about this material I can't get. They drop one midterm for Bio, but my average is still a 48 and its worth almost half my grade. I really don't know what I should do, will this ruin my GPA, and chances of getting into the Gillings school, even thinking of throwing away my med school dreams, if I can't even pass this intro STEM class. Should I just try and withdraw, or is it too late, really looking for some advice and reassurance here."
"Lost item, help needed ",https://www.reddit.com/r/UNC/comments/1gvce9v/lost_item_help_needed/,7,3,2024-11-20 00:18:49,Yesterday around 3:45/4:00 pm I lost a small black bag of electronics (chargers etc) on an NS bus that I took from the credit union bus stop on Pittsboro Street to the Southern Village parking lot. I don’t have social media to post but hoping to find help here. Need to find it ASAP. There was a kind black man driving the bus when I was on it. 
RA with sports ,https://www.reddit.com/r/UNC/comments/1gvhr5g/ra_with_sports/,3,2,2024-11-20 04:51:15,Hi everyone. I recently wanted to join club Cheer and possibly become an RA next year. I was wondering if that’s something possible for me to do. I know that you can only have a certain number of hours but I just wanted to see if anyone has more info! Thanks!
Plus swipes in the beach cafe,https://www.reddit.com/r/UNC/comments/1gveje5/plus_swipes_in_the_beach_cafe/,4,5,2024-11-20 02:01:22,"Can you use your plus swipe at the beach cafe, and if so, what can you get?"
Spanish Placement Exam,https://www.reddit.com/r/UNC/comments/1gvfovw/spanish_placement_exam/,3,0,2024-11-20 02:59:45,Does anyone know when the score for your Spanish Placement exam registers in ConnectCarolina? I took it last month but it still hasn’t appeared.
PHYS 114 Credit,https://www.reddit.com/r/UNC/comments/1gvhs27/phys_114_credit/,2,0,2024-11-20 04:52:37,"Hey everyone! I'm planning to major in radiologic science but currently am on the track to get a D in PHYS 114. I was wondering if I would have to retake it. I don't know if a D is classified as ""failing"" and I actually need a C. Looking on the website for the major I don't see anything that says I need a C for it but I just wanted to check in with others who might be more knowledgeable! Thanks!"
"Spring '25 Off Campus Housing Available, ~$800/month",https://www.reddit.com/r/UNC/comments/1gve72i/spring_25_off_campus_housing_available_800month/,3,0,2024-11-20 01:44:40,"Hi everyone! I'm looking to sublease/find somebody to take over my portion of the lease at Trilogy Chapel Hill for 1 room in a 3 bed, 2 bath. **Rent including fees and utilities is about \~$800/month, but I am willing to be flexible on price.** The apartment itself is shared with 2 male UNC seniors who are graduating at the end of next semester.  
  
Amenities:  
\- Located within walking distance of Food Lion, CVS, and Trader Joe's  
\- Fully furnished  
\- Well-equipped gym with cardio equipment, several machines, a Smith machine, and more  
\- Pool  
\- Access to campus via Chapel Hill Transit D Route (\~20 minute ride to campus) and CL route (\~10 minute walk to stop, \~10 minute ride to campus)  
\-  Study and conference rooms

Move in would be available beginning 12/17. Please feel free to PM if you are interested or have questions!"
Comp Sci (BSc) 420+ electives grade requirement?,https://www.reddit.com/r/UNC/comments/1gvfcau/comp_sci_bsc_420_electives_grade_requirement/,2,0,2024-11-20 02:41:39,"Hello!

I am a Comp Sci major student doing the BS and I am struggling pretty hard with an elective class (420+). I was checking the requirements and it doesn't say anything on the website about needing a C minimum for this class to count but I wanted to double check and ask if it's required to make a C or does a C- or even D+ still count for the major for elective classes?"
BIOL 440 or 443?,https://www.reddit.com/r/UNC/comments/1gv7sef/biol_440_or_443/,1,0,2024-11-19 20:59:12,"Has anyone taken BIOL 440 or 443, which would you recommend?"
HELP FOR OFF-CAMPUS HOUSING ,https://www.reddit.com/r/UNC/comments/1guit36/help_for_offcampus_housing/,19,10,2024-11-18 23:23:55,Today me and my suitemates didn't manage to get any housing this round (it closed right as we were going in for the selection) My suitemates and I are desperate to get any sort of off-campus housing so does anyone have any recommendations for off-campus housing. Preferably cheap but at this point we will take what's left. 
Rams Head Parking ,https://www.reddit.com/r/UNC/comments/1gulogr/rams_head_parking/,5,1,2024-11-19 01:36:48,Hi I have a commuter spot in Rams Head for the whole school year. Usually I take my car home but I was wondering if I’m allowed to leave the car there overnight. Sometimes I sleep at a friends on campus. 
ConnectCarolina problem?,https://www.reddit.com/r/UNC/comments/1gukwpd/connectcarolina_problem/,3,2,2024-11-19 00:59:45,"I recently changed my major, and the classes required to finish my selected pathway just aren’t there anymore. It’s been a couple days and I don’t know what to do. 
Does anybody have any help? Or, has anybody else experienced this?"
Emailing professor about waitlisted class,https://www.reddit.com/r/UNC/comments/1gu8mtl/emailing_professor_about_waitlisted_class/,5,4,2024-11-18 16:24:49,Has anyone had success getting in a 200-300 seat class after emailing the professor? Trying to see what my options are and I'm getting desperate...
What grade do I have to get in Spanish 203 to get the credit for it?,https://www.reddit.com/r/UNC/comments/1gtugb3/what_grade_do_i_have_to_get_in_spanish_203_to_get/,7,5,2024-11-18 02:28:12,"hypothetically let's say I have a d- in Spanish (lol) what grade does it have to be to get the credit as my third level course? do I just have to pass? 

follow up question: is it offered as a summer course lol "
best way to prepare for chem 241L final?,https://www.reddit.com/r/UNC/comments/1gtrhdk/best_way_to_prepare_for_chem_241l_final/,8,0,2024-11-18 00:00:07,"hey all! final is coming up and i’ve reviewed the document from Motley, and done a few quizlets… unsure if it’s enough/ if anyone has any advice or other things to study? thanks!"
Housing concerns,https://www.reddit.com/r/UNC/comments/1gtlh87/housing_concerns/,14,5,2024-11-17 19:29:33,I feel like everyone has already gotten housing and so I am worried for our group that has a later appointment date. Does anyone know what is still available and if we are cooked😭
Is this schedule too difficult? ,https://www.reddit.com/r/UNC/comments/1gtvwuf/is_this_schedule_too_difficult/,2,8,2024-11-18 03:47:15,"https://preview.redd.it/mto8kvpl0l1e1.png?width=2164&format=png&auto=webp&s=f39cce18348c7b37dbb2d836690f8cfb0bcc3e25

I also plan to add another 400-level econ elective. "
"Apartments - Edition, Warehouse, Carolina Square, Shortbread- Feedback appreciated",https://www.reddit.com/r/UNC/comments/1gtmqys/apartments_edition_warehouse_carolina_square/,6,8,2024-11-17 20:25:22,"My student wants to live on or near Franklin. Ideally in an apt. with a private bed and bath, but with flatmates.  They are social, but a very serious student, so being close to campus and having some privacy for studying are important. Anyone lived or visited these apartments? I'm concerned about the reviews of Edition and Warehouse. Carolina Square has a waiting list, but it seems nice and very close. It is super bougie?  I like Union, but our student likes the feel of being in a place that has a sort of a feel of a city where more spots are walkable.  Thanks for any reviews good or bad, or any tips. "
Chat How We Feeling?,https://i.redd.it/dutb5iq4ll1e1.jpeg,1,3,2024-11-18 05:41:30,"How we feeling about the schedule guys?

P.S. as I’m sure you all know, just ignore the “waiting,” I’m trying to swap AAAD with ENGL. For now, my schedule is everything but ENGL. For reference, I am a transfer student (junior). "
preparing for phys 114 final,https://www.reddit.com/r/UNC/comments/1gtla9n/preparing_for_phys_114_final/,5,9,2024-11-17 19:21:06,what is he best way for prepare for the phys 114 final? I’ve heard the homework questions are helpful but are there any other ways I can best prepare? 
Purefoy apartment/townhomes,https://www.reddit.com/r/UNC/comments/1gtldf2/purefoy_apartmenttownhomes/,3,0,2024-11-17 19:24:53,"Has anyone lived in the Purefoy apartments and if so, would you recommend them?
Thanks in advance.
"
Transfer for fall 2025 ,https://www.reddit.com/r/UNC/comments/1gt3aqb/transfer_for_fall_2025/,7,9,2024-11-17 02:15:24,"
I applied to UNC in fall 24 and got denied for business. I’m currently a student at a T10 public business school in the US; however, I just don’t like it over here. I am trying to transfer to UNC Chapel Hill. I have a few questions:  

1. Should I transfer to economics to make it easier for me to transfer?  
2. Where can I find a list of my college credits that will transfer into UNC Chapel Hill (the list online seems old)?  
3. I can finish my degree in 3 years at my current college. Is it worth transferring into UNC Chapel Hill with hopes to get into Kenan in my junior year? I will need to study for 4 years at Chapel Hill.  
4. What kind of profile will I need? I will probably have a 3.85-3.9 GPA by the end of the semester.  

Thanks in advance."
Does SRC have heavy bags?,https://www.reddit.com/r/UNC/comments/1gtb48m/does_src_have_heavy_bags/,1,1,2024-11-17 10:53:55,I know eddie smith has freestanding ones if I recall correctly
does anyone have a Visible phone plan on campus?,https://www.reddit.com/r/UNC/comments/1gswv4m/does_anyone_have_a_visible_phone_plan_on_campus/,8,5,2024-11-16 20:59:33,currently have t-mobile and my service is lowkey shit. debating whether or not to switch to Visible and would love to get some opinions if anyone is also on that plan. thanks! 
kenan residence hall ,https://www.reddit.com/r/UNC/comments/1gsyikl/kenan_residence_hall/,5,1,2024-11-16 22:16:51,"hi so my roommate secured kenan for us for our sophomore year, but i can’t really find anything other than it’s an all girls dorm. is this a good pick? 
"
Free student ticket for UNC v. Wake Forest Game,https://www.reddit.com/r/UNC/comments/1gsrpst/free_student_ticket_for_unc_v_wake_forest_game/,6,4,2024-11-16 17:04:11,"Hi, I have a ticket for the Wake Forest game tonight but am not in town. If anyone is interested in taking my ticket, please let me know and I can transfer it to you!"
Philosophy & German Majors,https://www.reddit.com/r/UNC/comments/1gsegsv/philosophy_german_majors/,4,7,2024-11-16 03:31:03,Any philosophy or German majors active in the sub? Had some questions about the programs
Outlets in Morrison? ,https://www.reddit.com/r/UNC/comments/1gsdwot/outlets_in_morrison/,4,4,2024-11-16 03:00:26,I got a Morrison room next year (first room on the left) and was wondering about the outlet locations. I tried looking at virtual tours but couldn’t really see it. How many outlets are there in each room? 
Should I submit my 1440 SAT super score to UNC ?,https://www.reddit.com/r/UNC/comments/1gsb2j0/should_i_submit_my_1440_sat_super_score_to_unc/,3,16,2024-11-16 00:27:18,"For context this will be between the 25%-50% percentile. I scored 700 on reading and writing and 740 in math. I am an out of state applicant and have a 4.535 weighted gpa who has taken or is currently taking 8 aps, 7 honors, and 3 DE courses. Sorry if I did not provide enough information."
COMP 590 with Gedas Bertasius?,https://www.reddit.com/r/UNC/comments/1gseduv/comp_590_with_gedas_bertasius/,1,1,2024-11-16 03:26:31,"This course is about Visual Recognition with Transformers. I am trying to decide whether or not to enroll in this course.

How difficult is the course? Is the subject useful? 

I read a bit about the course on his website and there doesn't seem to be any exams. Instead we are graded on things like paper critiques, paper battles, and a course project. Are these things manageable?"
ARS accomodations for placement exams ,https://www.reddit.com/r/UNC/comments/1gs5o0m/ars_accomodations_for_placement_exams/,2,1,2024-11-15 20:19:26,"I have ARS accommodations for extended testing time and a separate location and was wondering if anyone had experience applying their accommodations toward UNC placement exams, if it's possible, or how to go about receiving the accommodations. "
Best park n ride option for UNC men’s basketball?,/r/chapelhill/comments/1grxf2n/best_park_n_ride_option_for_unc_mens_basketball/,4,1,2024-11-15 14:23:29,
Nutrition Major UNC ,https://www.reddit.com/r/UNC/comments/1grlw67/nutrition_major_unc/,5,1,2024-11-15 02:18:26,How difficult is it to get into the nutrition major here? 
chem 241L final,https://www.reddit.com/r/UNC/comments/1grknit/chem_241l_final/,7,2,2024-11-15 01:14:26,"hello fellow tarheels! was just wondering if any of you had taken the chem 241L final exam in the past, and if so, you might be willing to share some tips or suggestions as to how deeply to study for the test! any general thoughts would be appreciated as well :)

(please)"
Lost Umbrella w. Medical Emblem,https://www.reddit.com/r/UNC/comments/1gren6o/lost_umbrella_w_medical_emblem/,11,2,2024-11-14 20:39:21,"Hello, everyone! I believe that someone potentially took or stole my black umbrella in Peabody, and I am wondering if any of you all have any tips on how to get it back. I checked the lost and found and nobody had it. 

I left it to dry so it wouldn't get the floor wet, but when I went to retrieve it it was gone. It was a gift from my mom and it was one of those nice ones that folds outwards. It has a medical emblem on it. If nobody has found it that’s fine, I'll just cut my losses, but it's still disappointing. "
Connor vs Old West,https://www.reddit.com/r/UNC/comments/1grdjtd/connor_vs_old_west/,6,11,2024-11-14 19:52:02,Which one better for sophomores? How are the amenities and room sizes? How clean are they? What are yalls experiences with them? I’m torn between the two and no clue which one to choose.
Housing ,https://www.reddit.com/r/UNC/comments/1grcsd1/housing/,5,4,2024-11-14 19:19:36," I got a registration appointment today, but I’m a rising junior. I thought 14,15, and 16 was only for seniors, I mean I’m not complaining."
CHEM 441 - Intermediate Analytical (Tiani),https://www.reddit.com/r/UNC/comments/1grg8wy/chem_441_intermediate_analytical_tiani/,3,0,2024-11-14 21:48:47,"Has anyone here taken CHEM 441? I have to take it next semester but can find next to nothing about it online. If you have taken it, I'd love to hear what it is like. Thanks!"
Am I likely to get a 180-capacity class if I am #47 on the waitlist?,https://www.reddit.com/r/UNC/comments/1gr6n1a/am_i_likely_to_get_a_180capacity_class_if_i_am_47/,5,2,2024-11-14 14:58:59,It’s ANTH151. It’s so weird how there’s only one section offered yet so many recitations.
Any recommendations for an easy “Communication beyond Carolina” course?,https://www.reddit.com/r/UNC/comments/1gqyia6/any_recommendations_for_an_easy_communication/,6,5,2024-11-14 06:12:44,I am looking to do a communications course and I was wondering if you guys have any suggestions? Also has anyone taken public speaking and was it easy?
Has anyone taken EMES 103?,https://www.reddit.com/r/UNC/comments/1gqyhim/has_anyone_taken_emes_103/,3,2,2024-11-14 06:11:21,"
Hello, I was wondering if EMES 103 is required to take for the computer science major? It shows up on the Tar Heel tracker under the sciences section. However, if it is required, has anyone taken it and is it an easy course? "
Computer Science Application Concern / Challenges/ Clubs / Resources,https://www.reddit.com/r/UNC/comments/1gqygyl/computer_science_application_concern_challenges/,2,4,2024-11-14 06:10:21,"
Hello, I am looking to apply for the computer science major my sophomore year. However, I was planning to take COMP 110 this spring semester, but it was waitlisted and reserved before my enrollment appointment for Wave 1 at 4pm. As well, I was placed on the wait list position #124 during Wave 2 at 4pm during my second enrollment appointment. Do you guys have any suggestions? Has anyone taken COMP 110 over the summer or could you explain what is taught in the course? Also, if I were to take it next year in the fall, would it impact my acceptance? Also, what are the requirements to apply for the major such as gpa, extracurriculars, or clubs? Does anyone recommend any clubs for the computer science major as well? "
Ice Hockey Governor's Cup Game?,https://www.reddit.com/r/UNC/comments/1gqq57h/ice_hockey_governors_cup_game/,6,0,2024-11-13 22:57:10,When is the Governor's Cup ice hockey game? Lenovo Center website says it's next Wed 11/20 but the TicketMaster link isn't working. Other websites say it is TBA.
FC PAST,https://www.reddit.com/r/UNC/comments/1gqwx8e/fc_past/,2,0,2024-11-14 04:36:29,"Any recommendations for an fc past course. Hopefully an easy one, i just wanna get done with it."
Community manager interview ,https://www.reddit.com/r/UNC/comments/1gqsdrg/community_manager_interview/,3,0,2024-11-14 00:40:08,Hi I’m interviewing for community manager in the residence halls and I was wondering if anyone remembered their interview questions they were asked or if they had any tips/tricks 
Football tix plsss,https://www.reddit.com/r/UNC/comments/1gqwnen/football_tix_plsss/,2,0,2024-11-14 04:20:44,"If anyone has an extra ticket for the game this Saturday pls dm me, I’d be so grateful 🙏😔"
How is my schedule ,https://i.redd.it/8bnkaf20qp0e1.jpeg,12,30,2024-11-13 18:31:53,
